name,address,longitude,latitude,description,subordination,creation_time,modification_time,mo_from,mo_to,tu_from,tu_to,we_from,we_to,th_from,th_to,fr_from,fr_to,sa_from,sa_to,su_from,su_to
Центральная библиотека имени Р. С. Иванченко,"Респ Марий Эл,г Йошкар-Ола,ул Прохорова,д 30",47.83475,56.632788,"Центральная библиотека имени Р. С. Иванченко является информационным, культурно-просветительским центром города Йошкар-Ола, методическим центром для 13 библиотек-филиалов. Она была открыта в октябре 1946 года.К услугам пользователей открыты читальный зал, абонемент, сектор по работе с детьми, сектор по работе с юношеством, центр общественного доступа к социально-значимой информации, методико-библиографический отдел. Ежегодно читателями библиотеки становятся более 11 тысяч человек. Информационные ресурсы библиотеки включают универсальные по содержанию фонды, насчитывающие более 86 тысяч единиц хранения. Ежегодно в библиотеку поступает более двух тысяч новых книг, выписывается 70 наименований газет и журналов. В фонде имеются книги для слепых и слабовидящих, изданные по системе Брайля. Вход в библиотеку оборудован пандусом. Центральная библиотека имени Р. С. Иванченко – это:место проведения ежегодной социокультурной акции «Майский библиовечер»;создатель «Бульвара интеллектуальных развлечений»;организатор проекта в помощь профориентации молодежи «Живая книга»;интеллектуально-творческий конкурс «Литературно-краеведческий дилижанс»;инициатор литературно-исторического квеста «Лик города Йошкар-Олы» (День молодежи);место встречи любителей чтения в клубе «До и после 55»;площадка для молодежного дискуссионного клуба «Взгляд»;сотрудничество с учебными, дошкольными образовательными учреждениями, с различными организациями и частными лицами;мероприятия, акции, проекты, выставки.",Йошкар-Ола,2016-09-08T11:00:58Z,2023-03-28T06:45:49Z,09:00:00,19:00:00,09:00:00,19:00:00,09:00:00,19:00:00,09:00:00,19:00:00,,,09:00:00,16:00:00,09:00:00,16:00:00
Янгельская сельская библиотека,"Респ Башкортостан,р-н Абзелиловский,с Янгельское,ул Стадионная,д 14",58.796119,53.259477,"Янгельская сельская библиотека начала существовать как изба-читальня в 1940-х годах. С 1963 года она работает при сельском клубе. В 1969 году для клуба было построено двухэтажное здание, под библиотеку выделили две комнаты на втором этаже. В разные годы библиотекарями работали Анна Николаевна Напольских, Татьяна Ивановна Гребенщикова, Альфия Бахтияровна Насырова, Гафифа Мухаметовна Бикташева, Зухра Ханнановна Хисаметдинова, Альбина Мухамедовна Ахметова, Ануза Марсовна Манапова. Сегодня работает Гульсум Махмутовна Гильманова.Библиотека является информационным и культурным центром, главная задача – приобщение к книге и чтению. Фонд Янгельской сельской библиотеки насчитывает более 17 140 книг, количество пользователей – 1 323 человека. Здесь ведется «Летопись села Янгельского» с 2007 года. Библиотека – постоянный участник районных, республиканских и всероссийских конкурсов. При ней действует клуб по интересам «Мир твоих увлечений».",Абзелиловский район,2020-09-16T14:10:04Z,2023-02-03T12:15:26Z,09:00:00,17:50:00,09:00:00,17:50:00,09:00:00,17:50:00,09:00:00,17:50:00,09:00:00,17:50:00,,,,
Кужендеевская сельская библиотека,"обл Нижегородская,р-н Ардатовский,с Кужендеево,ул Центральная,зд 54А",43.0840467941099,55.2048773999984,"Кужендеевская сельская библиотека была открыта в 1970 году. Здание находилось в небольшом деревянном доме на окраине села, около конторы колхоза «Кужендеевский». Фонд составляет 8 242 экземпляра. Посетителей – 500 человек. В зоне обслуживания 3 населенных пункта: с. Кужендеево, д. Высоково, д. Беляеево. Для детей организован клуб «Книговичок». Основное направление работы – краеведение по авторской программе «Живи, село!». Победитель районного профессионального конкурса «Библиотекарь года – 2013». В 2018 году заняла 1 место в конкурсе библиотечных репортажей «Вспомним комсомольцев, отдадим им честь», в номинации «Лучший видеоролик».",Ардатовский район,2021-07-09T07:54:58Z,2023-03-09T14:17:20Z,08:00:00,17:00:00,08:00:00,16:00:00,08:00:00,16:00:00,08:00:00,16:00:00,08:00:00,16:00:00,,,,
Ананьинская библиотека,"обл Ярославская,р-н Ярославский,д Ананьино,ул Садовая,д 11а",39.960729,57.4887,"Сельская библиотека – это информационный, культурный центр деревни Ананьино. Книжный фонд насчитывает 3 851 различное издание, библиотека популярна среди жителей. В Ананьино проживает около 548 жителей, 150 из них являются читателями. В своей повседневной деятельности библиотека взаимодействует со всеми организациями и учреждениями, находящимися в зоне ее обслуживания. Она является открытой, общедоступной структурой, ориентированной на предоставление максимума услуг для населения своей деревни. Работает в тесном сотрудничестве с детским садом, школой, Домом культуры. Читателей оповещают о проводимых в библиотеках мероприятиях, информируют о новых книгах.",Ярославский район,2018-03-15T06:44:57Z,2023-03-27T08:37:18Z,,,14:00:00,18:00:00,14:00:00,18:00:00,14:00:00,18:00:00,14:00:00,18:00:00,10:00:00,14:00:00,,
Дуван-Мечетлинский филиал № 7,"Респ Башкортостан,р-н Мечетлинский,с Дуван-Мечетлино,ул Сабира Вагапова",58.3063614595499,55.6747921891278,"В деревне Дуван-Мечетлино Сабир Вагапов открыл волостную библиотеку в 1920 г. В 1947 году в пристрое мечети была открыта библиотека. Первым библиотекарем стал участник Великой Отечественной войны Ханов Хажип. С 1965 года в клубе работает библиотека. С 1965 по 1994 год бессменным библиотекарем была Галимова Дамира Авзаловна. С 2000 по 2016 год заведующей библиотекой работает Султанова Зарифа Гавнетдиновна. C 2016 года библиотекарем работает Ахметханова Гульназ Фарвазовна. Фонд библиотеки составляет 14 445 экземпляров, 830 читателей, 10 780 посещений, книговыдача – 17 381 экземпляр. В библиотеке проводятся интересные и востребованные мероприятия для взрослых и детей в онлайн и офлайн формате. Организованы кружки и клубы по интересам, ведется проектная деятельность, активно участвует в различных акциях, конкурсах.",Мечетлинский район,2020-09-07T07:22:23Z,2023-02-06T11:48:15Z,10:00:00,19:00:00,10:00:00,19:00:00,10:00:00,19:00:00,09:00:00,19:00:00,10:00:00,19:00:00,08:00:00,19:00:00,,
Николаевская библиотека филиал МБУК «МфКЦ» Петропавловского района Алтайского края,"край Алтайский,р-н Петропавловский,с Николаевка,ул Советская,50",84.122816,52.190559,"Библиотека села Николаевка датируется в середине 40-х годов. Библиотекарями работали Новикова Нина Ивановна, более 10 лет библиотечной деятельности отдала Зудилова Зинаида Федоровна. В 1980 году на должность заведующей была принята Пушкарева Галина Владимировна. Галина Владимировна закончила Алтайский государственный институт культуры. За годы работы зарекомендовала себя как грамотный специалист, обладающий большим опытом работы. Библиотечный стаж её 38 лет. Библиотека под её руководством стала любимым местом для читателей, появились новые формы работы. Галина Владимировна создала при библиотеке детскую театральную студию «Искорка». Самодеятельными артистами были поставлены сказки «Каша из топора», «Емеля и царская ночь» и др. В 2011 году Николаевская библиотека стала одним из победителей конкурса на предоставление грантов Губернатора Алтайского края в сфере культуры. В 2018 году Галина Владимировна ушла на заслуженный отдых. Не долгое время библиотекаря в Николаевской библиотеке работали Пустоварова Надежда Александровна, Федорищева Надежда Николаевна. С 2020 года Николаевской библиотекой филиалом заведует Легедина Наталья Ивановна. Фонд библиотеки 6053 экземпляра печатных изданий.",Петропавловский район,2022-04-06T15:12:44Z,2022-04-19T14:28:03Z,10:00:00,15:45:00,10:00:00,15:45:00,10:00:00,15:45:00,10:00:00,15:45:00,10:00:00,15:45:00,,,,
Сосновская сельская библиотека,"обл Брянская,р-н Выгоничский,с Сосновка,ул Салова,д 8",34.000111,53.007536,"Сосновская сельская библиотека находится на территории Сосновского сельского поселения. Библиотека находится в здании Сосновской администрации. Краеведение – одно из основных направлений деятельности библиотеки. Много лет ведется летопись села. Мероприятия, посвященные героической истории нашей Родины, Брянщины, помогают воспитывать у подрастающего поколения чувство патриотизма, приобщают к лучшим произведениям о войне. В канун Дня Победы библиотекой проводятся уроки мужества «Память пылающих лет», также организуется шествие «Бессмертного полка». Книжный фонд – 5 683, количество посещений – 3 786, количество читателей – 270.",Выгоничский район,2019-03-22T07:08:54Z,2023-03-05T10:26:42Z,,,09:00:00,18:00:00,10:00:00,18:00:00,10:00:00,18:00:00,10:00:00,18:00:00,,,10:00:00,18:00:00
Сапрыкинская сельская библиотека,"обл Белгородская,р-н Губкинский,с Сапрыкино,ул Центральная,д 49",37.632493,51.125047,"Сапрыкинская сельская библиотека была создана в 1954 году. В 1965 году в селе построили Дом культуры, где и разместилась библиотека. В 1978 году она вошла в состав Губкинской районной ЦБС как библиотека-филиал. В 2013 году библиотека переведена в пристроенное к Дому культуры помещение, оснащена новой мебелью, компьютерным оборудованием, имеет доступ в интернет. Площадь составляет 60 кв. м.В зону обслуживания библиотеки входят села Сапрыкино, Дубянка, Копцево, Малахово, Рябиновка, Успенка. Численность населения территории – 943 человека. Организована работа 3 библиотечных пунктов. Библиотека сегодня – это центр общественной и культурной жизни села. В настоящее время ею пользуются более 600 селян, им выдается ежегодно около 13 тысяч экземпляров литературы, количество посещений составляет более 5 тысяч. Фонд библиотеки насчитывает 14 тысяч документов. Населению предлагаются новые услуги: электронная доставка документов, компьютерные и интернет-услуги. Библиотека организует работу детского клуба «Школа вежливости» и клуба для подростков и юношества «Литературные встречи». Традицией стало проведение праздников книги, конкурсов на лучшего читателя, поэтических турниров. Библиотека ведет летопись села Сапрыкинской территории.",Губкинский район,2015-02-16T06:59:20Z,2023-02-09T13:37:41Z,,,11:00:00,19:00:00,11:00:00,19:00:00,11:00:00,19:00:00,12:00:00,20:00:00,12:00:00,20:00:00,11:00:00,19:00:00
Катмышская сельская библиотека – филиал № 14,"Респ Татарстан,р-н Мамадышский,с Катмыш,ул Ленина,д 85",50.840809,55.636941,"В селе Катмыш изба-читальня была открыта в 1924 году. Там работали активисты Садыйков Салих, Сафин Захит, Осипов Кузьма, Галкин, Ахметшин Мирза, Сокров, Гатауллин Фархулла. Они вместе с учителями вели борьбу с неграмотностью населения. Книжный фонд на сегодняшний день составляет 4 670 экземпляров, читателей – 433. В библиотеке широко пропагандируется художественная литература. К юбилеям писателей оформляются книжные выставки, стенды, выпускаются стенгазеты, проводятся библиографические обзоры, конкурсы чтецов, рисунков, литературно-музыкальные вечера. Сельский филиал оказывает услуги широкой аудитории, стремится соответствовать ожиданиям сельчан, является центром общественной и культурной жизни жителей села. Еще одно направление сельской библиотеки – изучение истории своего поселения. Именно сельская библиотека становится собирателем, хранителем и проводником культурных традиций.",Мамадышский район,2021-04-26T12:45:39Z,2023-03-01T15:01:34Z,09:00:00,22:00:00,09:00:00,22:00:00,09:00:00,22:00:00,09:00:00,22:00:00,09:00:00,22:00:00,18:00:00,21:45:00,,
Горшковская сельская библиотека,"Респ Татарстан,р-н Новошешминский,с Горшково,ул Луговая,д 54",51.208112,55.225563,"Точная дата основания Горшковской сельской библиотеки неизвестна. Есть сведения о том, что в довоенный период в селе действовала изба-читальня. С 2010 года библиотека находится в новом здании сельского Дома культуры. Пользователями являются все категории жителей села. Дети и пенсионеры – самые активные читатели. Книжный фонд – 5 750 экземпляров художественной литературы, из них 4 784 экземпляра на русском языке, 1 031 экземпляр на татарском языке, 4 – на английском языке. Журналов – 363. Мало кто из жителей не знает библиотеку. В Горшково она является островком культуры, информации и просто местом отдыха односельчан. Здесь тепло, светло и уютно.",Новошешминский район,2022-09-20T07:33:19Z,2023-01-31T13:42:15Z,,,10:00:00,13:00:00,10:00:00,13:00:00,10:00:00,13:00:00,10:00:00,13:00:00,10:00:00,13:00:00,10:00:00,13:00:00
Цепочкинская сельская библиотека,"обл Кировская,р-н Уржумский,с Цепочкино,ул Октябрьская,д 15",50.0946736335754,57.1814248271737,"Цепочкинская сельская библиотека открыта в 1915 году и получила имя Ф. Ф. Павленкова. В настоящее время Цепочкинская сельская библиотека имени Ф.Ф. Павленкова является структурным подразделением МКУК Богдановская сельская библиотека Уржумского района Кировской области. Книжный фонд библиотеки составляет более 8 000 экз. Число посетителей в год – 3 000. Приоритетные направления работы – краеведение и духовно-нравственное просвещение. Уделяется большое внимание изучению истории села, разработана экскурсия «Православные маршруты села Цепочкино», открыта краеведческая комната. Библиотека работает по программе духовно-нравственного воспитания детей и подростков «Прикосновение». С целью реализации творческого потенциала детей создан клуб «Волшебство своими руками», на занятиях которого дети знакомятся с народными куклами-оберегами («Травница», «Купавница», «Колокольчик», «Неразлучники»), учатся их изготавливать.",Уржумский район,2019-11-28T11:40:27Z,2023-03-01T11:25:04Z,14:00:00,16:30:00,10:00:00,16:30:00,10:00:00,16:30:00,10:00:00,16:30:00,10:00:00,16:30:00,,,13:00:00,15:30:00
Библиотека № 7 им. В. А. Закруткина,"обл Ростовская,р-н Красносулинский,г Красный Сулин,пер Интернациональный,д 5а",40.0475033015747,47.9085501254732,"Библиотека № 7 открыта 4 декабря 1974 года в клубе завода железобетонных изделий. В 1995 году ей присвоено имя В. А. Закруткина. С 2006 года библиотека входит в состав ЦБС Красносулинского городского поселения. Приоритетным направлением в деятельности является семейное чтение. Свою работу библиотека направляет на обслуживание всех читательских групп, культурно-информационное просвещение читателей и изучение читательских интересов.В библиотеку приходят не только за литературой, но и за восполнением дефицита общения, поделиться накопленными знаниями. На базе учреждения работает детское объединение «Сударушка» и женский салон «Серебряный возраст».Фонд насчитывает 27 789 экземпляров. Количество читателей – 1 402 человека.",Красносулинский район,2022-03-26T08:55:02Z,2023-10-02T07:44:54Z,,,10:00:00,18:00:00,10:00:00,18:00:00,10:00:00,18:00:00,10:00:00,18:00:00,10:00:00,18:00:00,10:00:00,18:00:00
