name,address,longitude,latitude,description,subordination,creation_time,modification_time,mo_from,mo_to,tu_from,tu_to,we_from,we_to,th_from,th_to,fr_from,fr_to,sa_from,sa_to,su_from,su_to
Центральная районная библиотека им. В. Г. Короленко,"обл Нижегородская,г Нижний Новгород,ул Родионова,д 199",44.0763437747955,56.3009501294259,"Библиотека им. В. Г. Короленко – это библиотека с историей. Ее «биография» берет свое начало в 80-х годах XIX века. С 1921 года носит имя В. Г. Короленко (1853–1922) – выдающегося русского писателя, публициста и общественного деятеля.Сейчас имеет статус Центральной районной библиотеки Нижегородского района, находится в новом, просторном помещении. Оснащена современным оборудованием, обустроены вместительный читальный зал и зал для проведения массовых мероприятий. Книжный фонд постоянно обновляется. Выделена территория чтения для самых маленьких пользователей, а также для людей с ограниченными возможностями здоровья.Молодой, творческий коллектив делает все, чтобы библиотека оставалась не только местом встречи поколений, но и центром интеллектуальной и культурной жизни района. Сотрудники помогают найти свою, особенную книгу, открывают читателям яркий мир творчества, тайны науки, дарят встречи с писателями и интересными людьми.",Нижний Новгород,2016-08-19T14:57:11Z,2023-03-07T08:28:34Z,10:00:00,18:00:00,10:00:00,18:00:00,10:00:00,18:00:00,10:00:00,18:00:00,10:00:00,18:00:00,,,10:00:00,16:00:00
Желонская сельская библиотека,"обл Кировская,р-н Куменский,д Желны,ул Комсомольская,д 11",50.474198,58.042686,"Желонская сельская библиотека была открыта 15 сентября 1967 года. Раньше она находилась в здании Дома культуры и занимала там небольшую комнату. В 1989 году библиотеку перевели в здание бывшей начальной школы. Она комплектовалась книгами из бибколлектора, выделял средства и сельский совет. С 1978 года книги поступают централизованно. С 2022 года библиотека находится в здании клуба. Ее посещают учащиеся Желонской средней школы. Востребована литература для написания рефератов и для чтения по школьной программе. Для учащихся проводятся различные мероприятия, викторины, конкурсы. Посещают библиотеку и ребята из детского садика, воспитатели, учителя, специалисты сельского хозяйства, механизаторы и другие рабочие. Ветхие издания списываются. Остальная литература заносится в электронный каталог.",Куменский район,2015-08-25T10:55:53Z,2023-04-19T13:47:27Z,08:30:00,16:10:00,08:30:00,16:10:00,08:30:00,16:10:00,08:30:00,16:10:00,08:30:00,16:10:00,,,,
Библиотека № 27 г. Кирова,"обл Кировская,г Киров,п Садаковский,пер Бамовский,д 1А",49.552859,58.594217,"История библиотеки началась в 1926 году, когда в деревне Лопатовская открылась изба-читальня. Объем фонда сейчас составляет свыше 16 000 единиц хранения, количество посетителей – более 1 000 человек в год. В настоящее время краеведение является приоритетным направлением деятельности библиотеки. Пополняется фонд краеведческого уголка, представленного предметами крестьянского быта. Выставка «Каповых дел мастера» знакомит с материалами из истории капового промысла в деревне Лопатовская (сейчас это поселок Садаковский), первыми мастерами, творившими чудеса из капа еще в ХIХ веке, династиями каповщиков XX века. Женщины, увлеченные рукоделием и изучением родного края, посещают клуб «Матаня», организованный при библиотеке в 2013 году.",Городской округ город Киров,2017-12-06T09:28:56Z,2023-02-22T11:54:32Z,,,10:00:00,18:00:00,10:00:00,18:00:00,10:00:00,18:00:00,10:00:00,18:00:00,10:00:00,17:00:00,,
Библиотека № 18 имени В. А. Жуковского,"г Москва,г Москва,пер Лялин,д 24-26",37.653164,55.756812,"Библиотека была основана в 1938 году, а имя Василия Андреевича Жуковского было присвоено ей в 1983 году – в честь 200-летия поэта. Сейчас в читальне действует зал-музей В. А. Жуковского. Весомую часть книжного фонда составляет раздел «Искусство и искусствознание», где можно найти широкий спектр информации о живописи, архитектуре, графике, а также театре и кино, медиаматериалы. Выделен фонд В. А. Жуковского.В библиотеке реализуется множество оригинальных творческих проектов. Так, театральный проект «Лялин центр» стал пространством, ориентированным на все виды сценических активностей. Молодежная студия театра и кино «Б.Э.Т.» – социальный культурный проект, продвигающий чтение среди молодежи при помощи визуальных видов искусств. В студии на бесплатной основе молодые люди обучаются навыкам актерского мастерства, опыту работы на сцене, становятся частью дружного творческого коллектива. Фонд библиотеки насчитывает более 31 245 единиц хранения. За 2021 год ее посетил 6 721 читатель.",Москва,2015-07-27T12:48:41Z,2023-02-21T07:59:05Z,10:00:00,18:00:00,10:00:00,18:00:00,10:00:00,18:00:00,10:00:00,18:00:00,10:00:00,18:00:00,,,,
Михайловская сельская библиотека,"Респ Татарстан,р-н Муслюмовский,с Михайловка,ул Гагарина,д 1",52.928952,55.240005,"В 1929 году в селе открылся первый клуб. Позже была открыта библиотека, первой работницей которой была Е. Чубукина. Начиная с 1970-х годов большой вклад в просвещение народа вносила Ф. Давлетшина. С 2022 года библиотекарем работает Э. Фасхиева. Основной целью деятельности Михайловской сельской библиотеки является осуществление социальных, культурных, образовательных и научных функций по удовлетворению универсальных информационных потребностей общества на основе принципов общедоступности. Для читателей проводятся различные мастер-классы и конкурсы. Фонд библиотеки насчитывает 10 000 экземпляров книг.",Муслюмовский район,2022-03-29T06:30:41Z,2023-01-11T07:30:10Z,,,10:00:00,18:00:00,10:00:00,18:00:00,10:00:00,18:00:00,10:00:00,18:00:00,10:00:00,18:00:00,10:00:00,18:00:00
Библиотека-филиал № 7 Адлерского района,"край Краснодарский,г Сочи,с Калиновое Озеро,ул Центральная,д 31",39.88536,43.613362,"Сельская библиотека-филиал № 7 основана в 1966 году. Заведующая библиотекой Мурлынова Надежда Андреевна – неравнодушный, творческий человек. В своей деятельности она использует инновационные формы работы. Уделяя большое внимание экологическому воспитанию подрастающего поколения, проводит встречи с читателями, семейные праздники, викторины, экскурсии в лес. Тщательно изучает читательские интересы, организует выставки семейного творчества, пропагандирует литературу. Библиотека села Калинового Озера работает по программе «Духовно-нравственное воспитание детей и молодежи, развитие и укрепление семейных традиций в Краснодарском крае». В маленькой, но уютной библиотеке все располагает к приятному времяпровождению. Именно поэтому в жизни сельчан она занимает важное место.",Сочи,2016-04-01T10:28:57Z,2023-03-20T11:39:50Z,11:30:00,18:00:00,11:30:00,18:00:00,11:30:00,18:00:00,11:30:00,18:00:00,11:30:00,18:00:00,11:30:00,18:00:00,,
Старковская библиотека-филиал № 29,"обл Кировская,р-н Зуевский,д Старки,ул Кирова,д 13",51.1079049110413,58.2993422484849,"Примерно в 1949 году в деревне Андрошинцы была изба-читальня при сельском совете. Затем организовали библиотеку в селе Исаковка, там она находилась до 1967 года (по воспоминаниям жителей). В 1967 году библиотеку перевозят в деревню Старки. Так как своего здания библиотека не имела никогда, то её постоянно перевозили. С 1967 по 1992 год библиотека находилась в деревянном здании с печным отоплением на улице Кирова. С 1992 по 1999 год библиотека находилась в кирпичном здании Старковского ДК. С 1999 по 2000 год фонд библиотеки остается в ДК, а библиотекарь принимает читателей в здании конторы. С 2000 по 2004 фонд библиотеки перевозят в здание конторы. В 2004 году библиотеку перевозят в здание Старковской школы, где она и находится в настоящее время. На данный момент библиотекарем является Крупина Людмила Анатольевна. Объём фонда на 2019 год – 3 606. Количество посетителей – 140.",Зуевский район,2020-02-19T12:02:36Z,2023-06-15T07:22:10Z,10:00:00,13:00:00,10:00:00,13:00:00,10:00:00,13:00:00,10:00:00,13:00:00,10:00:00,13:00:00,10:00:00,13:00:00,,
Крапивинская библиотека,"обл Кемеровская,р-н Крапивинский,пгт Крапивинский,ул Советская,двлд 14",86.808051,55.002155,"Библиотека была основана в 1962 г. Фонд – 30 630 экз. Он включает научные, научно-популярные, учебные, литературно-художественные, официальные, справочные, нотные, библиографические издания, карты, грампластинки, микрофильмы. Есть журналы (2 158 экз.) и газеты (63 экз.). Крапивинская библиотека предоставляет пользователям различные услуги: выдача литературы в читальном зале и на дом, справочно-библиографическое обслуживание, проведение массовых мероприятий, библиотечных уроков, обслуживание в системе МБА, информирование абонентов в форме библиографических списков, обзоров литературы, платные услуги согласно номенклатуре.",Крапивинский район,2017-11-03T09:37:15Z,2023-08-29T08:08:37Z,08:30:00,17:30:00,08:30:00,17:30:00,08:30:00,17:30:00,08:30:00,17:30:00,08:30:00,17:30:00,09:30:00,15:30:00,09:30:00,15:30:00
Кунгаковская сельская библиотека,"Респ Башкортостан,р-н Аскинский,д Кунгак,ул Молодежная,д 4",57.3103014710509,56.212792465729,"Кунгаковская сельская библиотека – структурное подразделение Районной клубно-библиотечной системы Аскинского района РБ. Основана в 1940 году как изба-читальня, где заведующим был Халиулла Нугамеров.После централизации библиотек в 1978 году она стала Кунгаковской библиотекой-филиалом.В 2011 году произошла реорганизация учреждения: МБУК «Межпоселенческая централизованная библиотечная система» было переименовано в МАУК «Аскинская межпоселенческая центральная библиотека». Библиотека стала называться сельской библиотекой. В 2012 году для библиотеки выделили кабинет в социально-культурном центре, и с тех пор она находится там. На начало 2020 года библиотека обслуживает населенные пункты с численностью населения 493 человека. Фонд составляет 2 313 экземпляров, выдано из фонда библиотеки 9 020 документов, число посещений – 9 120, число читателей – 410. Библиотека подключена к сети Интернет.",Аскинский район,2020-08-27T07:34:03Z,2023-03-13T14:24:44Z,09:00:00,18:00:00,09:00:00,18:00:00,09:00:00,18:00:00,09:00:00,18:00:00,09:00:00,18:00:00,09:00:00,18:00:00,,
Библиотека-филиал № 17 п. Новочернореченского,"край Красноярский,р-н Козульский,п Новочернореченский,ул Деповская,д 16",91.091425,56.265182,"Библиотека основана в 1982 году. Общий документооборот – 8 009 единиц. Количество посещений в год – 7 398. Пользователями библиотеки являются взрослые читатели в количестве 946 человек.В здании есть читальный зал, являющийся площадкой для реализации творческого, профессионального, образовательного, культурного потенциала пользователей. Взрослые жители с большим интересом принимают участие в мероприятиях экологических, краеведческих, патриотических и по другим направлениям. Проводятся различные культурно-массовые мероприятия.Библиотека участвует в проектной деятельности, сотрудничает со школами № 1, № 2 и детским садом «Колосок».",Козульский район,2023-05-16T06:14:09Z,2023-05-16T06:21:01Z,,,10:00:00,19:00:00,10:00:00,19:00:00,10:00:00,19:00:00,10:00:00,18:00:00,10:00:00,19:00:00,,
Хорнойская сельская библиотека,"Чувашия Чувашская республика,р-н Моргаушский,д Хорной,ул Школьная,д 17б",46.737332,55.993288,"Хорнойская сельская библиотека была открыта на базе избы-читальни в д. Пажалукасы (1930–1963). В 1952 году насчитывалось 3 124 книги, выписывалось 9 газет, 11 журналов. В 2008 году библиотека была оптимизирована в Хорнойский библиотечный пункт, фонд и штат был переведен на баланс Тойгильдинской сельской библиотеки. В 2021 году по просьбе населения и при поддержке администрации района была вновь открыта Хорнойская сельская библиотека, выделено 0,5 ставки, возвращен фонд и начали поступать новые книги. На 1 января 2021 года фонд включал 6 035 экземпляров книг, из них на чувашском языке 1 677 экземпляров. Библиотека обслуживает жителей д. Хорной. В 2021 году зарегистрировано 418 читателей, количество посещений составило 4 635, выдано книг и журналов 8 901 экземпляр. В библиотеке работает клуб по интересам для детей «Мастерилки», в рамках которого юные читатели учатся работать с бумагой, изучают разные техники аппликаций.",Моргаушский район,2022-02-16T05:58:37Z,2023-02-21T09:16:11Z,,,17:00:00,19:00:00,17:00:00,19:00:00,16:30:00,19:00:00,16:30:00,19:00:00,,,,
Центральная библиотека им. М. М. Зощенко,"г Санкт-Петербург,г Сестрорецк,ул Токарева,д 7",29.9561548233032,60.08858181231,"Центральная библиотека им. М. М. Зощенко открыта в 1944 году. Количество пользователей – свыше 8 000 человек. Посещаемость в год – более 95 000. Фонд – свыше 116 000 единиц. Пользователям предоставляется бесплатный доступ к популярным электронным библиотекам и каталогам, ресурсам Президентской библиотеки имени Б. Н. Ельцина, Национальной электронной библиотеки и информационно-образовательного центра «Русский музей: виртуальный филиал», материалам архивов Санкт-Петербурга. В библиотеке проходят лекции, выставки, встречи и другие события. Работает клуб робототехники и поэтический клуб. Для пенсионеров организованы компьютерные курсы. Индивидуальным посетителям музейной экспозиции «Жизнь и творчество Михаила Зощенко» предоставляются аудиогиды, экскурсии для организованных групп проводят кураторы экспозиции. Ежегодно в августе в сквере у библиотеки проходят Зощенковские чтения с участием артистов театра и кино, музыкантов и исполнителей. Литературно-музыкальный праздник, посвященный дню рождения Зощенко, объединяет поклонников его творчества уже почти 30 лет. Сотрудники библиотеки проводят пешеходные экскурсии по достопримечательностям Сестрорецка «Дальние Дубки» Петра I – 300 лет истории», «Пешком по Сестрорецку», «В старинных зданиях дух времени живет».",Санкт-Петербург,2015-10-07T12:33:47Z,2023-08-23T08:36:08Z,11:00:00,19:00:00,11:00:00,19:00:00,11:00:00,19:00:00,11:00:00,19:00:00,,,12:00:00,18:00:00,12:00:00,18:00:00
Библиотека № 2 «Истоки» г. Тольятти,"обл Самарская,г Тольятти,ул Горького,д 42",49.40699,53.519948,"Информационный центр для полиэтнического населения города. Библиотека №2 «Истоки» была создана в декабре 1951 года. В результате реализации проектов «Истоки» и «Диалог» в 2006 году в библиотеке был открыт отдел национальной литературы, в котором собраны материалы по истории, этнографии и языкам народов Поволжья для сохранения и развития, культур, национально-бытовых традиций диаспор, проживающих в городе. В своем активе библиотека «Истоки» насчитывает 13 партнеров: национально-культурные центры и автономии: чувашская национально-культурная автономия, татарская национально-культурная автономия, мордовский национально-культурный центр, еврейский НКЦ, украинский НКЦ, белорусский НКЦ, немецкий НКЦ , армянская НКА, азербайджанская НКА и др. С 2012 года в библиотеке функционирует общественный центр доступа к государственной и муниципальной информации с зоной WI-FI.",Тольятти,2015-10-30T10:31:01Z,2023-03-10T14:30:54Z,09:00:00,19:00:00,09:00:00,19:00:00,09:00:00,19:00:00,09:00:00,19:00:00,,,,,11:00:00,19:00:00
