name,address,longitude,latitude,description,subordination,creation_time,modification_time,mo_from,mo_to,tu_from,tu_to,we_from,we_to,th_from,th_to,fr_from,fr_to,sa_from,sa_to,su_from,su_to
Молодежная сельская библиотека,"край Краснодарский,р-н Белореченский,п Молодежный,ул Строителей,д 1",39.6691574188343,44.6789895367799,"Молодежная сельская библиотека была основана в 1971 году. Фонд библиотеки составляет 17 000 экземпляров. Количество читателей составляет 600 человек. Библиотека осуществляет всестороннее раскрытие фонда с использованием различных форм индивидуальной и массовой работы. Занимается продвижением книги и чтения среди населения, и повышение уровня читательской активности. Проводит социологические исследования с целью выявления интересов и потребностей пользователей. Использует опыт работы других библиотек с целью внедрения в практику работы библиотеки наиболее интересных форм библиотечных услуг.",Белореченский район,2022-03-23T17:34:04Z,2022-04-15T08:54:39Z,10:00:00,17:00:00,,,10:00:00,17:00:00,10:00:00,17:00:00,10:00:00,17:00:00,10:00:00,17:00:00,10:00:00,17:00:00
Кучеровская сельская библиотека,"край Красноярский,р-н Нижнеингашский,с Кучерово,ул Центральная,д 46",96.9658864557113,56.3117154150542,"Библиотека основана в 1976 году. Фонд на сегодня составляет 9 342 экземпляра. Количество посетителей за год составляет в среднем 370 человек. Библиотека в силу своих особенностей – открытости, доступности и бесплатности – берет на себя функции организации досуга населения. Свободное, непринужденное общение оказывается очень полезным для людей. Они, получая информацию о новых книгах, журналах, обмениваются опытом, помогают советом другим, находят единомышленников и друзей. Клубы по интересам при Кучеровской библиотеке созданы для привлечения новых читателей, расширения их кругозора, объединения людей разных возрастов и профессий, а также для организации их досуга. Важнейшей частью взаимодействия с общественностью являются отношения со средствами массовой информации. Библиотека тесно сотрудничает с местной газетой «Победа». Публикуются статьи, интервью о проводимых значимых мероприятиях, выставках. Освещаются все художественные выставки, которые проходят в библиотеке.С каждым годом совершенствуются навыки издательской деятельности. Издаваемая рекламная продукция стала более разнообразна как по тематике, так и по целевому назначению: библиографические пособия, памятки, буклеты, проспекты и другая рекламная продукция.",Нижнеингашский район,2021-04-29T05:07:08Z,2023-03-28T06:25:34Z,,,09:00:00,19:00:00,09:00:00,19:00:00,09:00:00,19:00:00,09:00:00,19:00:00,09:00:00,19:00:00,,
Центральная районная детская библиотека им. О. Кошевого,"обл Нижегородская,г Нижний Новгород,пр-кт Октября,д 19",43.865732,56.252682,"Центральная районная детская библиотека (ЦРДБ) им. О. Кошевого – самая крупная среди районных детских библиотек города. Официальное открытие библиотеки состоялось 10 марта 1939 года по адресу: улица Октябрьская, дом 19 (сегодня – проспект Октября). В 1939 году в библиотеку записалось 5724 человека. Не прекращала свою работу детская библиотека и в годы Великой Отечественной войны.После войны библиотека углубленно начала работать по патриотическому воспитанию детей и подростков. Исполнительный комитет Горьковского городского совета депутатов трудящихся решением № 854 от 30 октября 1948 года утвердил решение исполкома Автозаводского райсовета о присвоении имени Олега Кошевого детской центральной библиотеке в Автозаводском районе.С 1994 года библиотека является Центром детского творчества. В библиотеке имеется кукольный театр, в представлениях которого участвуют сами дети. Любимые литературные герои являются участниками всех праздников. В настоящее время библиотека располагает огромными возможностями по приобщению детей и подростков к культурным ценностям: имеет богатые книжные ресурсы, развитую информационную среду и доступ к информации. К услугам читателей – большой фонд литературы и периодических изданий, электронный каталог новых книг, электронная картотека статей, Интернет, развитый информационно-поисковый аппарат.Количество читателей – 6 300 чел. Книжный фонд – 53 850 экз.Структура:абонемент для дошкольников и младших школьников;абонемент для детей среднего и старшего школьного возраста;справочный зал;игровой зал;абонемент для руководителей детского чтения;районный методический центр детских и школьных библиотек;литературно-мемориальная экспозиция памяти Олега Кошевого.",Нижний Новгород,2016-10-20T11:03:33Z,2023-02-01T06:32:45Z,10:00:00,18:00:00,10:00:00,18:00:00,10:00:00,18:00:00,10:00:00,18:00:00,10:00:00,18:00:00,,,10:00:00,17:00:00
Балкашинская сельская библиотека,"обл Пензенская,р-н Белинский,с Балкашино,ул Центральная,зд 2",43.62687,52.877399,"Балкашинская сельская библиотека расположена в здании сельского Дома культуры. Основные виды деятельности – обслуживание читателей и предоставление пользователям информации на материальных или нематериальных носителях и справочно-библиографическое обслуживание. Также в библиотеке организована культурно-просветительская деятельность – здесь проводятся выставки, образовательные часы, научные и просветительские мероприятия. С постоянными читателями работает библиотекарь Людмила Николаевна Климкина. Основной книжный фонд насчитывает 8 783 экземпляра. Библиотека работает по программе «Пушкинская карта».",Белинский район,2023-05-03T08:08:41Z,2023-05-03T10:45:10Z,,,,,09:00:00,18:00:00,09:00:00,18:00:00,09:00:00,18:00:00,09:00:00,18:00:00,09:00:00,16:00:00
Старомеловатская библиотека,"обл Воронежская,р-н Петропавловский,с Старая Меловая,ул Первомайская,д 1",40.87286,50.278202,"В далеком 1917 году, после многих революционных событий, в селе была образована массовая публичная библиотека. Находилась она в центре села, в бывшем поповском доме. Книги в библиотеке были из личного собрания местного помещика Урсулова и насчитывалось их всего 603 экземпляра. В 1923 году при библиотеке образуется изба-читальня для проведения курсов по ликвидации неграмотности среди населения Старой Меловой. На 1 января 1952 года книжный фонд Старомеловатской сельской библиотеки составлял 4 025 экземпляров книг и брошюр. В настоящее время книжный фонд библиотеки насчитывает – 11 709 экземпляров, читателей – 950 человек, книговыдача –18 000 экземпляров.Старомеловатская сельская библиотека является культурным и информационным центром на селе. Основное направление работы библиотеки военно-патриотическое и краеведческое.",Петропавловский район,2017-04-27T08:07:41Z,2023-03-07T06:28:09Z,09:00:00,17:00:00,09:00:00,17:00:00,09:00:00,17:00:00,09:00:00,17:00:00,09:00:00,17:00:00,,,,
Библиотека с. Бабстово,"Аобл Еврейская,р-н Ленинский,с Бабстово,ул Ленина,д 14",132.479783,48.119807,"Библиотека была основана в 1960 году. Она была переведена из с. Целинное, где функционировала с 1957 года как профсоюзная библиотека Бабстовского зерносовхоза. Для нее выделили два смежных помещения в сельском клубе с отдельным входом. В 1976 году началась подготовка к централизации библиотечной системы района: был сверен фонд с инвентарными книгами, составили алфавитный каталог. И в 1977 году библиотека стала филиалом ЦБС. В декабре 1979 года построили здание нового Дома культуры, с тех пор библиотека размещается в просторных светлых залах ДК площадью около 150 кв. м.В настоящее время двери библиотеки всегда открыты для посетителей. Здесь работает кружок «Калейдоскоп идей». В 2020 г. книжный фонд составил 18 562 экземпляра, количество пользователей – 703 человека, посещений – 4 897, книговыдача – 7 220 экземпляров.",Ленинский район,2019-10-29T07:39:00Z,2023-03-21T08:45:01Z,,,10:00:00,18:00:00,10:00:00,18:00:00,10:00:00,18:00:00,10:00:00,18:00:00,10:00:00,18:00:00,10:00:00,18:00:00
Детская библиотека г. Кохма,"обл Ивановская,р-н Ивановский,г Кохма,ул Советская,д 30",41.093819,56.933587,"Детская библиотека была организована на базе детского отделения городской Кохомской библиотеки и начала свою работу 1 сентября 1961 года. Первоначально располагалась в здании администрации на ул. Советской, д. 38, после реструктуризации библиотек переехала в бывшее здание мужского училища Ясюнинских.Фонд включает 25 079 ед. хранения. Читателей – 1 500 человек. Книговыдача – около 30 000 экз. в год. Библиотека обладает универсальным книжным фондом для детей, является методическим центром по детскому чтению. Основную деятельность осуществляет в рамках программы «Детский калейдоскоп». В игровой форме сотрудники ведут своих юных читателей по дороге в мир книг. Конкурсы, путешествия с книжными героями, обзоры, творческие и интеллектуальные игры, турниры, кукольные спектакли, новогодние утренники – все это часть работы детской библиотеки.",Кохма,2015-11-17T12:10:55Z,2023-02-22T10:54:56Z,09:00:00,17:00:00,09:00:00,17:00:00,09:00:00,17:00:00,09:00:00,17:00:00,09:00:00,17:00:00,,,09:00:00,15:00:00
Высокиничская сельская модельная библиотека,"обл Калужская,р-н Жуковский,с Высокиничи,ул Ленина,д 18",36.911371,54.913732,"Высокиничская библиотека была основана в период 1929–1930 гг. во время коллективизации народного хозяйства. В центре села Высокиничи по ул. Советской, в простой бревенчатой избе расположилась изба-читальня – это была самая первая библиотека села Высокиничи. В 1956 для библиотеки было построено новое бревенчатое здание. Летом 2011 года библиотека переехала в новое помещение с новой библиотечной мебелью, обновился интерьер библиотеки, пополнился книжный фонд, установлен компьютер с принтером и сканером, ксерокс, открыт выход в интернет. Высокиничской библиотеке присвоили звание модельной. Работа в таких условиях стала намного интересней. Библиотека стала более востребованной, а ее работа эффективной.Библиотека обслуживает 1 213 читателей. В 2022 году фонд библиотеки составил 31 910 экземпляров, число посещений библиотеки – 9 961.",Жуковский район,2015-03-11T18:22:39Z,2023-02-22T12:03:54Z,,,10:00:00,18:00:00,10:00:00,18:00:00,10:00:00,18:00:00,10:00:00,18:00:00,10:00:00,18:00:00,10:00:00,18:00:00
Зеленогорская сельская библиотека,"Респ Марий Эл,р-н Моркинский,п Зеленогорск,ул Кооперативная,д 23",48.776633,56.522053,"Библиотека расположена в здании Зеленогорской средней общеобразовательной школы на первом этаже площадью 93 кв. м. с 11 посадочными местами. Обслуживает все категории читателей, особое место уделяет детям и подросткам. Для них проводятся громкие читки, игры, выставки, викторины, театрализованные представления, классные часы, часы информации, презентации книг, индивидуальные беседы, экскурсии, тематические вечера, обзоры, дискуссии, дискотеки, уроки нравственности, патриотизма.Для взрослого населения – вечера отдыха, концерты, собрания, индивидуальные и групповые беседы. Поддерживается сотрудничество с администрацией сельского поселения, школой, психоневрологическим интернатом, Зеленогорским ФАП. Фонд – 11 781 экземпляров книг, читателей – 757 человек.При библиотеке работают кружок «Капельки доброты» и клуб любителей поэзии «Радость общения».",Моркинский район,2022-03-16T06:07:09Z,2023-07-25T13:49:09Z,08:00:00,16:00:00,08:00:00,16:00:00,08:00:00,16:00:00,08:00:00,16:00:00,08:00:00,16:00:00,08:00:00,13:00:00,,
Тумская детская библиотека,"обл Рязанская,р-н Клепиковский,рп Тума,ул Советская,д 78а",40.550482,55.151682,"Тумская детская библиотека размещается в одноэтажном здании, построенном в 1965 году. В ней около 1 300 читателей. Основная категория пользователей – школьники с первого по девятый классы. Библиотечный фонд включает более 10 000 экземпляров книг и журналов – это отраслевая, художественная, детская литература. В пользовании читателей 2 зала: читальный и абонемент. На абонементе располагается основной фонд библиотеки со свободным доступом. В читальном зале к услугам читателей справочная литература и периодические издания. Здесь также проходят мероприятия, организуются книжные выставки, выставки изделий ручной работы. Библиотека – это центр детского чтения, общения и досуга, информационное пространство и среда для развития ребенка, где он может читать, творить, играть. Досуговая деятельность библиотеки очень разнообразна: клуб, творческие встречи, литературные вечера. Учреждение тесно сотрудничает со школами и детскими садами поселка. В небольшой библиотеке всегда царит атмосфера доброжелательности, уюта и комфорта. Здесь рады каждому читателю – и юному, и взрослому.",Клепиковский район,2022-12-06T11:39:39Z,2023-07-24T08:50:04Z,,,09:00:00,18:00:00,09:00:00,18:00:00,09:00:00,18:00:00,09:00:00,18:00:00,09:00:00,18:00:00,,
Луговая сельская библиотека,"обл Свердловская,р-н Тугулымский,д Луговая,ул Центральная,д 34",64.546531,56.940246,"Первая изба-читальня в д. Луговая образовалась в 1932 году. Размещалась она тогда в частном доме, здесь же размещался ликбез для неграмотных жителей деревни. Фонд составлял около 150 книг, поступали газеты и журналы, но их было мало. Освещение давала керосиновая лампа, тепло – печка. В 1937 году в деревне случился пожар, после которого избу-читальню перевезли в другое здание. В 1962 году началось строительство клуба с библиотекой. Переехав в новое здание, библиотека значительно пополнила свой книжный фонд. Активно проводились читательские конференции, обзоры книг, информационные вечера. Сегодня основными направлениями деятельности Луговской сельской библиотеки являются продвижение книги и чтения, патриотическое воспитание, формирование здорового образа жизни и краеведение. Краеведение является одним из ведущих направлений работы библиотеки. Несколько лет подряд в библиотеке реализуется краеведческая программа «Мой край называется Уралом». В рамках программы ведется большая поисковая работа по сбору, систематизации, печати и распространению материала об истории деревни Луговая, организуются и проводятся интересные мероприятия. На базе библиотеки действует любительское объединение «Встреча», объединяющее женщин, увлекающихся прикладными видами творчества. Фонд библиотеки насчитывает 2 720 экземпляров. В ней зарегистрированы 167 пользователей, в том числе 50 детей до 14 лет. Имеется доступ к НЭБ, а также к другим удаленным ресурсам.",Тугулым,2019-04-08T10:16:32Z,2023-03-24T08:23:44Z,,,,,,,,,09:00:00,17:00:00,,,,
Кошноруйская сельская библиотека,"Чувашия Чувашская республика,р-н Канашский,д Кошноруй,ул Ленина,д 33",47.4268893730164,55.6789938756195,"Кошноруйская сельская библиотека – одна из библиотек Канашского района Чувашской Республики. Расположена она в д. Кошноруй, Ленина д.33. Блиотека находится на территории Кошноруйской сельской администрации Канашского района и обслуживает населенные пункты – д. Кошноруй, с. Шигали, д. Д.Сормы, д. Ирх-Сирмы, д. Бл. Сормы, д. Зеленовка.Открылась в 1955 г. Первоначально она размещалась в частном доме по ул. Советская, д. 5 (совр. назв). Первый библиотекарь – Екатерина Аверкиевна Смирнова, уроженка д. Дальние Сормы. С 13 мая 2019 г. заведует библиотекой Никонорова Оксана Олеговна. За 2021 год число читателей библиотеки составило 936 человек. Посещение библиотеки составило 11900. Объем фонда – 13248 экз. из них электронных изданий – 68 экз. Периодические издания –12 наименований. Книговыдача – 23010 экз.",Канашский район,2015-07-23T07:10:05Z,2023-03-10T06:20:37Z,,,10:00:00,16:00:00,10:00:00,16:00:00,10:00:00,16:00:00,10:00:00,16:00:00,10:00:00,16:00:00,,
