name,address,longitude,latitude,description,subordination,creation_time,modification_time,mo_from,mo_to,tu_from,tu_to,we_from,we_to,th_from,th_to,fr_from,fr_to,sa_from,sa_to,su_from,su_to
Красная сельская библиотека,"край Ставропольский,р-н Грачевский,с Красное,ул Красная,двлд 38",42.442505,45.117075,"До 1950 года библиотека находилась в старой двухкомнатной хате и называлась избой-читальней. Председатель колхоза «Коминтерн» Д. В. Евдокимов решил пополнить ее фонд книгами и организовать библиотеку. Она открылась в мае 1951 года. Читателей тогда было около 200 человек, фонд включал 1 500 книг. В 1969 году библиотека переехала в новый Дом культуры, и ей было присвоено имя Д. В. Евдокимова. С каждым годом фонд пополнялся, шел прирост читателей. Сейчас книжный фонд насчитывает 21 363 экземпляра, книговыдача – 28 462 экземпляра, библиотеку посещают более 1 000 читателей. Фонд периодических изданий представлен журналами «Саша и Маша», «Дарья: биографии», «Классная девчонка», «Моя прекрасная дача», «Сельская новь», газетами «Российская газета: неделя», «Ставропольская правда», «Вперед». В библиотеке постоянно действует детский уголок, работает клуб «Золотой возраст» (для пожилых людей). Ведется работа по проекту «Вместе с книгой и игрушкой». В библиотеке организуются выставки новинок, тематические досье, издаются рекомендательные списки, закладки, открытки с рекламой книг. Многие выставки были выездными, интерактивными, сопровождались играми, викторинами, кроссвордами.",Грачевский район,2023-08-24T11:01:35Z,2023-09-04T11:39:59Z,,,09:00:00,17:00:00,09:00:00,17:00:00,09:00:00,17:00:00,09:00:00,17:00:00,09:00:00,17:00:00,,
Борковская библиотека,"обл Архангельская,р-н Котласский,д Борки,ул Центральная,д 4",47.3547782301867,61.334949097271,"История Борковской сельской библиотеки берет свое начало с 1989 года, когда закрылась библиотека в д. Слуда. Борковская библиотека располагалась сначала в здании закрытого детского сада два года, а затем под библиотеку выделили одно из помещений Борковской школы, через несколько лет библиотека разместилась в здании сплавконторы. В 2006 году Борковская библиотека была переименована в библиотеку-клуб и переехала в здание клуба, где и находится по сей день. Наиболее ярко в деятельности библиотеки представлены услуги по организации общения. Здесь уже много лет работает клуб по интересам «Соседушки», участники собираются на мероприятия раз в неделю. Также библиотека организует работу по продвижению книги и чтения, ведет краеведческую работу. Фонд библиотеки на начало 2022 года, в сего – 1680 изданий, книг – 1343 экз., периодических изданий – 337 экз",Котласский район,2022-10-31T08:49:36Z,2023-01-23T09:04:55Z,,,,,13:00:00,16:00:00,13:00:00,16:00:00,13:00:00,16:00:00,,,,
Панкрушихинская районная библиотека,"край Алтайский,р-н Панкрушихинский,с Панкрушиха,ул Ленина,влд 7",80.344223,53.831955,"Здание Панкрушихинской районной библиотеки было построено в 1959 году. Вместимость зала – 30 посадочных мест. В нем работают с литературой читатели, проводятся торжественные мероприятия, собрания, концерты. Библиотека проводит порядка 180 мероприятий в год. Ведут работу пять клубных формирований: клуб по интересам, а также игровой, мультипликационный, шахматный, театральный клубы. В них занимается более 30 человек. Для каждой возрастной категории используются свои формы проведения досуга: для молодежи – утренники, театрализованные представления, викторины, игровые программы, тематические концерты, выставки, квесты, диспуты, круглые столы, профориентационные встречи, спортивные праздники, вечеринки;для ветеранов – чествования на дому, тематические концерты, круглые столы;для людей с ограниченными возможностями – вечера отдыха, календарные праздники;для людей среднего возраста – тематические встречи, круглые столы, встречи в стиле ретро, юбилейные торжества.",Панкрушихинский район,2023-10-25T06:16:13Z,2023-10-26T13:05:37Z,09:00:00,17:00:00,09:00:00,17:00:00,09:00:00,17:00:00,09:00:00,17:00:00,09:00:00,17:00:00,,,10:00:00,14:00:00
Центральная библиотека села Таштып,"Респ Хакасия,р-н Таштыпский,с Таштып,ул Ленина,д 37",89.887754,52.802328,"Центральная библиотека села Таштып была основана в 1928 г. На сегодняшний день фонд включает в себя 23 221 экз. книг, количество посетителей – 1 881 человек. На протяжении всей своей истории библиотека стремится приобщить читателей к интеллектуальному богатству человечества, обогатить их досуг. Сегодня она востребована и как информационный центр. Так, в библиотеке работает центр общественного доступа к информации (ЦОД). В распоряжении пользователей нормативно-правовые базы данных «КонсультантПлюс» и «Гарант». Библиотекари составляют информационные буклеты по российскому законодательству. Их тематика актуальна и востребована: «О мерах социальной поддержки ветеранов труда», «Новое в налоговом законодательстве», «Об исчислении пенсий» и др.",Таштыпский район,2021-10-14T03:19:23Z,2023-02-27T09:21:11Z,09:00:00,17:00:00,09:00:00,17:00:00,09:00:00,17:00:00,09:00:00,17:00:00,09:00:00,17:00:00,,,10:00:00,17:00:00
Советская модельная сельская библиотека,"обл Оренбургская,р-н Бугурусланский,с Советское,ул В.Карпова,д 29",52.7858258236234,53.8221032283148,"Советская сельская модельная библиотека была создана в 1937 году. Сегодня это информационно-культурный центр, оснащенный современными техническими средствами и подключенный к сети Интернет. Фонд включает 14 900 экземпляров. Библиотека осуществляет библиотечное, информационное и сервисное обслуживание населения, ориентируясь в своей деятельности на государственные, областные и районные целевые программы. Приоритетные направления работы – патриотическое воспитание, возрождение национальной культуры, краеведение, пропаганда книги и чтения, духовное возрождение.С 2011 года успешно работает клуб друзей библиотеки «Леопольд». В 2016 году члены клуба подготовили театрализованное представление к юбилею С. Т. Аксакова по сказке «Аленький цветочек», которое показали на библиотечном мероприятии «Путешествие в чудесный край, Аксаковым воспетый». Кроме того, в репертуаре представлены такие спектакли, как «Заюшкина избушка», «Теремок», «Дюймовочка», «Однажды в библиотеке». С 2021 года работает волонтерский отряд «Добрые сердца».",Бугурусланский район,2022-11-11T15:03:42Z,2023-06-16T12:37:46Z,,,09:00:00,17:30:00,09:00:00,17:00:00,09:00:00,17:30:00,09:00:00,17:00:00,09:00:00,16:00:00,,
Юрьянская центральная районная библиотека им. С. И. Сычугова,"обл Кировская,р-н Юрьянский,пгт Юрья,ул Ленина,д 15",49.279492,59.044102,"Юрьянская центральная районная библиотека – одна из старейших библиотек района. Ее история тесно связана с именем ученого, врача, просветителя С. И. Сычугова. К 105-летию со дня открытия библиотеки в 1999 году решением Юрьянской районной думы библиотеке присвоено его имя. С 2001 года стали проводиться Сычуговские чтения. Здесь открыт публичный центр правовой информации (ПЦПИ). Библиотека обслуживает 3 750 читателей. Фонд насчитывает 32 984 экземпляра книг и журналов. С 2011 года внедряются современные информационные технологии: функционирует электронный каталог с использованием программы OPAC-Global. На сайте обеспечен доступ к электронному каталогу для всех пользователей интернета.",Юрьянский район,2015-09-02T08:00:44Z,2023-02-21T13:47:38Z,09:00:00,18:00:00,09:00:00,18:00:00,09:00:00,18:00:00,09:00:00,18:00:00,09:00:00,18:00:00,,,09:00:00,16:00:00
Октябрьская сельская библиотека,"Чувашия Чувашская республика,р-н Мариинско-Посадский,с Октябрьское,ул Советская,влд 13",47.8169014269142,55.9039278497055,"Октябрьская сельская библиотека размещена в кирпичном одноэтажном здании. Библиотека обеспечивает сельским жителям свободный доступ к информации, знаниям. В обслуживании граждан использует традиционные и новейшие информационные технологии, фонды документов и современные носители информации, обеспечивает доступ в глобальное информационное пространство, содействует формированию информационного общества. Заботится о развитии подрастающего поколения и о людях, нуждающихся в социокультурной поддержке. Обслуживает 850 пользователей, из них дети до 14 лет – 378, молодежь от 15 до 30 лет – 162. Направление деятельности – семейно-досуговый центр. Функционирует клуб «Хочу все знать». Фонд составляет 23 952 экз., в том числе 9 наименований периодических изданий, 5 082 издания на чувашском языке.Сервисные услуги: распечатка документов, сканирование, предоставление компьютерной техники для самостоятельной работы, интернет.",Мариинско-Посадский район,2021-03-17T09:15:02Z,2023-02-21T12:25:09Z,12:00:00,19:00:00,12:00:00,19:00:00,12:00:00,19:00:00,12:00:00,19:00:00,12:00:00,19:00:00,12:00:00,19:00:00,,
Петропавловская детская библиотека,"Респ Бурятия,р-н Джидинский,с Петропавловка,ул Терешковой,д 7б",105.327242,50.613897,"Петропавловская детская библиотека основана в 1958 году. Документный фонд насчитывает 16 381 экземпляр, ежегодно библиотека обслуживает более 1 500 читателей. Сегодня Петропавловская детская библиотека – это своеобразный островок цивилизации, соединяющий в себе достижения современной техники и книжной культуры. Для творческих исканий и развития способностей юных читателей созданы все условия. Библиотечное пространство построено в соответствии с запросами читателей. Приоритетные направления работы реализуются через целевые программы «Островок счастливого детства – библиотека» (центр семейного чтения) и «Не расставайтесь с книгой летом» (программа летнего чтения). Для детей и их родителей работает клуб семейного чтения «Всей семьей в библиотеку», при котором действует родительский университет, проводятся семейные конкурсы, родительские собрания, дни открытых дверей, акции.В библиотеке постоянно действует и обновляется выставка «Для вас, родители!». Выпускается рекламно-издательская продукция: брошюры, рекомендательные списки литературы, памятки «Памятка для родителей», «Как помочь ребенку полюбить чтение», «Чтение – дело семейное», «Расти с книжкой малыш!» и другие. Также в библиотеке действует Музей читательского творчества, пресс-центр «Золотое перышко», постоянная выставка «Добрых рук мастерство».",Джидинский район,2022-09-16T02:14:28Z,2022-09-21T08:56:14Z,09:00:00,18:00:00,09:00:00,18:00:00,09:00:00,18:00:00,09:00:00,18:00:00,09:00:00,18:00:00,10:00:00,17:00:00,,
Иннокентьевская поселенческая библиотека,"край Красноярский,р-н Идринский,д Иннокентьевка,ул Зеленая,д 21",91.8814959791087,54.7829541308482,"Иннокентьевская поселенческая библиотека была открыта в 1990 году. Имеет универсальный фонд – 3 722 экземпляра документов. Количество посетителей – 739 человек. Деревня Иннокентьевка самая отдаленная от районного центра (80 км), не имеет сотовой связи и интернета, что ограничивает жителей в выборе досуга. Поэтому проблема организации досуга – одна из актуальных, и занимаются ею библиотека и сельский клуб. Из-за небольшого количества жителей часто работа ведется совместно. Есть еще одна особенность – в деревне проживает много староверов. Они с удовольствием посещают творческую студию «Волшебная мастерская». Для детей и подростков работает любительское объединение «Почемучки». Работа библиотеки направлена на приобщение к чтению, развитие творческой инициативы, выявление интересов пользователей.",Идринский район,2021-04-26T03:32:31Z,2023-03-17T11:05:31Z,,,09:00:00,12:00:00,09:00:00,12:00:00,09:00:00,12:00:00,09:00:00,12:00:00,09:00:00,12:00:00,09:00:00,12:00:00
Филиал № 2 «Библиотека семейного чтения» г. Мурманска,"обл Мурманская,г Мурманск,ул Адмирала флота Лобова,д 46",33.084853,69.025552,"Детская библиотека для ребят открылась в феврале 1954 года. Сегодня этой библиотекой пользуется 2,6 тысячи человек. Библиотечный фонд составляет 17 тысяч экземпляров. Каждую субботу в 12 часов и воскресенье в 14 часов работает арт-лаборатория «Тайна песочных картин». А в 15 часов проходят занятия в «Чудесной мастерской». Каждое воскресенье в 15 часов проходят занятия в мастерской семейного чтения «Библиокроха». В интерьере библиотеки всегда присутствуют экспозиции детских рисунков и поделок. В уютном читальном зале библиотеки много научно-познавательных книг, периодики, электронных изданий, настольных игр. Каждый может найти себе занятие по душе. По воскресеньям проходят литературные, семейные праздники.",Мурманск,2016-09-24T15:16:10Z,2023-02-21T13:21:42Z,,,11:00:00,18:00:00,11:00:00,18:00:00,11:00:00,18:00:00,11:00:00,18:00:00,11:00:00,18:00:00,11:00:00,18:00:00
Ишлинская сельская библиотека,"Респ Башкортостан,р-н Аургазинский,с Ишлы,ул Ленина,д 21",55.9062319612538,54.1932654807551,"Ишлинскую сельскую библиотеку открыли в 30-х годах ХХ века. Она была одной из первых волостных библиотек Миркит-Минского уезда Уфимской губернии. В настоящее время библиотека является интеллектуальным центром для жителей села Ишлы, деревень Старокузяково, Якты-Юл, Ахмерово, Арсланово, Муксино (1 614 человек). Фонд составляет 19 729 экземпляров. Услугами учреждения пользуются 998 читателей. Главное направление деятельности библиотеки – это оперативное предоставление информации по социальным, историческим, экономическим и другим вопросам. Ведется патриотическое, нравственное, эстетическое воспитание подрастающего поколения, экологическое просвещение населения, краеведческая деятельность. Пользователи Ишлинской сельской библиотеки – дети и учащаяся молодежь, сельская интеллигенция (учителя, врачи, работники сельскохозяйственного производства), а также пенсионеры, домохозяйки.",Аургазинский район,2020-09-16T07:49:20Z,2023-03-15T06:37:46Z,,,09:00:00,19:00:00,09:00:00,19:00:00,09:00:00,19:00:00,09:00:00,19:00:00,09:00:00,19:00:00,,
