name,address,longitude,latitude,description,subordination,creation_time,modification_time,mo_from,mo_to,tu_from,tu_to,we_from,we_to,th_from,th_to,fr_from,fr_to,sa_from,sa_to,su_from,su_to
Майминская сельская библиотека,"Респ Алтай,р-н Майминский,с Майма,ул Советская,д 57",85.905423,52.011701,"Сельская библиотека была открыта в 1986 г. Фонд насчитывает 8 474 экз. книг, обслуживает около 800 читателей в год, проводит более 100 мероприятий. Сельская библиотека является культурным центром для большого пласта населения, который территориально удален от центральной библиотеки. При сельском библиотечном учреждении функционирует множество клубов по интересам; сюда стекаются школьники, которые любят заглянуть в библиотеку до или после занятий; приходят пожилые люди, желающие получить культурное и полезное общение. Кроме того, библиотека организует выставки местных художников, картины которых украшают стены помещений.Здание имеет удобное расположение – рядом школа, спортивный зал бокса, православная церковь. Такое соседство позволяет сотрудникам расширить спектр своей работы.В 2023 г. библиотека открыла свои двери после капитального ремонта. В залах появились новые книжные стеллажи, современная техника для работников и читателей, на полках расположились новые востребованные книги.",Майминский район,2023-04-05T03:24:55Z,2023-04-05T09:21:46Z,09:00:00,17:00:00,09:00:00,17:00:00,09:00:00,17:00:00,09:00:00,17:00:00,09:00:00,17:00:00,,,,
Первоцепляевская сельская модельная библиотека,"обл Белгородская,р-н Шебекинский,с Первое Цепляево,ул Ленина,д 50А",37.257258,50.498435,"В 1967 году в селе Первое Цепляево было построено двухэтажное здание Дома культуры, где для сельской библиотеки было выделено помещение на втором этаже. В 2008 году библиотека значительно пострадала во время пожара. В декабре 2009 года после окончания капитального ремонта Дома культуры, библиотеке присвоен статус модельной. В соответствии с требованиями модельного стандарта созданы комфортные условия для интеллектуального досуга и общения читателей всех возрастов. С учетом потребностей различных категорий пользователей в Первоцепляевской сельской модельной библиотеке появились возможности для чтения лекций, проведения творческих встреч, мастер-классов, просмотров кинофильмов, организации интерактивных площадок, клубов по интересам, площадок для общения, проведения интеллектуальных игр, бесплатных курсов компьютерной грамотности для старшего поколения. Библиотека ведет работу в рамках продвижения лучших образцов классической и современной литературы. Количество пользователей в библиотеке – 570 человек. Книжный фонд насчитывает 7300 экземпляров. На базе библиотеки действуют клубные объединения: · «Молодой избиратель», · «Книгаренок», · «Школа здоровья» Каждый желающий сможет найти себе интересное занятие.",Шебекинский район,2015-03-15T14:37:29Z,2023-02-06T07:00:12Z,,,12:30:00,19:00:00,12:30:00,19:00:00,12:30:00,19:00:00,13:30:00,20:00:00,13:30:00,20:00:00,12:30:00,19:00:00
Парфентьевская сельская библиотека,"обл Московская,г Коломна,с Парфентьево,ул Луговая,д 7",38.810652,55.105403,"Парфентьевская бесплатная библиотека-читальня была открыта решением Коломенского уездного собрания в марте 1901 г. Библиотечный фонд составляет 8,5 тысяч экземпляров, количество пользователей – 500 человек.Сохраняя богатую историю села, библиотека ведет краеведческую работу, ведет поиск документальных свидетельств прошедших десятилетий, создает краеведческий музей старинного быта, где можно увидеть афиши времен Первой мировой войны. Библиотека сегодня – это интересные книги и веселые встречи, экологическое воспитание подрастающего поколения и летний читальный зал. Ежегодно проводятся рождественские встречи для всех возрастов, детские новогодние театральные представления, праздники Масленицы и Дня пожилого человека. Для родителей с детьми каждую последнюю субботу месяца открывает двери любительское объединение «Мастерилка».",Коломенский городской округ,2016-10-04T08:29:31Z,2023-02-22T13:53:16Z,,,11:00:00,19:00:00,11:00:00,19:00:00,11:00:00,19:00:00,11:00:00,19:00:00,11:00:00,20:00:00,,
Библиотечно-досуговый центр г. Находки,"край Приморский,г Находка,мкр поселок Врангель,ул Железнодорожная,д 6/1",133.081557856484,42.7662585619252,"22 сентября 2023 года состоялось торжественное открытие современного библиотечно-досугового центра. Оно стало результатом активной работы местной администрации и благотворительных организаций, при поддержке которых были осуществлены ремонтные работы, закуплено современное оборудование и созданы комфортные условия для посетителей всех возрастов. Новый библиотечно-досуговый центр предоставит жителям микрорайона возможность проводить время с пользой, изучать новые книги и журналы, участвовать в мастер-классах и творческих вечерах, а также пользоваться современными компьютерными и информационными ресурсами. Фонд библиотеки универсальный – 2 400 экземпляров.",Находка,2023-10-04T00:23:21Z,2023-10-04T06:36:47Z,11:00:00,19:00:00,11:00:00,19:00:00,11:00:00,19:00:00,11:00:00,19:00:00,,,,,11:00:00,19:00:00
Алексеевская сельская детская библиотека № 28,"Респ Башкортостан,р-н Уфимский,д Алексеевка,ул Центральная,д 52",55.9984285526909,54.8303412452784,"Алексеевская сельская детская библиотека № 28 основана в 2003 году.Книжный фонд библиотеки составляет 4 374 экз. Количество читателей – 883, из них детей до 14 лет – 741, молодежь 15–24 лет – 72.Приоритетные направления деятельности Алексеевской сельской детской библиотеки № 28: пропаганда культурного и исторического наследия России, республики, района; возрождение традиций семейного чтения; информационная поддержка образования и самообразования, формирование информационной и культуры детей, патриотическое воспитание; формирование правовой и компьютерной грамотности.Возглавляет библиотеку Гайсина С.В.",Уфимский район,2020-09-22T14:43:16Z,2023-02-21T09:24:56Z,,,10:00:00,18:00:00,10:00:00,18:00:00,10:00:00,18:00:00,10:00:00,18:00:00,10:00:00,18:00:00,,
Детская библиотека имени Ильича,"обл Ростовская,г Ростов-на-Дону,ул Металлургическая,д 113/46",39.769361,47.251225,"Детская библиотека имени Ильича является культурно–информационным центром Первомайского района г. Ростова–на–Дону, образована в 1949 году. На сегодняшний день фонд детской библиотеки состоит из около 56 754 экземпляров. Обслуживает около 4 200 читателей. Приоритетным направлением является экологическое воспитание подрастающего поколения, которое осуществляется в тесной связи с преподавателями Детского эколого–биологического центра города Ростова–на–Дону. С 2014 года в библиотеке работает кружок «Экодизайн» декоративно–прикладной и экологической направленности, деятельность которого заключается в том, чтобы заинтересовать как новых, так и действующих читателей в посещении библиотеки, расширить экологическую деятельность филиала, привлечь детей к чтению литературы по творческому направлению, организовать досуг читателей.",Ростов-на-Дону,2019-05-30T10:03:15Z,2023-03-17T09:23:52Z,09:00:00,17:00:00,09:00:00,17:00:00,09:00:00,17:00:00,09:00:00,17:00:00,09:00:00,17:00:00,,,09:00:00,17:00:00
Модельная сельская библиотека с. п. Хада-Булакское – филиал № 14,"край Забайкальский,р-н Борзинский,с Хада-Булак,ул Юбилейная,д 4",116.558052,50.611353,"Библиотека в селе Хада-Булак появилась после революции. Находилась она в маленьком домике и называлась изба-читальня. В 30-х годах клуб и библиотеку перенесли в бывшую церковь. За все время библиотека несколько раз меняла адрес, прежде чем стала находиться в Доме культуры. В 2021 году в рамках национального проекта «Культура» состоялось открытие модельной библиотеки в с. Хада-Булак. Одним из главных направлений в деятельности модельной сельской библиотеки является краеведческая работа – сохранение прошлого и настоящего села, опыта предшествующих поколений, традиций, обычаев, природного своеобразия местности. С 1992 г. заведующая библиотекой начала собирать сведения об истории села, его жителях, памятные вещи, связанные с родным селом. За многолетнюю поисково-исследовательскую работу по изучению своей малой родины сотрудниками библиотеки накоплена достаточно хорошая информационная и краеведческая база, которая стала основой реализации проектов по изданию Книги памяти «Село Хада-Булак и его жители в годы Великой Отечественной войны», выпусков событийных, краеведческих календарей с. Хада-Булак и т.д. Общий фонд библиотеки с. Хада-Булак составляет 8633 экз., в том числе электронные ресурсы – 78 экз. Отдельным массивом выделен краеведческий фонд, он составляет 900 экз. В рамках Национального проекта «Культура» создана отдельная зона для лиц с ограниченными возможностями здоровья (ОВЗ), поступление составило 66 экз. (печатные документы и аудиокниги).",Борзинский район,2022-11-15T04:10:41Z,2022-11-28T08:59:54Z,09:00:00,21:00:00,09:00:00,21:00:00,09:00:00,21:00:00,09:00:00,21:00:00,09:00:00,21:00:00,09:00:00,21:00:00,,
Пселецкая сельская библиотека,"обл Курская,р-н Пристенский,с Пселец,ул Центральная,д 95",36.5309731870864,51.2890874119265,"Пселецкая сельская библиотека была основана в 1954 году. На протяжении длительного периода времени основными направлениями деятельности библиотеки оставались: приобщение читателей к лучшим образцам художественной литературы;военно-патриотическое; экологическое;краеведческое; привитие здорового образа жизни. Фонд составляет свыше 12 000 экземпляров. Ежегодно учреждение обслуживает 390 читателей – взрослых и детей, количество посещений – около 3 000. Проводимые библиотекой викторины, конкурсно-познавательные программы, игры, экологические праздники приводят детей и подростков к пониманию глубокой духовной связи человека с окружающим миром.",Пристенский район,2020-12-16T11:38:10Z,2023-02-21T09:33:27Z,10:00:00,16:40:00,10:00:00,16:40:00,10:00:00,16:40:00,10:00:00,16:40:00,10:00:00,16:40:00,,,,
Ямадинская сельская модельная библиотека,"Респ Башкортостан,р-н Янаульский,с Ямады,ул Центральная,д 53",55.3263115882874,56.1418232949578,"В деревне Ямады изба-читальня была открыта в 1936 году. Первым библиотекарем был житель села Султангареев Бахтигарей. Вся культурно-просветительская работа была возложена на работника избы-читальни, учителей и активистов села. В то время библиотека находилась в деревне Югамаш, а в Ямадах была только передвижная библиотека. Здание было ветхим, но несмотря ни на какие трудности, Султангареев Бахтигарей отдал все силы работе. Султангареев Бахтигарей погиб на войне в 1943 году. С 1945 по 1960 год в библиотеке работает Саитгалиев. После него библиотекари часто менялись. За эти годы вырос книжный фонд библиотеки. В 1985 году в селе Ямады был построен Дом культуры. На втором этаже разместилась библиотека. В библиотеке чисто, уютно, имеется читальный зал на 20 посадочных мест, созданы все условия для работы с читателями. С 2011 года в библиотеке работает Халмурадова Гульнара. В этом же году открылась вторая в районе, а среди сельских – первая по счету модельная библиотека в селе Ямады. На 1 января 2017 года книжный фонд библиотеки составляет 12 821 экземпляров изданий, количество пользователей – 790, книговыдача – 21 315, число посещений – 17 153.",Республика Башкортостан,2017-02-28T11:41:53Z,2023-10-17T11:51:57Z,09:00:00,17:00:00,09:00:00,21:00:00,09:00:00,17:00:00,09:00:00,21:00:00,09:00:00,17:00:00,09:00:00,17:00:00,,
Среднекужебарская сельская библиотека,"край Красноярский,р-н Каратузский,д Средний Кужебар,ул Полтавская,д 8",92.970592,53.489936,"Здание библиотеки построено в 1952 году. С 25 октября 1984 года и по настоящее время в библиотеке работает Никифорова Любовь Николаевна. В библиотеке проводятся акции, литературные вечера, игры, информационно-познавательные часы для различных групп читателей. Для детей работает детский клуб «Малышок». Люди пожилого возраста обслуживаются на дому. С ними ведется индивидуальная работа с целью выявления интересов и подбора литературы. Сведения о работе библиотеки: читателей – 112;посещений – 1 614;книговыдача – 2 987;книжный фонд – 2 490 экземпляр. В библиотеке имеется 5 наименований периодических изданий.",Каратузский район,2021-05-14T08:27:35Z,2023-02-22T13:09:04Z,16:00:00,19:00:00,16:00:00,19:00:00,16:00:00,19:00:00,16:00:00,19:00:00,16:00:00,19:00:00,,,16:00:00,19:00:00
Екатериновская сельская библиотека,"обл Самарская,р-н Безенчукский,с Екатериновка,ул Фрунзе,д 51",49.446381,53.091283,"Екатериновская сельская библиотека Самарской Губернии была открыта 5 марта 1900 года. В настоящее время сельские библиотеки являются неотъемлемой и самой значимой частью социальной структуры сельских поселений, общественной жизни местных сообществ, способствующие социальному и духовному возрождению сел, сохранению историко-культурного наследия России. Находясь в максимальной близости к населению и его потребностям, являясь единственным источником информации и знаний для сельчан, сельские библиотеки в значительной мере выполняют функции социальной коммуникации, остаются наиболее стабильными и самыми доступными учреждениями культуры. Культурно-просветительская деятельность библиотеки – выставочная деятельность, организация и проведение образовательных, просветительских мероприятий, реализация культурно-просветительских программ.",Безенчукский район,2020-03-09T11:01:27Z,2023-07-11T07:18:32Z,,,10:00:00,18:00:00,10:00:00,18:00:00,10:00:00,18:00:00,10:00:00,18:00:00,10:00:00,18:00:00,10:00:00,16:00:00
Староакбуляковская сельская библиотека,"Респ Башкортостан,р-н Караидельский,д Старый Акбуляк,ул Салавата,д 43",56.7398974299431,55.8944790902544,"В 1930–1931 годах в деревне Старый Акбуляк появилась изба-читальня. В годы Великой Отечественной войны в ней работала Мустафина Газима. В разные годы ее работниками были: Мубаряков Талгат, Ахметов Глимхан, Сафиуллина Фарида, Гильмазов Фагиль. В 1970 году в деревне было построено большое типовое здание клуба. В 1974 году был выделен отдельный штат заведующего библиотекой. Возглавила ее Габдинурова Альфира. В 1976–1977 годах работала Насабутдинова Нафуза. В 1978 году в районе была проведена централизация библиотек. Староакбуляковская сельская библиотека начала функционировать как 23-й филиал библиотечной системы района. С августа 1978 года по 1983 год заведующей сельской библиотекой работала Мансурова Аниса. После нее до 1985 года проработали Нурлыгаянова Флорида, Риянова Рида, Сабирова Клара. В декабре1985 года на работу была принята Ахметянова Разиля. В настоящее время более 34 лет она является заведующей сельской библиотекой. Заочно окончила Уфимский библиотечный техникум по специальности «Библиотечное дело». Библиотека регулярно проводит различные массовые мероприятия. Активно участвует во всех мероприятиях, проводимых в деревне. В 2011 году приобрела статус модельной. Это любимое место людей разного возраста.",Караидельский район,2020-02-07T07:39:35Z,2023-03-16T09:51:53Z,09:00:00,21:00:00,,,09:00:00,21:00:00,09:00:00,21:00:00,09:00:00,21:00:00,09:00:00,21:00:00,09:00:00,21:00:00
