name,address,longitude,latitude,description,subordination,creation_time,modification_time,mo_from,mo_to,tu_from,tu_to,we_from,we_to,th_from,th_to,fr_from,fr_to,sa_from,sa_to,su_from,su_to
Максовская сельская библиотека,"обл Рязанская,р-н Сараевский,с Максы,ул Центральная,д 29",41.288726,53.708528,"Максовская сельская библиотека обслуживает жителей села Максы Сараевского района. Учреждение ведет свою историю с 50-х годов ХХ века.Библиотекой накоплен большой материал по истории села, систематически проводятся краеведческие чтения, исследовательская работа. Ведется работа по духовному воспитанию юного поколения. При библиотеке действует воскресная школа. Так же большое внимание уделяется развитию творческого потенциала. В библиотеке действуют кружки рукоделия как для взрослых, так и для детей. Участники кружков систематически участвуют в творческих районных конкурсах. Ежегодно услугами библиотеки пользуется более 200 человек. Фонд включает около 3 000 экземпляров. Библиотека подключена к сети Интернет. Предоставляет услугу – обучение азам компьютерной грамотности людей пожилого возраста. Ежегодно для посетителей проводится более 200 мероприятий.",Сараевский район,2023-01-20T13:43:05Z,2023-12-12T13:21:47Z,,,09:00:00,17:00:00,09:00:00,17:00:00,09:00:00,17:00:00,09:00:00,17:00:00,09:00:00,16:00:00,09:00:00,12:00:00
Калужская сельская библиотека,"обл Саратовская,р-н Федоровский,с Калуга,ул Школьная,зд 2",47.166861,51.371976,"Со слов старожилов села, библиотека основана в 30-х годах XX века. Первоначально это была изба-читальня, которая находилась в здании сельского совета. Во время посевной и уборочной выезжали на полевые станы, занимались наглядной агитацией: писали «молнии», «боевые листки», оформляли лозунги, стенды, клеили «звезды» на комбайны передовиков. Проводились беседы, громкие чтения. В настоящее время библиотека находится в помещениях сельской школы. Сегодня фонд насчитывает более 7 000 печатных экземпляров, он универсальный, рассчитан на широкий круг читателей. Ежегодно библиотеку посещает более 2 500 пользователей. При библиотеке действуют клубы по интересам: для детей краеведческий «Родничок» и для взрослого населения «Сударушка».",Федоровский район,2022-09-19T07:58:57Z,2022-09-23T10:30:04Z,09:00:00,13:00:00,14:00:00,17:00:00,14:00:00,17:00:00,09:00:00,13:00:00,09:00:00,13:00:00,,,,
Гиблицкая сельская библиотека,"обл Рязанская,р-н Касимовский,с Гиблицы,ул Центральная,д 87б",41.089893,54.965062,"В селе Гиблицы библиотека была основана в 1952 году. В 2012 году она стала модельной. Количество пользователей – 400 человек. Сегодня библиотека – это грамотно скомплектованный фонд по всем отраслям знаний, насчитывающий 5 368 экземпляров как на традиционных книжных носителях, так и на аудио- и видеокассетах, компакт-дисках; это наличие современных компьютеров с выходом в интернет, сканера, копировальной техники. В библиотеке работает Муниципальный информационный центр, который постоянно пополняется новой информацией. Библиотека тесно сотрудничает с Гиблицкой сельской администрацией, средней общеобразовательной школой, Домом культуры.",Касимовский район,2018-10-22T06:51:48Z,2023-04-18T12:14:20Z,,,10:00:00,17:00:00,10:00:00,17:00:00,10:00:00,17:00:00,10:00:00,17:00:00,10:00:00,17:00:00,10:00:00,17:00:00
Библиотека (универсальная) № 16 г. Сургута,"АО Ханты-Мансийский Автономный округ - Югра,г Сургут,пр-кт Комсомольский,д 12",73.4384912252426,61.2389805303098,"Библиотека была основана в 2016 году. Для посетителей оборудованы автоматизированные рабочие места с доступом к интернет-ресурсам социально-правовой и образовательной тематики, электронным полнотекстовым ресурсам, справочно-правовой системе, удаленному электронному читальному залу Президентской библиотеки им. Б. Ельцина. Фонд – 25 936 экземпляров книг, журналов, электронных изданий, аудиокниг. Имеются комиксы, книги-панорамы, книги с объемными иллюстрациями, книги-виммельбухи, книги серии «Театр теней», энциклопедии 3D и 4D, тактильные книги, альбом почтовых марок, посвященных теме космоса. Средняя посещаемость библиотеки – 19 613 читателей за год. Осуществляется надомное обслуживание маломобильных пользователей. В рамках программы «Семейное чтение» организованы кружки «Мастерим вместе», «Народное чтение». В сотрудничестве с учебными учреждениями города реализуется программа «Культура для школьников» и программа по внеурочной деятельности «Читательская копилка».",Сургут,2016-09-19T09:55:41Z,2024-02-02T13:59:19Z,,,11:00:00,19:00:00,11:00:00,19:00:00,11:00:00,19:00:00,11:00:00,19:00:00,11:00:00,19:00:00,11:00:00,19:00:00
Центральная детская библиотека г. Салавата,"Респ Башкортостан,г Салават,ул Калинина,д 26А",55.9303600787462,53.3462115911487,"Центральная детская библиотека появилась в 1952 году, она стала любимым местом юных салаватских книголюбов. Размещалась на первом этаже двухэтажного дома № 17. В 1979 году детская библиотека с книжным фондом более чем 40 000 экземпляров переехала в новое помещение, где и находится по сей день. Тогда же приобрела она и новый статус, став Центральной детской библиотекой.Основные направления деятельности – приобщение детей и подростков к книге и чтению, организация разумного досуга, создание особой библиотечно-информационной среды. Сегодня читателями библиотеки являются около 7 500 юных горожан и их родителей. Книжный фонд насчитывает свыше 55 000 экземпляров книг и периодических изданий. В библиотеке проводятся познавательные мероприятия, литературные обзоры, викторины, презентации, читательские конкурсы, игровые программы.",Салават,2020-08-28T10:20:39Z,2023-03-14T11:47:55Z,,,09:00:00,18:00:00,09:00:00,18:00:00,09:00:00,18:00:00,09:00:00,18:00:00,09:00:00,17:00:00,,
Теве-Хаинская модельная библиотека,"Респ Тыва,р-н Дзун-Хемчикский,с Теве-Хая,ул Ленина,д 23",91.450571,51.363558,"В 1976 году вышел приказ об открытии библиотеки в селе Теве-Хая. Библиотека начала функционировать с книжным фондом в 500 экземпляров в маленьком домике. Уже в 1981 году книжный фонд библиотеки уже составлял 13600 экземпляров книг и журналов, шла подписка периодических изданий. По сей день, библиотека играет важную роль во всех аспектах жизнедеятельности населенного пункта. Библиотека кардионально изменилась. Фонд укомплектован новой яркой, красочной, интересной литературой по самым разным отраслям науки. Сделан текущий и капитальный ремонт помещения библиотеки, библиотека оснащена современной мебелью согласно дизайн проекту. Улучшилось материально-техническая база библиотеки. В библиттеке оборудованы следующие зоны: мультимедийная, информационно-выставочная зона, зона интерактивной среды. Для читателей очень понравилась зона отдыха и чтения– «мягкая зона», где можно в комфорте полистать книжки, погрузиться в захватывающий мир литературы. Теве-Хаинская библиотека переросла понятие«библиотеки» в ее калссическом понимании, внедрены инновационные форматы работы, чтобы читателям былоинтересно",Дзун-Хемчикский кожуун,2020-06-11T00:11:19Z,2023-03-28T08:23:41Z,08:30:00,17:30:00,08:30:00,17:30:00,08:30:00,17:30:00,08:30:00,17:30:00,08:30:00,17:30:00,09:00:00,14:00:00,,
Библиотека п. Медвеженского,"край Ставропольский,р-н Красногвардейский,п Медвеженский,ул Красногвардейская,д 27",41.604736,45.725511,"В 1947 году в поселке Медвеженском была открыта библиотека в помещении бывшей конюшни. В 1987 году построили новый Дом культуры. В нем для библиотеки было отведено 3 больших и светлых посещения. Сегодня в учреждении проходят всевозможные мероприятия: выставки, тематические вечера, беседы. Перед библиотекарями стоит задача: привлечение новых и сохранение старых читателей. В работе они добиваются, чтобы каждая книга была открытием в новый мир, будь то приключения или детективы. Библиотека обслуживает 1 011 читателей и включает в себя отделы: взрослый абонемент, детский абонемент, читальный зал, книгохранилище. На начало года фонд насчитывает 15 162 экземпляра.",Красногвардейский район,2023-10-19T11:57:34Z,2023-10-24T08:14:27Z,09:00:00,17:00:00,09:00:00,17:00:00,09:00:00,17:00:00,09:00:00,17:00:00,09:00:00,17:00:00,,,09:00:00,16:00:00
Ревдинская центральная городская библиотека им. А. С. Пушкина,"обл Свердловская,г Ревда,ул Максима Горького,д 30",59.906877,56.800202,"Сегодня современному человеку необходимы новые технологии, интернет, высокие скорости. Изменилась и библиотека, которая является необходимым атрибутом ежедневной жизни успешного человека. Сейчас в библиотеке есть все: книги и журналы, электронные правовые базы данных, интернет, электронные версии книг, традиционные каталоги и электронный каталог, электронный доступ к фондам областных и государственных библиотек. Библиотека сегодня – это настоящее открытое окно в мир! Центральная городская библиотека им. А. С. Пушкина – это информационный, образовательный и культурный центр Ревды. Ее услугами пользуется более 10 000 жителей. Одновременно с традиционными услугами в главной библиотеке города предоставляются услуги с использованием новых технологий. В регулярном режиме проводятся мероприятия для различных категорий пользователей с использованием мультимедийного оборудования, консультации в Компьютерной академии для пенсионеров, бесплатные юридические консультации. Однако наряду с современными технологиями получения нужной информации остается место и для книги. Ведь ее важнейшее предназначение – сохранять знания, накопленные веками, и передавать их следующим поколениям.",Ревда,2015-07-31T05:00:16Z,2023-06-09T06:41:49Z,11:00:00,19:00:00,11:00:00,19:00:00,11:00:00,19:00:00,11:00:00,19:00:00,11:00:00,19:00:00,,,09:00:00,16:00:00
Шакарлинская сельская библиотека,"Респ Башкортостан,р-н Белокатайский,с Шакарла,ул Советская",59.1484293394534,55.7661144353578,"Шакарлинская сельская библиотека была открыта в 1954 году, сегодня она располагается в здании сельского клуба. Книжный фонд библиотеки составляет 8 280 экземпляров документов, ежегодно ее посещают около 3 500 человек. Для привлечения к чтению детей в библиотеке проводятся различные мероприятия: литературный час «День поэзии Маршака», игровая программа «Первоклассные ребята», библиотечные уроки «Мудрая привычка читать». Библиотека активно участвует во всероссийских, межрегиональных, республиканских акциях «Библионочь», «Наши истоки. Читаем фольклор», «Читаем детям о войне», «Книжка на ладошке», «Дни лермонтовской поэзии в библиотеке» и других.",Белокатайский район,2020-09-18T05:44:55Z,2023-03-14T13:33:40Z,,,12:00:00,15:30:00,12:00:00,15:30:00,12:00:00,15:30:00,12:00:00,15:30:00,12:00:00,15:30:00,,
Киртелинская поселенческая библиотека,"Респ Татарстан,р-н Тетюшский,с Киртели,ул Гагарина,зд 21Б",48.622869,54.743344,"В 1918 году при Киртелинском волъисполкоме впервые была открыта изба-читальня в доме купца Романова Алексея Егоровича. Заведующей избой-читальней была Праксина Галина Гавриловна, родом из с. Кульметьевка. Книги стали доступны для массового читателя, хотя в то время многие не могли читать. Проводились массовые мероприятия: громкие чтения, обзоры, просмотр периодики газет и журналов. В 1931 г. избу-читальню переименовали в Сельскую библиотеку. Фонд библиотеки рос, сельский совет выделял деньги на библиотеку. В 1965 г. заведующим библиотекой был Видманов Вениамин Алексеевич. В 1972 г. построили сельский дом культуры, где и расположилась библиотека. В здании СДК находится библиотека по сегодняшний день. В 2020 г был капитальный ремонт СДК и библиотеки. Долгое время (с 1970 г.) библиотекарем работала Дружинина (Родионова) Любовь Фёдоровна. С 16 июля 2012 года библиотекарем работала Романова Любовь Леонидовна. С 1 февраля 2019 г. работала Жугарева Наталья Сергеевна. А с 9 февраля 2021 года ведущий библиотекарь Киртелинской поселенческой библиотеки Абраконова Галина Васильевна. В зону обслуживания входят с. Киртели, с. Кадышево, д. Красный Восток и д. Васильевка. Библиотека осуществляет информационное обслуживание. С населением систематически проводятся массовые мероприятия. Библиотека тесно сотрудничает с культурными и образовательными организациями села Киртели и МСУ.",Тетюшский район,2022-04-05T12:15:50Z,2023-02-21T08:38:30Z,14:30:00,17:30:00,14:30:00,17:30:00,14:30:00,17:30:00,14:30:00,17:30:00,14:30:00,17:30:00,13:30:00,16:30:00,,
Рындинская сельская библиотека,"Чувашия Чувашская республика,р-н Цивильский,с Рындино,ул Центральная,д 61",47.439392,55.849812,"Рындинская сельская библиотека является структурным подразделением централизованной библиотечной системы МБУК «ЦРК и БО» Цивильского муниципального округа Чувашской Республики. Библиотека открылась в 1936 году как изба-читальня. На сегодняшний день библиотека является информационно-культурным центром, оснащённым современными техническими средствами, компьютером, сканером, принтером, телевизором. Фонд библиотеки составляет 11737 экз., 600 человек являются читателями, ежегодное посещение составляет 9600. В библиотеке проводятся различные мероприятия: литературно-музыкальные вечера, читательские конференции, литературно-поэтические композиции, презентации книг, круглые столы, беседы о прочитанной книге, о запросах и т.д. Библиотека работает совместно с местной администрацией, МДОУ ""Звездочка"", Домом культуры. При библиотеке действуют два любительских клуба: для детей «Почемучка» и «Хозяюшка» для взрослых.",Цивильский район,2021-03-21T15:03:46Z,2023-03-02T13:31:13Z,,,12:00:00,19:00:00,12:00:00,19:00:00,12:00:00,19:00:00,12:00:00,19:00:00,10:00:00,13:00:00,,
Лешуконская межпоселенческая библиотека,"обл Архангельская,р-н Лешуконский,с Лешуконское,ул Октябрьская,д 26",45.7625904182899,64.8998189238481,"Лешуконская межпоселенческая библиотека ведет свою историю с 12 февраля 1897 года, когда Архангельским губернатором Энгельгардтом был утвержден Устав Лешуконской бесплатной народной библиотеки-читальни. Библиотека была открыта по просьбе крестьян Лешуконского волостного схода Мезенского уезда на деньги от добровольных пожертвований учреждений и частных лиц.В состав муниципального учреждения культуры «Лешуконская центральная библиотека» входят 14 стационарных библиотек: центральная библиотека, детская библиотека, пять сельских библиотек: Вожгорская, Койнасская, Ценогорская, Юромская, Белощельская, и семь библиотек-клубов: Березницкая, Засульская, Олемская , Родомская, Устькымская, Усть-Чуласская, Кебская. Библиотечный фонд составляет 133 тысячи экз.книг.В библиотеке каждый имеет возможность работать с информационными ресурсами библиотеки, а также получить консультацию в поиске и выборе источников информации. Также для пользователей библиотеки и всех желающих действуют различные клубы по интересам.Библиотека представляет услуги:– абонемента;– читального зала;– межбиблиотечного абонемента (МБА) и внутрисистемного обмена (ВСО).",Лешуконский район,2016-04-18T09:01:38Z,2023-01-31T14:06:07Z,10:00:00,18:45:00,10:00:00,18:45:00,10:00:00,18:45:00,10:00:00,18:45:00,10:00:00,18:45:00,,,12:00:00,18:45:00
