name,address,longitude,latitude,description,subordination,creation_time,modification_time,mo_from,mo_to,tu_from,tu_to,we_from,we_to,th_from,th_to,fr_from,fr_to,sa_from,sa_to,su_from,su_to
Библиотека № 22 им. И. А. Бунина,"обл Воронежская,г Воронеж,ул Южно-Моравская,д 74",39.1041558980942,51.6551072051889,"С 2005 года библиотека № 22 носит имя Ивана Алексеевича Бунина. В библиотеке оформлена большая экспозиция, посвященная жизни и творчеству последнего русского классика, Нобелевского лауреата в области литературы. У гостей библиотеки всегда есть возможность познакомиться с ее уникальными материалами, принять участие в литературно-музыкальных вечерах, детских утренниках, мастер-классах, посвященных Ивану Алексеевичу Бунину. Библиотека обладает универсальным книжным фондом – более 75 тысяч книг, пользователи всегда могут получить информацию о новинках литературы, для них в читальном зале оборудованы индивидуальные автоматизированные места для работы и отдыха. Библиотека обеспечивает своим читателям доступ в Интернет, качественную юридическую информацию с помощью программы «Гарант», есть возможность воспользоваться электронными читальными залами Национальной электронной и Национальной электронной детской библиотеками. В библиотеке работают творческие объединения:Детский клуб «Солнышко». Здесь самые маленькие читатели не только могут почитать свои первые книжки, но и поиграть в них. Для них проводятся мастер-классы по рисованию, лепке и оригами.Досуговый клуб для самых мудрых читателей – «Возрождение». Его посещают постоянные читатели старшего поколения. Каждое третье воскресенье месяца в 15:00 творческие читатели собираются на «Воскресные встречи». Здесь звучат их стихи, песни, у них есть возможность обсудить прочитанные книги, поучаствовать в выставках творческих работ.Регулярно, раз в три месяца в библиотеке проводятся литературно-художественные выставки современных воронежских художников различной тематики. Устраиваются презентации, на которых художники рассказывают о своем творчестве. Кукольный театр «Книжкины друзья» показывает свои представления малышам не только в стенах библиотеки, но и в оздоровительных лагерях, на площадках города, в детских садах. В 2014 году в библиотеке организован трогательный музей «Добрые сказки». Здесь можно поиграть с куклами, актерами кукольного театра «Книжкины друзья», поучаствовать в викторинах по сказкам, в мастер-классах «Кукольные истории»Деятельность библиотеки ежедневно освещается в соц. сетях и на сайте МБУК «ЦБС» г. Воронежа.",Воронеж,2015-08-31T18:35:56Z,2023-03-10T13:31:57Z,,,10:00:00,19:00:00,10:00:00,19:00:00,10:00:00,19:00:00,10:00:00,19:00:00,10:00:00,19:00:00,10:00:00,19:00:00
Качканарская городская библиотека им. Ф. Т. Селянина,"обл Свердловская,г Качканар,мкр 5 А,д 7а",59.481228,58.694188,"Библиотека была основана 1 сентября 1961 года. Среднегодовое количество читателей библиотеки составляет – 5500 человек. Фонд библиотеки на начало 2022 года составляет – 54277 книги. В библиотеку приходят не только дети, но и взрослые. Каждый находит для себя что-то интересное. Здесь богатый фонд художественной и научно-популярной литературы, мультимедийных изданий, множество словарей, энциклопедий, большое количество газет и журналов.Культурно-просветительская деятельность библиотек традиционно велась по актуальным направлениям и носила комплексный характер. Основу системы просвещения библиотек города составляет совокупность просветительских программ, для повышение уровня общей культуры и социальной активности населения. Для читателей всегда работают выставки увлекательных книг, проводятся познавательные и развлекательные мероприятия. Библиотека принимает участие в областной акции «Библионочь», в акции тотального чтения «День чтения», во Всероссийской культурно-образовательной акции «Ночь Искусств». Ежегодно библиотека им. Ф.Т. Селянина является площадкой для проведения Муниципального этапа Международного конкурса чтецов «Живая классика». С 2015 года проходит Муниципальный конкурс «Качканар читающий». Библиотека организовала мероприятие формата «Дневной Дозор». Совместно со Свердловской филармонией ведет проект «Виртуальный концертный зал». Любители музыки объединились в сети, смотрят концерты онлайн и параллельно делятся своими впечатлениями.",Качканар,2022-04-07T09:59:37Z,2023-03-27T13:29:09Z,,,10:00:00,19:00:00,10:00:00,19:00:00,10:00:00,19:00:00,10:00:00,19:00:00,10:00:00,18:00:00,,
Красненская сельская библиотека-клуб им. Г. С. Малеванкиной,"обл Свердловская,г Верхняя Пышма,п Красный,ул Проспектная,д 5",60.680371,57.054949,"В 1946 году в поселке Красный организована библиотека. До 1976 года библиотека находилась в клубе. С 1978 году – в здании старого детсада. В 1988 году она переехала в другое здание и получила статус клуба-библиотеки. Заведующая – Малеванкина Генриетта Сидоровна. В 2012 году постановлением администрации Красненскому сельскому клубу–библиотеке присвоено имя Малеванкиной Генриетты Сидоровны.В библиотеке–клубе ведется работа в рамках программ по гражданско-патриотическому воспитанию подрастающего поколения, по продвижению книги и популяризации чтения. В библиотеке ведут работу 8 клубных формирований по авторским программам. С 2013 года ежегодно на площадке учреждения проходит фестиваль, посвященный памяти первого библиотекаря – Г. С. Малеванкиной. За годы проведения фестиваля он стал знаковым для библиотеки–клуба и поселка в целом.Фонд – 13098 экземпляров, число пользователей 1221 человек, посещений – 15626.",Верхняя Пышма,2015-08-05T10:47:39Z,2023-02-21T11:02:10Z,10:00:00,20:00:00,10:00:00,20:00:00,10:00:00,20:00:00,10:00:00,20:00:00,10:00:00,20:00:00,10:00:00,18:00:00,,
Центральная районная детская библиотека им. Н. А. Зайцева,"обл Нижегородская,г Нижний Новгород,ул Зайцева,д 7",43.8017955422402,56.3707668388286,"Центральная районная детская библиотека им. Н. А. Зайцева открылась в 1991 году. Ежегодно около 4 000 жителей Сормовского района становятся ее читателями. Фонд составляет 31 000 экземпляров.В 1998 году в помещении библиотеки открылась музейная экспозиция, посвященная Н. А. Зайцеву. Она знакомит юных читателей с жизнью и деятельностью талантливых нижегородских инженеров-конструкторов судов на подводных крыльях Н. А. Зайцева, Р. Е. Алексеева, их соратников. В ее фонде содержатся уникальные документы по судостроению, фото- и видеоматериалы, личные вещи знаменитых земляков.С 2013 года библиотека успешно функционирует как центр поддержки детского чтения. Работа направлена на повышение статуса книги, чтения, библиотеки. Организуются встречи с нижегородскими писателями и поэтами, знаменитыми нижегородцами, проводятся конкурсы, литературно-игровые мероприятия. Для читателей действует пять любительских объединений. Ежегодно проводится 150 мероприятий и книжных выставочных экспозиций.Центральная районная детская библиотека им. Н. А. Зайцева удостоилась премии Министерства культуры Нижегородской области в области библиотечного дела в номинации «Литературно-творческое развитие детей в условиях библиотеки» и почетной грамоты от Департамента культуры администрации города Нижнего Новгорода за высокие показатели в работе и профессиональное мастерство.",Нижний Новгород,2016-08-22T12:11:07Z,2023-03-07T12:00:15Z,10:00:00,18:00:00,10:00:00,18:00:00,10:00:00,18:00:00,10:00:00,18:00:00,10:00:00,18:00:00,,,10:00:00,17:00:00
Библиотека № 44 им. В. Г. Короленко (филиал № 1),"г Москва,г Москва,ул Фестивальная,д 46",37.5120609998703,55.8625892727193,"Библиотека была основана в 1951 году. Изначально располагалась в Вокзальном переулке Тимирязевского района столицы. В 1957 году стараниями известного литературоведа А. В. Храбровицкого ей было присвоено имя В. Г. Короленко. В 1970 г. библиотека переехала на Фестивальную улицу, где и находится по сегодняшний день. До 2014 года была центральной библиотекой № 65 имени В. Г. Короленко.Универсальный фонд насчитывает 87 300 единиц хранения.Библиотека ведет активную мемориальную деятельность, сотрудничая со многими регионами России и ближним зарубежьем. Силами сотрудников библиотеки создан виртуальный музей В. Г. Короленко. Библиотека является успешной открытой площадкой для творческой самореализации людей различных возрастных категорий. Стабильной популярностью пользуются и существующее более 20 лет литературное объединение «У Короленко», и открытое несколько лет назад антикафе Bibliothèque, и новый проект «Музыкально-поэтическая гостиная Павла Пикалова». Библиотека реализует разноплановые культурные и просветительские программы: «Читать модно! Мастерская диалога», «Вернисаж в белом зале», «Классическая музыка для всех!». Библиотека принадлежит ГБУК г. Москвы «ЦБС САО».",Москва,2015-07-27T02:51:40Z,2023-02-21T09:11:24Z,,,11:00:00,19:30:00,11:00:00,19:30:00,11:00:00,19:30:00,11:00:00,19:30:00,11:00:00,19:30:00,,
Библиотека им. А. А. Фадеева г. Новосибирска,"обл Новосибирская,г Новосибирск,ул Полярная,д 17",82.856227,55.027557,"Библиотека основана в 1952 году. Первоначально по паспорту – городская библиотека № 29 Кировского района поселка Судоремонтный Завод. На сегодняшний момент фонд насчитывает около 14 000 изданий. Число посетителей в год – 13 500 человек. У библиотеки большая зона обслуживания: помимо микрорайона Затон, где она находится, еще и несколько прилегающих. Проведение мероприятий для населения является одним из приоритетных направлений. Библиотека активно работает с ТОС и советом ветеранов, занимается организацией досуга детей в летнее время, совместно с ТОС участвует в грантовых проектах, проводит экологические акции, праздники молодых матерей Затона, благотворительные акции для детей-инвалидов, активно работает с социально незащищенными жителями микрорайона, проводит Декаду пожилого человека, День Победы, День матери, День славянской письменности и культуры, День города, День защиты детей. Библиотека – не только культурный, но и социальный центр района. Она организует посещение ветеранов на дому, правовую помощь жителям и бездомным из Епархиального комплексного центра, ведение сообщества в социальной сети «ВКонтакте». В 2005 году по инициативе жителей Затона в библиотеке был открыт Музей боевой и трудовой славы «Затон». Он располагает уникальными документами и экспонатами. В 2023 году библиотека была модернизирована по федеральному проекту «Культурная среда» и продолжила работу в новой концепции «Библиотека на Оби».",Новосибирск,2023-12-26T10:40:34Z,2023-12-27T06:16:00Z,10:00:00,19:00:00,10:00:00,19:00:00,10:00:00,19:00:00,10:00:00,19:00:00,10:00:00,19:00:00,11:00:00,18:00:00,,
Библиотека им. Саши Чекалина,"обл Нижегородская,г Нижний Новгород,ул Столетова,д 8",43.981391,56.267027,"В феврале 1945 года на улице Ялтинской открыта первая детская библиотека Приокского района. В конце 50-х годов она переехала на улицу Столетова, где находится и сегодня. В эти же годы ей было присвоено имя Саши Чекалина, комсомольца, Героя Советского Союза. Ежегодно библиотека участвует в Неделе детской книги, летних чтениях, акции «Библионочь» и многих других. С успехом проходят в библиотеке встречи детей с нижегородскими писателями и знаменитыми людьми Нижнего Новгорода. В библиотеке создана электронная картотека читателей и электронный каталог документов.Фонд библиотеки составляет более 16 000 экземпляров книг. Ежегодно услугами библиотеки пользуются более 1 800 читателей.",Нижний Новгород,2018-11-14T09:15:46Z,2023-02-17T12:47:17Z,09:00:00,17:30:00,09:00:00,17:30:00,09:00:00,17:30:00,09:00:00,17:30:00,09:00:00,17:30:00,,,09:00:00,17:30:00
Библиотека им. Александра Ивановича Куприна г. Армавира,"край Краснодарский,г Армавир,ул Луначарского,д 402",41.151787,44.973449,"Библиотека была основана в 1970 г. и включает в себя абонемент, читальный зал, детский сектор. Для читателей установлен компьютер, имеется выход в сеть Интернет. Объем библиотечного фонда – свыше 30 500 экземпляров книг. Библиотека им. А. И. Куприна – это не только пропагандист чтения и книги, но и организатор многих интересных культурных мероприятий для жителей микрорайона. В библиотеке и на площадке рядом с ней проводятся народные гулянья, посвященные Масленице, Святкам, Дню семьи, организуются праздники двора, фольклорные посиделки. Цель этих веселых, ярких мероприятий – помочь людям лучше узнать друг друга и укрепить добрососедские отношения. На протяжении многих лет в библиотеке успешно действует клуб «Любава». На встречи в этом объединении собираются люди со всех концов города. Частыми гостями здесь бывают местные поэты и музыканты. Библиотека находит таланты среди людей, увлеченных декоративно-прикладным искусством. Выставки изделий из соломки, дерева, бисера постоянно украшают интерьер учреждения. Их посещают не только армавирцы, но и жители пригородов.",Армавир,2022-01-19T06:50:13Z,2023-02-28T11:06:29Z,,,10:00:00,19:00:00,10:00:00,19:00:00,10:00:00,19:00:00,10:00:00,19:00:00,10:00:00,17:00:00,10:00:00,17:00:00
Детская библиотека им. А. С. Пушкина г. Иркутска,"обл Иркутская,г Иркутск,ул Франк-Каменецкого,д 32",104.300208,52.28923,"Детская библиотека им. А. С. Пушкина (до 2010 г. – Центральная детская библиотека г. Иркутска) – одна из старейших в городе, она открыла свои двери для юных иркутян 17 апреля 1923 года. В 2000 году решением Иркутской городской думы и мэра города Иркутска Центральной детской библиотеке было присвоено имя А. С. Пушкина. С изменением устава ЦБС г. Иркутска с июня 2011 г. библиотека получила название – Детская библиотека им. А. С. Пушкина. В год открытия при библиотеке был создан кружок «Друзья книги». По вторникам проходили громкие пушкинские чтения, а по понедельникам и пятницам – краеведческие чтения и рассказы о Байкале. Работоспособный фонд библиотеки составлял 1 741 экземпляр, выдан он был 20 000 раз. Сегодня библиотечный фонд включает более 38 000 экземпляров, в том числе книги с автографами писателей, коллекции «Редкий фонд», периодические издания. Ежегодно в Пушкинке проходит фестиваль поэтического слова «Читаем Пушкина», в дни каникул работает «Самый летний кинотеатр». Уже традиционными в библиотеке стали встречи с иркутскими поэтами и писателями.На сегодняшний день библиотека обслуживает 3 000 читателей, количество посещений в год составляет около 21 000.",Иркутский район,2021-11-02T08:26:41Z,2023-02-27T14:07:03Z,10:00:00,18:00:00,10:00:00,18:00:00,10:00:00,18:00:00,10:00:00,18:00:00,10:00:00,18:00:00,10:00:00,18:00:00,,
