name,address,longitude,latitude,description,subordination,creation_time,modification_time,mo_from,mo_to,tu_from,tu_to,we_from,we_to,th_from,th_to,fr_from,fr_to,sa_from,sa_to,su_from,su_to
Библиотека № 1 им. Л. Н. Толстого г. Перми,"край Пермский,г Пермь,пр-кт Комсомольский,д 79",56.250176,57.990853,"В истории муниципальной библиотеки № 1 сохранились традиции двух библиотек Перми – библиотеки им. Л. Н. Толстого, открывшейся в 1911 году по инициативе городского сообщества, и библиотеки Пермского моторного завода, начавшей свою работу в 1933 году. Это старейшая библиотека города, первая бесплатная читальня, подлинный духовный центр Перми. Библиотека № 1 им. Л. Н. Толстого расположена в здании Пермского городского дворца культуры им. А. Г. Солдатова. В 2019 году она стала одним из победителей конкурса в рамках национального проекта «Культура» по созданию модельных муниципальных библиотек. В результате модернизации для читателей организован доступ к полнотекстовым электронным базам данных, современному компьютерному и мультимедийному оборудованию. В пространстве библиотеки сочетаются исторический интерьер, стильный дизайн, опыт знаковых проектов. Библиотека стала точкой притяжения для представителей разных возрастных поколений, молодых творческих людей, новых встреч и ярких проектов. Ежегодно библиотеку посещают более 18 000 человек, выдается более 50 000 документов. Фонд насчитывает 30 000 документов.",Пермь,2020-05-14T10:07:42Z,2023-11-09T10:29:49Z,,,11:00:00,19:00:00,11:00:00,19:00:00,11:00:00,19:00:00,11:00:00,19:00:00,11:00:00,19:00:00,,
Библиотека им. А. Пушкина г. Азова,"обл Ростовская,г Азов,ул Кондаурова,д 40",39.4256843738068,47.0982999388349,"Библиотека была основана 1 октября 1977 года, в 1999 году она получила имя Александра Сергеевича Пушкина. С 2011 года библиотека компьютеризирована и подключена к сети Интернет. В настоящее время учреждение обслуживает свыше 1 500 читателей ежегодно, предоставляя в их распоряжение фонд (более 14 000 экземпляров) и электронные ресурсы. В библиотеке работает творческий клуб «Литературная гостиная», который ориентирован на учащихся начальной школы. На каждом заседании проводятся творческие лаборатории, участники могут попробовать сделать своими руками что-нибудь необычное и оригинальное. Для популяризации имени А. С. Пушкина как бренда библиотеки сотрудники разрабатывают и проводят различные мероприятия (уроки, беседы, праздники).",Азов,2022-03-02T11:20:19Z,2023-03-01T13:34:27Z,,,10:00:00,18:00:00,10:00:00,18:00:00,10:00:00,18:00:00,10:00:00,18:00:00,10:00:00,18:00:00,,
Центральная городская библиотека им. П. Л. Проскурина,"обл Брянская,г Брянск,ул 3 Интернационала,д 21",34.3030285835266,53.3066307393001,"Центральная городская библиотека им. П. Л. Проскурина является старейшим информационным, культурным и просветительским центром для населения. Она была открыта 14 марта 1917 года как народная библиотека-читальня. Основой для создания фондов стали книги, подаренные жителями. В настоящее время библиотека располагается в том же здании (являющемся памятником архитектуры), в котором 100 лет назад была открыта читальня. Сегодня ЦГБ им. П. Л. Проскурина входит в состав Централизованной системы общедоступных библиотек Брянска и выполняет функции координационного и методического центра для 17 библиотек города. Фонд насчитывает свыше 100 000 экземпляров документов, в год библиотеку посещает более 80 000 человек. Библиотека оказывает услуги максимально широкой аудитории. Ежегодно она проводит более 700 массовых мероприятий различной тематики, организует книжно-иллюстративные и декоративно-художественные выставки. Здесь можно почитать книжные новинки, а также послушать лекции, поучаствовать в мастер-классах, квестах, получить знания в областях литературы, истории, архитектуры, изобразительного искусства. Для самостоятельной работы пользователям предоставлены рабочие места с выходом в интернет, имеется доступ к Национальной электронной библиотеке. Организован «Библиотеатр», театрализованные постановки которого пользуются большой популярностью, работает клубное объединение «Литературный гид» и краеведческий клуб «Брянск – Бежица». С 2013 года ежегодно в день рождения П. Л. Проскурина проводятся Межрегиональные Проскуринские чтения.",Брянск,2015-11-27T13:15:49Z,2024-02-07T06:47:30Z,11:00:00,20:00:00,11:00:00,20:00:00,11:00:00,20:00:00,11:00:00,20:00:00,11:00:00,20:00:00,10:00:00,18:00:00,10:00:00,18:00:00
Культурный центр семейного чтения и досуга им. П. А. Михина,"обл Курская,г Курск,пр-кт Дружбы",36.1353440670996,51.7411332688918,"Культурный центр семейного чтения и досуга МБУК ЦСБ г. Курска был образован в Центральном округе города Курска в январе 2007 г. на базе библиотеки-филиала № 10 путем слияния с библиотекой-филиалом № 6 ЦБС г. Курска. Он унаследовал богатый опыт и добрые традиции своих предшественников. 9 декабря 2014 г. Культурному центру семейного чтения и досуга был присвоен статус «Модельная библиотека».6 мая 2020 года в рамках празднования 75-летия Победы в Великой Отечественной войне постановлением главы города Курска В. Н. Карамышева № 838 от 6 мая 2020 г. Культурному центру семейного чтения и досуга присвоено имя участника Великой Отечественной войны, кавалера ордена Александра Невского, почетного гражданина города Курска, члена Союза писателей России Петра Алексеевича Михина.Универсальный библиотечный фонд Культурного центра семейного чтения и досуга им. П. А. Михина составляет 96 588 экз. на различных носителях. Организован доступ к ФГИС «Национальная электронная библиотека», «Национальная электронная детская библиотека».",Курск,2020-11-06T14:54:48Z,2023-02-21T12:21:20Z,09:00:00,19:00:00,09:00:00,19:00:00,09:00:00,19:00:00,09:00:00,19:00:00,09:00:00,19:00:00,,,10:00:00,18:00:00
Библиотека № 8 им. Ф. Ф. Павленкова с. Вассята,"край Пермский,г Чайковский,с Вассята,ул Советская,д 3",54.580289,56.886946,"Дата основания библиотеки – 1912 год. На 2022 год фонд насчитывает 9 276 экземпляров книг и журналов. Количество посетителей за год – 3 759 человек. В краеведческом фонде библиотеки хранятся неизданные материалы по истории библиотеки и села.Библиотека обслуживает детское и взрослое население. Для каждой возрастной категории оформляются книжные выставки, проводятся тематические мероприятия. Библиотека принимает участие в Национальной программе поддержки и развития чтения, в программе «Семья. Семейное чтение», в патриотическом воспитании населения села. Среди партнеров учреждения детский сад, школа, клуб.",Чайковский,2019-10-23T06:37:16Z,2023-08-09T12:20:15Z,,,10:00:00,16:40:00,10:00:00,16:40:00,10:00:00,16:40:00,10:00:00,16:40:00,14:00:00,19:40:00,,
Центральная библиотека им. М. Н. Богданова г. Барыша,"обл Ульяновская,р-н Барышский,г Барыш,ул Красноармейская,д 45",47.105048,53.650976,"В 2016 году библиотеке было присвоено имя Модеста Николаевича Богданова – известного писателя и зоолога. Общий фонд Центральной библиотеки Барыша насчитывает 24 155 единиц хранения. В фонде имеются документы в специальных форматах для слепых (со шрифтом Брайля), также библиотека получает журнал для слабовидящих. Пользователи могут работать в справочных системах «Гарант» и «КонсультантПлюс». Библиотека сотрудничает с учреждениями образования, культуры, социальной защиты населения, МВД, СМИ и др. Она принимает участие в реализации регионального движения «За народное чтение!», в акциях «День Победы», «Ночь кино», «Ночь искусств», «Ночь музеев», «Библионочь». Привлекает пользователей к участию в различных конкурсах: «Аленький цветочек», «К чтению через игру», «Молодое слово России» и др. На протяжении нескольких лет реализуются акции «Читаем детям о войне», «Читай во имя мира».",Барышский район,2016-04-19T13:43:06Z,2023-10-10T06:25:17Z,08:00:00,18:00:00,08:00:00,18:00:00,08:00:00,18:00:00,08:00:00,18:00:00,08:00:00,18:00:00,,,11:00:00,15:00:00
Дунайская библиотека – филиал № 8 им. Э. Горборукова,"обл Белгородская,р-н Грайворонский,с Дунайка,ул Дунайка,д 33",35.534927,50.549276,"Дунайская библиотека – филиал № 8 им. Э. Горборукова входит в состав Грайворонской библиотечной системы и обслуживает жителей Дунайской сельской территории. Она была открыта 1 августа 1950 года. В 2010 году получила статус модельной библиотеки. В 2013 году Дунайской модельной библиотеке было присвоено имя Горборукова Эдуарда Александровича, геройски погибшего в Чеченской Республике. Имя Эдуарда Горборукова библиотека носит с честью и гордостью, воспитывая подрастающее поколение на примерах мужества и героизма. Библиотека сегодня: фонд – более 10 000 единиц; число пользователей – 545;посещений – 7 500; Дунайская муниципальная модельная библиотека имени Эдуарда Горборукова – информационный и культурно-просветительский центр. Работа клубов по интересам, выставки творческих работ, встречи с поэтами и художниками делают библиотеку любимым местом досуга, культурного и духовного общения. Учреждение принимает активное участие в акциях и конкурсах, занимается проектной деятельностью, является площадкой интеллектуального развития и культурного досуга населения.",Грайворонский район,2015-02-11T06:28:18Z,2023-06-15T12:46:53Z,,,14:00:00,21:00:00,13:00:00,19:00:00,13:00:00,19:00:00,13:00:00,21:00:00,13:00:00,19:00:00,13:00:00,19:00:00
Библиотека семейного чтения им. В. Д. Берестова,"обл Ростовская,г Шахты,ул Парковая,д 56",40.239359,47.696873,"Библиотека семейного чтения им. В. Д. Берестова открыта в 1979 году как детская библиотека, в связи с новой застройкой многоэтажного сектора в районе улицы Парковая. Располагается на первом этаже многоэтажного дома. Входит в состав МБУК г. Шахты «ЦБС». В районе обслуживания – две школы, три дошкольных учреждения, Дом детского творчества. С 2006 года библиотека носит имя поэта В. Д. Берестова. Сегодня она имеет статус библиотеки семейного чтения и обслуживает все категории читателей, выполняя информационную, культурно-просветительскую и досуговую функцию. На базе открыт библиотечно-информационный центр (БИЦ), здание оснащено копировальной техникой, компьютером, подключением к интернету.",Шахты,2019-02-04T09:31:00Z,2023-03-04T05:41:56Z,09:00:00,18:00:00,09:00:00,18:00:00,09:00:00,18:00:00,09:00:00,18:00:00,,,,,09:00:00,18:00:00
Удомельская центральная библиотека им. Н. А. Зворыкина,"обл Тверская,г Удомля,пр-кт Курчатова,д 3б",35.0105792284012,57.8681484864473,"Свою историю Удомельская центральная библиотека ведет с образования в 1901 году Удомельско-Рядской библиотеки, находящейся на содержании Троицкого приходского братства. В 2019 году постановлением администрации Удомельского городского округа ей присвоено имя Николая Анатольевича Зворыкина. Торжественное открытие обновленной современной модельной библиотеки состоялось 30 марта 2023 года. Сегодня в структуру Центральной библиотеки входят 7 специализированных отделов. Фонд насчитывает более 61 000 экземпляров документов на различных носителях. Проделан большой ремонт, книжные фонды пополнились новыми печатными изданиями, интерактивным оборудованием, компьютерной, мультимедийной техникой, оборудованием для штрихкодирования.",Удомельский район,2017-04-19T06:23:32Z,2024-01-10T06:03:07Z,09:00:00,18:00:00,09:00:00,18:00:00,09:00:00,18:00:00,09:00:00,18:00:00,09:00:00,18:00:00,10:00:00,17:00:00,,
Уинская центральная библиотека им. Ф. Ф. Павленкова,"край Пермский,р-н Уинский,с Уинское,ул Пролетарская,д 8",56.583577,56.881124,"Уинская центральная библиотека им. Ф. Ф. Павленкова была основана в 1912 году как основная (центральная районная) на средства Флорентия Федоровича Павленкова. Фонд библиотеки насчитывает 28 318 экземпляров (книги, периодические издания, видео, CD), книги на национальных языках, книги с автографами пермских писателей и поэтов. Количество посетителей – 1 721 человек. Библиотека включает в себя отдел методической, библиографической работы и обслуживания читателей, абонемент, коворкинг-центр (читальный зал), отдел обработки, комплектования, книгохранения и использования единого фонда.В библиотеке работают: краеведческий уголок «Здесь край мой, исток мой, дорога моя»;Центр правовой информации по вопросам местного самоуправления;молодежная информационная служба;Центр экологической информации «Экониформ»;литературный киносалон;клуб любителей художественной литературы «Встреча»;«Бюро добрых услуг» (для людей с ограниченными возможностями здоровья).",Уинский район,2015-10-11T23:29:12Z,2023-06-02T13:12:25Z,09:00:00,18:00:00,09:00:00,18:00:00,09:00:00,18:00:00,09:00:00,18:00:00,09:00:00,18:00:00,10:00:00,17:00:00,,
Библиотека № 2 им. А. С. Пушкина г. Брянска,"обл Брянская,г Брянск,ул Пушкина,д 19",34.4121837615967,53.2636688166544,"Библиотека № 2 основана в 1948 году, а в 1965 году ей было присвоено имя А. С. Пушкина. С 1999 года она входит в ассоциацию библиотек, носящих имя поэта. Библиотека расположена в центре Володарского района и является информационным центром микрорайона, местом досуга и общения любителей книги. Располагает универсальным книжным фондом (более 30 000 единиц хранения), который удовлетворяет запросы различных категорий пользователей. Ежегодно библиотеку посещает более 34 000 человек. Библиотека состоит из двух отделов: абонемента и читального зала. Читальный зал выдержан в стиле пушкинской эпохи, располагает книжным фондом произведений поэта и пушкиноведческих изданий с 1936 года, предметами изобразительного и декоративно-прикладного искусства пушкинской тематики. Все это дает возможность погрузиться в бескрайний поэтический мир великого русского писателя. При библиотеке работают два клуба – любителей книги «Фолиант» и дискуссионный «Легко ли быть молодым?».",Брянск,2016-10-11T09:18:22Z,2023-09-04T08:13:33Z,10:00:00,19:00:00,10:00:00,19:00:00,10:00:00,19:00:00,10:00:00,19:00:00,,,10:00:00,18:00:00,10:00:00,18:00:00
Модельная библиотека им. Яныбая Хамматова с. Серменево,"Респ Башкортостан,р-н Белорецкий,с Серменево,ул Калинина,д 25а",58.0936592817307,53.8747403178481,"Свою историю библиотека им. Яныбая Хамматова ведет с 1930 года. В 2006 году на базе сельской библиотеки была создана по общероссийскому проекту современная модельная библиотека. На сегодняшний день библиотека располагает фондом в 23 500 экз. книг по всем отраслям знаний. Количество пользователей составляет 1 870 человек. Односельчане могут взять в библиотеке не только книгу и периодические издания, а также могут пользоваться интернетом, справочно-правовой системой «Консультант Плюс», электронно-библиотечной системой IPRbooks. Профилирующим направлением работы библиотеки является краеведческая деятельность, направленная на изучение и сохранение традиций башкирского народа. Библиотека – центр местного сообщества и поэтому она берет на себя обязанности по сохранению и передаче культурного наследия от поколения к поколению.",Белорецкий район,2020-04-14T12:30:07Z,2023-02-02T13:11:20Z,09:00:00,18:00:00,09:00:00,18:00:00,09:00:00,18:00:00,09:00:00,18:00:00,09:00:00,18:00:00,10:00:00,18:00:00,,
