name,address,longitude,latitude,description,subordination,creation_time,modification_time,mo_from,mo_to,tu_from,tu_to,we_from,we_to,th_from,th_to,fr_from,fr_to,sa_from,sa_to,su_from,su_to
Библиотека им. В. Шишкова,"край Красноярский,г Железногорск,ул Толстого,зд 19",93.439863,56.197453,"Первая библиотека города. Открылась в сентябре 1951 года как профсоюзная библиотека градообразующего предприятия «Сибхимстрой», услугами которой пользовались и жители поселка Первомайский. В 1994 году присоединена к муниципальному бюджетному учреждению культуры «Центральная городская библиотека им. М. Горького», стала ее пятым филиалом. Библиотека обслуживает более 4 000 читателей в год. Фонд составляет 25 000 документов на различных носителях. На постоянной основе в библиотеке действуют четыре клуба: эколого-краеведческий «Родничок», исторический «Ювента», литературно-досуговый клуб «Надежда» и клуб «Выходного дня». В 2021 библиотека открылась после модернизации — в рамках краевого проекта «Городская библиотека». Появилась новая современная мебель, компьютерное оборудование и офисная техника, есть доступ к высокоскоростному интернету.",Железногорск,2021-06-04T03:04:07Z,2023-03-01T06:21:03Z,10:00:00,20:00:00,10:00:00,20:00:00,10:00:00,20:00:00,10:00:00,20:00:00,10:00:00,20:00:00,,,11:00:00,18:00:00
Библиотека № 3 им. Б. Л. Васильева г. Смоленска,"обл Смоленская,г Смоленск,ул Юрьева,д 3",32.047056,54.810439,"Библиотека № 3 им. Б.Л. Васильева – старейшая библиотека города Смоленска, была открыта в 1898 году. До этого времени библиотеки Смоленска были недоступны большинству населения. Поэтому группа интеллигентов-книголюбов на частные пожертвования во временно «дарованном» помещении за Днепром организовала общедоступную библиотеку. Книги для библиотеки покупались библиотечным комитетом и жертвовались горожанами. Библиотека не осталась в стороне от политической жизни города Смоленска и страны – в 1905–1906 годах пять сотрудников библиотеки были арестованы за свои убеждения и высланы из города. После революции 1917 года библиотека становится центром просвещения и воспитания нового поколения. В 1923 году в библиотеке насчитывается 14 000 томов (из них 2 059 – для детей) и 1 642 читателя. В годы Великой Отечественной войны город был практически полностью разрушен. Не стало исключением и зданием библиотеки, 16 июля 1941 года в него попал снаряд и все имущество сгорело. Но уже в 1943 году, после освобождения Смоленщины, работа библиотеки вновь возобновляется в небольшом здании. Книги присылала вся страна. Кроме основной деятельности, в библиотеке выпускались иллюстрированные библиографические плакаты, которые использовались в школах, госпиталях и на призывных пунктах. В 1973 году библиотека переехала в новое здание по улице Юрьева, дом 3, где располагается по настоящее время. В 1976 году библиотека вошла в состав централизованной библиотечной системы города Смоленска. Фонд – 34 680 экземпляров, количество читателей – 3 237, количество посещений – 24 121, книговыдача – 78 340. Библиотека предоставляет разным возрастным категориям удобный читальный зал с новейшей периодикой и справочными изданиями, абонемент с обширной литературой для всех категорий населения. В оснащенном современной техникой Центре правовой и деловой информации, жители микрорайона могут получить информацию по интересующим вопросам при помощи баз данных «Консультант», «Гарант», ресурсов Интернет. Несмотря на все изменения в жизни страны, библиотека всегда была, есть и будет верна своему предназначению – быть не только хранилищем книг, но и центром знания. Она по-прежнему является просветительским и информационным центром микрорайона «Покровка».",Смоленск,2015-08-13T13:33:29Z,2023-02-01T09:05:38Z,11:00:00,19:00:00,11:00:00,19:00:00,,,11:00:00,19:00:00,11:00:00,19:00:00,10:00:00,18:00:00,10:00:00,18:00:00
Михайловская центральная районная библиотека им. А. С. Пушкина,"обл Рязанская,р-н Михайловский,г Михайлов,ул Победы,д 3а",39.0281081853128,54.233346958692,"В настоящее время в системе муниципального учреждения культуры «Михайловская центральная районная библиотека им. А. С. Пушкина» – 30 библиотек.Библиотечная сеть района обслуживает свыше 21 500 пользователей, что составляет около 62,2 % населения района. Выдается около 500 000 экземпляров различных материалов, проводится более 600 массовых мероприятий. Общий фонд всех библиотек учреждения составляет свыше 201 тысячи экземпляров. Ежегодно выдается пользователям библиотек более 9 тысяч справок различной тематики.В стенах Михайловской центральной районной библиотеки им. А. С. Пушкина для учащихся школ проводятся интересные, познавательные, часто театрализованные, мероприятия самой разной тематики: встречи с классиками русской литературы, мероприятия, посвященные памятным датам истории, знакомство с родным краем и знаменитыми земляками. Студентам высших и средних учебных заведений библиотека поможет не только подобрать литературу по интересующей теме, но и найти необходимую информацию в интернете, распечатать курсовую или дипломный проект. Людям, предпочитающим держать в руках живую книгу, а не ее электронный аналог, библиотекари с удовольствием помогут выбрать интересные книги самых разных жанров: от нестареющей классики до произведений современных авторов.",Михайловский район,2016-11-02T06:05:07Z,2023-02-27T06:47:55Z,,,09:00:00,18:00:00,09:00:00,18:00:00,09:00:00,18:00:00,09:00:00,18:00:00,09:00:00,17:00:00,10:00:00,17:00:00
Юношеская библиотека № 14 им. И. Сельвинского,"Респ Крым,г Евпатория,пр-кт Победы,д 19",33.3479931950569,45.192036722387,"Библиотека была открыта в 1972 году, а статус юношеской получила в феврале 1989 года. В декабре 1999 года, к 100-летию со дня рождения поэта Ильи Львовича Сельвинского, юношеские годы которого прошли в Евпатории, библиотеке было присвоено его имя. Это произошло в торжественной обстановке: на праздник приехали дочери и внучка поэта, состоялась научно-практическая конференция. Сегодня библиотека продолжает активно работать с подростками и молодежью, организует тренинги, диспуты, круглые столы, ведет работу с семьями, в которых воспитываются приемные дети и дети-инвалиды. Сотрудники принимают участие в библиотечных проектах, организуют выставки живописи и фото, выступления поэтов и бардов, уличные акции и флешмобы. Работает бесплатный интернет-центр для пользователей. Библиотека ежегодно обслуживает 2 300 читателей, в распоряжении которых около 20 000 книг.",Евпатория,2017-09-11T06:56:33Z,2023-09-12T05:20:31Z,10:00:00,17:00:00,10:00:00,17:00:00,10:00:00,17:00:00,10:00:00,17:00:00,,,10:00:00,17:00:00,10:00:00,17:00:00
Библиотека им. В. И. Даля г. Нижнего Новгорода,"обл Нижегородская,г Нижний Новгород,ул Черняховского,д 9",43.850111,56.333195,"Библиотека основана в 1962 году. Ее возглавляет Потанина Ирина Сергеевна.Структура: младший абонемент, средний абонемент, старший абонемент, 2 читальных зала.Для маломобильных граждан вход в библиотеку оборудован пандусом.Дополнительная услуга для читателей – ксерокопирование. По состоянию на 01.01.2021:количество читателей – 2 120;количество посещений – 15 817;количество книговыдач – 34 921;книжный фонд – 35 672 экз.При библиотеке работает клуб любителей и почитателей русской словесности «Златоуст». В настоящее время она обслуживает детей микрорайона Орджоникидзе, работает со школами № 66, 69, 172. Дети с удовольствием посещают массовые мероприятия, знакомятся с литературой, представленной на содержательных, красочно оформленных выставках. Богатый фонд библиотеки позволяет удовлетворять разнообразные запросы читателей.22 февраля 2019 года здесь открылась новая игровая комната. Помимо книжного фонда, там широко представлены игры на любой вкус и пристрастие. Библиотекари будут проводить с детьми громкие чтения, беседы, часы увлекательных игр, творческие конкурсы, праздники во время каникул.",Нижний Новгород,2021-07-01T09:54:14Z,2023-03-09T11:39:47Z,10:00:00,18:00:00,10:00:00,18:00:00,10:00:00,18:00:00,10:00:00,18:00:00,10:00:00,18:00:00,,,10:00:00,17:00:00
Библиотека им. М. Сеспеля – филиал № 13 г. Чебоксары,"Чувашия Чувашская республика,г Чебоксары,ул 50 лет Октября,д 3",47.273509,56.127833,"Библиотека открылась в декабре 1967 года. Первоначально находилась в трехкомнатной квартире жилого дома в Северо-Западном районе города. В 1986 году переехала в новое просторное здание по ул. 50 лет Октября, в котором располагается и сегодня.Книжный фонд – 45 000 экземпляров печатных и более 100 экземпляров электронных изданий. Библиотеку ежегодно посещают 7 000 читателей разного возраста. На абонементе любой посетитель найдет современную и классическую литературу, литературу по технике, истории, спорту, искусству. Его ждет удивительный мир фантастики, приключений и детективов. В читальном зале универсальный книжный фонд представлен отраслевыми энциклопедиями, справочниками, словарями, учебными пособиями.Зал «Инфотека» – это пространство для учебы, работы, отдыха и, конечно, веселых тусовок. Это пространство альтернативного времяпрепровождения, ориентированное на аудиторию активных и креативных людей, предпочитающих живое общение. Здесь для читателей проходят самые разные мероприятия: игры, конкурсы, книжные выставки различной тематики, тематические и литературно-музыкальные вечера, диспуты, обзоры и беседы. В массовой работе библиотеки отражаются все актуальные темы современности в мире, стране, городе, юбилейные даты писателей и поэтов.",Чебоксары,2015-07-22T09:39:44Z,2023-02-21T13:24:39Z,10:00:00,19:00:00,10:00:00,19:00:00,10:00:00,19:00:00,10:00:00,19:00:00,10:00:00,19:00:00,,,10:00:00,18:00:00
Калужская городская библиотека – филиал № 8 им. Есенина,"обл Калужская,г Калуга,пер Малинники,д 16",36.295863,54.553444,"Библиотека имени С. Есенина была образована в 1955 году. Расположена в микрорайоне Малинники, обслуживает детей и взрослых. К услугам посетителей взрослый и детский абонементы и читальные залы, в которых представлена художественная и справочная литература, широкий краеведческий материал. А для любителей периодики выделен уютный уголок, располагающий к чтению газеты или журнала. Есть уютные зоны для чтения и доступ к Wi-Fi. Книжный фонд насчитывает более 118 000 экземпляров и ежегодно пополняется. На сегодняшний день библиотека оказывает услуги более 6 000 пользователей. Для них проводятся разнообразные акции, праздники, литературно-музыкальные вечера, устные журналы, часы памяти, краеведческие часы, квесты, викторины, мастер-классы, тематические беседы и обзоры, игровые программы. В библиотеке действует клуб любителей поэзии «Лира». Для членов клуба организуются творческие встречи, литературно-музыкальные вечера, мастер-классы. Для детей создан кружок «Библиотечный репетитор» и проект «Игротека». Библиотека тесно сотрудничает со школами № 1 и № 25, Областным центром образования, детскими садами № 72 «Калинка» и № 72 «Малинка», Калужским комплексным центром социального обслуживания населения «Забота», Домом культуры «Малинники», детской школой искусств № 5.",Калуга,2015-03-15T14:53:24Z,2023-11-09T13:29:11Z,11:00:00,19:00:00,11:00:00,19:00:00,,,11:00:00,19:00:00,11:00:00,19:00:00,11:00:00,19:00:00,11:00:00,19:00:00
Центральная городская библиотека им. Н. В. Гоголя,"обл Кемеровская,г Новокузнецк,ул Спартака,д 11",87.125138,53.756893,"Центральная городская библиотека им. Н. В. Гоголя, основанная в 1929 г. – старейшая публичная библиотека Кемеровской области. Это крупнейший информационный и культурный центр Новокузнецка, координационный и методический центр для библиотек города. Миссия – обеспечение свободного доступа к информации, свободное духовное развитие и приобщение горожан к ценностям мировой культуры.В структуре Центральной библиотеки 11 специализированных отделов. Обслуживает все категории населения из всех районов города. В собрании библиотеки свыше 480 тыс. экземпляров книг, журналов, аудиозаписей, электронных изданий. В редком фонде книгохранения более 1 600 экземпляров книг XIX – начала XX веков, факсимильные, подарочные, миниатюрные издания. В библиотеке собран уникальный краеведческий материал по истории, экономике, культуре Кузбасса и Новокузнецка.Библиотека предоставляет доступ к удаленным информационным ресурсам: Национальная электронная библиотека, Электронная библиотека диссертаций РГБ, Полнотекстовая база данных ПОЛПРЕД, Электронная библиотека Кузбасса.",Новокузнецк,2015-10-26T14:53:48Z,2023-03-02T14:23:00Z,10:00:00,20:00:00,10:00:00,20:00:00,10:00:00,20:00:00,10:00:00,20:00:00,,,10:00:00,18:00:00,10:00:00,18:00:00
Кобяйская улусная библиотека им. Т. Е. Сметанина,"Респ Саха /Якутия/,у Кобяйский,пгт Сангар,ул Алексеева,д 3",127.469720665932,63.9232149900682,"Центральная улусная библиотека с 1978 года является головным учреждением Кобяйской централизованной библиотечной системы, которая объединяет 16 филиалов и осуществляет административно-управленческую, хозяйственно-финансовую, организационно-методическую деятельность. Является лауреатом премии главы муниципального образования «Кобяйский улус (район)» Республики Саха (Якутия) в области культуры и искусства «Серебряный хомус – 2015» в номинации «Лучшее учреждение культуры Кобяйского улуса». Информационно-библиотечное обслуживание пользователей осуществляют 12 специалистов, которые имеют специальное библиотечное образование, из них 7 человек имеют высшее специальное, 5 человек – среднее специальное образование. За 2020 год зарегистрировано 2 586 пользователей, в том числе 430 удаленных, 184 ребенка до 14 лет, 712 молодых людей 14–30 лет.На 1 января 2021 года библиотечный фонд включает 34 581 экземпляр документов. За 2020 год поступило 560 экземпляров новых документов. В 2021 году книговыдача составила 37 141 экземпляр.Сегодня, в условиях снижения интереса к чтению, перед каждым специалистом стоит задача инновационного, творческого подхода к своей профессиональной деятельности. Важную роль в привлечении читателей, конечно же, играет качественное обновление книжного фонда, приобретение тех изданий, которые соответствуют их потребностям, пополнение фонда мультимедийных и электронных ресурсов и специальной литературы, в том числе для инвалидов по зрению и слуху.",Кобяйский район,2021-04-16T01:59:31Z,2023-05-30T13:33:32Z,09:00:00,18:00:00,09:00:00,18:00:00,09:00:00,18:00:00,09:00:00,18:00:00,09:00:00,18:00:00,09:00:00,18:00:00,,
