name,address,longitude,latitude,description,subordination,creation_time,modification_time,mo_from,mo_to,tu_from,tu_to,we_from,we_to,th_from,th_to,fr_from,fr_to,sa_from,sa_to,su_from,su_to
Библиотека им. Ю. А. Адрианова г. Нижнего Новгорода,"обл Нижегородская,г Нижний Новгород,ул Дьяконова,д 25",43.885675,56.264447,"Библиотека носит имя известного нижегородского поэта Юрия Адрианова. В своих стихах поэт часто воспевал родной город. Воспитание любви к родному краю – ведущая тема библиотеки. Гордость учреждения – большой фонд краеведческой литературы и литературно-мемориальная экспозиция, посвященная жизни и творчеству Юрия Адрианова. Ежегодно осенью проводятся Адриановские встречи, собирающие почитателей поэзии, друзей и знакомых поэта. Сотрудники организуют выставки, тематические встречи и городские экскурсии, устраивают кинопоказы и праздники, проводят занятия в кружках и на открытых площадках.Количество читателей – 6 600 человек. Книжный фонд – 45 000 экз.Структура:абонемент для взрослых;абонемент для детей;справочно-информационный зал;сектор краеведения;литературно-мемориальная экспозиция Ю. Адрианова.",Нижний Новгород,2016-10-20T08:24:41Z,2023-07-14T11:24:39Z,10:00:00,18:00:00,10:00:00,18:00:00,10:00:00,18:00:00,10:00:00,18:00:00,10:00:00,18:00:00,,,10:00:00,17:00:00
Билярская сельская библиотека им. Кул Гали,"Респ Татарстан,р-н Алексеевский,с Билярск,ул Калинина,влд 3",50.382911,54.982068,"История Билярской библиотеки своими корнями уходит в далекие 30-е годы. В ноябре 1984 года ей было присвоено имя Кул Гали в честь 800-летия со дня рождения основоположника татарской письменной поэзии. Фонд насчитывает 10 862 экземпляра книг, а также 27 наименований периодических изданий. При библиотеке работает краеведческий клуб «Мирас» (12 человек) и женский клуб «Сударушка» (13 человек). Для привлечения читателей проводятся различные мероприятия: тематические вечера, беседы, викторины, литературные часы, устные журналы, флешмобы, акции и многое другое. Библиотека работает по следующим направлениям: краеведческое, военно-патриотическое воспитание, экологическое просвещение и другие.",Алексеевский район,2021-04-09T10:24:11Z,2023-09-12T12:21:16Z,09:00:00,17:00:00,09:00:00,17:00:00,09:00:00,17:00:00,09:00:00,17:00:00,09:00:00,17:00:00,09:00:00,13:00:00,,
Белореченская сельская библиотека им. П. Е. Русских,"обл Кировская,р-н Омутнинский,п Белореченск,ул Петра Русских,д 14",52.2994923591614,58.7712836533157,"Библиотека основана в 1967 году. Фонд – 6 698 экземпляров. Ежегодно ее посещают 655 читателей.Белореченская сельская библиотека реализует историко-патриотическое и нравственное направления библиотечной деятельности, популяризирует основы здорового образа жизни и художественную литературу. 26 марта 2020 года в соответствии с ходатайством Управления культуры Омутнинского района Белореченская сельская Дума решила присвоить Белореченской сельской библиотеке имя земляка – Героя Советского Союза Петра Егоровича Русских. Очень символично, что такое знаменательное в жизни библиотеки, сельского поселения, местного сообщества событие произошло в год празднования 75-летия Великой Победы. Библиотека сегодня – это центр информации, самообразования и культуры поселка, способствующий разностороннему развитию его жителей.",Омутнинский район,2015-08-18T07:58:36Z,2023-02-21T14:17:54Z,10:00:00,16:10:00,10:00:00,16:10:00,10:00:00,16:10:00,10:00:00,16:10:00,10:00:00,16:10:00,10:00:00,12:20:00,,
Новомирская сельская библиотека-филиал им. А. Б. Нейдгарта,"обл Нижегородская,р-н Вадский,сп Новый Мир,ул Школьная,д 3",44.43318,55.426299,"Библиотека основана в 1950 г. В 1987 г. была включена в структуру централизованной библиотечной системы. В 2018 г. ей присвоено имя российского политического и государственного деятеля Алексея Борисовича Нейдгарта.Библиотека сегодня: фонд – 3 424, пользователей – 500, посещений – 5 000.Читателями библиотеки являются люди различных возрастов и интересов. Для удобства фонд разделен на тематические стеллажи: «Зарубежная литература», «Отечественная литература», «Классическая литература», «Романы», «Детективы» и «Детская литература». Большим спросом пользуются периодические издания. Библиотека активно сотрудничает с сельской администрацией, детским садом, Домом культуры, школой, ветеранской организацией. Работа по популяризации имени А. Б. Нейдгарта ведется в рамках программы «Край родной, навек любимый». В библиотеке постоянно действует выставка «Честь смолоду: жизнь и духовный подвиг Алексея Борисовича Нейдгарта». Созданы и пополняются папки-накопители «Отрада для души», «Нить истории» об истории поселка. Регулярно оформляются выставки на актуальные темы и просто для души. Также в библиотеке проводятся различные мероприятия со взрослыми и детьми. Для детей создан клуб «Умелые ручки», в котором ребята учатся делать поделки своими руками. Взрослые посещают клуб «Надежда». Члены клуба являются активистами библиотеки. Библиотека является участником всех культурных мероприятий, проводимых в селе.",Вадский район,2021-06-18T07:16:16Z,2023-03-07T09:36:15Z,,,11:00:00,18:00:00,11:00:00,18:00:00,11:00:00,18:00:00,11:00:00,18:00:00,11:00:00,18:00:00,10:30:00,14:00:00
Центр семейного чтения им. В. Чапаева – филиал № 6,"Чувашия Чувашская республика,г Чебоксары,ул О.Беспалова,д 1",47.178099,56.106419,"Библиотека входит в состав МБУК «Объединение библиотек города Чебоксары». Образована в 1947 году. В 2014 году в связи с реорганизацией городских ЦБС была преобразована в библиотеку-филиал. Информационный, образовательный, досуговый центр. Обслуживает более 6 тыс. читателей.Фонд библиотеки насчитывает свыше 35 тыс. экземпляров: книги, альбомы репродукций, CD и DVD-диски, около 50 наименований периодических изданий. В библиотеке созданы условия для творческой самореализации юных читателей: действует клуб «Дружеские встречи», эколого-театрализованная студия «Тропинка», литературный салон «Таланты и поклонники».",Чебоксары,2015-07-22T09:50:58Z,2023-02-21T12:52:14Z,10:00:00,19:00:00,10:00:00,19:00:00,10:00:00,19:00:00,10:00:00,19:00:00,10:00:00,19:00:00,,,10:00:00,18:00:00
Центральная муниципальная библиотека им. Н. А. Некрасова,"Респ Удмуртская,г Ижевск,ул им Вадима Сивкова,д 158",53.206774,56.844727,"Центральная муниципальная библиотека им. Н. Некрасова открылась 15 сентября 1960 года. Ее фонд – 53 000 экземпляров. Пользователи – 15 000 человек. Библиотека является административным и методически центром для 22 библиотек-филиалов Ижевска. Ежегодно сотрудники ЦМБ организуют более 400 мероприятий разного масштаба. С 2013 года библиотека является организатором ежегодного масштабного культурного события – городского книжного фестиваля «Читай, Ижевск!». С 2015 года организует международную акцию по проверке грамотности «Тотальный диктант» в Ижевске. Также это площадка для проведения общероссийских и международных акций: «Большой этнографический диктант», «Тест по истории отечества», «Географический диктант», «Библионочь» и др. Библиотека – активная участница конкурсов и грантов разного уровня. В 2022–2023 годах ее сотрудники одержали победу в 7 конкурсах.",Ижевск,2018-04-13T05:20:40Z,2023-09-27T09:10:13Z,10:00:00,20:00:00,10:00:00,20:00:00,10:00:00,20:00:00,10:00:00,20:00:00,10:00:00,18:00:00,,,10:00:00,18:00:00
Лузская районная библиотека им. В. А. Меньшикова,"обл Кировская,р-н Лузский,г Луза,пл Труда,д 6",47.280283,60.620104,"Лузская районная библиотека им. В. А. Меньшикова является главной библиотекой Лузского муниципального округа. Открыта в декабре 1945 года. Библиотека сегодня: фонд – более 48 000 экз.;число пользователей – 4 950 человек;число посещений стационарных и удаленных – 58 060; книговыдача – 128 000 экз.;число клубных объединений – 7;методический центр для 19 муниципальных библиотек округа. Лузская районная библиотека им. В. А. Меньшикова является библиотечно-информационным центром и предоставляет пользователям бесплатный доступ к документам и справочно-правовой системе «Консультант+», справочно-библиографическому аппарату и электронному каталогу. Обслуживание удаленных пользователей ведется через группы в социальных сетях и сайт. В библиотеке создан избирательный участок, работает общественная площадка для встречи с депутатами, а также для проведения переписи населения. Проводятся районные семинары и конкурсы профессионального мастерства, научно-практические конференции, театрализованные представления и праздники, мастер-классы по народному творчеству, встречи с писателями, дни православной книги, дни вятской книги, всероссийская акция «Библионочь» и т. д.С 2010 года в библиотеке проходят ежегодные межрегиональные краеведческие православные чтения, с 2015 года ведется работа по проекту историко-патриотической летописи.",Лузский район,2022-04-14T20:23:45Z,2023-02-28T12:01:20Z,08:00:00,18:00:00,08:00:00,18:00:00,08:00:00,18:00:00,08:00:00,18:00:00,08:00:00,18:00:00,08:00:00,18:00:00,10:00:00,16:00:00
Иванцевская библиотека-филиал им. А. М. Бастракова,"обл Кировская,р-н Белохолуницкий,с Иванцево,ул Советская,д 24",50.99929,59.128112,"Иванцевская библиотека филиал обслуживает жителей села Иванцево.Имя земляка, участника Великой Отечественной войны, Героя Советского Союза А. М. Бастракова присвоено библиотеке по праву. Здесь долгие годы собирают материал о нем, пополняют мемориальную экспозицию, организуют экскурсии. Большое внимание работник библиотеки уделяет краеведческой работе, жизни и судьбам земляков. Клуб «Сударушка» служит местом общения селянок, отдушиной в их нелегкой жизни.В 2008 году библиотека отметила свое 100-летие. Весь этот период ее деятельность отличает профессионализм, интеллигентность, истинная культура.",Белохолуницкий район,2015-08-24T08:19:18Z,2023-02-01T09:19:21Z,12:00:00,18:00:00,12:00:00,18:00:00,12:00:00,18:00:00,12:00:00,18:00:00,12:00:00,18:00:00,12:00:00,18:00:00,,
Республиканская детско-юношеская библиотека им. В. Х. Колумба,"Респ Марий Эл,г Йошкар-Ола,ул Эшкинина,д 10",47.908439,56.632026,"Республиканская детско-юношеская библиотека имени В. Х. Колумба – одна из крупнейших библиотек Республики Марий Эл. Пройдя путь от детского отделения Областной центральной библиотеки в 1924 году, городской детской библиотеки в 1935 году, 1 июля 1967 года она наконец приобрела статус республиканской детской библиотеки. Именно с этой даты ведется летоисчисление современной библиотеки. В 2015 году путем присоединения к Республиканской юношеской библиотеке имени В. Х. Колумба открыла двери нового здания уже Республиканская детско-юношеская библиотека имени В. Х. Колумба.Книжный фонд насчитывает порядка 190 000 единиц хранения, ежегодно библиотека обслуживает около 14 000 читателей, выдает более 250 000 книг. Сегодня библиотека – это информационный, культурно-просветительский, интеллектуально-досуговый центр для детей и молодежи, содействующий развитию и поддержке чтения среди подрастающего поколения.",Республика Марий Эл,2015-07-31T09:49:00Z,2023-04-19T08:19:58Z,09:00:00,18:00:00,09:00:00,18:00:00,09:00:00,18:00:00,09:00:00,18:00:00,09:00:00,16:00:00,,,09:00:00,16:00:00
Центральная библиотека им. Героя Советского Союза А. Н. Пайкова п. Воскресенского,"обл Нижегородская,р-н Воскресенский,рп Воскресенское,ул Ленина,д 102",45.435125,56.836086,"Официальное открытие первой библиотеки в Воскресенском состоялось в 1897 году, о чем сообщили «Нижегородские губернские новости» за 29 октября 1897 года. Располагалась она в частном доме помещика Левашева. В 1972 году библиотека переехала в типовое двухэтажное здание, где и располагается в настоящее время. Важный этап в библиотечном строительстве – конец 70-х годов, когда прошла централизация, объединение библиотек района в сеть. Был создан единый сводный каталог, читатели получили возможность пользоваться фондами всех библиотек района. В 2005 году Центральной библиотеке было присвоено имя Героя Советского Союза Александра Николаевича Пайкова.Учреждение обслуживает более 3 000 пользователей. Также является методической базой для библиотек района. Здесь создаются программы развития, совершенствуется процесс автоматизации библиотечной работы. Фонд насчитывает свыше 19 000 единиц.",Воскресенский район,2015-07-22T05:37:28Z,2023-08-08T12:00:56Z,08:00:00,18:00:00,08:00:00,18:00:00,08:00:00,18:00:00,08:00:00,18:00:00,08:00:00,18:00:00,,,09:00:00,16:00:00
Библиотека № 7 им. В. Л. Шокалюка,"край Забайкальский,г Чита,ул Федора Гладкова,д 4",113.483038,52.07042,"Самым красивым микрорайоном Читы горожане считают Северный, а у жителей этой части города одним из любимых мест досуга и самообразования является библиотека № 7, которая была открыта 27 декабря 1975 г. В те годы это была одна из классных комнат средней школы № 22.С 1979 г. библиотека находилась в жилом доме № 2, а в мае 2007 г. переехала в новое здание на ул. Ф. Гладкова, 4. Теперь она имеет большую возможность пригласить на массовые мероприятия детей и подростков, молодежь и ветеранов.Много лет библиотека сотрудничает с советом общественности микрорайона, детской школой искусств № 3, коллективами школ № 22 и № 27, педагогического колледжа и областного училища культуры дошкольных образовательных учреждений № 45, 75, 82, успешно организует обслуживание и проведение досуга людьми пожилого возраста. При библиотеке действовал клуб для пенсионеров «Золотой возраст», в настоящее время работают клубы интересных встреч, «Подсолнух», «Здоровье». Открыт памятный уголок В. Л. Шокалюка, известного агронома.Фонд насчитывает 15 000 экземпляров. Библиотека обслуживает более 2 000 читателей, ежегодно им выдается более 44 000 экземпляров документов. Вклад в развитие библиотеки внесли И. Н. Калачева, В. Г. Бичина. Оборудованы рабочие места для слабовидящих и незрячих посетителей. Места оснащены тифлофлешплеером, аудиокнигами и изданиями со шрифтом Брайля. Заведующая – Верхотурова Ольга Сергеевна.",Чита,2016-04-24T11:01:51Z,2023-02-22T08:04:12Z,09:00:00,18:00:00,09:00:00,18:00:00,09:00:00,18:00:00,09:00:00,18:00:00,09:00:00,18:00:00,,,09:00:00,18:00:00
