name,address,longitude,latitude,description,subordination,creation_time,modification_time,mo_from,mo_to,tu_from,tu_to,we_from,we_to,th_from,th_to,fr_from,fr_to,sa_from,sa_to,su_from,su_to
Троицко-Печорская межпоселенческая центральная библиотека им. Г. А. Фёдорова,"Респ Коми,р-н Троицко-Печорский,пгт Троицко-Печорск,ул Мира,д 26",56.195792,62.7147,"История Центральной районной библиотеки начинается с 1894 года. Одна из первых библиотек Коми края называлась тогда Печорской народной библиотекой. Заведовать ею был назначен законоучитель Печорской земской школы священник Александр Александрович Сахаров. В 1898 году в библиотеке было книг и периодических изданий 776 томов на сумму 500 руб.В 2008 году библиотеке присвоено имя коми писателя Геннадия Александровича Фёдорова. В 2010-м открылся Центр общественного доступа к ресурсам Президентской библиотеки им. Б. Н. Ельцина. В 2011 г. – Литературный музей.Сегодня это современный краеведческий, информационный, образовательный, культурный и досуговый центр. Фонд документов центральной библиотеки на 1.01.2020 – 40 605 экземпляров. Читателям предоставлен доступ к Национальной электронной библиотеке (НЭБ), к электронной библиотеке «ЛитРес».",Троицко-Печорский район,2016-04-13T07:02:31Z,2023-02-21T08:12:07Z,09:00:00,18:00:00,09:00:00,18:00:00,09:00:00,18:00:00,09:00:00,18:00:00,09:00:00,18:00:00,,,09:00:00,18:00:00
Центральная районная библиотека им. С. С. Васильева-Борогонского,"Респ Саха /Якутия/,у Усть-Алданский,с Борогонцы,ул Ленина,д 29",131.161326,62.672077,"История библиотеки началась в 1924 году, она была первой народной библиотекой Якутии советского периода. С 1997 года носит имя С. С. Васильева-Борогонского – известного писателя, видного общественного государственного деятеля, лауреата Государственной премии Якутской АССР им. П. А. Ойунского. Библиотека сегодня: фонд – 53 451 единица;число пользователей – 3 259;стационарные посещения – 13 121; внестационарные посещения – 35 176; удаленные обращения – 15 797. Библиотека – информационный и культурно-просветительский центр. Читателям предоставлен бесплатный доступ к сетевым ресурсам. Удаленным пользователям предоставляются онлайн-услуги. Создается электронная библиотека Усть-Алданской МЦБС. Центральная районная библиотека – любимое место досуга, культурного и духовного общения сельчан. Разнообразие клубов, лекций, мастер-классов, выставок, конкурсов получило положительные отклики читателей. Библиотека активно формирует культурную среду района.",Усть-Алданский район,2022-10-25T06:35:16Z,2023-06-05T11:05:29Z,09:00:00,18:00:00,09:00:00,18:00:00,09:00:00,20:00:00,09:00:00,20:00:00,09:00:00,18:00:00,,,09:00:00,18:00:00
Библиотека им. Н. Некрасова г. Кургана,"обл Курганская,г Курган,ул Василия Блюхера,д 24",65.369442,55.445007,"Библиотека им. Н. Некрасова – одна из старейших библиотек Кургана, открыта 5 ноября 1955 года. Первоначально она располагалась по улице Куйбышева, 157 и называлась «Третья городская библиотека». Первой заведующей была Тамара Ивановна Белова. 17 декабря 1956 года по инициативе горисполкома библиотека переведена на улицу Блюхера, 24. В этот же период библиотеке присвоено имя поэта Николая Алексеевича Некрасова. На сегодняшний день количество читателей библиотеки – около 3 500 человек, книжный фонд – 21 876 экземпляров. Количество посадочных мест в зале массовых мероприятий – 20. В библиотеке трудятся 4 специалиста. Сотрудники гордятся историей библиотеки и семейными читательскими династиями, многие из которых насчитывают несколько поколений. Для читателей работают взрослый и детский абонементы, где можно выбрать для чтения деловую и учебную литературу, а также книжные новинки на любой вкус и возраст. Дамы элегантного возраста приходят сюда для общения в «Женском клубе». Каждое воскресенье маленькие читатели могут проявить свои творческие способности и научиться мастерить на занятиях творческой студии «Куклики». В 2021 году для детей микрорайона организован краеведческий клуб «Искатели». Участники изучают культуру и историю родного края в форме творческих заданий и с использованием кейс-технологий. Несколько лет библиотека работает по программе «Общение вокруг чтения», в рамках которой проводятся круглые столы, диспуты, беседы для детей, подростков и взрослого населения микрорайона.",Курган,2023-04-11T09:42:54Z,2023-04-11T10:34:38Z,,,10:00:00,19:00:00,10:00:00,19:00:00,10:00:00,19:00:00,10:00:00,19:00:00,11:00:00,18:00:00,11:00:00,18:00:00
Библиотека им. М. К. Волдиной с. Казым,"АО Ханты-Мансийский Автономный округ - Югра,р-н Белоярский,с Казым,ул Каксина,д 10",67.2398874163628,63.7054020781671,"В 1931 г. в селе Казым была организована культбаза, а в 1932 г. в отчетах значится изба-читальня. В селе Казым основная часть населения – представители коренных народов, поэтому краеведение является главным направлением в работе библиотеки. На протяжении многих лет в сотрудничестве с сельским клубом, выставочным залом, школьным музеем, Казымским этнографическим музеем проводятся национальные праздники, ведется работа по сбору и систематизации материалов об истории села и Белоярского района. В 2001–2004 гг. библиотека работала по программе «Отчим краем мы гордимся». С 2009 г. возобновлена работа по программе. Цель программы – приобщение детей к богатствам национальной культуры, знакомство с традиционными отношениями коренного населения с окружающей средой. В библиотеке работает кружок «Веранг нэ» по декоративно-прикладному искусству коренных народов Севера и кружок «Рэт ясанг» по изучению хантыйского языка.Фонд на 1 января 2021 г. – 13 858 единиц, количество посещений – 2 458 человек.",Белоярский район,2019-11-14T07:29:11Z,2023-03-03T12:09:49Z,,,11:00:00,19:00:00,11:00:00,19:00:00,11:00:00,19:00:00,11:00:00,19:00:00,11:00:00,19:00:00,,
Центральная библиотека им. М. М. Зощенко,"г Санкт-Петербург,г Сестрорецк,ул Токарева,д 7",29.9561548233032,60.08858181231,"Центральная библиотека им. М. М. Зощенко открыта в 1944 году. Количество пользователей – свыше 8 000 человек. Посещаемость в год – более 95 000. Фонд – свыше 116 000 единиц. Пользователям предоставляется бесплатный доступ к популярным электронным библиотекам и каталогам, ресурсам Президентской библиотеки имени Б. Н. Ельцина, Национальной электронной библиотеки и информационно-образовательного центра «Русский музей: виртуальный филиал», материалам архивов Санкт-Петербурга. В библиотеке проходят лекции, выставки, встречи и другие события. Работает клуб робототехники и поэтический клуб. Для пенсионеров организованы компьютерные курсы. Индивидуальным посетителям музейной экспозиции «Жизнь и творчество Михаила Зощенко» предоставляются аудиогиды, экскурсии для организованных групп проводят кураторы экспозиции. Ежегодно в августе в сквере у библиотеки проходят Зощенковские чтения с участием артистов театра и кино, музыкантов и исполнителей. Литературно-музыкальный праздник, посвященный дню рождения Зощенко, объединяет поклонников его творчества уже почти 30 лет. Сотрудники библиотеки проводят пешеходные экскурсии по достопримечательностям Сестрорецка «Дальние Дубки» Петра I – 300 лет истории», «Пешком по Сестрорецку», «В старинных зданиях дух времени живет».",Санкт-Петербург,2015-10-07T12:33:47Z,2023-08-23T08:36:08Z,11:00:00,19:00:00,11:00:00,19:00:00,11:00:00,19:00:00,11:00:00,19:00:00,,,12:00:00,18:00:00,12:00:00,18:00:00
Детский отдел им. Н. К. Крупской г. Морозовска,"обл Ростовская,р-н Морозовский,г Морозовск,ул Ленина,д 151",41.829997,48.352821,"Здание детской библиотеки в Морозовске было построено в 50-х годах ХХ века. Фонд на конец 2023 года включает 33 975 экземпляров, ежегодно отдел посещает более 23 000 человек. Библиотекари проводят массовые мероприятия для детей круглый год (летом – еще и для пришкольных лагерей района). Информация о них размещается в рубриках «Книга недели детской библиотеки» и «Читателю детской библиотеки» на сайте учреждения, который начал работу в 2014 году.Самые активные пользователи – ребята от 15 до 24 лет. Они читают книги по школьной программе, для развлечения и отдыха. Читатели отдела от 14 до 18 лет временно трудоустраиваются на летний период в детский отдел по программе Центра занятости населения. Они помогают библиотекарям готовить презентации к мероприятиям, занимаются расстановкой книг в фонде, набирают на компьютере тексты сценариев.",Морозовский район,2022-01-25T13:47:21Z,2024-02-15T06:10:24Z,09:00:00,19:00:00,09:00:00,19:00:00,09:00:00,19:00:00,09:00:00,19:00:00,09:00:00,19:00:00,,,11:00:00,19:00:00
Библиотека-филиал № 6 им. В. В. Ходарева,"край Ставропольский,г Ставрополь,ул Серова,д 422",41.9986951391467,45.0319052411416,"Библиотека основана в 1952 году. В 2015 году по инициативе городской Думы Ставрополя ей было присвоено имя ставропольского поэта Витислава Васильевича Ходарева. Библиотека ставит перед собой цели – обеспечить доступность к своим информационным ресурсам всем слоям населения, удовлетворить потребности пользователей в различных областях знаний, способствовать продвижению чтения и повышению статуса книги. Приоритеты – популяризация творчества ставропольского поэта В. В. Ходарева. Основное направление работы – патриотическое воспитание детей и юношества. Работа центра «Патриот». Девиз – «Мы любим вас, читатели! Мы ценим вас, читатели! Мы работаем для вас!» Читателей – более 3 500 чел., фонд – более 60 000 экз. Библиотека работает по программам: «Патриотическое воспитание граждан Российской Федерации» – формирование нравственного отношения к историческому и героическому прошлому России.«Уважение к государственной символике» – воспитание в каждом человеке уважения к своей Родине. «Культура России» – ознакомление с культурным наследием России. «Земли родной благословенный край» – воспитание любви к родному городу и краю.«Лето с книгой» – ежегодная программа летних чтений. «Школа экологии» для учащихся младших классов – воспитание экологической культуры и ответственности, любви к природе родной страны и родного края и пропаганда здорового образа жизни.",Ставрополь,2021-01-26T12:32:45Z,2023-02-10T07:48:02Z,10:00:00,19:00:00,10:00:00,19:00:00,10:00:00,19:00:00,10:00:00,19:00:00,10:00:00,19:00:00,,,10:00:00,19:00:00
Черкизовская библиотека им. Д. Кедрина,"обл Московская,р-н Пушкинский,дп Черкизово,ул Вокзальная,д 52/1",37.84057,56.011349,"Черкизовская библиотека им. Д. Кедрина была основана в 1960 году. Сегодня ее фонд насчитывает 20 969 книг, журналов и брошюр. Читатели – 750 человек. Библиотека занимает достойное место в образовательной, информационной и культурной инфраструктуре поселка. В библиотеке проходят различные массовые мероприятия, работают творческие мастерские, проводятся выставки картин местных художников, фотовыставки, выставки изделий прикладного искусства, литературно-поэтические вечера, краеведческие экскурсии. Работают кружки для учащихся общеобразовательной школы: художественный и по игре на семиструнной гитаре.",Пушкинский район,2015-03-22T05:06:01Z,2023-08-17T05:33:11Z,,,10:00:00,19:00:00,10:00:00,19:00:00,10:00:00,19:00:00,10:00:00,19:00:00,10:00:00,19:00:00,,
Центральная библиотека им. А. С. Пушкина г. Малая Вишера,"обл Новгородская,р-н Маловишерский,г Малая Вишера,ул Московская,д 36",32.219686,58.844761,"Публичная библиотека в посаде Малая Вишера открыта общественным управлением 25 июня (по старому стилю) 1900 года по случаю столетнего юбилея со дня рождения А. С. Пушкина.Центральная районная библиотека обслуживает взрослое население города от 14 лет. Она является культурным, просветительским и информационным центром для жителей города и методическим центром для библиотек района. Книжный фонд насчитывает 44 850 экземпляров книг, брошюр и журналов, обслуживаются 3 100 читателей. Структура центральной библиотеки им. А. С. Пушкина: сектор организации фондов и каталогов; отдел инновационной деятельности; отдел обслуживания: абонемент, абонемент популярной литературы, читальный зал.",Маловишерский район,2015-09-01T11:03:09Z,2023-07-24T13:00:31Z,10:00:00,18:00:00,10:00:00,18:00:00,10:00:00,18:00:00,10:00:00,18:00:00,10:00:00,18:00:00,10:00:00,17:00:00,,
Детская библиотека им. А. С. Пушкина г. Константиновска,"обл Ростовская,р-н Константиновский,г Константиновск,ул Калинина,д 118",41.102335,47.582994,"Год организации библиотеки – 1949-й. Фонд насчитывает 16 536 экземпляров. Библиотека создает необходимые условия для полного и оперативного предоставления пользователям необходимой информации на традиционных и электронных носителях. Работа ведется как офлайн, так и онлайн. Мероприятия проводятся с помощью новейших информационных технологий, с использованием интерактивного оборудования. Все мероприятия освещаются на сайте библиотеки и на страницах социальных сетей. В учреждении работают 3 клуба по интересам: «Разноцветные идеи», «Теремок» и «ЛуЧиК». Детская библиотека работает в тесном взаимодействии с работниками школ, детских садов и школы искусств. Принимает участие в конкурсах и акциях различного уровня.",Константиновский район,2024-01-15T07:20:52Z,2024-01-15T08:28:42Z,08:00:00,17:00:00,08:00:00,17:00:00,08:00:00,17:00:00,08:00:00,17:00:00,08:00:00,17:00:00,09:00:00,16:00:00,,
Мценская межпоселенческая районная библиотека им. И. С. Тургенева,"обл Орловская,г Мценск,ул Машиностроителей,д 2",36.5714263916016,53.2819287525845,"Мценская районная библиотека имени И. С. Тургенева – одна из крупнейших и старейших библиотек Орловской области. В 2011, 2015, 2016, 2017 годах она была включена в ежегодный Национальный реестр «Ведущие учреждения культуры России». В 2021 году была внесена в Общенациональный реестр «Флагманы социально-экономического развития России» как «Лучшее учреждение культуры и искусства Мценского района 2020 года». Из века в век «Тургеневка» привлекает читателей своим уникальным фондом и высококвалифицированными специалистами, активным внедрением новых технологий и сохранением вековых традиций. Библиотека была открыта 22 августа 1913 года в день 30-летия со дня смерти писателя И. С. Тургенева и названа «Общественной библиотекой имени И. С. Тургенева». С первых дней открытия она стала главным культурным центром Мценского края. Это ведущее информационно-образовательное и культурно-просветительское учреждение, предоставляющее своим пользователям документы различных видов по всем отраслям знаний. Библиотека располагает универсальным документным фондом, насчитывающим 80 217 экз.",Мценский район,2016-09-07T08:03:13Z,2023-03-21T12:05:47Z,11:00:00,18:00:00,11:00:00,18:00:00,11:00:00,18:00:00,11:00:00,18:00:00,11:00:00,18:00:00,11:00:00,18:00:00,,
