name,address,longitude,latitude,description,subordination,creation_time,modification_time,mo_from,mo_to,tu_from,tu_to,we_from,we_to,th_from,th_to,fr_from,fr_to,sa_from,sa_to,su_from,su_to
Библиотечно-информационный центр им. П. И. Бартенева,"обл Липецкая,г Липецк,ул Ленина,д 31",39.610476,52.615459,"Библиотечно-информационный центр им. П. И. Бартенева располагается в исторической части Липецка, на улице Ленина (Дворянской), 31. Его история начинается с открытия в 1961 году библиотеки № 5; в 1966 году она вошла в состав Централизованной библиотечной системы города Липецка. В 2005 году, в результате объединения библиотеки № 5 для взрослых, детской библиотеки № 15 и открытия зала информационных технологий, был организован Библиотечно-информационный центр № 3. В 2009 году решением Липецкого городского совета депутатов учреждению было присвоено имя знаменитого земляка, историка и пушкиниста Петра Ивановича Бартенева. В 2012 году после перепланировки в библиотеке было создано единое современное пространство с максимально открытым доступом к библиотечным ресурсам, функциональными читательскими зонами для детей и взрослых, залом для мероприятий. В 23 января 2013 года в библиотеке открылся первый в России музей Петра Ивановича Бартенева. А в 2015 году внедрена система автоматизированной книговыдачи на основе RFID–технологий.К услугам читателей универсальный фонд – более 54 000 экземпляров. Ежегодно здесь обслуживают более 5 000 читателей и выдают им около 110 000 документов. Основные направления работы: литературоведение, краеведение, поддержка местной литературы, сохранение памяти о П. И. Бартеневе.",Липецк,2017-06-28T13:40:36Z,2023-05-29T11:01:55Z,09:00:00,19:00:00,09:00:00,19:00:00,09:00:00,19:00:00,09:00:00,19:00:00,,,,,09:00:00,18:00:00
Центральная районная библиотека им. И. Н. Сабирова,"обл Челябинская,р-н Еманжелинский,г Еманжелинск,ул Гагарина,д 7",61.3189128381542,54.7531703198497,"Библиотека была основана в 1936 году. На 1 января 2024 года число пользователей – 10 954 человека, фонд – более 70 000 документов. После капитального ремонта и масштабной модернизации в рамках национального проекта «Культура» в 2023 году библиотека стала модельной. Новое пространство в библиотеке – коворкинг-зона, где пользователи могут воспользоваться беспроводным выходом в интернет, предполагается проведение мероприятий для малых групп. Информационный киоск наполнен справочной информацией о библиотеке. Книжный фонд пополнился на 1 383 экземпляра. В основном это художественные произведения, научно-популярные, исторические книги. Гордостью библиотеки являются коллекции классики, раритетные издания – редкие книги 1907 года и миниатюрные книги. Для людей с ограниченными возможностями здоровья приобретен тифлоплеер «Соло-4», устройство для чтения говорящих книг, клавиатура Clevy с большими кнопками (беспроводная). С 2019 года библиотека работает по проекту «Славянские чтения».",Еманжелинский район,2024-02-20T09:24:49Z,2024-02-21T11:07:23Z,09:00:00,18:00:00,09:00:00,18:00:00,09:00:00,18:00:00,09:00:00,18:00:00,09:00:00,18:00:00,09:00:00,18:00:00,,
Детская библиотека им. А. П. Гайдара г. Курган,"обл Курганская,г Курган,ул Коли Мяготина,д 144",65.347397,55.446345,"Детская библиотека им. А. П. Гайдара была открыта в 1954 году по адресу: ул. К. Мяготина, 144. Здесь она расположена и в настоящее время. Библиотека им. Гайдара известна многим курганцам. За почти 70-летнюю историю своего существования в ней появились читательские династии.С 2010 года библиотека была закрыта на ремонт и не обслуживала читателей до 2021 года. В сентябре 2021 года она была вновь открыта для читателей. Сейчас в ней проходят разнообразные по формам и темам мероприятия, для детей, подростков, семей с детьми. Количество посадочных мест на мероприятиях – 25. После многолетнего перерыва библиотека активно входит в социокультурную инфраструктуру центрального микрорайона. Читатели с давних пор – дети центрального района города, большая работа велась с детскими садами. Многие годы реализовались и продолжают реализовываться программы по продвижению книги и чтения: «Земля – волшебная планета», «Академия для малышей», «Библиотека + школа», «Возрождение». В настоящее время библиотека позиционирует себя как современное культурно-просветительское и культурно-информационное комфортное, безопасное и дружелюбное пространство. Для детей по воскресеньям проводятся творческие мастер-классы и работает шахматный кружок «Диагональ» (занятия 2 раза в месяц). Организованные читательские события становятся местом продвижения традиции семейного чтения, семейного досуга вокруг книги; развития читательской культуры детей и семьи. Сейчас в библиотеке более 2 000 читателей, фонд – 14 056 экземпляров. Штат – 4 сотрудника.",Курган,2023-04-04T11:23:27Z,2023-04-05T08:47:28Z,10:00:00,18:00:00,10:00:00,18:00:00,10:00:00,18:00:00,10:00:00,18:00:00,10:00:00,17:00:00,,,10:00:00,18:00:00
Аннинская центральная библиотека им. Е. П. Ростопчиной,"обл Воронежская,р-н Аннинский,пгт Анна,ул Ленина,д 34А",40.4278421401978,51.4864410061791,"Аннинская центральная библиотека им. Е. П. Ростопчиной, развиваясь вместе с поколениями своих читателей, прошла долгий путь от народной читальни до современного центра информации и культуры. В 2018 году она отметила свой 100-летний юбилей. В 2012 году ей присвоили имя известной поэтессы ХІХ века – Евдокии Петровны Ростопчиной, творчество которой было тесно связано с аннинской землей. Книжный фонд библиотеки включает 67 000 экземпляров. Ее пользователями являются около 5 000 населения поселка Анна, в год ее посещают более 70 000 человек. Будучи открытой и общедоступной, Аннинская центральная библиотека им. Е. П. Ростопчиной оказывает бесплатные услуги широкой аудитории, стремясь соответствовать ожиданиям аннинцев.",Аннинский район,2015-08-13T08:35:44Z,2023-11-20T15:27:51Z,08:00:00,17:00:00,08:00:00,17:00:00,08:00:00,17:00:00,08:00:00,17:00:00,08:00:00,17:00:00,,,08:00:00,17:00:00
Библиотека им. А. С. Пушкина г. Новосибирска,"обл Новосибирская,г Новосибирск,ул Широкая,д 15",82.86256,54.993882,"Крупнейшая библиотека Левобережья основана в 1934 году. Имя А. С. Пушкина было присвоено в 1949 году. Библиотечный фонд насчитывает более 40 000 изданий, включает отраслевую и художественную литературу, произведения классиков и современных авторов, периодику для всех возрастов. Особенность библиотеки – зал искусств со своим фондом и регулярными мероприятиями, направленными на раскрытие талантов и развитие творческих способностей посетителей. Ежегодно библиотека становится одной из основных площадок для проведения Пушкинского дня в России. Помимо этого, проводятся познавательные мероприятия, концертные программы, встречи с творческими людьми: писателями, поэтами, музыкальными и танцевальными коллективами. В библиотеке доступен широкий спектр услуг, в том числе бесплатный интернет и Wi-Fi.",Новосибирск,2024-01-31T03:52:38Z,2024-01-31T07:21:36Z,10:00:00,19:00:00,10:00:00,19:00:00,10:00:00,19:00:00,10:00:00,19:00:00,10:00:00,19:00:00,,,11:00:00,18:00:00
Комаровская библиотека им. Ф. Ф. Павленкова,"край Пермский,р-н Кунгурский,д Гробово,ул Центральная,д 3",57.113287,57.510936,"В 1897 году была открыта изба-читальня в селе Комарово Комаровской волости. На совместные средства Кунгурского уездного Земства и русского книгоиздателя Ф. Ф. Павленкова в 1909 году учреждена народная библиотека. На протяжении многих лет библиотека являлась центром культурного досуга жителей. Она работает по экологическому и краеведческому направлениям с детьми и пенсионерами. Проводятся социально значимые акции, выставки, конкурсы, массовые мероприятия: Неделя детской книги, Декада семьи, Дни славянской письменности и культуры, Дни пожилого человека. Принимает участие в краевых акциях «Подарите радость чтения», «Исцеление чтением», во всероссийских акциях «Библионочь», по творчеству писателей. Библиотека сегодня: пользователей –85 человек;документовыдача – 7 000 книг;фонд – 2 125 экземпляров.",Кунгур,2022-03-15T09:59:11Z,2023-03-20T12:51:01Z,,,,,15:00:00,18:00:00,,,15:00:00,18:00:00,,,15:00:00,18:00:00
Уинская центральная библиотека им. Ф. Ф. Павленкова,"край Пермский,р-н Уинский,с Уинское,ул Пролетарская,д 8",56.583577,56.881124,"Уинская центральная библиотека им. Ф. Ф. Павленкова была основана в 1912 году как основная (центральная районная) на средства Флорентия Федоровича Павленкова. Фонд библиотеки насчитывает 28 318 экземпляров (книги, периодические издания, видео, CD), книги на национальных языках, книги с автографами пермских писателей и поэтов. Количество посетителей – 1 721 человек. Библиотека включает в себя отдел методической, библиографической работы и обслуживания читателей, абонемент, коворкинг-центр (читальный зал), отдел обработки, комплектования, книгохранения и использования единого фонда.В библиотеке работают: краеведческий уголок «Здесь край мой, исток мой, дорога моя»;Центр правовой информации по вопросам местного самоуправления;молодежная информационная служба;Центр экологической информации «Экониформ»;литературный киносалон;клуб любителей художественной литературы «Встреча»;«Бюро добрых услуг» (для людей с ограниченными возможностями здоровья).",Уинский район,2015-10-11T23:29:12Z,2023-06-02T13:12:25Z,09:00:00,18:00:00,09:00:00,18:00:00,09:00:00,18:00:00,09:00:00,18:00:00,09:00:00,18:00:00,10:00:00,17:00:00,,
Модельная специализированная детская библиотека № 24 им. А. С. Пушкина,"обл Ульяновская,г Ульяновск,ул Карла Маркса,д 33/2",48.38875,54.322337,"Детская библиотека № 24 – одна из старейших детских библиотек Ульяновска. Впервые она встретила своих читателей в 1946 году. Библиотека обслуживает ежегодно около 5 000 пользователей. Библиотека № 24 – это образовательный, культурный, досуговый центр микрорайона. Для посетителей работают клубы: «Игротека в библиотеке», семейная хобби-мастерская «Самоделкины», шахматный клуб, студия рисунка для детей. Специалисты библиотеки реализуют различные формы массовых мероприятий как в оффлайн-, так и в онлайн-формате: медиапрезентации, интерактивные занятия, шахматные турниры, акции, совместные мероприятия с ТОСами. В 2015 году на базе детской библиотеки № 24 открылся Виртуальный центр Всероссийского музея Александра Пушкина, а 6 июня 2016 года ей было торжественно присвоено имя Александра Сергеевича Пушкина (в рамках областного проекта «Именами славится Россия»).",Ульяновск,2022-09-20T06:36:43Z,2023-11-30T07:30:03Z,,,09:30:00,18:00:00,09:30:00,18:00:00,09:30:00,18:00:00,09:30:00,18:00:00,09:30:00,18:00:00,09:30:00,18:00:00
Библиотека им. Н. К. Крупской г. Новосибирска,"обл Новосибирская,г Новосибирск,ул Максима Горького,д 104",82.931497,55.027913,"Библиотека работает с 1923 года как детская библиотека № 49. В 1933 году ей было присвоено имя Надежды Константиновны Крупской. В 2017 году учреждение стало структурным подразделением Централизованной библиотечной системы Центрального округа по Железнодорожному, Заельцовскому и Центральному районам Новосибирска. Сегодня в библиотеке свыше 47 000 книг и 4 000 пользователей. Основное направление ее работы – нравственно-эстетическое воспитание читателей. Именно поэтому на базе библиотеки действует проект «Территория увлечений», направленный на эстетическое и творческое развитие личности маленьких читателей через книгу.В библиотеке также работает несколько кружков: театральный кружок «NB.Дети» для детей 7–14 лет, участники которого приобретают навыки актерского мастерства, изучают основы ораторского искусства, воспитывают культуру речи, учатся правильно создавать интонационный строй, выстраивать диалогическую речь, и шахматный кружок «Шах и мат» для детей 7–14 лет.",Новосибирск,2024-01-15T09:39:23Z,2024-02-14T13:27:06Z,10:00:00,18:00:00,10:00:00,18:00:00,10:00:00,18:00:00,10:00:00,18:00:00,10:00:00,18:00:00,10:00:00,18:00:00,,
Детская библиотека с. им. Полины Осипенко,"край Хабаровский,р-н Имени Полины Осипенко,с им П.Осипенко,ул Амгуньская,д 82",136.496245908177,52.4220832097087,"В библиотеке регистрируются и обслуживаются 250 человек ежегодно. Фонд насчитывает 6 227 экземпляров книг и периодических изданий. В детской библиотеке регулярно проводятся тематические мероприятия, беседы, книжные выставки и обзоры новинок. Действуют 2 кружковых объединения – «Игротека» и «В гостях у книжки». В «Игротеке» школьники с удовольствием занимаются коллективными настольными играми. «В гостях у книжки» – новая форма работы – громкие чтения, при которой и дети, и взрослые вместе читают вслух понравившиеся книги. В библиотеке имеется кинопроектор – ребята часто просматривают информационные и патриотические ролики, по желанию смотрят мультфильмы. Также организовано место для детей, где они после школы могут делать уроки, а библиотекарь всегда ребятам в этом помогает. Детская библиотека тесно сотрудничает с учреждениями села: школой, Центром внешкольной работы, детским садом, Домом культуры. Проводятся совместные мероприятия. Дети посещают библиотеку не только самостоятельно, но и коллективно, целыми классами.",Район имени Полины Осипенко,2023-12-28T00:22:40Z,2023-12-28T05:38:39Z,09:00:00,17:15:00,09:00:00,17:15:00,09:00:00,17:15:00,09:00:00,17:15:00,09:00:00,17:00:00,,,,
Библиотека-филиал № 22 им. Е. А. Баратынского,"обл Тамбовская,г Тамбов,ул Мичуринская,д 97",41.4321148395538,52.7415629145542,"Свою деятельность библиотека начала в 1991 году в рабочем общежитии хлебозавода №5. В 2000 году библиотеке решением городской Думы было присвоено имя Е.А. Боратынского. Свою работу библиотека строит по принципу: все в библиотеке – для читателя; ему должно быть комфортно, здесь он должен получить всю необходимую информацию, а также может приятно провести свой досуг. Приоритетным направлением работы является пропаганда здорового образа жизни, популяризация книг по физической культуре и спорту. Фонд библиотеки составляет более 26 000 единиц. Для читателей предоставляется доступ в интернет и услуги ксерокопирования. В год проводится около 200 массовых мероприятий: встречи с интересными людьми города, вечера отдыха, музыкальные гостиные, лектории, праздники и многое другое.",Тамбов,2016-09-08T12:12:34Z,2023-03-01T13:39:02Z,10:00:00,18:00:00,10:00:00,18:00:00,10:00:00,18:00:00,10:00:00,18:00:00,10:00:00,18:00:00,09:00:00,17:00:00,,
