id,registration,name,category,сultural_property,height,width,depth,preservation,description
10926,2016-06-14T09:46:14Z,Ящик с диапозитивами,,,,,,,
3335,2016-06-14T09:44:50Z,Достойно есть (название изначальное); Богородица Достойно есть  в четырех образах (название придуманное)    Автор: Аноним (иконописец)    Школа / Место издания: Россия    Период оригинала: 20 век,,,80,90,,,"Размеры: В. 80, Ш. 90 (приблизительно) / В. 90, Ш. 80 (приблизительно)    Ссылка на каталоги / инвентари: В источнике: роспись (?)"
12706,2016-06-14T09:45:59Z,Фигурка кошки,,,16.8,,,,Размеры: В. 16.8
7725,2016-06-14T09:45:26Z,Святой (название употребляемое)    Автор: Аноним (иконописец)    Школа / Место издания: Россия ?,ИКОНА,,20,30,,,"Стиль: Дерево поделочное    Размеры: В. 20, Ш. 30 (доска) / В. 30, Ш. 20 (доска)    Ссылка на каталоги / инвентари: В источнике не указаны имя Святого, иконография, датировка, требуется уточнение."
16682,2016-06-14T09:46:31Z,Хлыст  с металлическим навершием    Период оригинала: 19 век,,,,,,,Инвентарный номер: КП 1226/ОД 463
3576,2016-06-14T09:44:53Z,Неопалимая купина (название изначальное); Богоматерь Неопалимая Купина  (название употребляемое)    Автор: Аноним (иконописец)    Школа / Место издания: Россия    Период оригинала: 19 век,ИКОНА,,30,40,,,"Размеры: В. 30, Ш. 40 (приблизительно) / В. 40, Ш. 30 (приблизительно)"
9032,2016-06-14T09:45:34Z,Нож    Автор: Неизвестный мастер,,,,,,,Инвентарный номер: Инв. №38. Старый инв. №1168
11404,2016-06-14T09:45:50Z,Ножницы,,,0.125,,,,Размеры: Дл. 0.125
2440,2016-06-14T09:44:39Z,"Мечты (название придуманное)    Автор: Шамурзаев Шамиль Алиевич (художник)    Школа / Место издания: Россия, Северный Кавказ    Период оригинала: середина 20 век; 2 половина 20 век",ЖИВОПИСЬ,,91,98,,,"Размеры: В. 91, Ш. 98 (приблизительно, без обрамления)    Ссылка на каталоги / инвентари: ЧГОМ: № 540 (535 п.ф.)"
11154,2016-06-14T09:46:15Z,Кисть,,,,,,,
18564,2016-06-14T09:46:45Z,Нож с треугольным клинком в ножнах,ОРУЖИЕ ХОЛОДНОЕ,,,,,,"Стиль: драпировка    Размеры: общая длина ножа - 485 мм, длина клинка - 285 мм, ширина клинка - 46,2 мм, длина ножен - 300 мм, общая длина ножа в ножнах - 504 мм."
17173,2016-06-14T09:46:21Z,"Царские врата. Благовещение, евангелисты    Школа / Место издания: Центральная Россия (тверские земли?)    Период оригинала: 2 половина, 15 век, 1 половина, 16 век",ИКОНА,,148,37.2,,,"Размеры: В. 148.0, Ш. 37.2"
9769,2016-06-14T09:45:36Z,Коробочка,,,,,,,Инвентарный номер: Инв. № 1035
10718,2016-06-14T09:45:49Z,Распятие,,,17,34,,,"Размеры: В. 17.0, Ш. 34.0"
18455,2016-06-14T09:46:41Z,"Спас Нерукотворный (название придуманное); Нерукотворный образ Христа (название изначальное)    Автор: Аноним    Школа / Место издания: Россия    Период оригинала: 17 век, 18 век, 19 век, 20 век (?)",ИКОНА,,29.5,22.5,,,"Размеры: В. 29.5, Ш. 22.5"
15671,2016-06-14T09:46:27Z,Тень учителя    Автор: Рерих Николай Константинович,ИКОНА,,153,92,,,"Размеры: В.92, Дл.153 см"
12038,2016-06-14T09:45:55Z,Безделушка в виде животных,,,,,,,
15142,2016-06-14T09:46:18Z,"Блюдце от  чашки из сервиза ""Плодородная Мичурина""    Автор: ф. Яковлева С.Е., р. Ефимова А.М.    Период оригинала: середина, 20 век",,,15.7,2.5,,,"Стиль: Роспись подглазурная и надглазурная полихромная.    Размеры: В. 2.5, Д. 15.7    Ссылка на каталоги / инвентари: МЗ-С 1403 б. Отсутствует по неустановленным причинам. Объяснительная записка бывшего директора музея ЛФЗ Н.С. Петровой"
13030,2016-06-14T09:46:02Z,Письмо,,,,,,,
19849,2018-11-07T08:56:15Z,"Фото ""Лесостепной ландшафт"" 1988г. 1шт., ч/б фото бумага, 18.4х23.8см., инв№ 44",АРХИВНЫЕ ДОКУМЕНТЫ,Объект является культурной ценностью,,,,хорошая,УПМ 44
559,2016-06-14T09:44:26Z,Распятие Иисуса Христа (название изначальное)    Автор: Аноним (мастер)    Школа / Место издания: Россия    Аноним (литейщик),,,27,14,,,"Размеры: В. 27, Ш. 14, Т. 1.5 (предельные)    Ссылка на каталоги / инвентари: Фото: может относиться к Элементам 1,3,4.  В источнике не содержатся сведения о техниках."
9373,2016-06-14T09:45:40Z,"Икона, имеющая двустороннее изображение    Автор: Неизвестный художник",,,,60,,,"Размеры: B. 78, Ш. 60    Инвентарный номер: Инв. №24. Старый инв. № 317"
12678,2016-06-14T09:45:59Z,Фотография,,,35.5,25.5,,,"Размеры: В. 35.5, Ш. 25.5"
5107,2016-06-14T09:45:04Z,Изголодался (название придуманное)    Автор: Репин Илья Ефимович (художник)    Школа / Место издания: Россия    Период оригинала: 2 половина 19 век ?; 1 половина 20 век ?,РИСУНОК,,41,47.2,,,"Стиль: Карандаш итальянский; Картон: Коричневый    Размеры: В. 41, Ш. 47.2 (картон ?)"
20267,2018-12-05T14:13:35Z,"МОКМ КП-106/48 Образец древесной породы с повреждениями, нанесенными вредителями леса. Дерево, размер не зафиксирован. Поступление 1966 г.",ОБРАЗЦЫ ФЛОРЫ И ФАУНЫ,Объект является культурной ценностью,,,,Не зафиксировано,Не зафиксировано
211,2016-06-14T09:44:16Z,"Вступление 4-го корпуса на Турецкий берег (название записано ?);  Вступление четвертого корпуса на турецкий берег (название записано ?)    Автор: Соколов П. (?); Соколов Петр Петрович (художник, с оригинала ?); Соколов Павел (литограф)    Школа / Место издания: Россия    Период оригинала: 4 четверть 19 век; 1 четверть 20 век",ОТТИСК,,,,,,Стиль: Другая техника: фотолитография    Ссылка на каталоги / инвентари: ЧИХМ: № 82
7693,2016-06-14T09:45:27Z,Богоматерь Словенская (название придуманное); Славянская Божья Матерь (название изменяемое)    Автор: Аноним (иконописец); Аноним (мастер)    Школа / Место издания: Россия,ИКОНА,,,,,,"Стиль: С басмой ?/ С окладом/ризой ?/  Другое ?: Бронза (отделка)    Ссылка на каталоги / инвентари: В источнике не указана датировка, материал, техника, требуется уточнение."
9743,2016-06-14T09:45:36Z,Чашка,,,,,,,Инвентарный номер: Инв. № 311
2923,2016-06-14T09:44:47Z,"Господь Вседержитель (название употребляемое); Иисус Христос Вседержитель (название изначальное); Спас Вседержитель (название придуманное)    В русском оригинале (переводе): Пантократор (греческий, название изначальное)    Автор: Аноним (иконописец)    Школа / Место издания: Россия ?",ИКОНА,,17,14.6,,,"Стиль: Латунь?/ Медь ?    Размеры: В. 17, Ш. 14.6 (приблизительно)    Ссылка на каталоги / инвентари: В источнике не указана техника, требуется запрос."
21004,2019-03-11T07:58:34Z,"Рельеф 59х59см, масса для моделирования, оргалит, световая начинка. 2014г. Автор: Костриковы Сергей и Татьяна",РАЗНОЕ,Объект является культурной ценностью,59,59,,,
10435,2016-06-14T09:45:47Z,Подсумок,,,,,,,"Размеры: 0,17 х 0,09, Дл. ремня 0,93"
16634,2016-06-14T09:46:31Z,Иллюстрированное описание перемен. Вып. 3 за 1883 г.    Школа / Место издания: Санкт - Питербург    Период оригинала: 2 половина 19 век,,,,,,,Стиль: Хромолитография    Инвентарный номер: Эи 1501
15591,2016-06-14T09:46:21Z,Пагоны контр - адмиральские,,,16,6,,,"Размеры: Дл. 16, Ш. 6 см    Инвентарный номер: В-12567"
16384,2016-06-14T09:46:29Z,Статуэтка - Электромонтер    Автор: Попов К.    Период оригинала: 20-е годы 20 века,,,16.5,10,,,"Стиль: Глазурь краски.    Размеры: В.16.5, Ш.10 см    Инвентарный номер: КП-436"
21139,2019-03-14T13:08:06Z,"МОКМ КП-2241/383 Предмет из археологической коллекции Липовского В.С., собранной учащимися Палаткинской школы. Поступление 1956 г.",РАЗНОЕ,Объект является культурной ценностью,,,,Не зафиксировано,Не зафиксировано
23190,2023-03-13T11:37:49Z,"Монета боспорская. Митридат III. 38-45 гг. Боспорское царство. Медь, чеканка. Диаметр - 22 мм. РЯМЗ КП-9207 Н-3942 ГК-37806345",,Объект является культурной ценностью,,,,"окисление, загрязнение, потертость.","ATOV; BA, на обороте: B."
14395,2016-06-14T09:46:11Z,Кн. Георгий Александрович,,,16,10,,,"Размеры: В. 16.0, Ш. 10.0"
4664,2016-06-14T09:45:01Z,"Вход господень в Иерусалим (название записано; русский; лицевая сторона, верхнее поле); Вход Христа в Иерусалим (название изначальное)    Автор: Аноним (иконописец)    Школа / Место издания: Россия    Период оригинала: 1 половина 19 век",ИКОНА,,63.5,50.8,,,"Стиль: Дерево: 2 шпонки    Размеры: В. 63.5, Ш. 50.8 (доска)    Характер подписи: см. название"
18037,2016-06-14T09:46:36Z,Орден отечественной Войны II степени,,,,,,,Инвентарный номер: № 4289474
9912,2016-06-14T09:45:37Z,Чашка,,,,,,,Инвентарный номер: Инв. № 86
22812,2021-04-28T13:05:42Z,"Монета. 5 копеек 1879 год Медь. Чеканка. Размер: диаметр 3,2 см. № по книге поступлений: КП-1000 № по инвентарной книге: Н-94 № по ГК: 6665073",МОНЕТА / МЕДАЛЬ,Объект является культурной ценностью,,,,Загрязнения,НЕТ
908,2016-06-14T09:44:26Z,"Головоногий молюск (название употребляемое); Аммонит (название изначальное)    В русском оригинале (переводе): Australiceras (латинский, название придуманное)",,,4,,,,Размеры: Д. 4 ? (предельные)
21761,2020-03-16T12:46:17Z,"Монета. 20 копеек. 1873 г. Серебро. Чеканка. Размер: диаметр 2,2 см. № по книге поступлений: ТМ КП-1724/4 № по книге спецучёта: ДМ-96 № по ГК: 14164159",ПРЕДМЕТЫ НУМИЗМАТИКИ И БОНИСТИКИ,Объект является культурной ценностью,,,,"Отслоение на аверсе, деформация, патина, царапина на реверсе",нет
23036,2023-03-13T10:38:26Z,"ММ ОФ-29386/1 Фрагменты деисусного сокладня. «Фрагмент ""Богоматерь из Деисуса""». XIX в. Бронза, литье, эмаль",,Объект является культурной ценностью,,,,Потемнение,ММ ОФ-29386/1
4017,2016-06-14T09:44:54Z,"Иисус Христос Вседержитель (название изначальное); Спас Вседержитель (название придуманное)    В русском оригинале (переводе): Пантократор (греческий, название изначальное)    Автор: Аноним (иконописец)    Школа / Место издания: Россия",,,50,80,,,"Стиль: Дерево ?    Размеры: В. 50, Ш. 80 (приблизительно) / В. 80, Ш. 50 (приблизительно)"
2714,2016-06-14T09:44:36Z,"Парабеллум (название модели)    В русском оригинале (переводе): Парабеллум (название модели, название записано ?, латинский)    Автор: Люгер Георг (конструктор); Борхардт ? (система)    Школа / Место издания: Германия (система)    Дойче Ваффенунд Муниционс фабрикен (фирма оружейная)    Период оригинала: 1 половина 20 век",ОРУЖИЕ ОГНЕСТРЕЛЬНОЕ,,22.3,,,,"Размеры: К. 9 мм, Дл. 22.3, Дл. 10. 2 (ствол), Об. 8 зарядный / К. 7.65 мм, Дл. 9.8 (ствол),    Ссылка на каталоги / инвентари: ОРУЖИЕ ВЕРМАХТА: сс. 17 - 20    Ссылка на каталоги / инвентари: Состояние: выведено из боевого.  От редактора: название имеет значение девиза ( ""Готовься к войне"" ), телеграфный адрес фирмы ДВМ; иногда этот пистолет именуют ""люгером"", официальное название ""Пистолет 08"" (Р-08).  Последние метрические данные для пистолетов, выпускавшихся после 1918 и по 1934."
9735,2016-06-14T09:45:36Z,Чайница,,,12.5,,,,"Размеры: В. 12,5 см    Инвентарный номер: Инв. № 56 Бокалы"
15309,2016-06-14T09:46:28Z,"Книга ""Научные основы физического воспитания""    Автор: Г. Дёмени",,,,,,,Ссылка на каталоги / инвентари: перевод с французского под ред. приватдоцента В.Е.Игнатьева
15007,2016-06-14T09:46:18Z,Царь Салтан    Автор: Сперанский    Школа / Место издания: Россия Палех,,,17,10,,,"Размеры: В. 10; Дл. 17    Характер подписи: Сперанский, с. Палех и год создания    Ссылка на каталоги / инвентари: На внутренней стороне крышки имелся инвентарный номер фонда оригиналов училища. Практически все работы имели механические повреждения, трещины, царапины, сколы. Точного описания повреждений работ не имели.    Инвентарный номер: № 328"
4919,2016-06-14T09:45:01Z,"В память строительства русского флота в 1696 году  (название изначальное); На начатие флота (название старое); На заведение флота в 1696 году (название употребляемое); В память учреждения флота в России (название последнее)    Автор: Ломоносов Михаил Васильевич (проект, аверс); Климов Василий (медальер, резчик, с оригинала)    Школа / Место издания: Россия    Монетный двор    Период оригинала: 19 век",,,,,,,Ссылка на каталоги / инвентари: Фото: см. Источники.  Ср. с Предметами 2.2. и 2.3.
13408,2016-06-14T09:46:04Z,Датский король Христиан IX в молодости,,,17.5,22,,,"Размеры: В. 17.5, Ш. 22.0"
12915,2016-06-14T09:46:01Z,Блюдце,,,15.5,23.5,,,"Размеры: В. 15.5, Ш. 23.5"
9582,2016-06-14T09:45:41Z,Шекспир    Автор: Неизвестный мастер,,,,,,,Размеры: В. - 40    Инвентарный номер: Инв. №56. Старый инв. №55
5225,2016-06-14T09:44:56Z,"Святые Георгий Победоносец, Вонифатий, Гурий (название придуманное); Святые Гурий, Самон и Авива (название предполагаемое)    Автор: Аноним (иконописец)    Школа / Место издания: Россия",,,25,40,,,"Стиль: Дерево поделочное    Размеры: В. 25, Ш. 40 (приблизительно) / В. 40, Ш. 25 (приблизительно)"
10494,2016-06-14T09:45:47Z,Тарелка,,,0.27,,,,"Размеры: Д. 0,27"
13090,2016-06-14T09:46:02Z,Поздравительная карточка,,,,,,,
14950,2016-06-14T09:46:17Z,"Раннее утро на море    Автор: Айвазовский Иван Константинович    Период оригинала: 19 век, 3 четверть",ЖИВОПИСЬ,,30.5,39.5,,,"Размеры: В. 39.5, Д. 30.5    Характер подписи: ""Айвазовский 79.""    Ссылка на каталоги / инвентари: Учетный номер КП -349/Ж 154, Картина поступила в СИХМ из I Московского Пролетарского музея 12 июля 1923 г."
9536,2016-06-14T09:45:41Z,Икона «Распятие»    Автор: Неизвестный художник,,,,68,,,"Размеры: B. 87, Ш. 68    Инвентарный номер: Инв. №27. Старый инв. № 265"
840,2016-06-14T09:44:22Z,"Игра (название придуманное)    Автор: Щедровский Игнатий Степанович (художник, литограф)    Школа / Место издания: Россия    Период оригинала: 2 четверть 19 век",ОТТИСК,,29.5,34,,,"Стиль: Литография с подсветкой.    Размеры: В. 29.5, Ш. 34 (лист)    Ссылка на каталоги / инвентари: Фото: для Предметов 2. и 5. - два из предполагаемых произведений, Петербургские сцены, см.  ССылку."
12623,2016-06-14T09:45:59Z,Сергий Радонежский.Образ,,,19,26.5,,,"Размеры: В. 19.0, Ш. 26.5"
3351,2016-06-14T09:44:50Z,Богоявление (название изначальное); Крещение Господне (название старое); Крещение Иисуса Христа (название употребляемое)    Автор: Аноним (иконописец)    Школа / Место издания: Россия    Период оригинала: 2 половина 19 век,,,69,90,,,"Размеры: В. 69, Ш. 90 (доска)"
2820,2016-06-14T09:44:45Z,Сомнение Святого Фомы (название употребляемое); Уверение Апостола Фомы (название изначальное)    Автор: Аноним (художник)    Школа / Место издания: Россия    Период оригинала: 19 век ?,ИКОНА,,33,94,,,"Стиль: Масло ?    Размеры: В. 33, Ш. 94 (диптих, в обрамлении ?)    Ссылка на каталоги / инвентари: Фото: № 2, № 1-диптих."
16790,2016-06-14T09:46:32Z,"Манифест о крестьянской реформе., Приложение к кн. Journal de St. P., № 54    Автор: Тютчев Ф.И. перевод с французского",,,,,,,"Инвентарный номер: КП-4136, БТА 391"
23300,2023-03-13T11:52:52Z,"ОБРАЗОК. Богоматерь Козельщанская. XIX в. Российская империя. Медь, литьё. 80х65. РЯМЗ КП-10849 М-382 ГК-36781679",,Объект является культурной ценностью,,,,"потертость, потемнение, царапины.",Надписи: МР ФУ; IИС ХРС; ОБРКОЗЕЛЬЩАНСКОЙ БМ.
8161,2016-06-14T09:45:30Z,Юноша (название придуманное)    Автор: Сафронов Александр Николаевич (скульптор)    Школа / Место издания: Россия    Период оригинала: 3 четверть 20 век,,,,,,,"Ссылка на каталоги / инвентари: ЧГОМ:  не значится; ХУДОЖНИКИ ЧЕЧЕНО-ИНГУШЕТИИ: с. 17, фото (Предметы 2., 3., 4)"
12204,2016-06-14T09:45:56Z,Шкатулка,,,35,21,18,,"Размеры: Дл. 35.0, Ш. 21.0, В. 18.0"
9155,2016-06-14T09:45:35Z,Портрет военного    Автор: Неизвестный художник,ЖИВОПИСЬ,,,52,,,"Размеры: B. 69, Ш. 52    Инвентарный номер: Старый инв. №457 по ИК ВКМ"
16755,2016-06-14T09:46:35Z,"Свод законов Российской Империи Т.12,ч.2",,,,,,,"Инвентарный номер: КП-2700/6621, МБ 2"
1311,2016-06-14T09:44:34Z,"Воин (название употребляемое)    Автор: Голов Виктор Иванович (художник)    Школа / Место издания: Россия, Палех    Художественно-производственные мастерские Палехского отделения Худфонда РСФСР    Период оригинала: 20 век",ЖИВОПИСЬ,,12,10,,,"Размеры: В. 12, Ш. 10 (пластинка) / В. 10, Ш. 12 (пластинка)    Характер подписи: 67 ?"
19390,2018-08-22T06:57:38Z,"Кустодия  Автор: Франц Жаннер  Материал: медь  Высота - 29,1 см   Диаметр - 10,9 см.  В центре монограмма IHS, наверху изображен терновый венок",РЕЛИГИОЗНЫЙ ПРЕДМЕТ,Объект является культурной ценностью,29.1,,,,В центре монограмма IHS
7373,2016-06-14T09:45:23Z,Воскресение Христово с сошествием во ад и праздники (название употребляемое)    Автор: Аноним (иконописец)    Школа / Место издания: Россия ?    Период оригинала: 19 век,,,34,30,,,"Стиль: Дерево ?    Размеры: В. 34, Ш. 30 (доска)"
14188,2016-06-14T09:46:09Z,"Принцесса Луиза, принцесса Виктория и принцесса Мод",,,15,20,,,"Размеры: В. 15.0, Ш. 20.0 рамка: В. 20.5, Ш. 28.5"
10500,2016-06-14T09:45:48Z,Пейзаж    Автор: Боголюбов А.П.,,,18.5,25,,,"Размеры: В. 18.5, Ш. 25.0"
