id,registration,name,category,сultural_property,height,width,depth,preservation,description
5287,2016-06-14T09:45:07Z,"Казанская Богородица (название старое); Богоматерь Казанская (название придуманное)    Автор: Аноним (иконописец); Аноним (мастер, ювелир)    Школа / Место издания: Россия    Период оригинала: 19 век",ИКОНА,,30,45,,,"Стиль: Другое: акварель ?; С окладом: Другое - металл (?)    Размеры: В. 30, Ш. 45 (в киоте ?) / В. 45, Ш. 30 (в киоте ?)    Характер подписи: [Казанская Божия Матерь] (?)"
6712,2016-06-14T09:45:14Z,В ознаменование 100-летия со дня рождения В.И.Ленина (название записано; русский; оборотная сторона)    Период оригинала: 3 четверть 20 век,,,32,,,,"Размеры: Д. 32 мм    Характер подписи: 1870 - 1970 ( чекан); За доблестный труд (О. чекан)    Ссылка на каталоги / инвентари: СОВЕТСКИЕ НАГРАДЫ / 1996: с. 9, № 4.1., № 4.2.; ОРДЕНА и МЕДАЛИ СССР : сс. 192-193; ОРДЕНА И МЕДАЛИ СССР / 1983    Ссылка на каталоги / инвентари: Фото: реверс см. верхнее изображение."
15971,2016-06-14T09:46:24Z,Плакат    Автор: В.В. Маяковский,,,41.5,63,,,"Стиль: Трафаретный оттиск 4 кадра+1    Размеры: В.41.5, Ш.63; В.40, Ш.62; В.40.5, Ш.62; В.40, Ш.63; В.21.5, Ш.69 см    Инвентарный номер: И-1082"
11593,2016-06-14T09:45:52Z,Четыре гребенки,,,,,,,
23084,2023-03-13T11:20:29Z,Бурка периода Гражданской войны.,,Объект является культурной ценностью,,,,Удовлетворительное,Отсутствуют
588,2016-06-14T09:44:23Z,Сретение (название изначальное) ; Принесение Христа во храм (название придуманное)    Автор: Аноним (список)    Школа / Место издания: Россия    Период оригинала: 19 век,ИКОНА,,71,57,,,"Стиль: Без оклада/ризы/басмы ?; Темпера?    Размеры: В. 71, Ш. 57 (доска)    Ссылка на каталоги / инвентари: В источнике не содержатся данные о технике, материалах, иконографии и др."
20268,2018-12-05T14:13:35Z,"МОКМ КП-106/50 Образец древесной породы с повреждениями, нанесенными вредителями леса. Дерево, размер не зафиксирован. Поступление 1966 г.",ОБРАЗЦЫ ФЛОРЫ И ФАУНЫ,Объект является культурной ценностью,,,,Не зафиксировано,Не зафиксировано
22085,2020-08-27T14:53:03Z,"ШКМ КП-1251/18. Номер по ГК 14793765. Монета Название: ""15 копеек"". подлинник Датировка: 1955 Место создания: СССР Материал: металл Техника: чеканка Размеры: Д-19.6мм.",ПРЕДМЕТЫ НУМИЗМАТИКИ И БОНИСТИКИ,Объект является культурной ценностью,,,,"Потерта, загрязнена",нет
4861,2016-06-14T09:45:03Z,"Сошествие во ад / Воскресение Христово (название двойное, название изначальное); Воскресение Христово (название употребляемое)    Автор: Аноним (иконописец)    Школа / Место издания: Россия ?",,,,,,,
13178,2016-06-14T09:46:03Z,Поздравительная карточка,,,,,,,
21373,2019-03-20T09:33:07Z,"МОКМ КП-2672 Морская раковина. Polunices. Минеральное вещество, размер не зафиксирован. Поступление 1969 г.",РАЗНОЕ,Объект является культурной ценностью,,,,Не зафиксировано,Не зафиксировано
3313,2016-06-14T09:44:48Z,Божья Матерь (название старое); Богоматерь (название употребляемое)    Автор: Аноним (иконописец)    Школа / Место издания: Россия    Период оригинала: 19 век,,,20,30,,,"Стиль: Дерево ?    Размеры: В. 20, Ш. 30 (приблизительно) / В. 30, Ш. 20 (приблизительно)"
17743,2016-06-14T09:46:38Z,"""Ленинское знамя"" №183 от 17.11.1972    Период оригинала: 20 век, 3 четверть",,,,,,,Инвентарный номер: КП-3745
19807,2018-10-25T11:46:06Z,"Створка складня. Медь, литьё, эмаль. 15х9. Кон. 18 – нач. 19 вв. ЯКМ КП 211",РЕЛИГИОЗНЫЙ ПРЕДМЕТ,Объект является культурной ценностью,,,,загрязнения,"Надпись ""ЯКМ 211"""
6309,2016-06-14T09:45:17Z,Всевидящее око (название употребляемое); Всевидящее Око Божие (название изначальное)    Автор: Аноним (иконописец)    Школа / Место издания: Россия ?,,,,,,,"Стиль: Дерево ?    Ссылка на каталоги / инвентари: В источнике не указаны техника, материал, размеры и иконография, требуется уточнение."
15762,2016-06-14T09:46:23Z,Спас Нерукотворный,ИКОНА,,108,80,,,"Стиль: Икона в серебристом окладе    Размеры: В.108, Ш.80 см    Ссылка на каталоги / инвентари: Ярославская обл., Некрасовский  район, с. Никольское, Храм Святителя Николая. Похищение произошло 24.04.2007 г.    Инвентарный номер: 96"
13346,2016-06-14T09:46:04Z,Ламбрекен,,,1.5,0.75,,,"Размеры: В. 1.50, Ш. 0.75"
20910,2019-03-06T07:01:33Z,"МОКМ КП-2712/5 Трубка курительная с надписью. Из коллекции этнографического подъёмного материала из с. Лорино. Материал, размер не зафиксированы. Поступление 1969 г.",РАЗНОЕ,Объект является культурной ценностью,,,,Не зафиксировано,Не зафиксировано
22195,2020-09-03T15:48:28Z,"ШКМ КП-1255/82. Номер по ГК 14797608. Монета Название: ""10 пфеннигов"". Датировка: 1898 Место создания: Германия Материал: металл Техника: чеканка Размеры: Д-21мм",ПРЕДМЕТЫ НУМИЗМАТИКИ И БОНИСТИКИ,Объект является культурной ценностью,,,,Потерта,нет
16185,2016-06-14T09:46:26Z,Крест,,,,,,,Инвентарный номер: ДИМЭ - 22
13461,2016-06-14T09:46:04Z,Княжна Ольга Александровна в детстве,,,10.2,16,,,"Размеры: В. 10.2, Ш. 16.0"
97,2016-06-14T09:44:16Z,"Бретонская ферма (название изначальное); Пейзаж с темными домами (название придуманное)    Автор: Бенуа Александр Николаевич (художник) ?; Бенуа Альберт Николаевич (художник) ?    Школа / Место издания: Россия, Франция    Период оригинала: 4 четверть 19 век; 1 четверть 20 век",ЖИВОПИСЬ,,,,,,Ссылка на каталоги / инвентари: ЧИХМ: № 16
7201,2016-06-14T09:45:23Z,"Юрий Константинович Терапиано (название рукописное; лицевая сторона)    Автор: Рубисова Елена Федоровна (художник)    Школа / Место издания: Россия, Франция    Период оригинала: 2 четверть 20 век",РИСУНОК,,46.5,37.2,,,"Размеры: В. 46.5, Ш. 37.2 (в свету ?, лист ?)    Характер подписи: Е. Рубисова    Характер подписи: Терапиано Ю.К.; Герра Р.Ю.; Ганьи    Характер подписи: 1936 (П.); Дорогому Ренэ Юлиановичу Герра / на память о праздновании / дня рождения Ю.К.Терапиано / в Ганьи 28/Х/1975  / Е.Рубисова (рука автора, справа внизу)    Ссылка на каталоги / инвентари: Герра Р. / ГТГ: с. 134, с. 46 - кат. 257"
7594,2016-06-14T09:45:25Z,Богоматерь Казанская (название придуманное); Казанская Божья Матерь (название старое)    Автор: Аноним (иконописец)    Школа / Место издания: Россия,ИКОНА,,,,,,"Стиль: С венцами: венцом, Серебро ?/ Белая жесть ?/ Другое ?, Белый металл    Ссылка на каталоги / инвентари: В источнике не указаны датировка, материал и техника, размеры, требуется уточнение.  В источнике: рисунок в верхней части (?)."
4477,2016-06-14T09:44:59Z,Николай Угодник (название старое); Святой Николай Чудотворец (название изначальное)    Автор: Аноним (иконописец)    Школа / Место издания: Россия ?,ИКОНА,,20,25,,,"Стиль: Дерево поделочное    Размеры: В. 20, Ш. 25 (доска) / В. 25, Ш. 20 (доска)"
12698,2016-06-14T09:45:59Z,Закат на море с парусником    Автор: Айвазовский И.К.,ЖИВОПИСЬ,,8,11.1,,,"Размеры: В. 8.0, Ш. 11.1; фотография - В. 20.5, Ш. 27.5"
13482,2016-06-14T09:46:05Z,Копилка,,,8.9,7.5,21,,"Размеры: Дл. 8.9, Ш. 7.5, В. 21.0"
13496,2016-06-14T09:46:05Z,Фигурка рыбы,,,0.19,,,,Размеры: Дл. 0.19
19696,2018-09-11T14:52:17Z,"Содержание статьи Бунимовича Д. ""Новейшие советские фотоаппараты"" к сборнику статей «Воскресные чтения». СССР, г. Москва. 1952 г. На 15 листах. Бумага. Машинопись. 30,0х20,0 см. ПМ КП 29027/243",АРХИВНЫЕ ДОКУМЕНТЫ,Объект является культурной ценностью,,,,Бумага пожелтела,Нет данных
6354,2016-06-14T09:45:16Z,Богородица (название старое); Богоматерь с младенцем (название употребляемое)    Автор: Аноним (иконописец)    Школа / Место издания: Россия (народная),,,50,30,,,"Размеры: В. 50, Ш. 30 (доска, в окладе ?)    Ссылка на каталоги / инвентари: В источнике не указана иконография, техника и материал, требуется уточнение."
19530,2018-09-07T10:27:17Z,"Лампа миниатюрная МН-12-0,15. СССР. Стекло. ПМ КП 13664/85",РАЗНОЕ,Объект является культурной ценностью,,,,Без видимых повреждений,Нет данных
18944,2016-08-08T14:28:19Z,"Икона - триптих ""Пресвятая Богородица с младенцем""",ИКОНА,Объект является культурной ценностью,1.5,23,25,,
6055,2016-06-14T09:45:06Z,Рождество Христово (название изначальное)    Автор: Аноним (иконописец)    Школа / Место издания: Россия ?    Период оригинала: 2 половина 18 век,ИКОНА,,26,30.5,,,"Размеры: В. 26, Ш. 30.5 (доска) / В. 30.5, Ш. 26 (доска)    Ссылка на каталоги / инвентари: Состояние: по поверхности наблюдаются утраты красочного слоя."
5823,2016-06-14T09:44:59Z,Чревовица (название придуманное); Богоматерь Блаженно Чрево (название предполагаемое)    Автор: Аноним (иконописец)    Школа / Место издания: Россия ?,ИКОНА,,52,60,,,"Стиль: Дерево поделочное    Размеры: В. 52, Ш. 60 (доска) / В. 60, Ш. 52 (доска)"
19440,2018-09-07T06:49:54Z,"Барометр-анероид системы Гольдшмидта, карманный. Швейцария, г. Цюрих, конец 19 в. В металлическом корпусе цилиндрической формы с вращающейся крышкой, сбоку присоединены термометр и лупа. Термометр стеклянный, ртутный с пределами измерений от - 20 до 40 градусов С. Металл, стекло. Диаметр 42 мм, длина 75 мм, высота 30 мм. Фирма ""Goldschmid"" (Гольдшмидт) - изготовитель. ПМ КП 21417/1",РАЗНОЕ,Объект является культурной ценностью,,,,Без видимых повреждений,"Надписи на верхней крышке: ""N 1036"" и готическим немецким шрифтом: ""V. Goldsсhmid. Zurich"""
16492,2016-06-14T09:46:30Z,СВЯТОЙ АНТОНИО    Период оригинала: 18 век,,,77,35,,,"Размеры: В.77, Ш.35 см"
4515,2016-06-14T09:44:59Z,Богородица (название старое); Богоматерь (название употребляемое)    Автор: Аноним (ювелир)    Школа / Место издания: Россия ?,,,3,5,,,"Стиль: Золочение ? / Золото ?    Размеры: В. 3, Ш. 5 / В. 5, Ш. 3"
15180,2016-06-14T09:46:27Z,"Пулемет РПД №898    Период оригинала: середина, 20 век",,,,,,,
6073,2016-06-14T09:45:17Z,Богоматерь Троеручица (название изначальное)    Автор: Аноним (иконописец)    Школа / Место издания: Россия ?,,,,,,,"Стиль: Дерево ?    Ссылка на каталоги / инвентари: В источнике не указаны техника, материал, размеры, требуется уточнение."
12929,2016-06-14T09:46:01Z,Тетрадь,,,17.8,22.5,,,"Размеры: В. 17.8, Ш. 22.5"
3569,2016-06-14T09:44:53Z,Богородица с младенцем (название старое): Богоматерь с младенцем (название употребляемое)    Автор: Аноним (иконописец)    Школа / Место издания: Россия    Период оригинала: 19 век,ИКОНА,,23,27,,,"Размеры: В. 23, Ш. 27 (приблизительно) / В. 27, Ш. 23 (приблизительно)"
14901,2016-06-14T09:46:17Z,Знак должностной волостного заседателя на колодке с цепочкой,,,,,,,Инвентарный номер: КОМК 996
3522,2016-06-14T09:44:51Z,Святой Пантелеймон Целитель (название изначальное)    Автор: Аноним (иконописец)    Школа / Место издания: Россия,ИКОНА,,53,39,,,"Размеры: В. 53, Ш. 39 (приблизительно)"
21633,2020-03-13T08:24:57Z,"Монета. 1 полтинник. 1924 г Серебро. Чеканка. Размер: диаметр – 2,6 см. № по книге поступлений: ТМ КП-1726/6 № по книге спецучёта: ДМ-144 № по ГК: 14289395",ПРЕДМЕТЫ НУМИЗМАТИКИ И БОНИСТИКИ,Объект является культурной ценностью,,,,незначительная потертость,нет
19369,2018-05-03T08:06:52Z,"Пуговица  Россия, Тула, кон. XIX в.,  сталь, гранение  д. - 1 см  КП 21672  ПДМП 1046-бк",РАЗНОЕ,Объект является культурной ценностью,,,,,
7189,2016-06-14T09:45:21Z,Автор: Аноним (мастер)    Школа / Место издания: Россия ?    Период оригинала: середина 19 век,,,71,,,,"Стиль: Квадрат: основание    Размеры: В. 71; Об. 7 рожков    Ссылка на каталоги / инвентари: В источнике:  кронштейны спиралевидные, изогнутые, стоян в виде треножника, орнаментованного ламбрикенами и ветками.  В источнике не указаны изготовитель, наличие надписей, требуется уточнение."
10998,2016-06-14T09:46:14Z,Фотография,,,26.5,20,,,"Размеры: В. 26.5, Ш. 20.0"
169,2016-06-14T09:44:16Z,"Мясник с лотком говядины (название изначальное, название записано?); Мясник (название в переводе, французский)    В русском оригинале (переводе): [...] Boud[...] (название записано; французский)    Автор: Орловский Александр Осипович (художник, литограф)    Школа / Место издания: Польша, Россия    Период оригинала: 1 четверть 19 век; 2 четверть 19 век",ОТТИСК,,36.5,27,,,"Размеры: В. 36.5, Ш. 27 (лист ?)    Характер подписи: ? (О. чернила фиолетовые, карандаш); РМ ? ( правый нижний угол листа)    Ссылка на каталоги / инвентари: ЧИХМ: № 38    Ссылка на каталоги / инвентари: Состояние: после реставрации (1966 после)."
21643,2020-03-13T08:24:57Z,"Монета. 1 полтинник. 1924 г Серебро. Чеканка. Размер: диаметр – 2,6 см. № по книге поступлений: ТМ КП-1726/16 № по книге спецучёта: ДМ-154 № по ГК: 14289410",ПРЕДМЕТЫ НУМИЗМАТИКИ И БОНИСТИКИ,Объект является культурной ценностью,,,,полная,нет
20717,2019-01-18T12:28:19Z,МОКМ КП-1612/126 Предмет из археологической коллекции В.В. Леонтьева из Уэлена. Кость. Поступление до 1968 г.,РАЗНОЕ,Объект является культурной ценностью,,,,Не зафиксировано,Не зафиксировано
9690,2016-06-14T09:45:42Z,Блюдца,,,,,,,Инвентарный номер: Инв. № 62-72
23541,2023-09-12T12:34:40Z,"МПББ ОФ-4156 ДП-101 Подсвечник из семьи А.И. Михайловского-Данилевского. Б.м. Конец XVIII - начало XIX веков. Бронза, литьё. Высота: 24,0 см. Длина: 7,0 см. Ширина: 2,6 см.",,Объект является культурной ценностью,,,,"Царапины, мелкие выбоины.",Клейм нет.
13961,2016-06-14T09:46:08Z,Альбом фотографий,,,,,,,
7244,2016-06-14T09:45:28Z,Автор: Аноним (резчик)    Школа / Место издания: Германия    Период оригинала: 19 век,,,12,,,,"Стиль: СКУЛЬПТУРА / СТАТУЯ : Резная, Слоновая кость; Дерево: постамент    Размеры: В. 12 (без подставки / цоколя); В. 8 (постамент)    Ссылка на каталоги / инвентари: В источнике не указано, кого представляет фигурка, требуется уточнение."
11414,2016-06-14T09:45:50Z,Ваза,,,43,11.5,,,"Размеры: В. 43.0, Ш. 11.5"
8595,2016-06-14T09:45:45Z,Портрет Петра Великого    Автор: Неизвестный художник XIX века,ЖИВОПИСЬ,,,92,,,"Размеры: B. 118, Ш. 92"
21400,2019-03-21T08:56:10Z,"Позвонок туловищный плезиозавра., 1шт., h-9.5 ., д-14., инв№ 2219",ОБРАЗЦЫ ФЛОРЫ И ФАУНЫ,Объект является культурной ценностью,,,,позвонок немного разрушен с разных сторон,УПМ 2219
20316,2018-12-06T13:03:32Z,МОКМ КП-110 Почки березы. Размеры не зафиксированы. Поступление до 1955 г.,ОБРАЗЦЫ ФЛОРЫ И ФАУНЫ,Объект является культурной ценностью,,,,Не зафиксировано,Не зафиксировано
8435,2016-06-14T09:45:29Z,"Благовещение (название изначальное, название сцены); Дева Мария из Благовещения (название придуманное)    Автор: Аноним (иконописец)    Школа / Место издания: Россия    Период оригинала: 1 четверть 20 век; 2 половина 19 век",ИКОНА,,45,25,,,"Размеры: В. 45, Ш. 25 (доска); В. 48, Ш. 25 (доска)    Ссылка на каталоги / инвентари: Фото: в источнике было указано наличие фото, требуется уточнение."
23353,2023-03-13T12:01:15Z,"Монета Рима. Отацилия. 249 г. Римская империя. Серебро, чеканка. Диаметр - 22,5 мм., вес - 3,8 г. РЯМЗ КП-11881 Н-4288 СА-256 ГК-38157239",,Объект является культурной ценностью,,,,"потертость, окисление, по краям повреждения.",-
13198,2016-06-14T09:46:03Z,Кн. Александра Георгиевна,,,21.8,30.2,,,"Размеры: В. 21.8, Ш. 30.2"
7888,2016-06-14T09:45:28Z,Святой Николай Чудотворец (название изначальное)    Автор: Аноним (иконописец)    Школа / Место издания: Россия ?,ИКОНА,,27,32,,,"Стиль: Дерево поделочное    Размеры: В. 27, Ш. 32 (доска) / В. 32, Ш. 27 (доска)    Ссылка на каталоги / инвентари: В источнике не указаны датировка, требуется уточнение."
9278,2016-06-14T09:45:39Z,Беспредметная живопись    Автор: Неизвестный художник,ЖИВОПИСЬ,,,50.3,,,"Размеры: B. 70,3, Ш. 50,3    Инвентарный номер: Инв. №93. Старый инв. №814 и №1253 по ИК ВКМ"
4933,2016-06-14T09:44:44Z,В память войны с турками в 1774 году (название изначальное); Мир с Портой (название употребляемое)    Автор: Юдин Самойла Юдич (медальер) ?    Школа / Место издания: Россия    Монетный двор    Период оригинала: 3 четверть 18 век,,,25,32,38,,"Размеры: В. 38 мм, Ш. 32 мм (штемпель), Дл. 25 мм (сторона)    Характер подписи: Ю    Характер подписи: Порта / Турция    Характер подписи: ПОБЪДИ / ТЕЛЮ (О. в венке); ЗАКЛЮЧЕНЪ МИРЪ / СЪ ПОРТОЮ / 10 IЮЛЯ / 1774 Г. (О. под обрезом)    Ссылка на каталоги / инвентари: СМИРНОВ: № 277    Ссылка на каталоги / инвентари: Описание составлено по каталогу, см. Ссылку."
10990,2016-06-14T09:46:14Z,"Образ Божией Матери ""Отрада и Утешение""",,,14.2,18,,,"Размеры: В. 14.2, Ш. 18.0"
13464,2016-06-14T09:46:04Z,Портрет неизвестного мужчины,,,5,10,,,"Размеры: В. 5.0, Ш. 10.0"
15665,2016-06-14T09:46:21Z,Богоматерь Тихвинская    Период оригинала: 18 век,ИКОНА,,124,85,,,"Размеры: В.124, Ш.85 см    Инвентарный номер: ВХ 3271"
