id,registration,name,category,сultural_property,height,width,depth,preservation,description
5502,2016-06-14T09:45:07Z,"Морской пейзаж при луне (название придуманное)    Автор: Айвазовский Иван Константинович (художник, приписано, с оригинала ?); Волков ? (художник ?, копировал ?)    Школа / Место издания: Россия    Период оригинала: 3 четверть 19 век",ЖИВОПИСЬ,,64,100,,,"Размеры: В. 64, Ш. 100 (приблизительно, без обрамления ?); В. 64, Ш. 97.5 (без обрамления)    Характер подписи: Айвазовский И.К.; Волков    Характер подписи: Айвазовский /1868 (фальшивая подпись, справа внизу, красная краска); Волков / 1866 (слева внизу)    Ссылка на каталоги / инвентари: ЧГОМ: № 449  (444 п.ф.); МУЗЕЙ / ГРОЗНЫЙ: сс. 34-35    Ссылка на каталоги / инвентари: Состояние: в реставрации (1995 с)."
6093,2016-06-14T09:45:17Z,"Иисус Христос Вседержитель (название изначальное); Спас Вседержитель (название придуманное)    В русском оригинале (переводе): Пантократор (греческий, название изначальное)    Автор: Аноним (иконописец)    Школа / Место издания: Россия ?    Период оригинала: 1 четверть 19 век ?",ИКОНА,,30,20,,,"Размеры: В. 30, Ш. 20 (доска)    Характер подписи: 1825 (О.)    Ссылка на каталоги / инвентари: Состояние: плохая сохранность."
10619,2016-06-14T09:45:48Z,Щеточка,,,0.3,,,,Размеры: Дл. 0.30
10193,2016-06-14T09:45:43Z,Москва - река. Подмосковье    Автор: Налбандян Д.А.,ЖИВОПИСЬ,,,50,,,"Размеры: B. 70, Ш. 50"
6600,2016-06-14T09:45:10Z,"Сладколобзающая / Умиление (название изначальное) ; Богоматерь Умиление (название употребляемое)    В русском оригинале (переводе): Гликофилуса / Елеуса (греческий, название изначальное)    Автор: Аноним (иконописец)    Школа / Место издания: Россия ?    Период оригинала: 18 век ?",,,10,15,,,"Стиль: С окладом: Медь, Филигрань/скань (поля ?), Стекло    Размеры: В. 10, Ш. 15 (в окладе) / В. 15, Ш. 10 (в окладе)    Ссылка на каталоги / инвентари: В источнике не указаны техника живописи, оклада, материал оклада."
17826,2016-06-14T09:46:39Z,"Деньги и казначейские разменные знаки 1915-1917 г.г., 3 шт.    Период оригинала: 20 век, 1 четверть",,,,,,,"Инвентарный номер: КП-1522 КП-1523, КП-1542"
22483,2021-01-25T09:11:27Z,Монета иностранная. НВФ-16,МОНЕТА / МЕДАЛЬ,Объект является культурной ценностью,,,,"Монета сильно потерта, потемневшая",НВФ-16
1169,2016-06-14T09:44:29Z,"Тройка (название изначальное); Тройка зимняя (название употребляемое)    Автор: Зиновьев Николай Михайлович (художник)    Школа / Место издания: Россия, Палех    Художественно-производственные мастерские Палехского отделения Худфонда РСФСР    Период оригинала: середина 20 век",ЖИВОПИСЬ,,,,,,"Ссылка на каталоги / инвентари: МЕЛЕНТЬЕВ: с. 246 (фото)    Ссылка на каталоги / инвентари: Фото: см. Ссылку, нуждается в подтверждении."
5121,2016-06-14T09:45:03Z,У фронта (название придуманное)    Автор: Тихобразов Николай Иванович (художник)    Школа / Место издания: Россия    Период оригинала: 19 век,РИСУНОК,,22.3,18.3,,,"Стиль: Карандаш итальянский; Белый: белила    Размеры: В. 22.3, Ш. 18.3 (лист ?)"
5723,2016-06-14T09:45:11Z,Святой Николай Чудотворец (название изначальное)    Автор: Аноним    Школа / Место издания: Россия ?,,,25,35,,,"Стиль: Дерево ?    Размеры: В. 25, Ш. 35 (доска ?) / В. 35, Ш. 25 (доска ?)"
15391,2016-06-14T09:46:24Z,Лыжница    Автор: Бартрам Н.М.,,,23,,,,"Стиль: Папье - маше, ткань, дерево    Размеры: В. 23    Ссылка на каталоги / инвентари: Производитель НИИ игрушки"
5829,2016-06-14T09:45:05Z,"Святые Сидор, Аврамий, Игнатий, Иона, Дмитрий, Исая и Иосиф (название придуманное)    Автор: Аноним (эмальер)    Школа / Место издания: Россия",ЭМАЛЬ,,14,10.5,,,"Стиль: Живопись по эмали ?    Размеры: В. 14, Ш. 10.5 (пластинка)"
9601,2016-06-14T09:45:41Z,Ливия    Автор: Неизвестный мастер,,,,20,,,"Размеры: B. 37, Ш. 20    Инвентарный номер: Инв. №34. Старый инв.№ 8/427"
4349,2016-06-14T09:44:58Z,Портрет генерала (название придуманное)    Автор: Аноним (художник)    Школа / Место издания: Россия ?,ЖИВОПИСЬ,,100,85,,,"Стиль: Масло ?    Размеры: В. 100, Ш. 85 (без обрамления ?)    Ссылка на каталоги / инвентари: Состояние: после реставрации на месте (1961)."
1112,2016-06-14T09:44:30Z,Венера и Амур (название придуманное)    Автор: Аноним (модельщик)    Школа / Место издания: Западная Европа    Аноним (литейщик),,,,,,,"Стиль: Полая ? ; Постамент: Прямоугольник, темный Коричневый"
7830,2016-06-14T09:45:27Z,Божья Матерь (название старое); Богоматерь (название употребляемое)    Автор: Аноним (иконописец)    Школа / Место издания: Россия ?,,,,,,,"Стиль: Дерево ?    Ссылка на каталоги / инвентари: В источнике не указаны иконография, датировка, материал, техника, размеры, требуется уточнение."
11214,2016-06-14T09:46:16Z,Компас,,,104,1.5,2.7,,"Размеры: Дл. 104.0, Ш. 1.5, В. 2.7"
12486,2016-06-14T09:45:58Z,Подсвечник,,,17,16,,,"Размеры: В. 17.0, Ш. 16.0"
22594,2021-01-25T13:56:36Z,Брошюра. П.Гущин. «Тулун-частица нашей Родины». ОФ- 469,ДОКУМЕНТ / КНИГА,Объект является культурной ценностью,,,,Без видимых повреждений,ОФ-469
11040,2016-06-14T09:46:15Z,Литография,,,,,,,
9107,2016-06-14T09:45:35Z,Голова мужчин (Этюд)    Автор: Неизвестный художник,ЖИВОПИСЬ,,,71,,,"Размеры: B. 53,5, Ш. 71    Инвентарный номер: Инв. №112. Старый инв. №504 по ИК ВКМ"
14170,2016-06-14T09:46:09Z,Витрина к книжному шкафу,,,123.5,46.5,25.5,,"Размеры: Дл. 123.5, Ш. 46.5, В. 25.5"
14868,2016-06-14T09:46:17Z,"Любитель кодакист    Период оригинала: 20 век, 1 четверть",,,,,,,Инвентарный номер: ЭКМ 8786/1-13
20511,2018-12-25T11:41:03Z,"Аммонит Speetoniceras sp., 1шт., д-34 см.,инв №2407",ОБРАЗЦЫ ФЛОРЫ И ФАУНЫ,Объект является культурной ценностью,,,,"жилая камера давлена,раковина загипсована",УПМ 2407
7645,2016-06-14T09:45:25Z,"Богоматерь Казанская (название придуманное)    Автор: Аноним (мастер, ювелир)    Школа / Место издания: Россия",,,15,10,,,"Размеры: В. 15, Ш. 10 (не менее); Пр. 64 Серебро    Ссылка на каталоги / инвентари: В источнике не указаны датировка, техника, требуется уточнение."
14486,2016-06-14T09:46:12Z,Футляр,,,22,15,26,,"Размеры: Дл. 22.0, Ш. 15.0, В. 26.0"
21448,2019-09-20T06:52:20Z,"МОКМ КП-2241/400 Предмет из археологической коллекции Липовского В.С., собранной учащимися Палаткинской школы. Поступление 1956 г.",РАЗНОЕ,Объект является культурной ценностью,,,,Не зафиксировано,Не зафиксировано
19747,2018-09-12T07:08:49Z,Доклад отчетный секретаря Комитета по устройству Музея прикладных знаний Зенгера и переписка по хозяйственным вопросам. 1871-1889 гг. На 92-х листах. Рукопись. Бумага. ПМ КП 16605,ДОКУМЕНТ / КНИГА,Объект является культурной ценностью,,,,Нет данных,Нет данных
16533,2016-06-14T09:46:31Z,РАСПЯТИЕ,,,,,,,
6969,2016-06-14T09:44:44Z,Автор: Валентинов-Миллер Эрик Эдуардович (художник)    Школа / Место издания: Россия    Период оригинала: 20 век,ЖИВОПИСЬ,,46,29,,,"Размеры: В. 46, Ш. 29 (картон) / В. 46, Ш. 30 (картон)    Ссылка на каталоги / инвентари: ЧГОМ: № 131; № 212"
2340,2016-06-14T09:44:39Z,"Высохший родник (название придуманное)    Автор: Ахмаров Шамсудин Магомедович (художник)    Школа / Место издания: Россия, Северный Кавказ    Период оригинала: 4 четверть 20 век",ЖИВОПИСЬ,,69,49.5,,,"Размеры: В. 69, Ш. 49.5 (приблизительно, без обрамления)    Ссылка на каталоги / инвентари: ЧГОМ: № 64"
13190,2016-06-14T09:46:03Z,Поздравительная карточка,,,,,,,
14914,2016-06-14T09:46:17Z,"Медаль ""За оборону Сталинграда"" ""За нашу советскую Родину""    Период оригинала: 20 век",,,,,,,
11195,2016-06-14T09:46:16Z,Бумажник,,,9.5,14.8,,,"Размеры: В. 9.5, Ш. 14.8"
16263,2016-06-14T09:46:27Z,"Лампа керосиновая, круглая    Период оригинала: 19 век, 4 четверть, 20 век, 1 четверть",,,35,,,,Размеры: В. 35    Инвентарный номер: ЕКМ 6961
8948,2016-06-14T09:45:34Z,Китайское божество    Автор: Неизвестный мастер,,,13,,,,Размеры: В. 13    Инвентарный номер: Инв. №93 по ИК за 1938 г. Инв. №448 по ИК №4
7481,2016-06-14T09:45:25Z,Богородица с младенцем (название старое); Богоматерь с младенцем (название употребляемое)    Автор: Аноним (иконописец)    Школа / Место издания: Россия ?,,,30,30,,,"Стиль: Дерево ?    Размеры: В. 30, Ш. 30 (доска ?)    Ссылка на каталоги / инвентари: В источнике не указаны иконография, датировка, материал и техника, требуется уточнение."
10744,2016-06-14T09:45:49Z,Натурщица    Автор: Неизвестный художник,,,52,29,,,"Размеры: В. 52.0, Ш. 29.0"
1005,2016-06-14T09:44:28Z,Явление Аврааму трех ангелов (название изначальное); Троица Ветхозаветная (название придуманное)    Автор: Аноним (список)    Школа / Место издания: Россия    Период оригинала: 19 век,ИКОНА,,15,19,,,"Стиль: Масло ?; Медь : оправа    Размеры: В. 15, Ш. 19 (в обрамлении) ?; В. 19, Ш. 15 (в обрамлении)?"
23067,2023-03-13T10:43:03Z,ММ ОФ-27125 Барельеф. Погорелов В.М. Барельеф. «На заводе». 1930-е годы Гипс,,Объект является культурной ценностью,,,,"Многочисленные царапины, потертости, загрязнения",ММ ОФ-27125
23459,2023-04-17T11:02:29Z,"Статуэтки 3 поросенка 1- черный, 2-сиреневый, 3-желтый. h=2,5 см. КИРМ КП 997 ПИ 52",,Объект является культурной ценностью,,,,Не известно,Не известно
11885,2016-06-14T09:45:54Z,Кристалл,,,,,,,
21271,2019-03-18T14:17:58Z,"МОКМ КП-2383/7 Фотография по истории строительства Певека. Дата съемки неизвестна. Фотобумага, размер не зафиксирован. Поступление 1967 г.",АРХИВНЫЕ ДОКУМЕНТЫ,Объект является культурной ценностью,,,,Не зафиксировано,Не зафиксировано
7178,2016-06-14T09:45:21Z,"Ангел передо мной (название рукописное; оборотная сторона); Муза / Явление (название двойное, название придуманное); Видение / Автопортрет с музой (название двойное, название последнее);    Автор: Шагал Марк Захарович (художник)    Школа / Место издания: Россия, Франция    Период оригинала: 1 четверть 20 век",ЖИВОПИСЬ,,152.8,134,,,"Стиль: Холст, Лен: льняной тонкий холст; Квадрат почти    Размеры: В. 152.8, Ш. 134 (без обрамления, в свету ?); В. 157, Ш. 140 (без обрамления ?)    Характер подписи: Шагал М.; Добычин М.    Характер подписи: Ангел перед мной (О. вверху справа, рука автора ?, карандаш); М.Шагал. Пр [...] 10/XI 1921 г. (О. вверху справа); Картина М.Шагала / Свидетельствую / М.Добычин (О. вверху справа); Ангел перед мной (О. слева сбоку, перевернутая надпись, частично закрывающаяся подрамником, карандаш)    Ссылка на каталоги / инвентари: ШАГАЛ /1989: с.76 (фото), с. 304 (кат. 29); МОСКВА-ПАРИЖ/1: с. 310    Ссылка на каталоги / инвентари: Состояние: по периметру (на сгибе) старые проколы от гвоздей со следами ржавчины; следы реставрации - кромки дублированы, мелкие старые реставрационные тонировки вдоль верхнего края, другое см. Источники.  Фото: 18f532-1 из каталога ШАГАЛ /1989, см. Ссылку.  Последние размеры из каталогов, см. Ссылку."
4876,2016-06-14T09:45:00Z,От бед и страдания Богородица (название записано) ?; Богоматерь Избавление от бед страждущих (название предполагаемое),,,,,,,"Стиль: Белый: нимбы; Красный: темно-вишневый плащ / мафорий , темно-розовый плат ? Богоматери и темно-розовый гиматий на младенце;  Зеленый: хитон на младенце; Золотистый: корона ?, кайма на разных деталях одеяния Богоматери.    Характер подписи: [...] БЕДТ СТРА [?] (слева, сбоку)    Ссылка на каталоги / инвентари: Название: из Описания (см. Источники), требуется уточнение.  Надписи: подробно в Описании, см. Источники.  Описание изображений: подробно в Описании, см. Источники, требуется уточнение.   Основное описание см. Предмет 1, Элемент 0."
13134,2016-06-14T09:46:02Z,Рама,,,,,,,
12712,2016-06-14T09:45:59Z,Чашка с блюдцем,,,5,,,,"Размеры: В. 5.0, Д. блюдца 12.5"
23211,2023-03-13T11:41:24Z,"Монета Рима. Домициан. 81-96 гг. Римская империя. Медь, чеканка. Диаметр - 28 мм. РЯМЗ КП-9327 Н-3968 ГК-37806447",,Объект является культурной ценностью,,,,"сильное окисление, потертость, загрязнение.",-
316,2016-06-14T09:44:20Z,Казанская Богоматерь (название употребляемое); Богоматерь Казанская  (название придуманное)    Автор: Аноним (список)    Школа / Место издания: Россия    Период оригинала: 18 век; 19 век,ИКОНА,,12,15,,,"Размеры: В. 12, Ш. 15 (доска)?; В. 15, Ш. 12 (доска)?"
16156,2016-06-14T09:46:26Z,За охрану природы России    Период оригинала: 3 четверть 20 век,,,3,2.3,,,"Размеры: В.3, Ш.2.3 см    Инвентарный номер: ДИЭМ-219"
18256,2016-06-14T09:46:42Z,Яхель убивает Сисера (по библейским сюжетам)    Автор: Francesco Furini,ЖИВОПИСЬ,,70,50,,,"Размеры: В. 70, Ш. 50"
7870,2016-06-14T09:45:27Z,Святые года (название предполагаемое); Все Святые (название употребляемое)    Автор: Аноним (иконописец)    Школа / Место издания: Россия ?,,,25,30,,,"Стиль: Дерево ?    Размеры: В. 25, Ш. 30 (доска ?) / В. 30, Ш. 25 (доска ?)    Ссылка на каталоги / инвентари: Состояние: имеются утраты (?).  В источнике не указаны иконография, датировка, материал и техника, требуется уточнение."
20767,2019-01-21T09:22:58Z,"МОКМ КП-1848/7 Образец сырья для производства стекла. Материал, размеры не зафиксированы. Поступление 1956 г.",РАЗНОЕ,Объект является культурной ценностью,,,,Не зафиксировано,Не зафиксировано
10290,2016-06-14T09:45:46Z,Молодая особа,,,3.5,6.5,,,"Размеры: В. 3.5, Ш. 6.5"
10641,2016-06-14T09:45:48Z,Вид комнаты,,,18.3,15.5,,,"Размеры: В. 18.3, Ш. 15.5"
14062,2016-06-14T09:46:09Z,Кувшин,,,11,33,,,"Размеры: В. 33.0, Д. 11.0"
23360,2023-03-13T12:01:15Z,"Монета дирхем. X-XI вв. Арабский Халифат. Серебро, чеканка. Диаметр - 29,5 мм., вес - 2,9 г. РЯМЗ КП-11891 Н-4298 СА-261 ГК-38157167",,Объект является культурной ценностью,,,,"потертость, почернела, окисление, трещины, прорывы по краю, сквозное отверстие.",-
4336,2016-06-14T09:44:58Z,"Пейзаж (название употребляемое); Украинский пейзаж (название предполагаемое)    Автор: Васильковский ? (художник); Васильковский Сергей Иванович (художник) ?    Школа / Место издания: Россия, Украина    Период оригинала: 2 половина 19 век; 1 четверть 20 век",ЖИВОПИСЬ,,24,37,,,"Размеры: В. 24, Ш. 37 (доска)    Ссылка на каталоги / инвентари: Название: возможно вечерний или утренний, или грозовой и т.д. ( в источнике слово ""вечерний"" зачеркнуто).   Состояние: после реставрации на месте (1961)"
22423,2020-09-10T13:25:33Z,"Бинокль. Принадлежал Никифорову А.В., курсанту ВПУ им. Ленина СССР, 1927-1942 гг. Металл, кожа, стекло, 16,5х11,8х5,0 см ГБМ-1729, ИБ-109, № ГК 7542536",РАЗНОЕ,Объект является культурной ценностью,,,,"Утраты кожи, краска облетела",Справа на верхней крышке прорезной штамп (серп и молот)
18040,2016-06-14T09:46:36Z,Статуя Святого Рокуе    Период оригинала: 18 век,,,25,110,,,"Стиль: роспись    Размеры: В. 110, Д. 25-30"
17221,2016-06-14T09:46:21Z,"ОБИТЕЛЬ ЗОСИМА И САВВАТИЯ СОЛОВЕЦКИХ    Школа / Место издания: Русский Север    Период оригинала: 17 век, 2 половина",ИКОНА,,31.5,26.5,,,"Размеры: В. 31,5, Ш. 26,5"
17459,2016-06-14T09:46:36Z,Икона семейная    Школа / Место издания: Россия    Период оригинала: 19 век,ИКОНА,,46.7,61.7,,,"Стиль: Оклад выполнен в технике чеканки.    Размеры: В. 46,7; Ш. 61,7    Инвентарный номер: КИКМ №6308"
12364,2016-06-14T09:45:57Z,Открытое письмо и конверт,,,,,,,
12838,2016-06-14T09:46:00Z,Король Христиан IX в саду,,,17,12.5,,,"Размеры: В. 17.0, Ш. 12.5"
16827,2016-06-14T09:46:33Z,Палестина и Сидней. Альбом рисунков    Автор: Поливанов Н.П.,,,,,,,Инвентарный номер: КП-2700/6246
9892,2016-06-14T09:45:37Z,Чашка с блюдцем,,,,,,,Инвентарный номер: Инв. № 59
10636,2016-06-14T09:45:48Z,Банка,,,21,,,,Размеры: В. 21.0
22726,2021-04-28T12:09:46Z,Монета «2 копейки». СССР. 1924 г. ОФ-196,МОНЕТА / МЕДАЛЬ,Объект является культурной ценностью,,,,Потемневшая,нет
15953,2016-06-14T09:46:24Z,Монеты,,,,,,,"Ссылка на каталоги / инвентари: Список монет похищенных из ГУК ""Андроповский районный краеведческий музей"" находится в разделе РЕГИСТРАЦИЯ - поле ""Файлы документов - оснований""."
17893,2016-06-14T09:46:39Z,"Архангел Михаил    Период оригинала: 17 век, 4 четверть, 18 век, 1 четверть",ЖИВОПИСЬ,,136,80,,,"Размеры: В. 136, Ш. 80"
21787,2020-06-19T08:28:50Z,"Дрозд. Чучело. 10,0 х 28,0 см. ТКМГ ОФ 417",ОБРАЗЦЫ ФЛОРЫ И ФАУНЫ,Объект является культурной ценностью,,,,Без видимых повреждений,ОФ 417
22656,2021-04-21T12:30:49Z,Денежный знак «100 рублей». Россия. 1910 г. №ЛБ 146673. ОФ-264,ПРЕДМЕТЫ НУМИЗМАТИКИ И БОНИСТИКИ,Объект является культурной ценностью,,,,"Потерт по сгибам, края надорваны",№ЛБ 146673. ОФ-264
7387,2016-06-14T09:45:22Z,Святой Николай Чудотворец (название изначальное)    Автор: Аноним (иконописец); Аноним (мастер)    Школа / Место издания: Россия ?,ИКОНА,,24,27,,,"Стиль: С окладом/ризой: Алюминий ?/ Олово (сплавы) ?/ Серебро ?/ Другое ?    Размеры: В. 24, Ш. 27 (в окладе ?) / В. 27, Ш. 24 (в окладе ?) ; В. 24, Ш. 40 (в окладе ?) / В. 40, Ш. 24 (в окладе ?)"
