id,registration,name,category,сultural_property,height,width,depth,preservation,description
7781,2016-06-14T09:45:26Z,Распятие Христа (название изначальное)    Автор: Аноним (модельщик)    Школа / Место издания: Россия ?    Аноним (литейщик),,,,,,,"Ссылка на каталоги / инвентари: В источнике не указаны датировка, размеры, требуется уточнение."
7305,2016-06-14T09:45:28Z,Минеи (название придуманное); Избранные Святые (название употребляемое)    Автор: Аноним (иконописец)    Школа / Место издания: Россия    Период оригинала: середина 19 век; 2 половина 19 век,ИКОНА,,44.5,39,,,"Размеры: В. 44.5, Ш. 39 (доска)    Ссылка на каталоги / инвентари: В источнике не указаны подробности, требуется уточнение."
7395,2016-06-14T09:45:23Z,Автор: Аноним (иконописец)    Школа / Место издания: Россия ?,ИКОНА,,20,25,,,"Стиль: Дерево ?; Другое: серебрение по краям иконы (?)    Размеры: В. 20, Ш. 25 (в киоте ?) / В. 25, Ш. 20 (в киоте ?)"
17904,2016-06-14T09:46:40Z,Каллиграфическая табличка    Период оригинала: 19 век,,,,,,,Характер подписи: 1283 Innessalate kanet... (на оригинале арабский яз.)    Ссылка на каталоги / инвентари: В описании надпись дана в английском переводе - на оригинале - арабския.    Инвентарный номер: № 7
1912,2016-06-14T09:44:35Z,"Путеводительница / Богохранимая (название изначальное); Богоматерь Одигитрия (название употребляемое); Богоматерь с младенцем (название придуманное)    В русском оригинале (переводе): Одигитрия (греческий, название изначальное)    Автор: Аноним (модельщик)    Школа / Место издания: Россия ?    Период оригинала: 4 четверть 19 век",,,11.5,10,,,"Стиль: Прямоугольник вертикальный    Размеры: В. 11.5, Ш. 10 (пластинка)    Ссылка на каталоги / инвентари: Состояние: сохранность очень хорошая."
23395,2023-03-13T12:07:16Z,"Монета денарий. XI в. Западная Европа. Серебро, чеканка. Диаметр - 18 мм., вес - 0,6 г. РЯМЗ КП-12227 Н-4325 СА-841 ГК-38157214",,Объект является культурной ценностью,,,,"потертость, окисление, потемнела, края неровные.",AV:VE...ER RV:DOG...
17651,2016-06-14T09:46:38Z,Медаль 20 лет Победы в ВОВ,,,,,,,"Ссылка на каталоги / инвентари: Награжден Путин П.В., ветеран ВОВ    Инвентарный номер: 103-ОФ"
21306,2019-03-18T14:31:39Z,"МОКМ КП-2410 Фотография. Эскиз «Магаданские электростанции». Дата съемки неизвестна. Фотобумага, размер не зафиксирован. Поступление 1968 г.",АРХИВНЫЕ ДОКУМЕНТЫ,Объект является культурной ценностью,,,,Не зафиксировано,Не зафиксировано
9604,2016-06-14T09:45:41Z,Фигура солдата с ружьем    Автор: Неизвестный мастер,,,,14,,,"Размеры: B. 41, Ш. 14    Инвентарный номер: Инв. №48. Старый инв.№42/584"
739,2016-06-14T09:44:19Z,Морской пейзаж (название употребляемое); После шторма (название предполагаемое)    Автор: Айвазовский Иван Константинович (художник)    Школа / Место издания: Россия    Период оригинала: 2 половина 19 век ?,ЖИВОПИСЬ,,100,68,,,"Размеры: В. 100,  Ш. 68 (без обрамления ?) / В. 68,  Ш. 100 (без обрамления ?) /    Характер подписи: см. Общий комментарий    Ссылка на каталоги / инвентари: Фото: см. Составитель.  Подписи: в источнике не воспроизведены подпись и дата, см. фото; требуется уточнение."
2869,2016-06-14T09:44:43Z,Линия фронта (название придуманное); Фронтовая сцена (название употребляемое)    Автор: Поленов Василий Дмитриевич (художник)    Школа / Место издания: Россия    Период оригинала: 4 четверть 19 век ?,ЖИВОПИСЬ,,30,12,,,"Размеры: В. 30, Ш. 12 (приблизительно) / В. 40, Ш. 15 (приблизительно)"
19690,2018-09-11T14:52:17Z,"Оттиск статьи Н.Д. Зелинского и В. Садикова ""Uber die Hydrolyse der Eiweissstoffe mittels verdunnter Sauren"" (""Гидролиз белков с помощью разбавленных кислот""). Германия, г. Берлин. 1923 г. На пяти листах. На немецком языке. Типографский экземпляр с правкой, карандаш. Статья опубликована: журнал “Biochemische Zeitschrift” («Биохимический журнал»), том 138, выпуск 1/3. Бумага. 22,9х15,4 см. ПМ КП 30467/17",ПЕЧАТНЫЕ ИЗДАНИЯ,Объект является культурной ценностью,,,,"Бумага пожелтела, по левому краю – отверстия от дырокола, на обложке – следы проколов",Нет данных
9856,2016-06-14T09:45:37Z,Поднос,,,,23,,,"Размеры: B. 33, Ш. 23 см    Инвентарный номер: Инв. № (?)"
12385,2016-06-14T09:45:57Z,Открытое письмо и конверт,,,,,,,
12807,2016-06-14T09:46:00Z,Фотография,,,,,,,
3907,2016-06-14T09:44:55Z,Святая Троица (название изначальное); Отечество  (название употребляемое); Новозаветная Троица (название придуманное)    Автор: Аноним (иконописец)    Школа / Место издания: Россия,ИКОНА,,1.5,1.5,,,"Стиль: Другое: Резная , Полихромная ? (см. Общий Комментарий)    Размеры: В. 1.5, Ш. 1.5 (приблизительно)    Ссылка на каталоги / инвентари: В источнике: на фигурной доске."
687,2016-06-14T09:44:25Z,Кек - уок (название изначальное)    Автор: Вахрамеев Александр Иванович (художник)    Школа / Место издания: Россия    Период оригинала: 1 четверть 20 век,ЖИВОПИСЬ,,,,,,"Ссылка на каталоги / инвентари: В источнике не содержатся сведения об основе, размерах, цветах, подписи, надписях."
14044,2016-06-14T09:46:08Z,Солдат в медвежьей шапке    Автор: Неизвестный художник,ЖИВОПИСЬ,,29,65.5,,,"Размеры: В. 29.0, Ш. 65.5"
5411,2016-06-14T09:45:08Z,Хлестаков ухаживает за Марией Андреевной (название придуманное)    Автор: Аноним (художник)    Школа / Место издания: Россия    Период оригинала: 19 век,ЖИВОПИСЬ,,40,30,,,"Размеры: В. 40, Ш. 30 (в обрамлении ?)"
15684,2016-06-14T09:46:27Z,Крест,,,,,,,
21160,2019-03-14T13:18:15Z,"МОКМ КП-2241/397 Предмет из археологической коллекции Липовского В.С., собранной учащимися Палаткинской школы. Поступление 1956 г.",,Объект не является культурной ценностью,,,,Не зафиксировано,Не зафиксировано
19958,2018-11-30T08:41:02Z,"Сосуд, 8-12вв., 1шт.,глина,д-16.5, h-22 cм.,инв №279.",КЕРАМИКА,Объект является культурной ценностью,,,,хорошая,УПМ 279
2505,2016-06-14T09:44:42Z,Портрет грузинки (название придуманное); Портрет молодой женщины (название употребляемое)    Автор: Аноним (художник)    Школа / Место издания: Россия ?; Грузия ?    Период оригинала: 1 половина 19 век,ЖИВОПИСЬ,,80,64,,,"Стиль: Овал на прямоугольном холсте, после очередной дублировки    Размеры: В. 80, Ш. 64 (овал ?)    Ссылка на каталоги / инвентари: ЧГОМ: № 427; МУЗЕЙ / ГРОЗНЫЙ: сс. 72-73    Ссылка на каталоги / инвентари: Состояние: в реставрации (1995 с)."
2963,2016-06-14T09:44:47Z,Богородица (название старое); Богоматерь (название употребляемое)    Автор: Аноним (иконописец)    Школа / Место издания: Россия ?,,,42,37,,,"Стиль: Дерево ?    Размеры: В. 42, Ш. 37 (приблизительно)"
15787,2016-06-14T09:46:23Z,Преподобный Сергий Радонежский и Святой Никита епископ Новгородский,,,,38,,,"Размеры: В.?, Ш.38 см    Ссылка на каталоги / инвентари: Ярославская обл., Ярославский  район, с. Глухово. Похищение произошло 28.12.2007 г.    Инвентарный номер: 66"
14289,2016-06-14T09:46:10Z,Ящик для бумаг настольный,,,25,40.5,35.5,,"Размеры: Дл. 25.0, Ш. 40.5, В. 35.5"
4201,2016-06-14T09:44:56Z,Богородица (название старое); Богоматерь (название употребляемое)    Автор: Аноним (иконописец)    Школа / Место издания: Россия    Период оригинала: 18 век,ИКОНА,,32,35,,,"Стиль: Дерево поделочное; С окладом    Размеры: В. 32, Ш. 35 (приблизительно) / В. 35, Ш. 32 (приблизительно)"
20134,2018-12-04T12:38:26Z,"Аммонит Epivirgatites sp., 2шт.,д-4.8.,д-3см., инв№1815.",ОБРАЗЦЫ ФЛОРЫ И ФАУНЫ,Объект является культурной ценностью,,,,неполная : раковина деформирована,УПМ 1815
16941,2016-06-14T09:46:33Z,В русском оригинале (переводе): History of Fridrich V of Prussia. Vol. 1-2    Автор: Carlule. Th.,,,,,,,"Инвентарный номер: КП-2700/3579, MB 904"
2874,2016-06-14T09:44:43Z,Шторм на море у Крымского берега (название придуманное)    Автор: Айвазовский Иван Константинович (художник)    Школа / Место издания: Россия    Период оригинала: середина 19 век; 3 четверть 19 век,ЖИВОПИСЬ,,39,55,,,"Размеры: В. 39, Ш. 55 (без обрамления ?)"
5184,2016-06-14T09:45:02Z,Женщина в черном чепце (название придуманное)    Автор: Жуковский Ю.Г. (художник) ?    Школа / Место издания: Россия,ЖИВОПИСЬ,,28,17.8,,,"Стиль: Черный: чепец    Размеры: В. 28, Ш. 17.8 (лист ?)"
14839,2016-06-14T09:46:16Z,Господь Вседержитель    Школа / Место издания: Россия,ИКОНА,,36,30,,,"Стиль: Описание техники и материалов относится к окладу.    Размеры: В. 36, Ш. 30    Ссылка на каталоги / инвентари: Серебряный оклад, эмалевый венец."
7800,2016-06-14T09:45:27Z,"Иисус Христос Вседержитель (название изначальное)    В русском оригинале (переводе): Пантократор (греческий, название изначальное)    Автор: Аноним (иконописец)    Школа / Место издания: Россия ?    Период оригинала: 19 век ?",,,,,,,"Стиль: Дерево ?    Ссылка на каталоги / инвентари: В источнике не указаны иконография, материал, техника и размеры, требуется уточнение."
4652,2016-06-14T09:44:55Z,Иисус Христос с Апостолами (название употребляемое); Иисус Христос Вседержитель и Святые Апостолы (название последнее)    Автор: Аноним (иконописец)    Школа / Место издания: Россия,ИКОНА,,53,50,,,"Стиль: С басмой ? / С ризой ? (см. Общий комментарий): Медь ?/ Серебро ?/ Олово, жесть , полуда ?/ Белая жесть ?/  Другое ?    Размеры: В. 53, Ш. 50 (приблизительно) / В. 50, Ш. 53 (приблизительно)    Ссылка на каталоги / инвентари: В источнике: вся обрамлена мета[ллом ?]"
20210,2018-12-05T13:23:53Z,"МОКМ КП-70/1 Аметист бледно-окрашенный. Минерал, размер не зафиксирован. Поступление до 1955 г.",РАЗНОЕ,Объект является культурной ценностью,,,,Не зафиксировано,Не зафиксировано
9038,2016-06-14T09:45:35Z,Две части лат    Автор: Неизвестный мастер,,,,,,,Инвентарный номер: Инв. №47. Старый инв. №1207
3503,2016-06-14T09:44:51Z,Спас Нерукотворный (название придуманное); Нерукотворный образ Христа (название изначальное)    Автор: Аноним (иконописец)    Школа / Место издания: Россия,ИКОНА,,100,60,,,"Стиль: Масло ?/ Другое ?: роспись; Дерево ?    Размеры: В. 100, Ш. 60 (приблизительно) / В. 60, Ш. 100 (приблизительно) / В. 6, Ш. 10 (приблизительно) ?/ В. 10, Ш. 6 (приблизительно) ?"
7445,2016-06-14T09:45:29Z,Святые Петр и Павел (название употребляемое); Святой Апостол Петр и Святой Апостол Павел (название последнее)    Автор: Аноним (иконописец)    Школа / Место издания: Россия ?,,,50,40,,,"Стиль: Дерево ?    Размеры: В. 50, Ш. 40 (доска)"
13195,2016-06-14T09:46:03Z,Поздравительная карточка,,,,,,,
6599,2016-06-14T09:45:05Z,"Сладколобзающая / Умиление (название изначальное; Богоматерь Умиление (название употребляемое)    В русском оригинале (переводе): Гликофилуса / Елеуса (греческий, название изначальное)    Автор: Аноним (иконописец)    Школа / Место издания: Россия ?",ИКОНА,,,,,,"Стиль: Дерево ценных пород    Ссылка на каталоги / инвентари: В источнике не указаны техника живописи, размеры."
7281,2016-06-14T09:45:23Z,"Господь Вседержитель (название старое); Спас (название употребляемое); Иисус Христос Вседержитель (название изначальное)    В русском оригинале (переводе): Пантократор (греческий, название изначальное)    Автор: Аноним (иконописец)    Школа / Место издания: Россия ?    Период оригинала: 19 век",ИКОНА,,23.5,30.5,,,"Размеры: В. 23.5, Ш. 30.5 (доска) / В. 30.5, Ш. 23.5 (доска)"
2282,2016-06-14T09:44:39Z,"Портрет девушки (название употребляемое)    Автор: Латышев Николай Григорьевич (художник)    Школа / Место издания: Россия, Северный Кавказ    Период оригинала: 2 четверть 20 век; 2 половина 20 век",ЖИВОПИСЬ,,48,69,,,"Размеры: В. 48, Ш. 69 (картон ?) ?    Ссылка на каталоги / инвентари: ЧГОМ: № 506 (501 п.ф.)    Ссылка на каталоги / инвентари: Фото: Предмет 21.  В источнике размер ширины - 6?."
22153,2020-09-01T12:21:43Z,"ШКМ КП-1255/39. Номер по ГК 14797635. Монета Название: ""1 цент"". Датировка: 1898 Место создания: Нидерланды Материал: металл Техника: чеканка Размеры: Д-19мм",ПРЕДМЕТЫ НУМИЗМАТИКИ И БОНИСТИКИ,Объект является культурной ценностью,,,,Потерта,нет
19290,2018-01-25T09:52:50Z,"Скрипка работы Лоренцо Сториони Кремона, 1775 г., стоимость более 1 000 001 руб.",МУЗЫКАЛЬНЫЙ ИНСТРУМЕНТ,Объект является культурной ценностью,,,,,
4709,2016-06-14T09:45:01Z,"В память 100-летия Императорской Санкт-Петербургской Академии наук (название изначальное)    Автор: Толстой Федор Петрович (скульптор, медальер, с оригинала); Мещеряков Петр (резчик, копировал, аверс); Кучкин Михаил (резчик, копировал, реверс)    Школа / Место издания: Россия    Монетный двор    Период оригинала: 19 век",,,64,,,,"Размеры: Д. 64 мм ? / Д. 65 мм (штемпель)    Характер подписи: КОП. П. МЕЩЕРЯКОВЪ. ; КОП. М. КУЧКИНЪ (под обрезом, реверс)    Характер подписи: Николай I Павлович; Академия наук    Характер подписи: Г. ФЕОДОР ТОЛСТОИ (П.); СОЧ И РЪЗ Г ФЕОД ТОЛСТОИ (О. П.); Б. М. НИКОЛАЙ I ИМПЕРАТОРЪ И САМОДЕРЖЕЦЪ ВСЕРОСС. (по окружности); ОСНОВАТЕЛЮ И ХРАНИТЕЛЯМЪ. (О. по верху); ИМПЕР С ПЕТЕР АКАДЕМIЯ НАУКЪ (О. под обрезом); ДЕКАБРЯ XXIX ДНЯ / MDCCCXXVI Г. (о. под обрезом)    Ссылка на каталоги / инвентари: ГМЗ РК: № 302; СМИРНОВ: № 431; ГЕЛОС/2000.04: № 136 (фото)    Ссылка на каталоги / инвентари: Фото: см. Ссылку.  Описание составлено по каталогу, см. Ссылку."
15251,2016-06-14T09:46:28Z,"Пика    Школа / Место издания: Россия    Период оригинала: 1 четверть, 20 век",,,,,,,Ссылка на каталоги / инвентари: 17412 щ. Отсутствие в наличии зафиксировано в итоговом акте сверки наличия основного фонда с учетной документацией отдела научного учета фондов ГИМ от 16.04.1982 г.    Инвентарный номер: 6608 ор
21341,2019-03-19T13:28:42Z,"МОКМ КП-2605 Горный хрусталь. Минерал, размер не зафиксирован. Поступление 1969 г.",РАЗНОЕ,Объект является культурной ценностью,,,,Не зафиксировано,Не зафиксировано
2941,2016-06-14T09:44:47Z,"Крест старообрядческий (название употребляемое, створа, внешняя сторона)    Автор: Аноним    Школа / Место издания: Россия",,,12,36,,,"Размеры: В. 12, Ш. 36 (складень)    Характер подписи: [?] (внешняя сторона створки с крестом)"
22908,2022-02-08T07:00:07Z,"ЩНВц-32. Икона. Сретенье Господне. ХХ в., начало. Цветная литография, дерево. 35х30 см",ИКОНА,Объект является культурной ценностью,,,,"Вздутия и прорывы бумаги, следы воска, загрязнения",Нет данных
11076,2016-06-14T09:46:15Z,Фотография,,,,,,,
16223,2016-06-14T09:46:29Z,Светик Савишна. Копия-муляж.    Автор: Мусоргский М.П.    Школа / Место издания: Россия    Период оригинала: 4 четверть 20 век,,,26.5,37,,,"Размеры: В. 26,5; Ш. 37    Ссылка на каталоги / инвентари: Нотная рукопись. Копия-муляж.    Инвентарный номер: ПГОИАХМЗ н.в. 7983 (1)"
15469,2016-06-14T09:46:21Z,"Листовка ""В боях за Родину крепить дружбу народов""",,,,,,,"Ссылка на каталоги / инвентари: Письмо,ГУКиИ ""Центральный музей Вооруженных Сил"" № 458 от 22.10.2007 г., Акт от 16.05.2000 г., Акт от 09.12.2005 г.    Инвентарный номер: 4/26897"
4767,2016-06-14T09:44:23Z,"Крестьянин увозит у французов пушку в Русский лагерь (название записано; русский; лицевая сторона)    Автор: Теребенев Иван Иванович (художник, гравер)    Школа / Место издания: Россия    Период оригинала: 1 четверть 19 век",ОТТИСК,,26,36,,,"Стиль: Гравюра на металле: раскрашенная ?    Размеры: В. 26, Ш. 36 (отпечаток / оттиск) ?    Характер подписи: Иван Теребеневъ. (?)    Характер подписи: [...] между тем какъ / они, оставивши оную на полъ, бросились в деревню за контрибуцiею.   (следом за названием)    Ссылка на каталоги / инвентари: БОРОДИНСКАЯ ПАНОРАМА: № 23    Ссылка на каталоги / инвентари: Фото: предполагаемое произведение, см. Ссылку, требуется уточнение.  В источнике не указаны название, техника, размеры (последние взяты из описания, см. Ссылку)."
13656,2016-06-14T09:46:06Z,Линейка,,,0.38,,,,Размеры: Дл. 0.38
15066,2016-06-14T09:46:18Z,"Новобранец    Автор: Бурцев С.В.    Период оригинала: 20 век, 2 половина",,,,,,,"Ссылка на каталоги / инвентари: Цена 400 руб. в ценах 1988 г.    Инвентарный номер: С - 174, КП - 4944"
13024,2016-06-14T09:46:01Z,Поздравительная карточка,,,,,,,
5268,2016-06-14T09:45:07Z,Святой Николай Чудотворец (название изначальное); Николай Угодник (название старое)    Автор: Аноним (иконописец)    Школа / Место издания: Россия,ИКОНА,,40,35,,,"Размеры: В. 40, Ш. 35 (доска)    Ссылка на каталоги / инвентари: В источнике не указана техника живописи."
