id,registration,name,category,сultural_property,height,width,depth,preservation,description
6452,2016-06-14T09:45:20Z,"Обмен двух Королев, Изабеллы Бурбонской и Анны Австрийской  (название придуманное)    Автор: Одран Жан (гравер); Рубенс Питер Пауль (с оригинала)    Школа / Место издания: Франция; Бельгия / Фландрия (с оригинала)    Период оригинала: 18 век ?",,,38,52.5,,,"Размеры: В. 38, Ш. 52.5 (доска ?, лист ?)    Ссылка на каталоги / инвентари: В источнике не указана техника.  Состояние: после реставрации (1966)."
15555,2016-06-14T09:46:26Z,Орден Суворова I ст. № 110 (Хрулева А.В.),,,,,,,"Инвентарный номер: 6/6435, 39932, Ш-3-0/138"
15132,2016-06-14T09:46:18Z,"Блюдце от чашки из банкетного сервиза Петергофского дворца.    Период оригинала: 2 четверть, 19 век",,,13.5,2.6,,,"Стиль: Роспись надглазурная полихромная.    Размеры: В. 2.6, Д. 13.5    Ссылка на каталоги / инвентари: МЗ-И 616 б. Отсутствует по неустановленным причинам. Объяснительная записка бывшего директора музея ЛФЗ Н.С. Петровой"
20015,2018-11-30T12:32:56Z,"Направление в Ундоровскую участковую больницу,1979г, 1шт., картон, 8.8х15.2см., инв № 445",АРХИВНЫЕ ДОКУМЕНТЫ,Объект является культурной ценностью,,,,хорошая,УПМ445
4917,2016-06-14T09:44:29Z,За защиту Порт-Артура (название изначальное)    Период оригинала: 4 четверть 20 век,,,,,,,Характер подписи: ПОРТЪ / АРТУРЪ (чекан)    Ссылка на каталоги / инвентари: КРИСТИ/1999.12: № 292 (аналог)    Ссылка на каталоги / инвентари: Фото: см. Ссылку .
11007,2016-06-14T09:46:14Z,Умывальник,,,88,6.1,59,,"Размеры: Дл. 88.0, Ш. 6.1, В. 59.0"
20306,2018-12-06T12:46:19Z,"Стяжение пиритовое на раковине двустворчатого моллюска,J3V1 ,1шт., 4.5х3.9х1.8см.,инв№ 1949",РАЗНОЕ,Объект является культурной ценностью,,,,неполная: имеются трещины,УПМ 1949
14275,2016-06-14T09:46:10Z,Императрица Мария Федоровна верхом,,,37,28.5,,,"Размеры: В. 37.0, Ш. 28.5"
3405,2016-06-14T09:44:49Z,Богородица Казанская (название употребляемое); Богоматерь Казанская (название придуманное)    Автор: Аноним (иконописец)    Школа / Место издания: Россия    Период оригинала: 19 век,ИКОНА,,20,15,,,"Размеры: В. 20, Ш. 15 (приблизительно)"
5273,2016-06-14T09:45:05Z,Святой Николай Чудотворец (название изначальное); Николай Угодник (название старое)    Автор: Аноним (иконописец)    Школа / Место издания: Россия    Период оригинала: 18 век; 19 век,ИКОНА,,,,,,"Стиль: Дерево: ценной породы; Золочение: ""на золоте"" (?)    Ссылка на каталоги / инвентари: В источнике не указаны размеры, техника."
2831,2016-06-14T09:44:44Z,Богоматерь Всех Скорбящих Радость (название изначальное)    Автор: Аноним (художник)    Школа / Место издания: Россия    Период оригинала: 18 век ?; 19 век ?,ИКОНА,,74,52,,,"Стиль: С окладом/ризой: сплошной оклад    Размеры: В. 74, Ш. 52 (в окладе ?)    Характер подписи: [?] (левая сторона)"
21944,2020-08-24T14:02:12Z,"ШКМ КП-509. Номер по ГК 14792374. Скульптура Название: ""С.М. Киров"". Датировка: 1981 Место создания: СССР Материал: металл, гипс Техника: отливка Размеры: 34,0х12,0х8,0см.",СКУЛЬПТУРА / СТАТУЯ,Объект является культурной ценностью,,,,Без видимых дефектов,нет
13478,2016-06-14T09:46:05Z,Портрет английской королевы Александры с дочерьми,,,7.2,10,,,"Размеры: В. 7.2, Ш. 10.0"
22924,2022-03-21T07:14:15Z,"Шинель двубортная. Германия, 1939-1945 гг. сукно, пошив",,Объект является культурной ценностью,,,,Общее загрязнение,КП МС - 16004
8013,2016-06-14T09:45:31Z,Большая (золотая) медаль Росохотрыболов союз (название записано; лицевая сторона)    Период оригинала: 4 четверть 20 век,,,35,,,,"Стиль: Латунь; ?/ Бронза ?/ Другое ?, Желтый металл    Размеры: Д. 35 мм    Характер подписи: Выставка / Охотничьего собаководства (О.)"
15381,2016-06-14T09:46:24Z,Мяч,,,16.6,,,,"Размеры: В. 16.6, Окр. 52    Ссылка на каталоги / инвентари: Производитель Германия. Фабрика М. Штайф"
5891,2016-06-14T09:45:13Z,Портрет Наполеона I (название изначальное)    Автор: Аноним (литограф) ?; Аноним (художник) ?    Школа / Место издания: Франция ?; Россия ?; Западная Европа ?    Период оригинала: 1 половина 19 век ?,ОТТИСК,,4,4,,,"Стиль: Литография цветная; Дерево ?, Квадрат ?: рамка; Круг: портрет;    Размеры: В. 4, Ш. 4 (в свету ?, доска ?); В. 5, Ш. 5  (в обрамлении)    Характер подписи: ? (О. см. Общий комментарий)    Ссылка на каталоги / инвентари: Надписи: штамп комиссионного магазина на Арбате времен НЭПа, в Москве (?)"
18546,2016-06-14T09:46:45Z,Лук,,,,,,,"Стиль: деревообработка    Размеры: размах плеч - 842 мм, максимальный габарит - 860 мм."
5876,2016-06-14T09:45:13Z,Лысый монах с ребенком на руках (название придуманное)    Автор: Аноним (художник)    Школа / Место издания: Италия ?,ЖИВОПИСЬ,,20,15,,,"Стиль: Коричневый: ряса, одеяние мужчины    Размеры: В. 20, Ш. 15 (приблизительно) / В. 15, Ш. 20 (приблизительно)    Ссылка на каталоги / инвентари: Состояние: картина затемненная."
12970,2016-06-14T09:46:01Z,Рама-футляр,,,,,,,
22472,2021-01-25T08:57:18Z,Монета «10 геллеров». ЧССР. 1953 г. НВФ-28,МОНЕТА / МЕДАЛЬ,Объект является культурной ценностью,,,,Без видимых повреждений,НВФ-28
14160,2016-06-14T09:46:09Z,Пейзаж море вечером    Автор: Бенуа А.,,,48,32.5,,,"Размеры: В. 48.0, Ш. 32.5"
7017,2016-06-14T09:45:06Z,"Исторiя государства россiйскаго (название записано; титульный лист); История государства Российского (название изначальное)    Автор: Карамзин Н.М. (сочинитель); Петрович А.А. (издатель) ?    Кушнерев И.Н. и компания (товарищество, типография)    Период оригинала: 1 четверть 20 век",,,20,13.5,,,"Стиль: Переплет: Картон, Ткань, Зеленый (крышки), Коричневый (корешок)    Размеры: В. 20, Ш. 13.5, Ф. , Об. 280 с. (конволют ?)    Характер подписи: Васильев Н.Н., присяжный поверенный; Скрипов А.Н.    Характер подписи: Присяжный Повъренный Николай Николаевичь Васильевъ въ Ростовъ на Дону (в шампе, передний форзац); Скрипов Александр Николаевич (в штампе, передний форзац); Библiотека Присяжнаго повъреннаго Н.Н.Васильева, № ( в штампе, на с. 3)"
13788,2016-06-14T09:46:07Z,Почтовая карточка,,,,,,,
11884,2016-06-14T09:45:54Z,Кристалл,,,,,,,
9493,2016-06-14T09:45:40Z,Образ «Покров Пресвятой Богородицы»    Автор: Неизвестный художник,,,,58,,,"Размеры: B. 70, Ш. 58    Инвентарный номер: Инв. №26. Старый инв. № 319"
17353,2016-06-14T09:46:29Z,"Шествие    Автор: Лиоли, Юрий Константинович    Школа / Место издания: Россия    Период оригинала: 20 век 4 четверть",ЖИВОПИСЬ,,1.5,2,,,"Размеры: В. 1,5 , Ш. 2,0    Характер подписи: ""Юрий Лиоли 89 г.""    Характер подписи: Юрий Лиоли    Инвентарный номер: Б/н"
10070,2016-06-14T09:45:38Z,Чашечка,,,5,,,,Размеры: Д. 5 см    Инвентарный номер: Инв. № 107
17184,2016-06-14T09:46:20Z,"БОГОМАТЕРЬ ОДИГИТРИЯ (ТИПА ГРУЗИНСКОЙ)    Школа / Место издания: Вологодские земли    Период оригинала: 16 век, 2 половина",ИКОНА,,38.6,30.7,,,"Размеры: В. 38.6, Ш. 30.7"
4147,2016-06-14T09:44:57Z,Богоматерь Казанская (название придуманное)    Автор: Аноним (иконописец)    Школа / Место издания: Россия,,,20,25,,,"Стиль: Дерево поделочное    Размеры: В. 20, Ш. 25, Т. 1 (приблизительно) / В. 25, Ш. 20, Т. 1 (приблизительно)"
5677,2016-06-14T09:45:12Z,Архангел Михаил (название изначальное); Архангел Михаил воевода (название употребляемое); Архистратиг Михаил (название старое)    Автор: Аноним    Школа / Место издания: Россия ?,,,20,20,,,"Стиль: Дерево ?    Размеры: В. 20, Ш. 20 (доска ?)"
7433,2016-06-14T09:45:29Z,Святой Апостол Лука Евагелист (название изначальное)    Автор: Аноним (иконописец)    Школа / Место издания: Россия    Период оригинала: 2 половина 19 век,ИКОНА,,28,,,,Размеры: Д. 28 (доска)
4205,2016-06-14T09:44:56Z,Богородица (название старое); Богоматерь (название употребляемое)    Автор: Аноним (иконописец)    Школа / Место издания: Россия    Период оригинала: 17 век,,,,,,,Стиль: Дерево поделочное
11267,2016-06-14T09:46:16Z,Модель ударных трубок,,,,,,,
14800,2016-06-14T09:45:46Z,Господь Вседержитель    Период оригинала: 19 век,ИКОНА,,27,22.8,,,"Размеры: В. 27,0, Ш. 22,8, Вес 999,0 г    Характер подписи: «СТ» и одно неразборчиво.    Ссылка на каталоги / инвентари: Дар гражданки Галаховой Е.Н. КП ОИРК 1069-1. Акт № 45 от 23.01.1968 г. из ЗК ГЭ.    Инвентарный номер: ЭРО-8971, СВ-4327"
9403,2016-06-14T09:45:40Z,Икона «Святцы за октябрь - месяц»    Автор: Неизвестный художник,,,,77,,,"Размеры: B. 95, Ш. 77    Инвентарный номер: Инв. №19. Старый инв. № 234"
5847,2016-06-14T09:45:12Z,Святой князь Александр Невский (название изначальное)    Школа / Место издания: Россия,,,,,,,"Стиль: Серебро ? / Золоченое серебро ? / Золото ?    Ссылка на каталоги / инвентари: ОРДЕНА И НАГРАДЫ: № 20 (фото)    Ссылка на каталоги / инвентари: Фото: образец 1900 г., см. Ссылку и Комментарий.  В источнике: с мечами (?), серебро (?), требуется уточнение."
11695,2016-06-14T09:45:52Z,Тарелка,,,0.135,,,,"Размеры: Д. 0,135"
22389,2020-09-10T08:40:16Z,Монета «20 копеек». СССР. 1932 г. Диаметр 20 мм. ОФ 134,ПРЕДМЕТЫ НУМИЗМАТИКИ И БОНИСТИКИ,Объект является культурной ценностью,,,,Монета потерта,ОФ 134
19788,2018-09-14T07:53:10Z,"Сумочка для часов. Елизаветпольская губерния.  Полотно, ситец, мишура, шерсть. 6,5х9  КП-19933  Гр.Б-3001  ГК-5266010",РАЗНОЕ,Объект является культурной ценностью,,,,,
21711,2020-03-13T11:52:42Z,"Монета. 20 копеек 1931 г. Мельхиор. Чеканка. Размер: 21,8 мм. № по книге поступлений: ТМ КП-1726/20",ПРЕДМЕТЫ НУМИЗМАТИКИ И БОНИСТИКИ,Объект является культурной ценностью,,,,Незначительная потертость,нет
21641,2020-03-13T08:24:57Z,"Монета. 1 полтинник. 1924 г Серебро. Чеканка. Размер: диаметр – 2,6 см. № по книге поступлений: ТМ КП-1726/14 № по книге спецучёта: ДМ-152 № по ГК: 14289443",ПРЕДМЕТЫ НУМИЗМАТИКИ И БОНИСТИКИ,Объект является культурной ценностью,,,,Потертость,нет
17708,2016-06-14T09:46:38Z,Беседы на апостола Павла. Ч. 1.    Автор: Иоанн Златоуст    Период оригинала: 18 век,,,,,,,"Размеры: Ф. 2; [2], 2006, 96 стлб. с грав.    Инвентарный номер: 8434"
2014,2016-06-14T09:44:41Z,Портрет грузина (название изначальное); Веселый грузин (название рукописное; оборотная сторона)    Автор: Колчин ? (художник); Колчин Петр Петрович (художник) ?    Школа / Место издания: Россия    Период оригинала: 2 половина 19 век ?; 4 четверть 19 век ?,ЖИВОПИСЬ,,49,33,,,"Размеры: В. 49, Ш. 33 (картон ?); В. 39, Ш. 33 (картон ?)    Характер подписи: П Колчинъ (см. фото, под левым рукавом)    Характер подписи: Тбилиси; Вера Андреевна    Характер подписи: 25.III.89. [23.III.82 ?](П., см. фото, на левом рукаве); Веселый грузин / Глубокопочтимой Вере  Андреевне / на память невеселого пребывания в Тифлисе / П.Колчин 1892 г. / 1 марта (О. см. Общий комментарий); [?] (О. номера музейные, см. Общий комментарий)      Ссылка на каталоги / инвентари: ЧГОМ: № 204 (Предмет 1.)    Ссылка на каталоги / инвентари: Фото: см. Источники.  Состояние: после реставрации (1964).  Последние размеры из Паспорта, см. Источники.  Дата: последняя из надписи на обороте;   Надписи: коммеморативная надпись нуждается в уточнении; в источнике номера не воспроизводятся."
23190,2023-03-13T11:37:49Z,"Монета боспорская. Митридат III. 38-45 гг. Боспорское царство. Медь, чеканка. Диаметр - 22 мм. РЯМЗ КП-9207 Н-3942 ГК-37806345",,Объект является культурной ценностью,,,,"окисление, загрязнение, потертость.","ATOV; BA, на обороте: B."
7375,2016-06-14T09:45:23Z,Богоматерь с младенцем (название употребляемое)    Автор: Аноним (иконописец)    Школа / Место издания: Россия ?    Период оригинала: 1 половина 19 век,ИКОНА,,31.5,27,,,"Размеры: В. 31.5, Ш. 27, Т. 3(доска)"
5286,2016-06-14T09:45:07Z,Казанская Божья Матерь (название старое); Богоматерь Казанская (название придуманное)    Автор: Аноним (иконописец); Аноним (ювелир)    Школа / Место издания: Россия,ВЫШИВКА,,35,40,,,"Стиль: Масло ? / Темпера ?: лики;  С ризой: Бархат Красный, Коричневый; ВЫШИВКА : Жемчугом,  Жемчуг речной (риза); С камнями: Камень полудрагоценный ? / Стекло ?, Фиолетовый (сиреневый), Зеленый, Красный (риза)    Размеры: В. 35, Ш. 40 (доска ?) / В. 40, Ш. 35 (доска ?)"
21381,2019-03-20T09:33:07Z,"МОКМ КП-2710/71 Деталь американского винчестера. Из коллекции подъёмного археологического и этнографического материала из с. Лорино. Материал, размер не зафиксирован. Поступление 1969 г.",ОРУЖИЕ ОГНЕСТРЕЛЬНОЕ,Объект является культурной ценностью,,,,Не зафиксировано,Не зафиксировано
5521,2016-06-14T09:45:04Z,Иоанн Пророк (название изначальное); Святой Иоанн Предтеча Креститель (название последнее)    Автор: Аноним (модельщик)    Школа / Место издания: Россия    Аноним (литейщик),,,12,13,,,"Стиль: Отливка: Латунь ?/ Бронза ?/ Медь ?/ Другое ?; Дерево: поделочное, рама ?    Размеры: В. 12, Ш. 13 (в обрамлении ?) / В. 13, Ш. 12 (в обрамлении ?)"
22889,2022-02-08T06:55:14Z,ЩКП-3148. Оклад от храмовой иконы Николая Чудотворца и венец. Серебряный чеканный позолоченный. 112х98 см,РЕЛИГИОЗНЫЙ ПРЕДМЕТ,Объект является культурной ценностью,,,,"На омофоре утрачены все украшения, вырезаны куски серебра с боковых стенок оклада",С клеймом мастера: 1850 год. Надпись на боковой стенке: 14 фунтовъ
11930,2016-06-14T09:45:54Z,Пепельница,,,,0.108,,,"Размеры: В. , Ш. 0.108 x 0.105"
6446,2016-06-14T09:45:20Z,Портрет Марии Жозефины (название изначальное)    Автор: Древэ ? (гравер); Древе П. (гравер) ?; ? (с оригинала)    Школа / Место издания: Франция,,,38.5,28,,,"Стиль: Бумага сдублирована на тонкий Картон    Размеры: В. 38.5, Ш. 28 (лист ?, картон?)    Ссылка на каталоги / инвентари: Состояние: после реставрации (1962).  В источнике не указана техника."
11845,2016-06-14T09:45:53Z,Сирена,,,7.5,7.5,,,"Размеры: В. 7.5, Ш. 7.5"
10434,2016-06-14T09:45:47Z,Модель гамака,,,44,11,,,"Размеры: В. 44.0, Ш. 11.0"
2472,2016-06-14T09:44:38Z,Русские люди (название придуманное)    Автор: Симонов ? (художник); Симонов Евтей Семенович (художник) ?; Симонов Игорь Иванович (художник) ?    Школа / Место издания: Россия    Период оригинала: 20 век ?,,,50,70,,,"Размеры: В. 50, Ш. 70 (приблизительно)    Ссылка на каталоги / инвентари: ЧГОМ: № 554 (549 п.ф.)    Ссылка на каталоги / инвентари: В источнике не указаны техника, основа; возможно масло, картон (?)"
5643,2016-06-14T09:45:12Z,Пресвятая Троица (название старое); Троица Ветхозаветная (название придуманное); Явление Аврааму трех ангелов (название изначальное)    Автор: Аноним (иконописец); Рублев Андрей (манера)    Школа / Место издания: Россия    Период оригинала: 17 век ?; 18 век ?,ИКОНА,,30,40,,,"Размеры: В. 30, Ш. 40 (доска) / В. 40, Ш. 30 (доска)    Ссылка на каталоги / инвентари: В источнике: в стиле Рублева; лики Святых; внизу агнец и чаша, ср. с Предметом 2., требуется уточнение."
3720,2016-06-14T09:44:55Z,Распятие Христово (название употребляемое); Распятие Иисуса Христа (название изначальное)    Автор: Аноним (иконописец); Аноним (резчик)    Школа / Место издания: Россия,,,40,25,,,"Стиль: Полихромная ?    Размеры: В. 40, Ш. 25 (приблизительно)"
13362,2016-06-14T09:46:04Z,Кресло,,,67,58,82,,"Размеры: Дл. 67.0, Ш. 58.0, В. 82.0"
7353,2016-06-14T09:45:29Z,"Святая Троица (название употребляемое); Троица Ветхозаветная (название придуманное); Явление Аврааму трех ангелов (название изначальное)    Автор: Аноним (иконописец, художник)    Школа / Место издания: Россия ?",ИКОНА,,130,125,,,"Стиль: Холст ?;  Квадрат почти; Масло: мрачных тонов    Размеры: В. 130, Ш. 125 (без обрамления ?)    Ссылка на каталоги / инвентари: Состояние: осыпание красочного слоя (местами).  В источнике указана иконография: 3 фигуры Святых, требуется уточнение."
18343,2016-06-14T09:46:42Z,кинжал-кама    Период оригинала: 19 век,ОРУЖИЕ ХОЛОДНОЕ,,60,5,,,"Стиль: кинжал-кама дагестанского типа, клинок стальной. Рукоять в серебряной оправе с чернью, гравировкой и позолотой. Узор растительный. Ножны в чёрной коже с серебряными накладками у устья и наконечника.    Размеры: Дл.60, Ш.5    Ссылка на каталоги / инвентари: № КП 15878, № инв. 262    Ссылка на каталоги / инвентари: Похищен из Гунибского музея    Инвентарный номер: № КП 15878, № инв. 262"
