id,registration,name,category,сultural_property,height,width,depth,preservation,description
5290,2016-06-14T09:45:05Z,Богородица Казанская (название старое); Богоматерь Казанская (название придуманное)    Автор: Аноним (иконописец)    Школа / Место издания: Россия    Период оригинала: 1 четверть 19 век ?; 3 четверть 19 век,ИКОНА,,40,50,,,"Стиль: Золочение: сусальное золото    Размеры: В. 40, Ш. 50 (доска) / В. 50, Ш. 40 (доска)    Характер подписи: 1811 [1871] (О. процарапано, последняя цифра читается как ""1"" и как  ""7"")    Ссылка на каталоги / инвентари: В источнике не указана техника живописи."
6450,2016-06-14T09:45:20Z,Святой Иоанн Евангелист (название изначальное)    Автор: Лебрен Шарль (с оригинала) ?;  ? (гравер)    Школа / Место издания: Франция    Период оригинала: 18 век ?,,,44.5,32,,,"Стиль: Бумага сдублирована на Картон    Размеры: В. 44.5, Ш. 32 (доска ?, лист ?)    Ссылка на каталоги / инвентари: В источнике не указана техника.  Состояние: после реставрации (1969)."
16351,2016-06-14T09:46:19Z,"Медаль ""За оборону Кавказа""    Период оригинала: 20 век, 2 половина",,,,,,,Инвентарный номер: № 606
14276,2016-06-14T09:46:10Z,Трофеи охоты,,,37,28,,,"Размеры: В. 37.0, Ш. 28.0"
13582,2016-06-14T09:46:05Z,Герцогиня Кумберлендская с детьми,,,13.7,22,,,"Размеры: В. 13.7, Ш. 22.0"
6737,2016-06-14T09:45:14Z,"Спасательница (название изначальное, название в переводе); Богиня  сострадания (название употребляемое); Белая Тара (название последнее);    В русском оригинале (переводе): Тара (название изначальное; санскрит); Ситатара (название последнее; санскрит); Сагаан Дара-Эхэ (бурятский) ?    Школа / Место издания: Индия",,,18,15,,,"Стиль: Другое: сплав металлов, ""лемма"" (?)    Размеры: В. 18, Ш. 15"
20475,2018-12-24T14:32:38Z,"Позвонок ихтиозавра.,1шт., д-11.8см, h-4.2см.,инв. № 2295",ОБРАЗЦЫ ФЛОРЫ И ФАУНЫ,Объект является культурной ценностью,,,,"позвонок немного деформирован,сильно разрушен с одной стороны",УПМ 2295
18475,2016-06-14T09:46:41Z,"Богоматерь Неувядаемый цвет (название придуманное)    Автор: Аноним    Школа / Место издания: Россия    Период оригинала: 17 век, 18 век, 19 век, 20 век (?)",ИКОНА,,100,80,,,"Размеры: В. 100, Ш. 80    Инвентарный номер: 011"
7604,2016-06-14T09:45:24Z,Все Святые (название употребляемое); Святые и Богоматерь (название последнее)    Автор: Аноним (иконописец)    Школа / Место издания: Россия ?,ИКОНА,,27,32,,,"Стиль: Дерево ?    Размеры: В. 27, Ш. 32 (доска ?) / В. 32, Ш. 27 (доска ?)    Ссылка на каталоги / инвентари: В источнике не указаны иконография, датировка, материал и техника, требуется уточнение.  В источнике дважды указан правый угол: как место Смоленской Богородицы и Богородицы без имени, требуется уточнение."
19799,2018-10-25T11:46:06Z,"1. Образок «Богоматерь Одигитрия». Медь, литьё, эмаль. 10,5х7. ЯКМ КП 215",РЕЛИГИОЗНЫЙ ПРЕДМЕТ,Объект является культурной ценностью,,,,нет,ЯКМ 215
10157,2016-06-14T09:45:42Z,Анжела Дэвис    Автор: Налбандян Д.А.,ЖИВОПИСЬ,,,70,,,"Размеры: B. 110, Ш. 70"
2967,2016-06-14T09:44:47Z,Богородица (название старое); Богоматерь (название употребляемое)    Автор: Аноним    Школа / Место издания: Россия ?,ИКОНА,,30,25,,,"Размеры: В. 30, Ш. 25 (приблизительно)"
3652,2016-06-14T09:44:53Z,"Путеводительница / Богохранимая (название изначальное); Богоматерь Одигитрия (название употребляемое)    В русском оригинале (переводе): Одигитрия (греческий, название изначальное)    Автор: Аноним (иконописец)    Школа / Место издания: Россия",ИКОНА,,49,35,,,"Размеры: В. 49, Ш. 35 (приблизительно) / В. 35, Ш. 49 (приблизительно)"
9412,2016-06-14T09:45:40Z,Икона «Введение во храм»    Автор: Неизвестный художник,,,,42,,,"Размеры: B. 76, Ш. 42    Инвентарный номер: Инв. №28. Старый инв. № 255"
23219,2023-03-13T11:41:24Z,"Монета Рима. Криспина. 180-192 гг. Римская империя. Медь, чеканка. Диаметр - 29 мм. РЯМЗ КП-9339 Н-3980 ГК-37806465",,Объект является культурной ценностью,,,,"окисление, загрязнение, потертость.",-
12010,2016-06-14T09:45:54Z,Пресс,,,7.5,8,,,"Размеры: В. 7.5, Ш. 8.0"
5833,2016-06-14T09:45:09Z,Святой Апостол Лука Евангелист (название изначальное)    Автор: Аноним (художник)    Школа / Место издания: Россия ?    Период оригинала: 19 век,ЖИВОПИСЬ,,9.6,7.7,,,"Размеры: В. 9.6, Ш. 7.7 (лист ?)"
3095,2016-06-14T09:44:46Z,Святые Кирик и Улита (название изначальное); Святые Кирик и мать его Улита (название последнее)    Автор: Аноним    Школа / Место издания: Россия,ИКОНА,,25,30,,,"Размеры: В. 25, Ш. 30 (приблизительно) / В. 30, Ш. 25 (приблизительно)"
7522,2016-06-14T09:45:24Z,Скорбящие Пресвятая Богородица (название старое); Богоматерь Всех Скорбящих Радость (название изначальное)    Автор: Аноним (иконописец)    Школа / Место издания: Россия ?,,,30,40,,,"Стиль: Дерево ?    Размеры: В. 30, Ш. 40 (доска ?) / В. 40, Ш. 30 (доска ?)    Ссылка на каталоги / инвентари: В источнике не указаны датировка, материал и техника, требуется уточнение."
14381,2016-06-14T09:46:11Z,Кусок сургуча,,,,,,,
12694,2016-06-14T09:45:59Z,Кувшинчик,,,0.17,,,,"Размеры: Д. 0,17"
8739,2016-06-14T09:45:38Z,Масличные деревья    Автор: Неизвестный художник,,,,100,,,"Размеры: B. 68, Ш. 100    Инвентарный номер: Инв. № 171"
3938,2016-06-14T09:44:55Z,Богородица (название старое); Богоматерь (название употребляемое)    Автор: Аноним (иконописец)    Школа / Место издания: Россия,,,40,30,,,"Стиль: Дерево поделочное    Размеры: В. 40, Ш. 30 (приблизительно) / В. 400 мм, Ш. 300 мм (приблизительно)"
22082,2020-08-27T14:53:03Z,"ШКМ КП-1251/15. Номер по ГК 14793836. Монета Название: ""15 копеек"". подлинник Датировка: 1954 Место создания: СССР Материал: металл Техника: чеканка Размеры: Д-19.6мм.",ПРЕДМЕТЫ НУМИЗМАТИКИ И БОНИСТИКИ,Объект является культурной ценностью,,,,"Потерта, загрязнена",нет
4519,2016-06-14T09:44:59Z,Богородица (название старое); Богоматерь (название употребляемое)    Автор: Аноним (иконописец)    Школа / Место издания: Россия ?    Период оригинала: 19 век,,,25,35,,,"Стиль: Дерево ?    Размеры: В. 25, Ш. 35 (доска ?) / В. 35, Ш. 25 (доска ?)"
15195,2016-06-14T09:46:27Z,Девочка-якутка с книгой и цветком,,,,,,,
21898,2020-08-19T11:49:11Z,"ШКМ КП-384/1. Номер по ГК 14790973. Значок Название: ""Орешек"", подлинник Датировка: Вторая половина ХХ века Изготовитель: Невский судостроительно-судоремонтный завод Место создания: СССР Материал: металл Техника: штамповка Размеры: 2.5х4см.",ПРЕДМЕТЫ ФАЛЕРИСТИКИ И СФРАГИСТИКИ,Объект является культурной ценностью,,,,Без видимых дефектов,нет
13670,2016-06-14T09:46:06Z,Скатерть,,,2.02,1.54,,,"Размеры: В. 2.02, Ш. 1.54"
7675,2016-06-14T09:45:26Z,Автор: Аноним (мастер)    Школа / Место издания: Россия ?; Западная Европа ?    Период оригинала: 18 век; 19 век,,,,,,,Стиль: Золочение: позолота внутри    Размеры: Пр. 545 Серебро    Ссылка на каталоги / инвентари: Фото: см. Документ-основание
9814,2016-06-14T09:45:36Z,Чашка,,,,,,,Инвентарный номер: Инв. № 310
7135,2016-06-14T09:45:08Z,Кокосовый кубок (название придуманное)    Автор: Аноним (мастер)    Школа / Место издания: Западная Европа ?; Россия ?    Период оригинала: 1 четверть 19 век,,,8,14,,,"Стиль: Другое: кокосовый орех (тулово); Золочение ?, Бронза ? /Латунь ?/ Медь ?/ Другое ?: Желтый металл (стоян, арматура, крышка)    Размеры: В. 14 (с крышкой ?) / В. 24 (с крышкой ?), Д. 8 (кокос, с арматурой ?)    Характер подписи: Т-162 (О. поддон) ?; Вр-610 (О. поддон) ?    Ссылка на каталоги / инвентари: Состояние: поломан (?); после реставрации."
15630,2016-06-14T09:46:22Z,Н.М. Кулакова    Автор: П.А. Черниенко,,,80,30,60,,"Размеры: В.60, Дл.80, Ш.30    Инвентарный номер: 43642"
21330,2019-03-19T13:28:42Z,"МОКМ КП-2586 Песчаник с прожилками кварца. Минерал, размер не зафиксирован. Поступление 1969 г.",РАЗНОЕ,Объект является культурной ценностью,,,,Не зафиксировано,Не зафиксировано
23139,2023-03-13T11:29:42Z,"Медаль «В память освобождения крестьян». 1861 г. Металл, литьё, чеканка. Диаметр - 35 мм. РЯМЗ КП-1505 Н-571/9 ГК-37806301",,Объект является культурной ценностью,,,,"незначительные повреждения (налет окиси, потертость).",-
2869,2016-06-14T09:44:43Z,Линия фронта (название придуманное); Фронтовая сцена (название употребляемое)    Автор: Поленов Василий Дмитриевич (художник)    Школа / Место издания: Россия    Период оригинала: 4 четверть 19 век ?,ЖИВОПИСЬ,,30,12,,,"Размеры: В. 30, Ш. 12 (приблизительно) / В. 40, Ш. 15 (приблизительно)"
21884,2020-08-19T11:35:59Z,"ШКМ КП-372/1. Номер по ГК 14790966. Знак Название: ""60 лет Омского ССРЗ 1920-1980"". подлинник Датировка: 1980 Место создания: СССР Материал: металл Техника: штамповка Размеры: Д 60мм.",ПРЕДМЕТЫ ФАЛЕРИСТИКИ И СФРАГИСТИКИ,Объект является культурной ценностью,,,,Без видимых дефектов,нет
8728,2016-06-14T09:45:44Z,Гробница с мужской фигурой    Автор: Неизвестный скульптор второй половины XIX века,,,,17,,,"Размеры: B. 20, Ш. 17"
22760,2021-04-28T12:41:15Z,"Икона «Богоматерь с младенцем». Х1Х в. Дерево, 62х71 см ГРМ 1388 Сообщение № 2201 с пульта охраны от 31 августа 1992 г. Акт музея по поводу хищения икон из экспозиции, обращение в РУВД- 31.08. 1992 г. Справка от 05.01. 97 г. следственного отдела Городецкого РУВД о приостановлении уголовного дела Справка Городецкого РУВД о прекращении уголовного дела № 60002 от 31. 10. 2002 г.",ИКОНА,Объект является культурной ценностью,,,,нет,нет
3895,2016-06-14T09:44:55Z,Четыре избранных сюжета (название придуманное)    Автор: Аноним (иконописец)    Школа / Место издания: Россия,ИКОНА,,45,40,,,"Стиль: Золочение: Левкас под золото, позолота    Размеры: В. 45, Ш. 40 (приблизительно) / В. 40, Ш. 45 (приблизительно)"
13953,2016-06-14T09:46:08Z,Пепельница,,,15,6,,,"Размеры: В. 15.0, Ш. 6.0"
13153,2016-06-14T09:46:02Z,Карточка поздравительная,,,,,,,
2394,2016-06-14T09:44:38Z,Механизаторы (название придуманное)    Автор: Сухоруков Степан Маркович (художник)    Школа / Место издания: Россия    Период оригинала: 2 четверть 20 век; 3 четверть 20 век,ЖИВОПИСЬ,,188,127,,,"Размеры: В. 188, Ш. 127 (приблизительно, без обрамления) ? / В. 127, Ш. 188 (приблизительно, без обрамления) ?    Ссылка на каталоги / инвентари: ЧГОМ: № 287"
15431,2016-06-14T09:46:19Z,"Interieur au piano    Автор: Иван Пунин (Jean Pougny)    Школа / Место издания: Россия - Франция    Период оригинала: 2 четверть, 20 век",ЖИВОПИСЬ,,35.2,25.2,,,"Размеры: В.25.2, Д.35.2 см."
11662,2016-06-14T09:45:52Z,Копилка,,,17,10.5,,,"Размеры: В. 17.0, Ш. 10.5"
18538,2016-06-14T09:46:45Z,Тальвар,ОРУЖИЕ ХОЛОДНОЕ,,864,,,,"Размеры: общая длина - 864 мм, длина клинка - 756 мм"
9347,2016-06-14T09:45:39Z,Икона «Предтеча Крылатый»    Автор: Неизвестный художник,,,,53,,,"Размеры: B. 156, Ш. 53    Инвентарный номер: Инв. №5. Старый инв. № 273"
13693,2016-06-14T09:46:06Z,Фотография родных императрицы Марии Федоровны,,,,,,,
20562,2018-12-25T13:29:23Z,МОКМ КП-1319/25 Образец денежного знака царской России. Бумага. Поступление [1947 г.],ПРЕДМЕТЫ НУМИЗМАТИКИ И БОНИСТИКИ,Объект является культурной ценностью,,,,Не зафиксировано,Не зафиксировано
8735,2016-06-14T09:45:33Z,Лесные тени    Автор: Григорьев К.,,,,102,,,"Размеры: B. 51, Ш. 102    Инвентарный номер: Инв. № 137"
18211,2016-06-14T09:46:36Z,рисунок Константа Пермеке    Автор: Констант Пермеке (Сonstant PERMEKE),,,52,35,,,"Размеры: В. 52, Ш. 35    Ссылка на каталоги / инвентари: в ночь с 30 на 31 марта 2011 г. из частной коллекции похищены картины"
6328,2016-06-14T09:45:16Z,Избранные сюжеты (название придуманное)    Автор: Аноним (иконописец)    Школа / Место издания: Россия ?,,,18,,,,"Стиль: Дерево ?    Размеры: В. 18 (доска, в окладе ?)    Ссылка на каталоги / инвентари: В источнике не указаны сцены / сюжеты, техника и материал, требуется уточнение."
20545,2018-12-25T12:48:13Z,"МОКМ КП-314/9 Образец горной породы. Из коллекции, собранной Показаньевым. Минерал, размер не зафиксирован. Поступление 1955 г.",РАЗНОЕ,Объект является культурной ценностью,,,,Не зафиксировано,Не зафиксировано
3069,2016-06-14T09:44:46Z,Избранные Святые (название употребляемое)    Автор: Аноним (иконописец)    Школа / Место издания: Россия ?,ИКОНА,,70,45,,,"Размеры: В. 70, Ш. 45 (приблизительно)"
16160,2016-06-14T09:46:26Z,Монета 1 копейка    Период оригинала: 2 четверть 19 век - 1 четверть 20 век,,,,,,,
8099,2016-06-14T09:45:31Z,На ферме (название придуманное); Девушки с флягой (название последнее)    Автор: Аноним (скульптор) ?; Аноним (модельщик)    Школа / Место издания: Россия    Аноним (литейщик)    Период оригинала: 20 век ?,,,25,46,53,,"Размеры: В. 53, Ш. 46, Гл. 25 / В. 53, Ш. 25, Гл. 46 / В. 46, Ш. 25, Гл. 53    Ссылка на каталоги / инвентари: ЧГОМ: № 31 (скульптура)"
14440,2016-06-14T09:46:11Z,Штамп,,,15.2,8,,,"Размеры: Дл. 15.2, В. 8.0"
15014,2016-06-14T09:46:18Z,Царь Салтан    Автор: Кочупалов    Школа / Место издания: Россия Палех,,,20,12,,,"Размеры: В. 12; Дл. 20    Характер подписи: Кочупалов, с. Палех и год создания    Ссылка на каталоги / инвентари: На внутренней стороне крышки имелся инвентарный номер фонда оригиналов училища. Практически все работы имели механические повреждения, трещины, царапины, сколы. Точного описания повреждений работ не имели.    Инвентарный номер: № 405"
17894,2016-06-14T09:46:39Z,Св. Гваделупа (название придуманное); Дева Мария Гваделупская (название предполагаемое)    Период оригинала: 18 век,ЖИВОПИСЬ,,165,109,,,"Размеры: В. 165, Ш. 109"
14356,2016-06-14T09:46:11Z,Стакан,,,9.2,12,,,"Размеры: В. 12.0,  Д. 9.2"
20159,2018-12-04T13:57:09Z,"МОКМ КП-41 Аурипигмент. Минерал, размер не зафиксирован. Поступление до 1955 г.",РАЗНОЕ,Объект является культурной ценностью,,,,Не зафиксировано,Не зафиксировано
11530,2016-06-14T09:45:51Z,Внешний вид Гатчинского дворца и собственного сада,,,14.5,10.5,,,"Размеры: В. 14.5, Ш. 10.5"
260,2016-06-14T09:44:17Z,"Святая Троица (название употребляемое); Пресвятая Троица (название старое);  Троица Ветхозаветная (название придуманное); Явление Аврааму трех ангелов (название изначальное); Троица Ветхозаветная в бытии с хождением (название последнее)    Автор: Аноним (иконописец); Истомин Назарий (круг, приписано); Аноним (подновление)    Школа / Место издания: Россия, Москва # Россия, Устюжна ?    Период оригинала: 16 век; 1 четверть 17 век; 4 четверть 17 век; 19 век (подновления)",ИКОНА,,121.5,95.5,,,"Стиль: Дерево: доска липовая; Золотистый: фон, Золочение?; Желтый: охряной, поля; Прямоугольник вертикальный    Размеры: В. 121.5, Ш. 95.5 (без полей ?); В. 129, Ш. 101 (доска ?)    Ссылка на каталоги / инвентари: Устюжна: с. 27; Устюжна/1995: илл. 220    Ссылка на каталоги / инвентари: Фото: фото 1 (см. Ссылку);  ксерокопия фото из реставрационного паспорта -  фото 2; из Пинакотеки - фото 3.  В источниках информации не содержатся данные  о надписях.  Состояние:  поновления (фигуры Авраама и Сарры переписаны заново, 19 век); после реставрации (ВСНРПМ, 1976; 1980 по акту)"
10898,2016-06-14T09:46:14Z,Пузырек,,,8.5,4,,,"Размеры: В. 8.5, Ш. 4.0"
10872,2016-06-14T09:46:14Z,Спичечница,,,12.5,5.5,4.5,,"Размеры: Дл. 12.5, Ш. 5.5, В. 4.5"
12844,2016-06-14T09:46:00Z,Датский принц с женой и двумя детьми,,,14,14,,,"Размеры: В. 14.0, Ш. 14.0"
6087,2016-06-14T09:45:17Z,"Иисус Вседержитель (название употребляемое); Иисус Христос Вседержитель (название изначальное); Спас Вседержитель (название придуманное)    В русском оригинале (переводе): Пантократор (греческий, название изначальное)    Автор: Аноним (иконописец)    Школа / Место издания: Россия ?",,,100,85,,,"Размеры: В. 100, Ш. 85 (доска, в окладе ?)    Ссылка на каталоги / инвентари: В источнике не указаны техника, материал и иконография, требуется уточнение."
2590,2016-06-14T09:44:42Z,Проспект  Победы в Грозном (название изначальное)    Автор: Шустер Иван Петрович (художник)    Школа / Место издания: Россия    Период оригинала: 3 четверть 20 век,,,,,,,"Ссылка на каталоги / инвентари: ХУДОЖНИКИ ЧЕЧЕНО-ИНГУШЕТИИ: с. 18    Ссылка на каталоги / инвентари: Фото: Предмет 3.  В источнике не указана техника, основа, размеры."
19761,2018-09-12T07:16:36Z,"Медальон в металлической оправе (агатовый). 19 век. Камея овальная с погрудным портретом неизвестной дамы, выполненным из раковины, заключена в овальную латунную оправу. В верхней части имеется кольцо для крепления. Агат, латунь. 110х100 мм. ПМ КП 1311","ЗОЛОТО, СЕРЕБРО / ЮВЕЛИРНОЕ ИЗДЕЛИЕ",Объект является культурной ценностью,,,,Без видимых повреждений,нет
