id,registration,name,category,сultural_property,height,width,depth,preservation,description
19857,2018-11-09T07:03:17Z,"Моллюск двустворчарый Inoceramus aucella,K1h2., 1шт., 12.5х25см., инв№ 160",ОБРАЗЦЫ ФЛОРЫ И ФАУНЫ,Объект является культурной ценностью,,,,хорошая,УПМ 160
18549,2016-06-14T09:46:45Z,Шлем,,,292,,,,"Стиль: чеканка, клепка, слесарные работы    Размеры: диаметр - 212 мм, высота - 292 мм."
9539,2016-06-14T09:45:41Z,"Икона «Иоанн Богослов""    Автор: Неизвестный художник",,,,45,,,"Размеры: B. 44, Ш. 45    Инвентарный номер: Инв. .№30. Старый Инв. № 675"
7199,2016-06-14T09:45:23Z,"Проект оборотной стороны юбилейной медали 250-летия основания Санкт-Петербурга (название рукописное; русский; лицевая сторона)    Автор: Зарецкий Николай Васильевич (художник)    Школа / Место издания: Россия, Германия, Чехия, Франция    Период оригинала: середина 20 век",РИСУНОК,,35.1,24.8,,,"Размеры: В. 35.1, Ш. 24.8 (в свету ?, лист ?)    Характер подписи: Н. ЗаръцкIй.    Характер подписи: рисовал [...]  1953. (П.)    Ссылка на каталоги / инвентари: Герра Р. / ГТГ: с. 84, с. 35 - кат. 100"
14874,2016-06-14T09:46:17Z,"Портрет Николая II и Александры Федоровны/Олеография    Период оригинала: 19 век, 4 четверть",,,,,,,Инвентарный номер: ЭКМ 7558/7557
19530,2018-09-07T10:27:17Z,"Лампа миниатюрная МН-12-0,15. СССР. Стекло. ПМ КП 13664/85",РАЗНОЕ,Объект является культурной ценностью,,,,Без видимых повреждений,Нет данных
15441,2016-06-14T09:46:19Z,Портрет Ан - Сон - Хи    Автор: Костромитин А.Н.    Период оригинала: 3 четверть 20 век,,,50,35,55,,"Размеры: В.55, Дл.50, Ш. 35см.    Инвентарный номер: С - 65, КП - 1830"
14733,2016-06-14T09:45:46Z,"Иоанн Предтеча    Период оригинала: 19 век, 4 четверть",ИКОНА,,18,9.1,,,"Размеры: В. 18,0, Ш. 9,1, Вес 161,60 г    Характер подписи: Хлебниковъ; в овале – 88 проба и герб города Санкт-Петербурга и двуглавый орел.    Ссылка на каталоги / инвентари: КП ОИРК 148-1959. Поступление из ГМЭ (Акт №206, от 27. 04. 1950). Старые №№: 117-49    Инвентарный номер: ЭРО-6536, СВ-1095"
7673,2016-06-14T09:45:25Z,Автор: Аноним (мастер)    Школа / Место издания: Россия ?; Западная Европа ?    Период оригинала: 18 век; 19 век,,,5,,,,Размеры: В. 5 / В. 6 ; Пр. 545 Серебро    Ссылка на каталоги / инвентари: Фото: см. Документ-основание
13235,2016-06-14T09:46:03Z,Божия Матерь. Образ,,,10.7,13.5,,,"Размеры: В. 10.7, Ш. 13.5"
14208,2016-06-14T09:46:10Z,Английская королева Александра,,,,,,,
9384,2016-06-14T09:45:40Z,Религиозная картина «Царь Птолемей»    Автор: Неизвестный художник,,,,78,,,"Размеры: B. 94, Ш. 78    Инвентарный номер: Инв. №35. Старый инв. № 233"
9233,2016-06-14T09:45:39Z,Пейзаж (Этюд)    Автор: Серов Валентин Александрович (?),ЖИВОПИСЬ,,,76,,,"Размеры: B. 61, Ш. 76    Инвентарный номер: Инв. №90. Инв. №811 и №1244 по ИК ВКМ"
18527,2016-06-14T09:46:44Z,Знак ордена Святого Станислава 2-й степени    Автор: Павел Андреев    Период оригинала: XIX в.,,,,,,,"Стиль: Знак ордена Святого Станислава 2-й степени с Императорской короной и мечами. На ушке - клейма: именное ""ПА"", ""герб Санкт-Петербурга"", пробирные ""56"". На петле короны для ленты - клейма: ""ПА"", ""герб Санкт-Петербурга"", ""56"". Изготовлен по моде того времени - плоский с черной (темно-красной) эмалью.    Размеры: 76Х50 см, вес - 22,6 гр."
9468,2016-06-14T09:45:40Z,Религиозная картина «Чистота»    Автор: Неизвестный художник,,,,77,,,"Размеры: B. 95, Ш. 77    Инвентарный номер: Инв. №19. Старый инв. № 234"
13565,2016-06-14T09:46:05Z,Кн. Елизавета Федоровна,,,19.8,32.5,,,"Размеры: В. 19.8, Ш. 32.5"
1172,2016-06-14T09:44:29Z,"Вниз по матушке, по Волге (название изначальное)    Автор: Голиков Иван Иванович (художник)    Школа / Место издания: Россия, Палех    Художественно-производственные мастерские Палехского отделения Худфонда РСФСР    Период оригинала: 2 четверть 20 век",ЖИВОПИСЬ,,4,3,2.5,,"Стиль: Золото: роспись    Размеры: В. 2.5, Дл. 4, Ш. 3 (предмет) / В. 2.4 , Дл. 3.6, Ш. 3.1(предмет); В. 3, Ш. 4 (крышка, сцена) / В. 3.1, Ш. 3.6 (крышка, сцена)    Характер подписи: И.Голиков (золотом, крышка)    Характер подписи: 38 (золотом, крышка, слева ?); с.Палех 1926 г. (П., золотом, крышка, справа ?); Вниз по матушке, по Волге, по широкому раздолью [...] (в одну строку, бордюром вокруг картинки, крышка)    Ссылка на каталоги / инвентари: ПАЛЕХ: илл. б/н (1925)    Ссылка на каталоги / инвентари: Фото: № 2; № 1 - см. Ссылку (вариант).  Крышка откидная."
21465,2019-09-20T07:08:00Z,"МОКМ КП-2241/357 Предмет из археологической коллекции Липовского В.С., собранной учащимися Палаткинской школы. Поступление 1956 г.",РАЗНОЕ,Объект является культурной ценностью,,,,Не зафиксировано,Не зафиксировано
2824,2016-06-14T09:44:45Z,Богоматерь с младенцем по центру туловища (название придуманное)    Автор: Аноним (художник)    Школа / Место издания: Россия    Период оригинала: 19 век ?,ИКОНА,,33,94,,,"Стиль: Масло ?    Размеры: В. 33, Ш. 94 (диптих, в обрамлении ?)    Ссылка на каталоги / инвентари: Фото: № 2, № 1-диптих."
16770,2016-06-14T09:46:35Z,"Сборник решений Правительственного Совета за 1864-75 гг., Т. 1",,,,,,,"Инвентарный номер: КП-2700/7101, МБ 314"
2966,2016-06-14T09:44:47Z,Богородица (название старое); Богоматерь (название употребляемое)    Автор: Аноним    Школа / Место издания: Россия ?    Период оригинала: 18 век,ИКОНА,,40,42,,,"Размеры: В. 40, Ш. 42 (приблизительно) / В. 42, Ш. 40 (приблизительно)"
40,2016-06-14T09:44:15Z,"Южный пейзаж / Цветник (название двойное, название придуманное)    Автор: Рылов Аркадий Александрович (художник)    Школа / Место издания: Россия    Период оригинала: 4 четверть 19 век; 1 половина 20 век",ЖИВОПИСЬ,,67,89,,,"Стиль: Прямоугольник горизонтальный; Красный, Желтый: цветы кустарников; Белый: стена забора    Размеры: В. 67, Ш. 89 (без обрамления)    Ссылка на каталоги / инвентари: В источнике информации не содержатся данные о  периоде/ дате, наличии  подписи, надписей ."
2012,2016-06-14T09:44:41Z,Утро на озере (название придуманное)    Автор: Ломтюгин Н.Ф. (художник); Лапшин Николай Федорович (художник) ?    Школа / Место издания: Россия    Период оригинала: 20 век ?,ЖИВОПИСЬ,,68,40,,,"Размеры: В. 68, Ш. 40 (картон ?) ? / В. 40, Ш. 68 (картон ?) ?    Ссылка на каталоги / инвентари: ЧГОМ: № 193    Ссылка на каталоги / инвентари: В источнике: Ломтюгин  Н.Ф. (?)"
21908,2020-08-19T11:49:11Z,"ШКМ КП -393. Номер по ГК 14792299. Кредитный билет Название: ""Три рубля"". АЧ 418889, подлинник Датировка: 1905 Место создания: СССР Материал: бумага Техника: печать Размеры: 15.3х10см.",ПРЕДМЕТЫ НУМИЗМАТИКИ И БОНИСТИКИ,Объект является культурной ценностью,,,,"Помят, следы сгибов, чернильные пятна",нет
17524,2016-06-14T09:46:37Z,Орден Красной Звезды №496419,,,,,,,Инвентарный номер: КИКМ №2697
1909,2016-06-14T09:44:35Z,Приезд раджи (название придуманное)    Автор: Зоммер Рихард-Карл Карлович (художник)    Школа / Место издания: Россия    Период оригинала: 19 век,,,60,80,,,"Размеры: В. 60, Ш. 80 (в обрамлении ?)"
3664,2016-06-14T09:44:53Z,Три святителя (название употребляемое)    Автор: Аноним (иконописец)    Школа / Место издания: Россия    Период оригинала: 19 век,ИКОНА,,60,40,,,"Размеры: В. 60, Ш. 40 (приблизительно) / В. 40, Ш. 60 (приблизительно)"
9488,2016-06-14T09:45:40Z,Икона «Божия Матерь Владимирская»    Автор: Неизвестный художник,,,,53,,,"Размеры: B. 88, Ш. 53    Инвентарный номер: Инв. №21. Старый инв. № 1119"
2132,2016-06-14T09:44:41Z,"Пейзаж /  Горы (название употребляемое, название двойное)    Автор: Авсаджанов Георгий Дмитриевич (художник, приписано)    Школа / Место издания: Россия, Северный Кавказ    Период оригинала: середина 20 век; 2 половина 20 век",ЖИВОПИСЬ,,44,70,,,"Размеры: В. 44, Ш. 70 (картон ?) / В. 44, Ш. 60 (картон ?)    Ссылка на каталоги / инвентари: ЧГОМ: № 499 (494 п.ф.)    Ссылка на каталоги / инвентари: В источнике размеры ширины запечатан ( 60/70), требуется уточнение."
8811,2016-06-14T09:45:39Z,Пейзаж    Автор: Соловьев Лев Григорьевич,,,,13,,,"Размеры: B. 19, Ш. 13    Инвентарный номер: Инв. № 406. 7748/77"
15695,2016-06-14T09:46:22Z,Воскресение Христово,,,120,90,,,"Размеры: В.120, Ш.90 см."
12833,2016-06-14T09:46:00Z,Линейка,,,0.325,,,,"Размеры: Дл. 0,325"
8557,2016-06-14T09:45:44Z,"Вид реки Воронеж у шлюза    Автор: Соловьев, Лев Григорьевич",ЖИВОПИСЬ,,,,,,Ссылка на каталоги / инвентари: Поступило: Дар автора в 1909 г.
16247,2016-06-14T09:46:23Z,Орден Ленина,,,,,,,Инвентарный номер: 317471
23323,2023-03-13T11:55:54Z,"Монета восточная. кон. XIX в. Персия. Серебро, чеканка. Диаметр - 23 мм., вес - 4,6 г. РЯМЗ КП-11635 Н-4274 СА-284 ГК-38157209",,Объект является культурной ценностью,,,,"потертость, пятна.",-
12941,2016-06-14T09:46:01Z,Тетрадь,,,17.8,22.5,,,"Размеры: В. 17.8, Ш. 22.5"
15550,2016-06-14T09:46:26Z,За оборону Порт-Артура,,,,,,,Инвентарный номер: КП 3786
4848,2016-06-14T09:45:03Z,Автор: Аноним (мастер)    Школа / Место издания: Россия ?    Период оригинала: 19 век,,,17,13,,,"Размеры: В. 17, Ш. 13"
14863,2016-06-14T09:45:43Z,Лампада,,,7.5,12,,,"Размеры: В. 12, Д. 7,5    Инвентарный номер: 2450"
8493,2016-06-14T09:45:43Z,Антиминс. Подписан преосвященником Тобольским и Сибирским Варлаамом в церковь Иоанна Златоуста в Миясскую слободу Рафаиловского заказа.    Автор: ? (гравер)    Школа / Место издания: Россия    Период оригинала: 18 век 3 четверть; Дата: 1769 г.,ОТТИСК,,65,52,,,"Размеры: В. 52; Дл. 65    Ссылка на каталоги / инвентари: На сгибах потерт, загрязнен. Поступил по акту № 3а от 07.10.1946 г."
12138,2016-06-14T09:45:55Z,Стакан,,,10,65,,,"Размеры: В. 10.0, Ш. 65.0"
18996,2017-03-02T14:36:20Z,"Икона ""Сорок Мчеников Севастийских"", 19 век",ИКОНА,Объект является культурной ценностью,39,30,,,
14899,2016-06-14T09:46:17Z,Нагрудный знак Союза русского народа,,,5.5,3.5,,,"Размеры: Д.5,5, Ш. 3,5    Инвентарный номер: КОМК 2519"
20625,2018-12-27T08:50:49Z,МОКМ КП-1612/104 Предмет из археологической коллекции В.В. Леонтьева из Уэлена. Кость. Поступление до 1968 г.,РАЗНОЕ,Объект является культурной ценностью,,,,Не зафиксировано,Не зафиксировано
5685,2016-06-14T09:45:11Z,Распятие Иисуса Христа (название изначальное)    Автор: Аноним    Школа / Место издания: Россия ?,,,10,15,,,"Стиль: Дерево ?    Размеры: В. 10, Ш. 15 (доска ?) / В. 15, Ш. 10 (доска ?)"
4210,2016-06-14T09:44:56Z,Святой Илия Пророк  (название изначальное); Житие Ильи Пророка (название употребляемое)    Автор: Аноним    Школа / Место издания: Россия,,,,,,,
7626,2016-06-14T09:45:24Z,Все Святые (название употребляемое); Святые года (название предполагаемое)    Автор: Аноним (иконописец)    Школа / Место издания: Россия ?,,,130,60,,,"Стиль: Дерево ?; Синий: голубой, тыльная сторона    Размеры: В. 130, Ш. 60 (доска ?)    Ссылка на каталоги / инвентари: В источнике не указаны иконография, датировка, материал и техника, требуется уточнение."
22203,2020-09-03T15:48:28Z,"ШКМ КП-1255/90. Номер по ГК 14797680. Монета Название: ""5 пфеннигов"". Датировка: 1909 Место создания: Германия Материал: металл Техника: чеканка Размеры: Д-18мм",ПРЕДМЕТЫ НУМИЗМАТИКИ И БОНИСТИКИ,Объект является культурной ценностью,,,,Потерта,нет
10489,2016-06-14T09:45:47Z,Подкова,,,0.125,,,,Размеры: Дл. 0.125
13886,2016-06-14T09:46:07Z,Цветы,,,24.7,17.1,,,"Размеры: В. 24.7, Ш. 17.1"
4826,2016-06-14T09:45:03Z,Николай Угодник (название старое); Святой Николай Чудотворец (название изначальное)    Автор: Аноним (иконописец)    Школа / Место издания: Россия    Период оригинала: 19 век,,,25,20,,,"Стиль: Дерево поделочное    Размеры: В. 25, Ш. 20 (доска)"
7476,2016-06-14T09:45:25Z,Святой Николай Чудотворец (название изначальное); Никола Святитель (название употребляемое)    Автор: Аноним (иконописец)    Школа / Место издания: Россия ?,,,40,50,,,"Стиль: Дерево ?    Размеры: В. 40, Ш. 50 (доска ?) / В. 50, Ш. 40 (доска ?)    Ссылка на каталоги / инвентари: В источнике не указаны датировка, материал и техника, требуется уточнение."
2117,2016-06-14T09:44:42Z,Паганини (название придуманное)    Автор: Мишин Олег Михайлович (художник)    Школа / Место издания: Россия    Период оригинала: середина 20 век,,,,,,,"Ссылка на каталоги / инвентари: ХУДОЖНИКИ ЧЕЧЕНО-ИНГУШЕТИИ: с. 16    Ссылка на каталоги / инвентари: Фото: Предмет 7.  В источнике не содержатся сведения о технике, основе, размерах."
6571,2016-06-14T09:45:18Z,Святой Николай Чудотворец (название изначальное); Николай Угодник (название старое)    Автор: Аноним (иконописец)    Школа / Место издания: Россия ?,,,30,20,,,"Размеры: В. 30, Ш. 20 (доска, в окладе ?) / В. 20, Ш. 30 (доска, в окладе ?)"
20023,2018-11-30T12:32:57Z,"Свидетельство Победителю соцсоревнования коллективу совхоза ""Волжанка"",14.04.1988г.,инв № 449.",РАЗНОЕ,Объект является культурной ценностью,,,,хорошая,УПМ 449
20890,2019-03-05T13:44:04Z,"МОКМ КП-4476 Книга. Наровчатов С.С. Узор на клинке. Данные по издательству и году издания отсутствуют. Бумага. 11,0х15,0 Поступление 1979 г.",ПЕЧАТНЫЕ ИЗДАНИЯ,Объект является культурной ценностью,,,,Не зафиксировано,Не зафиксировано
7764,2016-06-14T09:45:26Z,Библейские праздники (название придуманное); Праздники (название употребляемое)    Автор: Аноним (модельщик)    Школа / Место издания: Россия ?    Аноним (литейщик),,,10,15,,,"Размеры: В. 10, Ш. 15 (створка ?) / В. 15, Ш. 10 (створка ?)    Ссылка на каталоги / инвентари: В источнике не указаны иконография, датировка, требуется уточнение."
9841,2016-06-14T09:45:36Z,Коробочка,,,,,,,Инвентарный номер: Инв. № 236
16757,2016-06-14T09:46:35Z,Статьи к тому 15 свода законов,,,,,,,"Инвентарный номер: КП-2700/6649, МБ 29"
8192,2016-06-14T09:45:30Z,Мужик и медведь (название придуманное)    Автор: Аноним (скульптор)  ?    Школа / Место издания: Россия,,,,,,,Стиль: чугун    Ссылка на каталоги / инвентари: Состояние: ружье отломано; после реставрации (1971).
3412,2016-06-14T09:44:51Z,Спаситель (название старое); Спас (название употребляемое); Иисус Христос Вседержитель (название изначальное); Спас Вседержитель (название придуманное)    В русском оригинале (переводе): Пантократор (название изначальное; греческий)    Автор: Аноним (иконописец)    Школа / Место издания: Россия,ИКОНА,,20,15,,,"Размеры: В. 20, Ш. 15 (приблизительно)"
359,2016-06-14T09:44:20Z,Автор: Аноним (резчик)    Школа / Место издания: Россия,,,,,,,"Стиль: Рельеф: барельеф; Полихромная роспись    Ссылка на каталоги / инвентари: В источнике информации не содержатся сведения об авторе,  дате, размерах, цветах, изображениях, надписях и состоянии."
644,2016-06-14T09:44:25Z,Школа / Место издания: Польша    Фраже (фабрика)    Период оригинала: 3 четверть 19 век,РАЗНОЕ,,60,,,,"Стиль: белый металл: Латунь, Серебрение - плакирование, Серебро (""мельхиор"") ?; Дерево (ручки)    Размеры: В. 60 (с заглушкой / колпачком); Об. 5 литров ?    Характер подписи: Варшава    Характер подписи: FRAGE[T] / [W] / WARS[Z]AW[I](A)[E]  (в овальном штампе, цоколь)    Ссылка на каталоги / инвентари: Фото: 1.8./5; 1.8./5a.  Самовар грушевидной формы с 2 отогнутыми ручками, на квадратном основании /цоколе с 4 ножками, кран фигурный.  Чайник ( набор мельхиоровый) на 4 шариках в виде орлиных лап (ножки).  В источнике не содержатся сведения, подтверждающие, что предмет является самоваром.  Датировка: датировка указана неточно, т.к. не соответствует штампу, требуется уточнение.  Надписи: эксперт неверно воспроизводит штамп, требуется уточнение."
10616,2016-06-14T09:45:48Z,Кри-кри (?),,,0.04,,,,Размеры: Дл. 0.04
2716,2016-06-14T09:44:36Z,"Автор: Вальтер Карл (система, патент)    Школа / Место издания: Германия (система)    Карл Вальтер Ваффенфабрик (фирма оружейная) ?; Шпрееверке ГмбХ (фирма оружейная) ?; Маузер (фирма оружейная) ?    Период оригинала: 2 четверть 20 век (образец) ?",ОРУЖИЕ ОГНЕСТРЕЛЬНОЕ,,215,,,,"Размеры: К. 6.35 мм / К. 7.65 мм / К. 9 мм, Дл. 215, Об. 8 зарядный    Ссылка на каталоги / инвентари: ОРУЖИЕ ВЕРМАХТА: сс. 21 - 27    Ссылка на каталоги / инвентари: Состояние: выведено из боевого.  Возможно пистолет образца 1929 : известен под наименованием ""РР"" ( полицай - пистоле) различных модификаций,  в том числе более компактная ""РРК"" (полицай - пистоле - криминаль), см. Рег. № 2.1./2689, Рег. № 2.1./ 2692; или образца 1938:  известен под наименованием ""Р-38""(мог выпускаться разными фирмами Германии, см. Изготовитель).    Размеры: стандартные для ""Р-38"""
22544,2021-01-25T11:56:45Z,Денежный знак «5 рублей». СССР. 1943 г. №аА 165657. ОФ-920,ПРЕДМЕТЫ НУМИЗМАТИКИ И БОНИСТИКИ,Объект является культурной ценностью,,,,Потёрт на сгибах,аА 165657
11960,2016-06-14T09:45:54Z,Коробка,,,9.8,12.5,,,"Размеры: В. 9.8, Ш. 12.5"
