id,registration,name,category,сultural_property,height,width,depth,preservation,description
4813,2016-06-14T09:45:00Z,Житие Святых (название придуманное); Сошествие во ад / Воскресение Христово и Праздники (название последнее)    Автор: Аноним (иконописец)    Школа / Место издания: Россия    Период оригинала: 4 четверть 19 век,ИКОНА,,53.2,44.5,,,"Размеры: В. 53.2, Ш. 44.5 (доска)    Ссылка на каталоги / инвентари: В источнике запись: ""40-святым явление Христа в сиянии"".   Состояние: сильное потемнение красочного покрытия; утрата красочного слоя; отслоение левкаса в отдельных местах; вертикальная трещина на доске."
10106,2016-06-14T09:45:38Z,Чайник,,,15.5,,,,"Размеры: В. 15,5 см    Инвентарный номер: Инв. № 33"
6306,2016-06-14T09:45:19Z,Богоматерь Прибавление ума (название употребляемое); Богоматерь Подательница ума (название придуманное)    Автор: Аноним (иконописец)    Школа / Место издания: Россия ?    Период оригинала: 18 век ?; 19 век ?,ИКОНА,,19,25,,,"Стиль: Темпера: цветной однотонный (?)    Размеры: В. 19, Ш. 25 (доска) / В. 25, Ш. 19 (доска)    Ссылка на каталоги / инвентари: От редактора: другие иконографии не исключаются: Богоматерь и младенец, спеленатые вместе / т.н. Филафет - Правдолюбие, требуется уточнение."
8750,2016-06-14T09:45:33Z,Берег реки    Автор: Соловьев Лев Григорьевич,,,,19.5,,,"Размеры: B. 25,5, Ш. 19,5    Инвентарный номер: Инв. № 345. 7678/7"
20842,2019-01-21T13:08:52Z,"МОКМ КП-2241/291 Предмет из археологической коллекции Липовского В.С., собранной учащимися Палаткинской школы. Поступление 1956 г.",РАЗНОЕ,Объект является культурной ценностью,,,,Не зафиксировано,Не зафиксировано
11813,2016-06-14T09:45:53Z,Яичко сувенирное,,,,,,,
5274,2016-06-14T09:45:04Z,Святой Николай Чудотворец (название изначальное)    Автор: Аноним (иконописец)    Школа / Место издания: Россия,ИКОНА,,20,30,,,"Размеры: В. 20, Ш. 30 (доска) / В. 30, Ш. 20 (доска)    Ссылка на каталоги / инвентари: В источнике не указана техника."
15106,2016-06-14T09:46:18Z,Медный подсвечник.    Период оригинала: XVIII в.,,,21,,,,Размеры: В. 21 см    Ссылка на каталоги / инвентари: 2085/2
17907,2016-06-14T09:46:36Z,"Автор: Сербан Кретои (Serban Cretoiu)    Период оригинала: 20 век, 4 четверть",,,15,30,90,,"Размеры: В. 90, Ш. 30, Гл. 15"
9740,2016-06-14T09:45:36Z,Чашечка трехгранная,,,,,,,"Инвентарный номер: Инв. № 1023, 227-231"
14683,2016-06-14T09:45:46Z,"Богоматерь Всех Скорбящих Радость    Школа / Место издания: Россия, Санкт-Петербург",ИКОНА,,33.8,27.1,,,"Размеры: В. 33,8, Ш. 27,1, Вес 1677,7 г    Характер подписи: ""М Л I"", ""АЯ"", ""1802"", ""84"".    Ссылка на каталоги / инвентари: От Выборгского РАЙФО г. Ленинграда, № 776. КП ОИРК 2870-94. Акт № 839 от 27.12.1989 г.    Инвентарный номер: ЭРО-9817, СВ-5044"
9173,2016-06-14T09:45:35Z,Городской пейзаж    Автор: Бубнова Варвара Дмитриевна,ЖИВОПИСЬ,,,71,,,"Размеры: B. 53,5, Ш. 71    Инвентарный номер: Инв. №13. Старый инв.№156 по ИК ВКМ"
16622,2016-06-14T09:46:31Z,Пистолет-пулемет Шпагина,,,,,,,Инвентарный номер: оф. 349
21636,2020-03-13T08:24:57Z,"Монета. 1 полтинник. 1924 г Серебро. Чеканка. Размер: диаметр – 2,6 см. № по книге поступлений: ТМ КП-1726/9 № по книге спецучёта: ДМ-147 № по ГК: 14289406",ПРЕДМЕТЫ НУМИЗМАТИКИ И БОНИСТИКИ,Объект является культурной ценностью,,,,Царапины на аверсе в верхней части просверлено отверстие,нет
4722,2016-06-14T09:45:01Z,"В память Всероссийской выставки в Москве 1882 г. (название записано; оборотная сторона)    Автор: Штейнман Леопольд Христианович (медальер, резчик, аверс); Важенин Сергей (медальер, реверс)    Школа / Место издания: Россия    Монетный двор    Период оригинала: 4 четверть 19 век",,,28,,,,"Стиль: Латунь ?/ Другое ?; Круг: медаль; Овал: медальон с портретом (аверс)    Размеры: Д. 28 мм ? / Д. 46 мм (штемпель)    Характер подписи: Л. ШТЕИНМАНЪ Р. (на фоне); С. ВАЖЕНИНЪ (внизу, реверс)    Характер подписи: Александр III Александрович    Характер подписи: ИМПЕРАТОРЪ / АЛЕКСАНДРЪ III (слева и справа, в овале); 1882 Г. (реверс, см. Название)    Ссылка на каталоги / инвентари: ГМЗ РК: № 319; СМИРНОВ: № 859    Ссылка на каталоги / инвентари: Описание составлено по каталогу, см. Ссылку.  В источнике указан размер: Д. 28 мм, не соответствующее каталоге, требуется уточнение."
9037,2016-06-14T09:45:35Z,Нарукавник    Автор: Неизвестный мастер,,,,,,,Инвентарный номер: Инв. №44. Старый инв. №1210
19695,2018-09-11T14:52:17Z,"План лекции к.х.н. Семишина В.И. ""Периодический закон Д.И. Менделеева и новые элементы - 97 и 98"". СССР, г. Москва. 1950 г. 22 октября. На 12 листах. Бумага. Машинопись. 30,0х20,0 см. ПМ КП 29027/162",ПЕЧАТНЫЕ ИЗДАНИЯ,Объект является культурной ценностью,,,,Бумага пожелтела,Нет данных
15185,2016-06-14T09:46:27Z,"Газеты ""Пионерская правда"", ""Молодой большевик"" (8 шт.)    Период оригинала: 1 половина, 20 век",,,,,,,
19689,2018-09-11T14:52:17Z,"Оттиск статьи Н.Д. Зелинского ""Металлизирование организмов"". Россия. 1922 г. На четырёх листах. Типографский экземпляр с правкой, карандаш, чернила. Статья опубликована: журнал ""Природа"", 1922, № 8-9. Бумага. 28,2х21,0 см. ПМ КП 30467/16",ПЕЧАТНЫЕ ИЗДАНИЯ,Объект является культурной ценностью,,,,"Бумага пожелтела, загрязнена, края обложки потемнели, по левому краю – отверстия от дырокола, вверху – следы проколов",Нет данных
349,2016-06-14T09:44:22Z,Воскресение - Сошествие во ад с двунадесятыми праздниками (название употребляемое); Сошествие во ад / Воскресение Христово и Праздники (название последнее)    Автор: Аноним (список); ? (с оригинала)    Школа / Место издания: Россия    Период оригинала: 4 четверть 19 век,,,124,80,,,"Стиль: Темпера ?; С окладом: сплошной желтый металл / Медь ?,  Латунь ?, Штамповка ?; Прямоугольник вертикальный    Размеры: В. 124, Ш. 80 (в окладе ?)    Ссылка на каталоги / инвентари: В источнике не содержатся сведения  о технике и материалах, надписях."
23500,2023-09-12T12:21:25Z,"МПББ ОФ-487/1 ОС-22 Эполет русский офицерский. Россия. Первая четверть XIX века. Золотая рогожка, галун, бахрома",,Объект является культурной ценностью,,,,Общее загрязнение.,Клейма отсутствуют.
9537,2016-06-14T09:45:41Z,Икона «Введение во храм»    Автор: Неизвестный художник,,,,42,,,"Размеры: B. 76, Ш. 42    Инвентарный номер: Инв. №28. Старый инв. № 255"
7450,2016-06-14T09:45:29Z,"Евангелие (название изначальное)    Автор: Аноним (мастер, ювелир, оклад)    Школа / Место издания: Россия    Период оригинала: 1 четверть 20 век",,,45,32,,,"Стиль: Латунь ?/ Медь ?/ Другое ? (оклад)    Размеры: В. 45, Ш. 32 (не менее)    Ссылка на каталоги / инвентари: Фото: имеется видеозапись, требуется запрос.  Состояние: после реставрации (1990), 2 металлические заплатки на окладе."
705,2016-06-14T09:44:14Z,Автор: Аноним (художник)    Школа / Место издания: Россия ?,СТЕКЛО,,20,,,,Размеры: В. 20    Ссылка на каталоги / инвентари: В источнике: с отделкой в виде инея.
20215,2018-12-05T13:23:53Z,"МОКМ КП-96 Углистый сланец. Камень, размер не зафиксирован. Поступление 1934 г.",РАЗНОЕ,Объект является культурной ценностью,,,,Не зафиксировано,Не зафиксировано
8235,2016-06-14T09:45:30Z,Тройственный Союз (название изначальное)    Автор: Толстой Федор Петрович (скульптор); Аноним (модельщик)    Школа / Место издания: Россия    Касли (завод чугуноплавильный)    Период оригинала: 19 век ?,,,,,,,"Ссылка на каталоги / инвентари: Фото: образец, см. Источники."
21116,2019-03-14T12:25:53Z,"МОКМ КП-2241/348 Предмет из археологической коллекции Липовского В.С., собранной учащимися Палаткинской школы. Поступление 1956 г.",,Объект не является культурной ценностью,,,,Не зафиксировано,Не зафиксировано
16986,2016-06-14T09:46:34Z,"Исторический Вестник. Т. СXIV, ноябрь",,,,,,,"Инвентарный номер: КП-2700/146, МБ 698"
12122,2016-06-14T09:45:55Z,Коробочка,,,3,3.3,,,"Размеры: В. 3.0, Ш. 3.3"
6629,2016-06-14T09:45:22Z,"Пора капели (название придуманное); Весна (название употребляемое)    Автор: Никиреев С.М. (художник, гравер ?)    Школа / Место издания: Россия    Период оригинала: 20 век",ОТТИСК,,,,,,Стиль: Гравюра на металле: офорт
17525,2016-06-14T09:46:37Z,"Медаль ""За освобождение Белграда""",,,3.2,,,,"Размеры: Д. 3,2    Инвентарный номер: КП №5097/14"
23437,2023-03-13T12:13:18Z,"Монета 10 копеек. 1828 г. Россия. Серебро, чеканка. Диаметр - 17 мм., вес - 1,7 г. РЯМЗ КП-55665 Н-11822 СА-469 ГК-38156928",,Объект является культурной ценностью,,,,потертость.,-
19724,2018-09-11T14:59:09Z,"Фотографии на паспарту ""Экспозиции отделов Политехнического музея (горного, энергетики, металлургии, радио)"". СССР, г. Москва, 1950 г. (?). На шести листах. Фотобумага. 75х30 см. ПМ КП 15263/21",РАЗНОЕ,Объект является культурной ценностью,,,,Без видимых повреждений,Нет данных
20957,2019-03-06T14:57:12Z,"МОКМ КП-3030/1 Алык - упряжь на собак. Кожа, размер не зафиксирован. Поступление 1974 г.",РАЗНОЕ,Объект является культурной ценностью,,,,Не зафиксировано,Не зафиксировано
20277,2018-12-05T14:27:57Z,"Конкреция известняковая с жеодами кальцита,С., 1шт.,7.5х6х3.8см.,инв. № 1879.",РАЗНОЕ,Объект является культурной ценностью,,,,"хорошая: конкреции, неполная - кристаллы имеют трещины.",УПМ 1879
20199,2018-12-05T13:04:19Z,"МОКМ КП-41 Аурипигмент. Минерал, размер не зафиксирован. Поступление до 1955 г.",РАЗНОЕ,Объект является культурной ценностью,,,,Не зафиксировано,Не зафиксировано
5950,2016-06-14T09:45:06Z,"Автор: Аноним (мастерская)    Школа / Место издания: Россия, Северный Кавказ    Период оригинала: 1 четверть 20 век",,,30,18,,,"Стиль: Шелк: Красный, темный, креп;  Серебро / Золоченое серебро: Литье, Штамповка ?, застежки;  Шкура / кожа / кож.выделка: подкладка    Размеры: Дл. 30, Ш. 18 (нагрудник); Ш. 15 (пары застежек); Об. 14 пар (одинаковые застежки); Об. 1 пара (верхняя застежка)"
2783,2016-06-14T09:44:45Z,Женский портрет (название употребляемое)    Автор: Аноним (художник)    Школа / Место издания: Западная Европа    Период оригинала: 17 век ?; 18 век?; 19 век ?,ЖИВОПИСЬ,,12.5,9.5,,,"Стиль: Хлопок ?/ Лен ?    Размеры: В. 12.5, Ш. 9.5 (без обрамления)"
237,2016-06-14T09:44:19Z,"Цветочница (название придуманное); Продавщица цветов (название последнее); Цветочная лавка (название употребляемое)    Автор: Ван дер Мийн Герман (художник)    Школа / Место издания: Нидерланды / Голландия ?, Бельгия / Фландрия ?    Период оригинала: 1 четверть 18 век; 2 четверть 18 век",ЖИВОПИСЬ,,,,,,"Стиль: Прямоугольник вертикальный;    Ссылка на каталоги / инвентари: Наше наследие 1991/2, с.51    Ссылка на каталоги / инвентари: НЦБ ИП: техника, основа, размеры не указаны."
903,2016-06-14T09:44:26Z,Большой мамонт (название придуманное),,,16,,,,"Стиль: Коричневый : темный; Красный: темно-бордовый.    Размеры: Д. 16, Дл. 280 (предельные),  Вес 80 кг    Ссылка на каталоги / инвентари: Фото: 2.1./791а   Состояние: кончик бивня обломан и не затерт, в средней части подломлен поперечной трещиной."
16012,2016-06-14T09:46:25Z,Бритва безопасная,,,4,4.1,,,"Размеры: Дл.4, Ш.4.1 см.    Ссылка на каталоги / инвентари: МУК ""Литературно-мемореальный музей А.П. Гадара г. Арзамаса"". 607220, Нижегородская область, г. Арзамас, ул. Космонавтов, д. 39 а    Инвентарный номер: 4162"
11755,2016-06-14T09:45:53Z,Доска для записей,,,8.5,18.8,,,"Размеры: В. 8.5, Ш. 18.8"
12211,2016-06-14T09:45:56Z,Столик,,,75,57,74,,"Размеры: Дл. 75.0, Ш. 57.0, В. 74.0"
6176,2016-06-14T09:45:20Z,Богородица (название старое); Богоматерь (название употребляемое)    Автор: Аноним (иконописец)    Школа / Место издания: Россия,,,,,,,Ссылка на каталоги / инвентари: В источнике не указаны размеры.
18364,2016-06-14T09:46:43Z,Автор: Dorine Beusmans Kuijlaars,,,92,,,,"Стиль: Основание - круг    Размеры: В. 92, Вес 25 кг    Ссылка на каталоги / инвентари: фигура, условно изображающая мужчину и женщину"
16241,2016-06-14T09:46:26Z,Орден Красного Знамени    Период оригинала: 20 век,,,,,,,Ссылка на каталоги / инвентари: Награждена Демина Е.И.    Инвентарный номер: 107934
14287,2016-06-14T09:46:10Z,Альбом с фотографиями,,,29.5,20.8,,,"Размеры: В. 29.5, Ш. 20.8"
8582,2016-06-14T09:45:45Z,Икона «Божия Матерь Скорбящих радостей»    Автор: Неизвестный художник XVI века,ЖИВОПИСЬ,,,25,,,"Размеры: B. 35, Ш. 25"
17455,2016-06-14T09:46:37Z,"Святая Ольга    Школа / Место издания: Россия    Период оригинала: 20 век, 1 четверть",ИКОНА,,12,10,,,Стиль: Оклад серебряный.    Размеры: В. 12; Ш. 10    Инвентарный номер: КИКМ №5462
9880,2016-06-14T09:45:37Z,Чашка,,,,,,,Инвентарный номер: Инв. № 86
9393,2016-06-14T09:45:40Z,Икона «Св. Флор и св. Лавр с житием»    Автор: Неизвестный художник,,,,75,,,"Размеры: B. 106, Ш. 75    Инвентарный номер: Инв. №9. Старый инв. № 249"
16461,2016-06-14T09:46:30Z,Страдание    Период оригинала: 18 век,ЖИВОПИСЬ,,125,95,,,"Размеры: В.125, Ш.95 см"
11523,2016-06-14T09:45:51Z,"Императрица Мария Федоровна с родными на палубе корабля ""Рында""",,,32,24.5,,,"Размеры: В. 32.0, Ш. 24.5"
9055,2016-06-14T09:45:35Z,Кортик немецкий    Автор: Неизвестный мастер,,,41.5,,,,"Размеры: Длина 41,5    Инвентарный номер: Инв. №84"
21548,2020-03-12T14:00:23Z,"Монета. 15 копеек 1 злотый. 1833 год. Серебро. Чеканка. Размер: диаметр – 1,9 см. № по книге поступлений: ТМ КП-1727/32 № по книге спецучёта: ДМ-207 № по ГК: 4397339",ПРЕДМЕТЫ НУМИЗМАТИКИ И БОНИСТИКИ,Объект является культурной ценностью,,,,Незначительная потертость,нет
12468,2016-06-14T09:45:58Z,Платок,,,56,63,,,"Размеры: В. 56.0, Ш. 63.0"
21302,2019-03-18T14:31:38Z,"МОКМ КП-2405/10 Фотография. Петров М.Г. Место съемки и дата неизвестны. Фотобумага, размер не зафиксирован. Поступление 1968 г.",АРХИВНЫЕ ДОКУМЕНТЫ,Объект является культурной ценностью,,,,Не зафиксировано,Не зафиксировано
23469,2023-04-17T11:02:30Z,"«Ажур Жар-птица» (Каслинское литье) чугун 9х22,5 КИРМ КП 3422 ПИ 182 Акт № 65 от 27.12.1995 г.",,Объект является культурной ценностью,,,,Не известно,Не известно
16299,2016-06-14T09:46:28Z,Нагрудная бляха надзирателя тюрьмы,,,,,,,Инвентарный номер: КП 121
21645,2020-03-13T08:24:57Z,"Монета. 1 полтинник. 1924 г Серебро. Чеканка. Размер: диаметр – 2,6 см. № по книге поступлений: ТМ КП-1726/18 № по книге спецучёта: ДМ-156 № по ГК: 14289392",ПРЕДМЕТЫ НУМИЗМАТИКИ И БОНИСТИКИ,Объект является культурной ценностью,,,,Незначительная потертость,нет
6637,2016-06-14T09:45:22Z,"Ночью у гостиницы ""Россия"" (название придуманное)    Автор: Демко А.И. (художник, литограф ?)    Школа / Место издания: Россия    Период оригинала: 20 век",ОТТИСК,,,,,,Стиль: Литография цветная
13578,2016-06-14T09:46:05Z,Коробка,,,,,,,
8151,2016-06-14T09:45:30Z,Портрет писателя Ошаева Х.Д. (название изначальное)    Автор: Бекичев Иван Дмитриевич (скульптор)    Школа / Место издания: Россия    Период оригинала: 3 четверть 20 век,,,,,,,"Ссылка на каталоги / инвентари: ЧГОМ:  не значится; ХУДОЖНИКИ ЧЕЧЕНО-ИНГУШЕТИИ: с. 15, фото (Предметы 4., 8.,9., 11., 12)"
16460,2016-06-14T09:46:30Z,Дева Мария и святой Антонио    Период оригинала: 18 век,ЖИВОПИСЬ,,85,75,,,"Размеры: В.85, Ш.75 см"
14972,2016-06-14T09:46:17Z,"Илья Муромец    Автор: Зиновьев    Школа / Место издания: Россия, Палех",,,12,10,,,"Размеры: В. 10; Дл.12    Характер подписи: Зиновьев    Ссылка на каталоги / инвентари: На внутренней стороне крышки имелся инвентарный номер фонда оригиналов училища. Практически все работы имели механические повреждения, трещины, царапины, сколы. Точного описания повреждений работ не имели.    Инвентарный номер: № 76"
2040,2016-06-14T09:44:38Z,Хлеб убран (название придуманное)    Автор: Григорьянц Арнольд Григорьевич (художник)    Школа / Место издания: Россия    Период оригинала: 2 половина 20 век,ЖИВОПИСЬ,,65,70,,,"Размеры: В. 65, Ш. 70 (приблизительно,без обрамления)    Ссылка на каталоги / инвентари: ЧГОМ: № 355"
4084,2016-06-14T09:44:57Z,Иисус Христос в Житие (название употребляемое)    Автор: Аноним (иконописец)    Школа / Место издания: Россия,,,35,20,,,"Стиль: Дерево ?    Размеры: В. 35, Ш. 20 (приблизительно) / В. 20, Ш. 35 (приблизительно)"
10371,2016-06-14T09:45:47Z,Королева Александра,,,18,30.5,,,"Размеры: В. 18.0, Ш. 30.5"
3785,2016-06-14T09:44:53Z,Казанская Богородица (название употребляемое); Богоматерь Казанская  (название придуманное)    Автор: Аноним (иконописец); Аноним (мастер)    Школа / Место издания: Россия,ИКОНА,,20,20,,,"Стиль: С окладом: Латунь ?/ Медь ?/ Серебро ?/ Сталь ?/ Белая жесть ? Другое ?; Квадрат ?    Размеры: В. 20, Ш. 20 (приблизительно)"
