id,registration,name,category,сultural_property,height,width,depth,preservation,description
2501,2016-06-14T09:44:43Z,Женский портрет (название употребляемое)    Автор: Аноним (художник)    Школа / Место издания: Россия    Период оригинала: 1 четверть 20 век,ЖИВОПИСЬ,,50,39,,,"Размеры: В. 50, Ш. 39 (приблизительно, без обрамления ?)    Ссылка на каталоги / инвентари: ЧГОМ: № 406"
5646,2016-06-14T09:45:12Z,Распятие Иисуса Христа (название изначальное)    Автор: Аноним (иконописец); Аноним (мастер)    Школа / Место издания: Россия ?    Период оригинала: 19 век,ИКОНА,,30,40,,,"Стиль: Другое: врезанный крест ?; Крест-распятие: Отливка ?, Рельеф ?, Латунь ?/ Бронза ?/ Медь ?/ Другое ?, металл    Размеры: В. 30, Ш. 40 (в киоте ?) / В. 40, Ш. 30 (в киоте ?)"
3108,2016-06-14T09:44:46Z,Святая княгиня Людмила (название изначальное)    Автор: Аноним (иконописец)    Школа / Место издания: Россия    Период оригинала: 19 век,,,9,11,,,"Размеры: В. 9, Ш. 11 (приблизительно) / В. 11, Ш. 9 (приблизительно)"
3942,2016-06-14T09:44:55Z,Богородица (название старое); Богоматерь (название употребляемое)    Автор: Аноним (иконописец)    Школа / Место издания: Россия    Период оригинала: 19 век,ИКОНА,,20,30,,,"Стиль: Дерево поделочное    Размеры: В. 20, Ш. 30 (приблизительно) / В. 30, Ш. 20 (приблизительно)"
16436,2016-06-14T09:46:30Z,Скульптурная группа - Пляска.    Автор: Артамонова Ольга Сергеевна    Период оригинала: Середина 20 век,,,14,15,,,"Стиль: Роспись надглазурная.    Размеры: В.14, Ш.15, Т.7 см    Инвентарный номер: КП-378, СК-33"
14702,2016-06-14T09:45:46Z,"Кулон    Школа / Место издания: Россия, Санкт-Петербург",,,49.2,3.9,6.2,,"Размеры: В. 6,2, Ш. 3,9, Дл. 49,2 (цепочка), Вес 16,97 г    Характер подписи: ""ВЗ"" - неизвестного мастера, Петербургского пробирного управления 1908-1917, проба - 56.    Ссылка на каталоги / инвентари: Приобретен через ЭЗК ГЭ от А.Н. Немилова за 12 000 рублей. КП ОИРК 2939. Акт № 737 от 30.11.1990 г.    Инвентарный номер: ЭРО-9939, ЗВ-1493"
10470,2016-06-14T09:45:47Z,Футляр-папка,,,66.5,51.5,,,"Размеры: В. 66.5, Ш. 51.5"
7580,2016-06-14T09:45:25Z,Двенадцать праздников (название употребляемое); Сошествие во ад / Воскресение Христово и Праздники (название последнее)    Автор: Аноним (иконописец)    Школа / Место издания: Россия ?,,,35,40,,,"Стиль: Дерево ?    Размеры: В. 35, Ш. 40 (доска ?) / В. 40, Ш. 35 (доска ?)    Ссылка на каталоги / инвентари: В источнике не указаны датировка, материал и техника, требуется уточнение."
12936,2016-06-14T09:46:01Z,Тетрадь,,,17.8,22.5,,,"Размеры: В. 17.8, Ш. 22.5"
8504,2016-06-14T09:45:43Z,"Воскрешение Лазаря    Автор: Аноним (иконописец)    Школа / Место издания: Россия    Период оригинала: 17 век, 1 половина, 2 четверть",ИКОНА,,50,70,,,Размеры: В. 70 см; Дл. 50 см    Ссылка на каталоги / инвентари: Икона обработана родомином с солидолом (имеет свечение под действием ультрафиолета)
15589,2016-06-14T09:46:21Z,Значок Советского комитета ветеранов войны,,,1.5,2.7,,,"Размеры: Дл. 1.5, В. 2.7    Инвентарный номер: 46267"
8250,2016-06-14T09:45:30Z,Казанская Богоматерь (название придуманное)    Автор: Аноним (иконописец); Аноним (мастер)    Школа / Место издания: Россия,ИКОНА,,20,30,,,"Размеры: В. 20, Ш. 30 (в окладе ?) / В. 30, Ш. 20 (в окладе ?)"
14970,2016-06-14T09:46:17Z,Алеша Попович    Автор: Бахирев    Школа / Место издания: Россия,,,12,10,,,"Размеры: В. 10; Дл. 12    Характер подписи: Бахирев    Ссылка на каталоги / инвентари: На внутренней стороне крышки имелся инвентарный номер фонда оригиналов училища. Практически все работы имели механические повреждения, трещины, царапины, сколы. Точного описания повреждений работ не имели.    Инвентарный номер: № 74"
11141,2016-06-14T09:46:15Z,"Игра ""Паук и мухи""",,,0.105,0.105,,,"Размеры: Дл. 0,105, Ш. 0,105"
15388,2016-06-14T09:46:24Z,"Вырезной лист ""Лошадь палочка""",,,44,55,,,"Стиль: Печать    Размеры: В. 55 , Дл. 44    Ссылка на каталоги / инвентари: Вырезной лист ""Лошадь палочка"". Москва, издательство журнала ""Светлячок"""
7870,2016-06-14T09:45:27Z,Святые года (название предполагаемое); Все Святые (название употребляемое)    Автор: Аноним (иконописец)    Школа / Место издания: Россия ?,,,25,30,,,"Стиль: Дерево ?    Размеры: В. 25, Ш. 30 (доска ?) / В. 30, Ш. 25 (доска ?)    Ссылка на каталоги / инвентари: Состояние: имеются утраты (?).  В источнике не указаны иконография, датировка, материал и техника, требуется уточнение."
5684,2016-06-14T09:45:11Z,"Владимирская Богородица (название старое); Богоматерь Владимирская  (название придуманное); Сладколобзающая / Умиление (название изначальное) ; Богоматерь Умиление Владимирская (название последнее)    В русском оригинале (переводе): Гликофилуса / Елеуса (греческий, название изначальное)    Автор: Аноним    Школа / Место издания: Россия",,,20,30,,,"Стиль: Дерево ?    Размеры: В. 20, Ш. 30 (доска ?) / В. 30, Ш. 20 (доска ?)"
10650,2016-06-14T09:45:49Z,Женская головка    Автор: Харламов А.А.,,,52,62,,,"Размеры: В. 52.0, Ш. 62.0"
4797,2016-06-14T09:45:03Z,"Архангел Гавриил (название изначальное); Архангел Гавриил в молении (название предполагаемое); Архангел Гавриил из Деисуса (название предполагаемое, название употребляемое)    Автор: Аноним (иконописец)    Школа / Место издания: Россия ?    Период оригинала: 19 век",ИКОНА,,160,90,,,"Размеры: В. 160, Ш. 90, Т. 6 (доска)"
12139,2016-06-14T09:45:55Z,Кружка,,,9.2,7.7,,,"Размеры: В. 9.2, Ш. 7.7"
10682,2016-06-14T09:45:49Z,Счет убитым зверям,,,28,34,,,"Размеры: В. 28.0, Ш. 34.0"
7586,2016-06-14T09:45:24Z,"Иисус Христос Вседержитель (название изначальное); Спас Вседержитель (название придуманное)    В русском оригинале (переводе): Пантократор (греческий, название изначальное)    Автор: Аноним (иконописец)    Школа / Место издания: Россия ?",ИКОНА,,26,30,,,"Стиль: Коричневый, Черный: общий тон    Размеры: В. 26, Ш. 30 (доска) / В. 30, Ш. 26 (доска)    Ссылка на каталоги / инвентари: В источнике не указаны иконография , датировка, техника, требуется уточнение.  Состояние: изображение просматривается слабо."
2139,2016-06-14T09:44:40Z,Мы из 1941 (название придуманное)    Автор: Шевченко Юрий Андреевич (художник)    Школа / Место издания: Россия    Период оригинала: 2 четверть 20 век; 2 половина 20 век,ЖИВОПИСЬ,,138,200,,,"Размеры: В. 138, Ш. 200 (приблизительно, без обрамления)    Ссылка на каталоги / инвентари: ЧГОМ: № 528 (523 п.ф.)"
17998,2016-06-14T09:46:40Z,В гримерной актрисы    Автор: В.И.Куров,,,80,100,,,"Размеры: В.80, Ш.100"
15014,2016-06-14T09:46:18Z,Царь Салтан    Автор: Кочупалов    Школа / Место издания: Россия Палех,,,20,12,,,"Размеры: В. 12; Дл. 20    Характер подписи: Кочупалов, с. Палех и год создания    Ссылка на каталоги / инвентари: На внутренней стороне крышки имелся инвентарный номер фонда оригиналов училища. Практически все работы имели механические повреждения, трещины, царапины, сколы. Точного описания повреждений работ не имели.    Инвентарный номер: № 405"
12648,2016-06-14T09:45:59Z,"Цветы миндаля, бабочки и шмель",,,34.5,20,,,"Размеры: В. 34.5, Ш. 20.0"
7430,2016-06-14T09:45:29Z,"Спас Нерукотворный (название придуманное); Нерукотворный образ Христа (название изначальное)    Автор: Аноним (иконописец); Аноним (мастер, ювелир)    Школа / Место издания: Россия, Москва    Период оригинала: 4 четверть 17 век; 1 четверть 18 век; 2 половина 19 век (оклад)",,,50,50,,,"Стиль: Темпера / письмо по дереву (?); С окладом: Серебро, Чеканка / Штамповка: высокий рельеф    Размеры: В. 50, Ш. 50 (в окладе ?); В. 53, Ш. 52 (в окладе ?)"
6096,2016-06-14T09:45:17Z,"Иисус Христос Вседержитель (название изначальное); Спас Вседержитель (название придуманное); Вседержитель (название в переводе)    В русском оригинале (переводе): Пантократор (греческий, название изначальное)    Автор: Аноним (иконописец); Аноним (мастер)    Школа / Место издания: Россия (народная)    Период оригинала: 4 четверть 18 век (оклад ?)",,,30,30,,,"Стиль: С окладом/ризой: Чеканка, Медь; Черный, Коричневый: темный тон    Размеры: В. 30, Ш. 30 (в окладе ?)"
12702,2016-06-14T09:45:59Z,Вазочка,,,10.5,73,,,"Размеры: В. 10.5, Ш. 73.0"
6533,2016-06-14T09:45:16Z,Святой Георгий Победоносец (название придуманное); Чудо Георгия Победоносца о змие (название последнее)    Автор: Аноним (иконописец)    Школа / Место издания: Россия (народная),ИКОНА,,50,30,,,"Размеры: В. 50, Ш. 30 (доска)"
2109,2016-06-14T09:44:38Z,Портрет рабочего (название употребляемое)    Автор: Мишин Олег Михайлович (художник)    Школа / Место издания: Россия    Период оригинала: середина 20 век; 2 половина 20 век,ЖИВОПИСЬ,,89,80,,,"Размеры: В. 89, Ш. 80 (приблизительно, без обрамления)    Ссылка на каталоги / инвентари: ЧГОМ: № 171    Ссылка на каталоги / инвентари: Фото: Предмет 12."
13400,2016-06-14T09:46:04Z,Жанровая сцена    Автор: Маковский К.Е.,,,13.5,10.9,,,"Размеры: В. 13.5, Ш. 10.9 (паспарту: В. 31.5, Ш.  39.2)"
5005,2016-06-14T09:44:22Z,Мужичек (название записано)    Автор: Аноним (художник)    Школа / Место издания: Россия    Период оригинала: 4 четверть 19 век,ОТТИСК,,33.5,42.3,,,"Размеры: В. 33.5, Ш. 42.3 (лист)    Ссылка на каталоги / инвентари: Фото: см. Источники, из коллекции ГИМ.   Описание по инв. №  42949, I Ch khr 5973 (ГИМ)"
98,2016-06-14T09:44:16Z,Лодка на взморье (название изменяемое); Лодки (название изначальное); Лодки на взморье (название последнее)    Автор: Голубин ? (художник); Голубин С. (художник)    Школа / Место издания: Россия    Период оригинала: 19 век; 1 четверть 20 век,ЖИВОПИСЬ,,51,71,,,"Стиль: Холст: ""Кр. холст"" (?)    Размеры: В. 51, Ш. 71 (без обрамления ?) ?; В. 33, Ш. 46 (без обрамления) / В. 33, Ш. 48 (без обрамления)    Ссылка на каталоги / инвентари: ЧИХМ: № 17    Ссылка на каталоги / инвентари: Последние размеры из учетных документов ГРМ, поступивших в 2003 г."
11150,2016-06-14T09:46:15Z,Шкафик,,,14.7,13,18,,"Размеры: Дл. 14.7, Ш. 13.0, В. 18.0"
7207,2016-06-14T09:45:21Z,"Французский пейзаж (название придуманное); Городской дворик в Авиньоне (название в переводе; французский)    В русском оригинале (переводе): Villeneuve Avignon (название рукописное; французский; оборотная сторона)    Автор: Бенуа Альберт Александрович (художник)    Школа / Место издания: Россия, Франция    Период оригинала: 1 четверть 20 век",ЖИВОПИСЬ,,38.8,27.8,,,"Размеры: В. 38.8, Ш. 27.8 (в свету ?, лист ?)    Характер подписи: Albert Benois    Характер подписи: Авиньон    Характер подписи: 3.9.23. (П.); см. Название (О. справа вверху, рука автора)    Ссылка на каталоги / инвентари: Герра Р. / ГТГ: с. 64, с. 31 - кат. 44"
4973,2016-06-14T09:44:30Z,"Всадник, стреляющий в леопарда (название придуманное)    Автор: Аноним (модельер); Аноним (мастер)    Школа / Место издания: Западная Европа, Франция    Период оригинала: 18 век",КЕРАМИКА,,20,25,,,"Стиль: Красный, Синий, Белый: одеяние всадника.    Размеры: В. 20, Ш. 25 (приблизительно)    Ссылка на каталоги / инвентари: Фото: скульптура на часовом корпусе.  В источнике: фигурка всадника съемная.  Состояние: у всадника отбита правая нога, у леопарда - правая передняя лапа; места обломов покрыты золотой краской."
7549,2016-06-14T09:45:25Z,Богородица (название старое); Богоматерь (название употребляемое)    Автор: Аноним (иконописец)    Школа / Место издания: Россия ?,ИКОНА,,9,12,,,"Стиль: С окладом/ризой ?/ Другое ?: Дерево    Размеры: В. 9, Ш. 12 (доска ?) / В. 12, Ш. 9 (доска ?)    Ссылка на каталоги / инвентари: В источнике не указаны иконография, датировка, техника, требуется уточнение."
18478,2016-06-14T09:46:41Z,"Святой Пантелеймон целитель    Автор: Аноним    Школа / Место издания: Россия    Период оригинала: 17 век, 18 век, 19 век, 20 век (?)",ИКОНА,,100,60,,,"Размеры: В. 100, Ш. 60,    Инвентарный номер: 046"
11768,2016-06-14T09:45:53Z,Барельеф,,,2.8,3.2,,,"Размеры: В. 2.8, Ш. 3.2"
12773,2016-06-14T09:46:00Z,Вазочка,,,3.9,1.5,,,"Размеры: В. 3.9, Ш. 1.5"
17180,2016-06-14T09:46:20Z,"ЧУДО ГЕОРГИЯ О ЗМИЕ    Школа / Место издания: Центральная Россия (Поволжье?)    Период оригинала: 16 век, середина",ИКОНА,,37.2,30.5,,,"Размеры: В. 37.2, Ш. 30.5"
15150,2016-06-14T09:46:19Z,"фигура ""Кошка""    Автор: ск. Кучкин, р. Ризнич И.И.    Период оригинала: 2 четверть, 20 век",,,3.5,1.4,,,"Стиль: Роспись надглазурная полихромная.    Размеры: В. 1.4, Дл. 3.5    Ссылка на каталоги / инвентари: ДС 566. Отсутствует по неустановленным причинам. Объяснительная записка бывшего директора музея ЛФЗ Н.С. Петровой"
437,2016-06-14T09:44:21Z,Преображение Христово (название изначальное)    Автор: Аноним (иконописец); Аноним (чеканщик)    Школа / Место издания: Россия    Период оригинала: 17 век,ИКОНА,,64,47.5,,,"Стиль: Темпера ?    Размеры: В. 64, Ш. 47.5 (приблизительно)    Ссылка на каталоги / инвентари: Размеры: по аналогии с другими иконами из этого ряда, см. Источники."
1973,2016-06-14T09:44:38Z,"Озеро (название придуманное)    Автор: Судковский Руфин Гаврилович (художник, приписано); Сергеев ? (художник); Сергеев Николай Александрович (художник) ?    Школа / Место издания: Россия    Период оригинала: 4 четверть 19 век",ЖИВОПИСЬ,,176,180,,,"Стиль: Квадрат( почти)    Размеры: В. 176, Ш. 180 (приблизительно) / В. 178, Ш. 177 (без обрамления ?)    Характер подписи: подпись ?    Характер подписи: 1898 (?)    Ссылка на каталоги / инвентари: ЧГОМ: № 291    Ссылка на каталоги / инвентари: Состояние: после реставрации на месте  (1961), в / после реставрации ?"
5291,2016-06-14T09:45:05Z,Казанская Богоматерь (название употребляемое); Богоматерь Казанская (название придуманное)    Автор: Аноним (иконописец); Аноним (чеканщик)    Школа / Место издания: Россия    Период оригинала: 4 четверть 19 век,,,40,55,,,"Стиль: С окладом: Чеканка, Другое - металл ?; Дерево поделочное    Размеры: В. 40, Ш. 55 (в окладе ?) / В. 55, Ш. 40 (в окладе ?)"
3850,2016-06-14T09:44:52Z,"Господь Вседержитель (название старое); Спас (название употребляемое); Иисус Христос Вседержитель (название изначальное); Спас Вседержитель (название придуманное)    В русском оригинале (переводе): Пантократор (греческий, название изначальное)    Автор: Аноним (иконописец)    Школа / Место издания: Россия, Нижний Новгород  ? (народная)",,,35,40,,,"Стиль: Дерево ?    Размеры: В. 35, Ш. 40 (приблизительно) / В. 40, Ш. 35 (приблизительно)"
15841,2016-06-14T09:46:23Z,Успение Святой Богородицы,ИКОНА,,50,40,,,"Размеры: В.50, Ш.40 см    Ссылка на каталоги / инвентари: Кировская область, Немский  район, с. Васильевское, Благовещенский храм.  Кража - 07.07.2006 г.    Инвентарный номер: 1094"
4933,2016-06-14T09:44:44Z,В память войны с турками в 1774 году (название изначальное); Мир с Портой (название употребляемое)    Автор: Юдин Самойла Юдич (медальер) ?    Школа / Место издания: Россия    Монетный двор    Период оригинала: 3 четверть 18 век,,,25,32,38,,"Размеры: В. 38 мм, Ш. 32 мм (штемпель), Дл. 25 мм (сторона)    Характер подписи: Ю    Характер подписи: Порта / Турция    Характер подписи: ПОБЪДИ / ТЕЛЮ (О. в венке); ЗАКЛЮЧЕНЪ МИРЪ / СЪ ПОРТОЮ / 10 IЮЛЯ / 1774 Г. (О. под обрезом)    Ссылка на каталоги / инвентари: СМИРНОВ: № 277    Ссылка на каталоги / инвентари: Описание составлено по каталогу, см. Ссылку."
14284,2016-06-14T09:46:10Z,Альбом с фотографиями,,,23.5,15,,,"Размеры: В. 23.5, Ш. 15.0"
17814,2016-06-14T09:46:39Z,"Крест    Период оригинала: 19 век, 4 четверть, 20 век, 1 четверть",,,16.5,9.5,,,"Размеры: В. 16,5; Ш. 9,5    Инвентарный номер: КП-2856"
3935,2016-06-14T09:44:55Z,"Путеводительница / Богохранимая (название изначальное); Богоматерь Вратарница (название придуманное); Богоматерь Иверская(название употребляемое); Богоматерь Одигитрия Иверская (название последнее)    В русском оригинале (переводе): Одигитрия (греческий, название изначальное); Портаитисса (название придуманное; греческий)    Автор: Аноним (иконописец)    Школа / Место издания: Россия",,,35,45,,,"Стиль: Дерево ?    Размеры: В. 35, Ш. 45 (приблизительно) / В. 45, Ш. 35 (приблизительно)"
7971,2016-06-14T09:45:06Z,"Исторiя государства россiйскаго (название записано; титульный лист); История государства Российского (название изначальное)    Автор: Карамзин Н.М. (сочинитель); Петрович А.А. (издатель) ?    Кушнерев И.Н. и компания (товарищество, типография)    Период оригинала: 1 четверть 20 век",,,20,13.5,,,"Размеры: В. 20, Ш. 13.5, Ф."
