id,registration,name,category,сultural_property,height,width,depth,preservation,description
14958,2016-06-14T09:46:17Z,"Печать    Период оригинала: 19 век, 4 четверть, 20 век, 1 четверть",,,8,2.3,5,,"Размеры: В. 5, Ш. 2.3, Дл. 8    Ссылка на каталоги / инвентари: Печать выполнена из медного сплава, с деревянной ручкой грушевидной формы. Рисунок букв горизонтальный. Сохранность: загрязнена, потерта, ручка расколота. Печать особой художественной ценности не имеет."
4007,2016-06-14T09:44:54Z,Иисус Христос после снятия с креста (название придуманное); Оплакивание Иисуса Христа (название предполагаемое)    Автор: Аноним (иконописец)    Школа / Место издания: Россия,ИКОНА,,25,25,,,"Стиль: Дерево поделочное    Размеры: В. 25, Ш. 25 (приблизительно)"
1144,2016-06-14T09:44:31Z,"Распятие (название изначальное, лицевая сторона) # Святой воин (название придуманное, оборотная сторона)    Автор: Аноним (ювелир)    Школа / Место издания: Россия ?",,,3,2,,,"Стиль: Штамповка ? / Литье ?    Размеры: В. 3, Ш. 2  (створка),  Т. 0.5 (корпус); Вес 3.41 грамма (Серебро) ?    Ссылка на каталоги / инвентари: Медальон с ушком."
5632,2016-06-14T09:45:12Z,Святая Наталия (название употребляемое); Великомученица Наталья (название старое)    Автор: Аноним (иконописец)    Школа / Место издания: Россия ?    Период оригинала: 19 век,ИКОНА,,22,25,,,"Стиль: Красный: цвет одежды    Размеры: В. 22, Ш. 25 (доска) / В. 25, Ш. 22 (доска)"
1246,2016-06-14T09:44:31Z,Весна (название употребляемое)    Автор: Аноним (художник),ЖИВОПИСЬ,,30,55,,,"Размеры: В. 30, Ш. 55 (без обрамления ?)"
8247,2016-06-14T09:45:30Z,Святой Николай Чудотворец (название изначальное)    Автор: Аноним (иконописец); Аноним (мастер)    Школа / Место издания: Россия ?,ИКОНА,,20,30,,,"Размеры: В. 20, Ш. 30 (в окладе ?) / В. 30, Ш. 20 (в окладе ?)"
12295,2016-06-14T09:45:56Z,Флаконец,,,21,5,,,"Размеры: В. 21.0, Ш. 5.0"
14734,2016-06-14T09:45:46Z,"Рамочка    Период оригинала: 19 век, 1 четверть",,,19,12.5,,,"Размеры: В. 19,0, Ш. 12,5, Вес 291,6 г    Ссылка на каталоги / инвентари: КП ОИРК 147-3175. Поступление из ГМЭ по акту № 205 от 27.04.1950 г. Старые №№ 1470-36    Инвентарный номер: ЭРО-6762, СВ-1394"
15746,2016-06-14T09:46:22Z,"Двухчастная икона: верх - Воздвижение Креста Господня, низ - Сретение Господне.",,,126,63,,,"Размеры: В.126, Ш.63 см    Ссылка на каталоги / инвентари: Ярославская обл., Тутаевский район, д. Ильинское, Церковь Ильи Пророка. Похищение произошло 24.04.2007 г."
4887,2016-06-14T09:44:44Z,"Автор: Роджеси Доменио (мастер) ?; Роджери Доменик (мастер) ?; Роджери ? (мастер) ?; Руджери Доменико (мастер) ?    Школа / Место издания: Италия, Кремона    Период оригинала: 4 четверть 17 век",,,385,211,,,Размеры: Дл. 385 мм (корпус); Ш. 211 мм (н. часть корпуса); Ш. 116 мм (с. часть корпуса)    Характер подписи: Domenio Rogiesi [...] in Cremona anno 169 [...] / Domenic Rugieri [...] in Cremona anno 169 [...]  (на этикетке)
12403,2016-06-14T09:45:57Z,Коробка,,,10.5,14,,,"Размеры: В. 10.5, Ш. 14.0"
6280,2016-06-14T09:45:18Z,Вход в Иерусалим (название употребляемое); Вход Христа в Иерусалим (название изначальное); Вход Господень в Иерусалим (название старое)    Автор: Аноним (иконописец)    Школа / Место издания: Россия,,,50,80,,,"Размеры: В. 50, Ш. 80 (доска, в окладе ?) / В. 80, Ш. 50 (доска, в окладе ?)"
11579,2016-06-14T09:45:52Z,Шкатулка,,,10.5,4.7,,,"Размеры: В. 10.5, Ш. 4.7"
7148,2016-06-14T09:45:21Z,"Лес / Озеро (название двойное, название изначальное); Озеро в сосновом лесу (название придуманное)    Автор: Шишкин Иван Иванович (художник)    Школа / Место издания: Россия    Период оригинала: 3 четверть 19 век",ЖИВОПИСЬ,,32,51,,,"Размеры: В. 32, Ш. 51 (без обрамления, ру ?)    Характер подписи: И.Шишкин. [...]    Характер подписи: [...] 79. (П.); 1841 ? (О. ?)    Ссылка на каталоги / инвентари: Надписи: в источнике нет указания, что инвентарный номер записан на предмете."
13459,2016-06-14T09:46:04Z,Дочери английского короля Эдуарда VII,,,10.5,16.5,,,"Размеры: В. 10.5, Ш. 16.5"
7607,2016-06-14T09:45:24Z,Владычица (название придуманное); Богоматерь в четырех образах и Усеченная глава Святого Пророка Иоанна Предтечи Крестителя  (название последнее)    Автор: Аноним (иконописец)    Школа / Место издания: Россия ?,ИКОНА,,60,40,,,"Размеры: В. 60, Ш. 40 (доска)    Ссылка на каталоги / инвентари: В источнике не указаны иконографии Богоматери, датировка, техника, требуется уточнение."
2774,2016-06-14T09:44:45Z,"Мужчина, облокатившийся на стол (название придуманное)    Автор: Майоров В. (художник)    Школа / Место издания: Россия    Период оригинала: 20 век",ЖИВОПИСЬ,,30,40,,,"Размеры: В. 30, Ш. 40 (приблизительно)    Характер подписи: MAYOR (сверху вниз)"
13373,2016-06-14T09:46:04Z,Корзинка для бумаг,,,33,45,,,"Размеры: В. 45.0, Д. 33.0"
17224,2016-06-14T09:46:21Z,"ПРЕПОДОБНЫЕ ЗОСИМ И САВВАТИЙ СОЛОВЕЦКИЕ    Школа / Место издания: Русский Север    Период оригинала: 17 век, 18 век",ИКОНА,,77.2,66.5,,,"Размеры: В. 77,2, Ш. 66,5"
1381,2016-06-14T09:44:35Z,"Пастушок (название изначальное)    Автор: Зиновьев Николай Михайлович (художник)    Школа / Место издания: Россия, Палех    Художественно-производственные мастерские Палехского отделения Худфонда РСФСР    Период оригинала: 20 век",ЖИВОПИСЬ,,17,13,,,"Размеры: В. 17, Ш. 13 (крышка ?) /  В. 13, Ш. 17 (крышка ?)    Характер подписи: 159 ?"
3838,2016-06-14T09:44:52Z,Неопалимая купина (название изначальное); Богоматерь Неопалимая Купина  (название употребляемое); Богородица Неопалимая Купина  (название старое)    Автор: Аноним (иконописец)    Школа / Место издания: Россия    Период оригинала: 19 век,,,31,35,,,"Стиль: Дерево ?    Размеры: В. 31, Ш. 35 (приблизительно) / В. 35, Ш. 31 (приблизительно)"
14214,2016-06-14T09:46:10Z,Коробка с игрой «Salta»,,,0.44,0.43,,,"Размеры: Дл. 0,44, Ш. 0,43"
3452,2016-06-14T09:44:51Z,"Владимирская Божья Матерь (название старое) ; Богоматерь Владимирская (название придуманное); Сладколобзающая /  Умиление (название изначальное); Богоматерь Умиление Владимирская  (название последнее)    В русском оригинале (переводе): Гликофилуса / Елеуса (греческий, название изначальное)    Автор: Аноним (иконописец)    Школа / Место издания: Россия    Период оригинала: 4 четверть 19 век",ИКОНА,,25,30,,,"Размеры: В. 25, Ш. 30 (приблизительно) / В. 30, Ш. 25 (приблизительно)"
11288,2016-06-14T09:45:50Z,Ящичек,,,10.5,6,15,,"Размеры: Дл. 10.5, Ш. 6.0, В. 15.0"
18212,2016-06-14T09:46:36Z,пейзаж Де Суттера    Автор: Де Суттер (DE SUTTER),,,83,68,,,"Размеры: В. 83, Ш. 68    Ссылка на каталоги / инвентари: в ночь с 30 на 31 марта 2011 г. из частной коллекции похищены картины"
7909,2016-06-14T09:45:27Z,Иоанн Пророк (название изначальное); Иоанн Креститель (название употребляемое); Святой Иоанн Предтеча Креститель (название последнее)    Автор: Аноним (иконописец)    Школа / Место издания: Россия ?,,,40,30,,,"Стиль: Дерево ?    Размеры: В. 40, Ш. 30 (доска ?)    Ссылка на каталоги / инвентари: В источнике не указаны иконография, датировка, техника, требуется уточнение."
11054,2016-06-14T09:46:15Z,Хромолитография,,,45.5,51,,,"Размеры: В. 45.5, Ш. 51.0"
7452,2016-06-14T09:45:29Z,Богородица Одигитрия Казанская (название употребляемое); Богоматерь Казанская (название придуманное)    Автор: Аноним (иконописец)    Школа / Место издания: Россия    Период оригинала: 19 век,ИКОНА,,29,32,,,"Размеры: В. 29, Ш. 32 (доска) / В. 32, Ш. 29 (доска)"
1048,2016-06-14T09:44:28Z,"Пушкиногорье (русский, название записано, титульный лист)    Автор: Гейченко Семен Степанович (автор); Пушкин Александр Сергеевич (рисовал); Носков Вл. (художник)    Школа / Место издания: Россия    Молодая гвардия (издательство); Акционерное общество Юхтейстюэ (типография)    Период оригинала: 4 четверть 20 век",,,26,20,,,"Стиль: Картон: переплет; Бумага: Каубеларт; Печать: офсет    Размеры: В. 26, Ш. 20 (лист); Ф.  84 х 108 1/16; Об. 278 страниц    Характер подписи: НВФ - 452 ?    Характер подписи: 8 руб. 50 коп.    Ссылка на каталоги / инвентари: ИБ № 2915;"
11223,2016-06-14T09:46:16Z,Гончие императорской охоты в Гатчине    Автор: Френц Р.Ф.,,,39,22.5,,,"Размеры: В. 39.0, Ш. 22.5"
15687,2016-06-14T09:46:22Z,Св. мученик Трифон    Школа / Место издания: Россия    Период оригинала: 19 век,ИКОНА,,45.5,37.5,,,"Размеры: В.45.5, Ш.37.5    Инвентарный номер: КП-39630, А-5087-IV"
3235,2016-06-14T09:44:48Z,"Богородица Владимирская  (название старое); Богоматерь Владимирская  (название придуманное); Сладколобзающая / Умиление (название изначальное) ; Богоматерь Умиление Владимирская (название последнее)    В русском оригинале (переводе): Гликофилуса / Елеуса (греческий, название изначальное)    Автор: Аноним (иконописец)    Школа / Место издания: Россия",,,20,24,,,"Стиль: Дерево ?    Размеры: В. 20, Ш. 24 (приблизительно) / В. 24, Ш. 20 (приблизительно)"
11755,2016-06-14T09:45:53Z,Доска для записей,,,8.5,18.8,,,"Размеры: В. 8.5, Ш. 18.8"
7626,2016-06-14T09:45:24Z,Все Святые (название употребляемое); Святые года (название предполагаемое)    Автор: Аноним (иконописец)    Школа / Место издания: Россия ?,,,130,60,,,"Стиль: Дерево ?; Синий: голубой, тыльная сторона    Размеры: В. 130, Ш. 60 (доска ?)    Ссылка на каталоги / инвентари: В источнике не указаны иконография, датировка, материал и техника, требуется уточнение."
4751,2016-06-14T09:45:00Z,"За победу под Калишем (название изначальное)    Автор: Гаупт Готфрид (медальер, резчик)    Школа / Место издания: Германия, Россия    Монетный двор    Период оригинала: 1 четверть 20 век ?",,,42,39,,,"Размеры: В. 42 мм ? / В. 43 мм, Ш. 39 мм    Характер подписи: H (?) ?; Haupt. F. (?) ?    Характер подписи: Петр I Алексеевич    Характер подписи: ЦРЬ ПЕТРЬ / АЛЕЗИЕВИЧ ВСЕЯ РОСИ ПОВЕЛИТЕЛЬ (по окружности); ЗАВЪРНОСТЬ / ИМУЖЕСТВО (О. по верху); 1706 (О. под обрезом)    Ссылка на каталоги / инвентари: ГМЗ РК: № 354; СПИНК/2000.11: № 466    Ссылка на каталоги / инвентари: Фото: см. Источники, оригинал.  Описание составлено по Источникам и каталогу.  Подписи: могут быть без подписи.  Копия не чеканенная, ср. с Предметом 2.  От редактора: были отчеканены несколько вариантов (известны 6 типов), всего было выпущено 300 медалей из золота (см. СПИНК, возможно оригинал)."
10982,2016-06-14T09:46:14Z,Плат,,,24,31,,,"Размеры: В. 24.0, Ш. 31.0"
5761,2016-06-14T09:45:13Z,Святой Апостол Лука Евагелист (название изначальное)    Автор: Аноним (иконописец)    Школа / Место издания: Россия ?    Период оригинала: 19 век,ИКОНА,,25,20,,,"Размеры: В. 25, Ш. 20 (доска) / В. 20, Ш. 25 (доска)"
7592,2016-06-14T09:45:25Z,Богоматерь Казанская (название придуманное)    Автор: Аноним (иконописец); Аноним (мастер)    Школа / Место издания: Россия,ИКОНА,,23,27,,,"Стиль: С окладом/ризой: Латунь ?/ Медь ?/ Другое ?, Желтый металл    Размеры: В. 23, Ш. 27 (в окладе ?) / В. 27, Ш. 23 (в окладе ?)    Ссылка на каталоги / инвентари: В источнике не указаны датировка, техника, требуется уточнение."
13911,2016-06-14T09:46:08Z,Столик-бобик,,,103,53,43.5,,"Размеры: Дл. 103.0, Ш. 53.0, В. 43.5"
339,2016-06-14T09:44:22Z,Казанская Божия Матерь (название употребляемое); Богоматерь Казанская  (название придуманное)    Автор: Аноним (список)    Школа / Место издания: Россия,ИКОНА,,28,25,,,"Стиль: Темпера ?    Размеры: В. 28, Ш. 25 (в окладе ?)    Ссылка на каталоги / инвентари: В источнике не содержатся сведения о датировке, технике, материалах, надписях."
8436,2016-06-14T09:45:29Z,Благовещение (название изначальное); Архангел Гавриил из Благовещения (название придуманное)    Автор: Аноним (иконописец)    Школа / Место издания: Россия    Период оригинала: 1 четверть 20 век,ИКОНА,,48,25,,,"Размеры: В. 48, Ш. 25 (доска)"
3680,2016-06-14T09:44:52Z,Неопалимая купина (название изначальное); Богоматерь Неопалимая Купина  (название употребляемое); Богородица Неопалимая Купина  (название старое)    Автор: Аноним (иконописец)    Школа / Место издания: Россия    Период оригинала: 2 половина 18 век ?; 1 половина 19 век ?,,,25,30,,,"Стиль: Дерево ?    Размеры: В. 25, Ш. 30 (приблизительно) / В. 30, Ш. 25 (приблизительно)"
17959,2016-06-14T09:46:40Z,"Филосовия старого дерева ""Вечер"" (диптих)    Автор: В.И.Куров",,,100,74,,,"Размеры: В. 100, Ш. 74"
3522,2016-06-14T09:44:51Z,Святой Пантелеймон Целитель (название изначальное)    Автор: Аноним (иконописец)    Школа / Место издания: Россия,ИКОНА,,53,39,,,"Размеры: В. 53, Ш. 39 (приблизительно)"
8495,2016-06-14T09:45:43Z,"Антиминс.    Автор: ? (гравер)    Школа / Место издания: Россия    Период оригинала: 18 век, 2 половина; Дата: 1741-1761 гг.",ОТТИСК,,57,39.8,,,"Размеры: В. 39,8; Дл. 57    Ссылка на каталоги / инвентари: Ткань пожелтела. Из старых поступлений."
3625,2016-06-14T09:44:54Z,Святой Николай Чудотворец (название изначальное); Николай Угодник (название старое)    Автор: Аноним (иконописец)    Школа / Место издания: Россия    Период оригинала: 19 век,ИКОНА,,30,40,,,"Размеры: В. 30, Ш. 40 (приблизительно) / В. 40, Ш. 30 (приблизительно)"
11724,2016-06-14T09:45:53Z,Пейзаж    Автор: Оболенская А.А.,ЖИВОПИСЬ,,23.5,15.5,,,"Размеры: В. 23.5, Ш. 15.5"
985,2016-06-14T09:44:29Z,"Пятница (название изначальное); Параскева Пятница с Деисусом (название старое); Святая Параскева Пятница под Деисусом и предстоящие Святые (название последнее)    В русском оригинале (переводе): Параскева (греческий, название изначальное)    Автор: Чулимов Григорий (иконописец, средник) ?; Лебедев Гаврила Васильевич (иконописец,  Деисус и поля)    Школа / Место издания: Россия    Период оригинала: 2 четверть 19 век; 2 половина 19 век ? (дополнения)",ИКОНА,,50.5,38.5,,,"Стиль: Резьба/тиснение по левкасу ?; Дерево: липа, цельная доска; направление слоя древесины относительно изображения вертикальное    Размеры: В. 50.5, Ш. 38.5, Т. 2.3 (доска)    Характер подписи: иконоп Гр. Чел[имов ?]. 3 гк ( внизу; на внутренней отбивке, черная краска)    Характер подписи: Лебедев Г.В. (иконописец ?)    Характер подписи: 1839 августа 8 (П. на внутренней отбивке, черная краска); ? (имена изображенных ); в рыковъ нижний Гавриле Васильичю Лебедеву по договору написать на сеи цке Пятницу ' припись архангела Гавриила Садофия Матроны муч. Андрея Первозваннаго за 16 ру сверх написалъ деисусъ надо прибавки еще за деисусъ что нибуть (О под верхней шпонкой, черные чернила); СИАМЗ № 9322 ( О. над нижней шпонкой, с., фиолетовые чернила);  СИАМЗ КП Ш № 9322 ( О. под нижней шпонкой, шариковая ручка, фиолетовая паста)    Ссылка на каталоги / инвентари: В источнике не содержатся сведения о размерах, не воспроизводятся надписи, касающиеся изображенных лиц, не указаны второй автор ( Лебедев Г.В. ?) и время дополнения новыми образами на полях и написания деисуса; размеры взяты из надписи на фото.  Состояние: коробление доски (1.8 см); 2 резные шпонки утрачены; на тыльной стороне по нижнему краю доски 4 мелкие трещины, края имеют сколы и отщипления; на лицевой стороне ?"
548,2016-06-14T09:44:26Z,Иоанн Пророк (название изначальное); Иоанн Креститель (название употребляемое); Иоанн Предтеча Креститель в Молении (название последнее)    Автор: Аноним (иконописец)    Школа / Место издания: Россия    Период оригинала: 18 век,ИКОНА,,31,27,,,"Стиль: Дерево поделочное; С ковчегом? ; Рама цельная гладкая (поля).    Размеры: В. 31, Ш. 27, Т. 3 (в обрамлении); Ш. 3 (обрамление)    Характер подписи: ? (свиток, 4 строки)    Ссылка на каталоги / инвентари: В источнике дано название ""Иоанн Богоприимец"" ?, поэтому 2 варианта описания до уточнения."
15517,2016-06-14T09:46:26Z,Самовар    Период оригинала: начало 20 века,,,25,33,,,"Размеры: В.33, Д.25    Инвентарный номер: АЭМ-1055"
3354,2016-06-14T09:44:50Z,Казанская Божия Матерь (название употребляемое); Богоматерь Казанская  (название придуманное)    Автор: Аноним (иконописец)    Школа / Место издания: Россия    Период оригинала: 19 век,,,55,80,,,"Размеры: В. 55, Ш. 80 (доска) / В. 55, Ш. 80 (доска)"
11662,2016-06-14T09:45:52Z,Копилка,,,17,10.5,,,"Размеры: В. 17.0, Ш. 10.5"
