id,registration,name,category,сultural_property,height,width,depth,preservation,description
12451,2016-06-14T09:45:58Z,Пожилая дама,,,13,18,,,"Размеры: В. 13.0, Ш. 18.0"
7832,2016-06-14T09:45:27Z,Богородица (название старое); Богоматерь (название употребляемое)    Автор: Аноним (иконописец)    Школа / Место издания: Россия ?,,,20,30,,,"Размеры: В. 20, Ш. 30 (доска ?) / В. 30, Ш. 20 (доска ?)    Ссылка на каталоги / инвентари: В источнике не указаны иконография, датировка, техника, требуется уточнение."
17546,2016-06-14T09:46:37Z,"Орден Трудового Красного Знамени №81007    Период оригинала: 20 век, 4 четверть",,,4.4,3.7,,,"Размеры: В. 4,4; Ш. 3,7    Инвентарный номер: КИКМ № 6266"
5441,2016-06-14T09:45:08Z,Святая Агнесса (название изначальное)    Автор: Аноним (художник)    Школа / Место издания: Италия    Период оригинала: 4 четверть 18 век; 1 четверть 19 век,ЖИВОПИСЬ,,74,65,,,"Размеры: В. 74, Ш. 65 (без обрамления ?)"
13697,2016-06-14T09:46:06Z,Подставка,,,1.4,10.3,7,,"Размеры: Дл. 1.4, Ш. 10.3, В. 7.0"
6611,2016-06-14T09:45:19Z,Праотцы Адам и Давид (название придуманное); Святой Иосиф Обручник и Святой Давид (название предполагаемое)    Автор: Аноним (иконописец)    Школа / Место издания: Россия ?    Период оригинала: 18 век ?; 19 век ?,ИКОНА,,6,17,,,"Стиль: Темпера: цветной однотонный (?)    Размеры: В. 6, Ш. 17 (доска) / В. 17, Ш. 6 (доска)"
14750,2016-06-14T09:45:45Z,"Сухарница    Период оригинала: 19 век, 4 четверть",,,7.1,34.1,,,"Стиль: Серебро 875 пробы    Размеры: В. 7,1, Ш. 34,1, Т. 24,7; Вес 673,0 г    Характер подписи: на пластине: « Ф:СБ» и датами «1865 XXV 1890 1 января»; на ручках: «Л» и герб г.Москвы.    Ссылка на каталоги / инвентари: КП ОИРК 148-4/1.Поступление из Гохрана (Акт №181 от 25.04.1951). Старые №№ ЯЩ 34.    Инвентарный номер: ЭРО-7647, СБ-4157"
3020,2016-06-14T09:44:46Z,"Сошествие во ад / Воскресение Христово (название двойное, название изначальное); Воскресение Христово (название употребляемое)    Автор: Аноним    Школа / Место издания: Россия ?    Период оригинала: 19 век",ИКОНА,,70,40,,,"Размеры: В. 70, Ш. 40 (приблизительно)"
14741,2016-06-14T09:45:45Z,"Николай Чудотворец    Период оригинала: 19 век, 1 половина",ИКОНА,,31.5,26.5,,,"Размеры: В. 31,5, Ш. 26,5 Оклад: Вес 415,5 г, Риза: В. 22,4, Ш.16,5; Вес 109,35 г    Ссылка на каталоги / инвентари: Живопись сильно повреждена, по нижнему краю митры отсутствует низка стекол, шитье порвано, жемчуг и бусы осыпаются, оклад помят и порван оп краям.    Инвентарный номер: ЭРО-7142 (а,б,в), СВ-1581, СВ-1001"
13873,2016-06-14T09:46:07Z,Морской вид    Автор: Дюккер Е.Э.,ЖИВОПИСЬ,,51.5,37.1,,,"Размеры: В. 51.5, Ш. 37.1"
10446,2016-06-14T09:45:47Z,Кобура,,,10,21,,,"Размеры: В. 10.0, Ш. 21.0"
1381,2016-06-14T09:44:35Z,"Пастушок (название изначальное)    Автор: Зиновьев Николай Михайлович (художник)    Школа / Место издания: Россия, Палех    Художественно-производственные мастерские Палехского отделения Худфонда РСФСР    Период оригинала: 20 век",ЖИВОПИСЬ,,17,13,,,"Размеры: В. 17, Ш. 13 (крышка ?) /  В. 13, Ш. 17 (крышка ?)    Характер подписи: 159 ?"
10387,2016-06-14T09:45:47Z,Таблица «Детали полевой ударной трубки»,,,46.5,37,,,"Размеры: В. 46.5, Ш. 37.0"
5939,2016-06-14T09:44:31Z,"Здание Адмиралтейства (название сцены; лицевая сторона, крышка)    Школа / Место издания: Россия    Период оригинала: 1 половина 20 век",РАЗНОЕ,,7.5,10,,,"Стиль: Сталь? Другое ?: металл (?); Штамповка ?    Размеры: В. 7.5, Ш. 10 (крышка) / В. 10, Ш. 7.5 (крышка)    Ссылка на каталоги / инвентари: Состояние: хорошая сохранность;  В источнике: личных обозначений и надписей нет."
4319,2016-06-14T09:44:58Z,"Старик араб у стены (название придуманное); Старик у каменной стены (название последнее)    Автор: Аноним (художник)    Школа / Место издания: Россия ?, Западная Европа",ЖИВОПИСЬ,,26,20,,,"Стиль: Масло ?    Размеры: В. 26, Ш. 20 (без обрамления ?) / В. 20, Ш. 26 (без обрамления ?)    Ссылка на каталоги / инвентари: Состояние: после реставрации на месте (1961)"
14110,2016-06-14T09:46:09Z,"Яхта ""полярная звезда""    Автор: де Мартино Е.",,,37.8,22,,,"Размеры: В. 37.8, Ш. 22.0"
5170,2016-06-14T09:45:02Z,"Пробуждение (название придуманное)    Автор: Дерегус Михаил Гордеевич (художник); ? (гравер)    Школа / Место издания: Россия, Украина    Период оригинала: 20 век",ОТТИСК,,22,15.5,,,"Стиль: Гравюра на металле: офорт    Размеры: В. 22, Ш. 15.5 (доска ?); В. 41.5, Ш. 30 (лист ?)"
11506,2016-06-14T09:45:51Z,Император Александр III с семьей и придворными в парке,,,17.5,12,,,"Размеры: В. 17.5, Ш. 12.0"
2920,2016-06-14T09:44:47Z,Святой Николай Мирликийский (название употребляемое); Святой Николай Чудотворец (название изначальное); Николай Угодник (название старое)    Автор: Аноним (иконописец)    Школа / Место издания: Россия ?,ИКОНА,,75,12.7,,,"Стиль: Бархат Коричневый: оборотная сторона доски    Размеры: В. 75 ?, Ш. 12.7, Т. 1 (приблизительно) / В. 35 ?, Ш. 12.7, Т. 1 / В. 25 ?, Ш. 12.7, Т. 1    Ссылка на каталоги / инвентари: В источнике не указана техника, требуется запрос."
12673,2016-06-14T09:45:59Z,Папка,,,38,27,,,"Размеры: В. 38.0, Ш. 27.0"
18940,2016-08-08T14:02:56Z,"Медная икона ""Успение Пресвятой Богородицы""",ИКОНА,Объект является культурной ценностью,34.4,28.9,,,
14293,2016-06-14T09:46:10Z,Портфельчик,,,20,15.5,,,"Размеры: В. 20.0, Ш. 15.5"
2513,2016-06-14T09:44:42Z,Осенний лес (название придуманное)    Автор: Аноним (художник),ЖИВОПИСЬ,,10.5,17,,,"Размеры: В. 10.5, Ш. 17 (картон ?)    Ссылка на каталоги / инвентари: ЧГОМ: № 459    Ссылка на каталоги / инвентари: Состояние: в реставрации (1995 с)."
4201,2016-06-14T09:44:56Z,Богородица (название старое); Богоматерь (название употребляемое)    Автор: Аноним (иконописец)    Школа / Место издания: Россия    Период оригинала: 18 век,ИКОНА,,32,35,,,"Стиль: Дерево поделочное; С окладом    Размеры: В. 32, Ш. 35 (приблизительно) / В. 35, Ш. 32 (приблизительно)"
5278,2016-06-14T09:45:05Z,Святой Серафим Саровский (название изначальное)    Автор: Аноним (художник)    Школа / Место издания: Россия    Период оригинала: 4 четверть 19 век ?; 1 четверть 20 век ?,ИКОНА,,55,45,,,"Стиль: Золотистый: орнамент по периметру, бордюр    Размеры: В. 55, Ш. 45 (без обрамления ?); Ш. 5 (бордюр)    Ссылка на каталоги / инвентари: Состояние: утрата красочного слоя снизу (Д. 15 см), просматривается грунтовка белого цвета."
17183,2016-06-14T09:46:20Z,"ВЕЛИКОМУЧЕННИЦА ПАРАСКЕВА ПЯТНИЦА    Школа / Место издания: Ценральная Россия    Период оригинала: 2 половина, 16 век",ИКОНА,,31.5,26.2,,,"Размеры: В. 31.5, Ш. 26.2"
2061,2016-06-14T09:44:44Z,"Сидящая женщина (название придуманное) # Молодой  человек (название употребляемое); Светловолосый юноша (название придуманное; оборотная сторона)    Автор: Захаров Петр Захарович, Захаров-Чеченец (художник)    Школа / Место издания: Россия    Период оригинала: 2 четверть 19 век",РИСУНОК,,24.3,18.5,,,"Размеры: В. 24.3, Ш. 18.5 (лист ?)    Характер подписи: Цветков И.Е.    Характер подписи: Захаров (О. карандаш, рука неизвестного); [галерея Цветкова ?] (О., штамп)    Ссылка на каталоги / инвентари: ЧГОМ:  не значится; ЗАХАРОВ: с. 44    Ссылка на каталоги / инвентари: Фото: оборотная сторона, см. Предмет 1.1."
14132,2016-06-14T09:46:09Z,Диван,,,1.74,0.63,1.1,,"Размеры: Дл. 1.74, Ш. 0.63, В. 1.10"
7442,2016-06-14T09:45:29Z,Богиня охоты (название употребляемое); Диана охотница в окружении собаки и зайца (название придуманное)    Автор: Аноним (скульптор) ?    Школа / Место издания: Западная Европа,,,50,40,,,"Стиль: Корпус: Бронза, Золотистый; Циферблат: Белый, Эмаль ?/ Фарфор ?    Размеры: В. 50, В. 60, Ш. 40 (приблизительно)"
17386,2016-06-14T09:46:32Z,"Бинокль № 9012 blc+ ""Dienstglas""",,,10,50,,,"Размеры: В. 10, Ш. 50    Ссылка на каталоги / инвентари: Похищен из экспозиции. Докладная зав. филиалом от 16.07.1988    Инвентарный номер: 5027/10"
4844,2016-06-14T09:45:03Z,Воскресение и 12 праздников (название употребляемое); Сошествие во ад / Воскресение Христово и Праздники (название последнее)    Автор: Аноним (иконописец)    Школа / Место издания: Россия    Период оригинала: 19 век,ИКОНА,,75,55,,,"Размеры: В. 75, Ш. 55 (доска)"
322,2016-06-14T09:44:22Z,"Путеводительница / Богохранимая (название изначальное); Божия Матерь Тихвинская (название старое); Богоматерь Одигитрия Тихвинская (название придуманное)    В русском оригинале (переводе): Одигитрия (греческий, название изначальное)    Автор: Аноним (список); Аноним (ювелир)    Школа / Место издания: Россия    Период оригинала: 19 век",ИКОНА,,32,27,,,"Стиль: Темпера?; С окладом: см. сл. стр.; С ризой: Жемчуг ( шитье ?)    Размеры: В. 32, Ш. 27 (в окладе)"
7829,2016-06-14T09:45:27Z,Пресвятая Богородица (название старое); Богоматерь (название употребляемое)    Автор: Аноним (модельщик)    Школа / Место издания: Россия ?    Аноним (литейщик),,,20,20,,,"Размеры: В. 20, Ш. 20 (пластинка ?)    Ссылка на каталоги / инвентари: В источнике не указаны иконография, датировка, требуется уточнение."
19351,2018-05-03T08:06:52Z,"Пряжка  Россия, нач . XXв, металл, стекло,  шир. - 5,8 см, в. - 3,7 см, глуб. - 0,6 см  КП 17307  ПДМП 704-бк",РАЗНОЕ,Объект является культурной ценностью,3.7,5.8,,,
7143,2016-06-14T09:45:21Z,Распятие Иисуса Христа (название изначальное)    Автор: Аноним (резчик); Аноним (ювелир)    Школа / Место издания: Россия ?    Период оригинала: 19 век,,,19,7,,,"Стиль: Перламутр: крест-распятие, врезанный в деревянный крест    Размеры: В. 19, Ш. 7"
4761,2016-06-14T09:44:37Z,"Кошка с клубком (название придуманное)    Автор: Плотников В. (скульптор ?, формовщик ?)    Школа / Место издания: Россия, Урал    Касли (завод чугуноплавильный)    Период оригинала: 19 век ?; 1 четверть 20 век ?",,,7,7,5,,"Стиль: чугун; Квадрат: крышка    Размеры: В. 5, Ш. 7, Гл. 7    Характер подписи: Плотников В.; Касли    Характер подписи: Касл.3 (О. в клейме); В.ПЛОТНИКОВЪ (О. в клейме)"
13707,2016-06-14T09:46:06Z,Подушка диванная,,,51,52,,,"Размеры: В. 51.0, Ш. 52.0"
3969,2016-06-14T09:44:57Z,"Богородица Тихвинская (название придуманное); Путеводительница / Богохранимая  (название изначальное); Богоматерь Одигитрия Тихвинская (название последнее)    В русском оригинале (переводе): Одигитрия (греческий, название изначальное)    Автор: Аноним (иконописец)    Школа / Место издания: Россия    Период оригинала: 20 век ?",,,15,20,,,"Стиль: Дерево ?    Размеры: В. 15, Ш. 20 (приблизительно) ? / В. 20, Ш. 15 (приблизительно)    Ссылка на каталоги / инвентари: В источнике: ""15  20 В "" (?)"
266,2016-06-14T09:44:18Z,Святой Апостол Лука Евагелист (название изначальное)    Автор: Аноним (иконописец)    Школа / Место издания: Россия    Период оригинала: середина 17 век,ИКОНА,,28,17,,,"Стиль: Ткань: паволока; Полукруг: верхняя часть иконки (арка)    Размеры: В. 28, Ш. 17  (в киоте)    Ссылка на каталоги / инвентари: ГМЗ РК: № 6, 7, 8, 9, 10, 11    Ссылка на каталоги / инвентари: Фото: общий вид ворот и киотцы с Евангелистами."
3270,2016-06-14T09:44:48Z,Святая Варвара (название изначальное)    Автор: Аноним (иконописец)    Школа / Место издания: Россия    Период оригинала: 19 век,,,30,20,,,"Стиль: Дерево поделочное    Размеры: В. 30, Ш. 20, Т. 6 (доска)"
2978,2016-06-14T09:44:47Z,Святой Димитрий (название старое); Святой Дмитрий (название употребляемое)    Автор: Аноним    Школа / Место издания: Россия ?    Период оригинала: 19 век,ИКОНА,,30,40,,,"Размеры: В. 30, Ш. 40 (приблизительно) / В. 40, Ш. 30 (приблизительно)"
2489,2016-06-14T09:44:43Z,"Императрица Александра Федоровна (название изначальное)    Автор: Винтергалтер Франсуа Ксавье (художник) ?    Школа / Место издания: Германия ?, Франция ?    Период оригинала: 19 век ?",,,83,64,,,"Размеры: В. 83, Ш. 64 (приблизительно)    Ссылка на каталоги / инвентари: ЧГОМ: № 388 (Предмет 1.)    Ссылка на каталоги / инвентари: Состояние:  после реставрации (1995)."
10412,2016-06-14T09:45:47Z,Умывальник,,,0.85,0.74,1.24,,"Размеры: Дл. 0.85, Ш. 0.74, В. 1.24"
6343,2016-06-14T09:45:16Z,Богородица Казанская (название старое); Богоматерь Казанская (название придуманное)    Автор: Аноним (иконописец)    Школа / Место издания: Россия    Период оригинала: 18 век ?; 19 век ?,ИКОНА,,45,50,,,"Стиль: Темпера: сочных контрастных тонов; Золочение: позолота    Размеры: В. 45, Ш. 50 (доска) / В. 50, Ш. 45 (доска)"
7315,2016-06-14T09:45:25Z,Святой апостол Марк (название употребляемое); Святой Апостол Марк Евангелист (название изначальное)    Автор: Аноним (иконописец)    Школа / Место издания: Россия ?,,,20,42,,,"Стиль: Дерево ?    Размеры: В. 20, Ш. 42 (доска ?) / В. 42, Ш. 20 (доска ?)    Ссылка на каталоги / инвентари: В источнике не указаны материал, техника, иконография, требуется уточнение."
3802,2016-06-14T09:44:52Z,Николай Чудотворец(название употребляемое); Святой Николай Чудотворец (название изначальное); Николай Угодник (название старое)    Автор: Аноним (иконописец)    Школа / Место издания: Россия,ИКОНА,,30,25,,,"Стиль: Дерево ?    Размеры: В. 30, Ш. 25 (приблизительно) / В. 25, Ш. 30 (приблизительно)    Ссылка на каталоги / инвентари: В источнике: мрачных темных тонов, лак."
8090,2016-06-14T09:45:31Z,Портрет женщины (название придуманное)    Автор: Аноним (скульптор) ?    Школа / Место издания: Россия ?    Период оригинала: 20 век ?,,,28,48,22,,"Размеры: В. 22, Ш. 48, Гл. 28 / В. 22, Ш. 28, Гл. 48 / В. 48, Ш. 28, Гл. 22    Ссылка на каталоги / инвентари: ЧГОМ: № 53, № 57, № 58 (скульптура)"
15537,2016-06-14T09:46:26Z,Этюд. Стройплощадка Кузнецкого металлургического комбината им. И.В. Сталина. 1928 г.    Автор: Бачевский С.А.,ЖИВОПИСЬ,,62,26,,,"Размеры: В.26, Дл.62    Инвентарный номер: КП 2202"
254,2016-06-14T09:44:17Z,"Тихвинская Божья Матерь (название старое); Путеводительница / Богохранимая  (название изначальное); Богоматерь Одигитрия Тихвинская (название придуманное)    В русском оригинале (переводе): Одигитрия (греческий, название изначальное)    Автор: Аноним (иконописец)    Школа / Место издания: Россия    Период оригинала: 4 четверть 18 век ?; 1 четверть 19 век ?; 4 четверть 19 век ?",ИКОНА,,26,21,,,"Стиль: Масло ?    Размеры: В. 26, Ш. 21 (доска, без обрамления ?)    Характер подписи: [Тихвинская] (слева)    Ссылка на каталоги / инвентари: Фото: на общем фото справа вверху, см. Источники.  Состояние: стерлась краска; трещина по середине иконы.  Название: эксперты не подтвердили, т.к. на фото не виден младенец."
6560,2016-06-14T09:45:15Z,"Иисус Христос Вседержитель (название изначальное; створа, слева)    В русском оригинале (переводе): Пантократор (греческий, название изначальное; створа, слева)    Автор: Аноним (модельщик)    Школа / Место издания: Россия    Аноним (литейщик)",,,10,7,,,"Размеры: В. 10, Ш. 7 (створа ?)    Ссылка на каталоги / инвентари: В источнике не указано название икон на центральной и правой створах, не дается размер складня в целом."
13385,2016-06-14T09:46:04Z,Будуарное кресло,,,67,70,79,,"Размеры: Дл. 67.0, Ш. 70.0, В. 79.0"
4185,2016-06-14T09:44:57Z,Все Святые (название употребляемое)    Автор: Аноним (иконописец)    Школа / Место издания: Россия,,,30,20,,,"Стиль: Дерево поделочное    Размеры: В. 30, Ш. 20 (приблизительно) / В. 20, Ш. 30 (приблизительно)"
10778,2016-06-14T09:46:13Z,Кресло,,,58,57,99,,"Размеры: Дл. 58.0, Ш. 57.0, В. 99.0"
18502,2016-06-14T09:46:41Z,"Илья на колеснице (название старое); Огненное вознесение Ильи Пророка (название употребляемое); Огненное восхождение Илии (название изначальное); Огненное восхождение Илии Пророка (название последнее)    Автор: Аноним    Школа / Место издания: Россия    Период оригинала: 17 век, 18 век",ИКОНА,,28,22,,,"Стиль: Доска выпуклой формы. Фон бордово-коричневого и темно-красного цвета    Размеры: В. 28, Ш. 22"
12479,2016-06-14T09:45:58Z,Умиление Божией Матери. Икона,,,11,19.5,,,"Размеры: В. 11.0, Ш. 19.5"
5236,2016-06-14T09:45:06Z,Развалины в степи (название придуманное)    Автор: Куинджи Архип Иванович (художник)    Школа / Место издания: Россия    Период оригинала: 2 половина 19 век ?; 1 четверть 20 век ?,ЖИВОПИСЬ,,22,34,,,"Стиль: Картон ? / Бумага ?    Размеры: В. 22, Ш. 34 (картон ?)    Характер подписи: Ж - 40 (О.)    Ссылка на каталоги / инвентари: Основа: из разных источников, требуется уточнение."
14776,2016-06-14T09:45:45Z,Богоматерь Казанская    Период оригинала: 19 век,ИКОНА,,35,28,,,"Стиль: Зернь; Камень - бирюза.    Размеры: В. 35,0, Ш. 28,0, Вес 1745,0 г    Ссылка на каталоги / инвентари: КП ОИРК 55-44. Поступление из ГМЭ по акту № 492 от 22.07.1946 г.; акт №363 от 21.05.1954 г. Старые №№ 111-43.    Инвентарный номер: ЭРО-8318, ВС-2563"
