id,registration,name,category,сultural_property,height,width,depth,preservation,description
7398,2016-06-14T09:45:22Z,Святой (название употребляемое)    Автор: Аноним (иконописец)    Школа / Место издания: Россия ?,ИКОНА,,17,13.2,,,"Размеры: В. 17, Ш. 13.2 (доска, в обрамлении)    Ссылка на каталоги / инвентари: От редактора: доски с такими данными (без учета иконографии) - 3 единицы (видимо, верхний ряд в полиптихе)."
48,2016-06-14T09:44:15Z,Иисус в младенчестве (название придуманное); Голова младенца (название употребляемое)    Автор: Аноним (рисовал)    Школа / Место издания: Италия,РИСУНОК,,30,20,,,"Стиль: Перо ?, Рисунок тушью с размывкой ?; Тушь: Коричневый ? / Черный ?    Размеры: В. 30, Ш. 20 (лист ?, приблизительно)    Ссылка на каталоги / инвентари: В источниках информации содержатся разные данные о технике; не содержатся данные о  периоде/дате, цветах тущи, бумаги, наличии  подписи, надписей ."
7791,2016-06-14T09:45:27Z,Распятие Христа (название изначальное)    Автор: Аноним (мастер)    Школа / Место издания: Россия ?,,,10,10,,,"Размеры: В. 10 / Ш. 10    Ссылка на каталоги / инвентари: В источнике не указаны материал, техника, требуется уточнение."
7249,2016-06-14T09:45:28Z,У ограды Никольской церкви (название изначальное)    Автор: Васильев Аркадий Павлович    Школа / Место издания: Россия    Период оригинала: 3 четверть 20 век,ЖИВОПИСЬ,,20,34,,,"Размеры: В. 20, Ш. 34 (без обрамления)    Ссылка на каталоги / инвентари: В источнике нет сведений о наличии подписи / надписи."
12166,2016-06-14T09:45:56Z,Пресс,,,3.5,3,,,"Размеры: В. 3.5, Ш. 3.0"
17833,2016-06-14T09:46:39Z,"Открытка. Рисунок Лебедева ""Дети""    Школа / Место издания: Россия    Период оригинала: 20 век, 1 четверть",,,13.5,8.5,,,"Размеры: Ш. 8,5; В.13,5    Инвентарный номер: КП-6664/4"
14167,2016-06-14T09:46:09Z,Шкаф книжный,,,1.32,0.505,1.32,,"Размеры: Дл. 1.32, Ш. 0.505, В. 1.32"
2051,2016-06-14T09:44:18Z,Момисонский перевал (название придуманное)    Автор: Слободин Андрей Федорович (художник)    Школа / Место издания: Россия    Период оригинала: 2 четверть 20 век; 2 половина 20 век,ЖИВОПИСЬ,,41,145,,,"Размеры: В. 41, Ш. 145 (приблизительно, без обрамления)    Ссылка на каталоги / инвентари: ЧГОМ: № 276"
19120,2017-10-18T14:15:49Z,"Флейта. Нач. 20 в., металл, кость.",МУЗЫКАЛЬНЫЙ ИНСТРУМЕНТ,Объект является культурной ценностью,31,1.9,,"Потертости, пятна окиси, на головке 2 трещины - 7,3 и 3,5 см, ободки неплотно прилегают к корпусу, на одном ободке следы пайки",ПКМ 13023/2
16601,2016-06-14T09:46:31Z,Картина    Автор: Кугач Ю.П.    Период оригинала: 50-70 гг. 20 века,ЖИВОПИСЬ,,60,80,,,"Размеры: В.60, Ш.80 см    Характер подписи: Выполнена красителем темного цвета"
4787,2016-06-14T09:44:22Z,"Служебно экономическая прогулка перед праздником (название записано; русский; лицевая сторона); Посещение  лавки мясника людьми в мундирах (название придуманное)    Автор: Шестаков Иван Федорович (художник, литограф); Руднев А. (издатель, печатник)    Школа / Место издания: Россия, Москва    Период оригинала: середина 19 век",ОТТИСК,,40,32,,,"Размеры: В. 40, Ш. 32 (лист ?) ?    Характер подписи: (см. фото); А.Руднев(ъ) [...] 1857 г. [...] ( н. поле ?) ?    Ссылка на каталоги / инвентари: СТЕРНИН / 1964: с.144    Ссылка на каталоги / инвентари: Фото: см. Ссылку, вариант, требуется подтверждение.  В источнике не указано название, автор произведения."
20682,2019-01-11T09:37:40Z,"КП -43914; С.Гр. – 9484  ГК-9363483  Непринцев Ю. М.  Весна 1943 года. 1961 г.   Офорт. И: 67х42,5;   Л: 93,5х62",ХУДОЖЕСТВЕННЫЕ ЦЕННОСТИ,Объект является культурной ценностью,67,42.5,,Нижнее поле помято,"Под изображением графитным карандашом: название, подпись, год."
6338,2016-06-14T09:45:16Z,"Богородица Владимирская (название старое); Богоматерь Владимирская  (название придуманное); Сладколобзающая / Умиление (название изначальное) ; Богоматерь Умиление Владимирская (название последнее)    В русском оригинале (переводе): Гликофилуса / Елеуса (греческий, название изначальное)    Автор: Аноним (иконописец)    Школа / Место издания: Россия (народная)",ИКОНА,,50,40,,,"Стиль: Темпера: мрачных темных тонов    Размеры: В. 50, Ш. 40 (доска)"
18919,2016-08-04T14:08:29Z,"Картина ""Мадонна с куропаткой"", Антонио ди Пуччи, темпера, картон, 164-1В0090",ЖИВОПИСЬ,Объект является культурной ценностью,54,32,,,
2974,2016-06-14T09:44:47Z,Богородица (название старое); Богоматерь (название употребляемое)    Автор: Аноним    Школа / Место издания: Россия ?    Период оригинала: 18 век,ИКОНА,,40,50,,,"Размеры: В. 40, Ш. 50 (приблизительно) / В. 50, Ш. 40 (приблизительно)"
6567,2016-06-14T09:45:18Z,Святой Николай Чудотворец (название изначальное); Николай Угодник (название старое)    Автор: Аноним (иконописец)    Школа / Место издания: Россия ?,,,20,30,,,"Размеры: В. 20, Ш. 30 (доска, в окладе ?) / В. 30, Ш. 20 (доска, в окладе ?)"
12768,2016-06-14T09:46:00Z,Кувшинчик,,,31,10.5,,,"Размеры: В. 31.0, Ш. 10.5"
3991,2016-06-14T09:44:55Z,"Иисус Христос Вседержитель (название изначальное); Спас Вседержитель (название придуманное)    В русском оригинале (переводе): Пантократор (греческий, название изначальное)    Автор: Аноним (иконописец)    Школа / Место издания: Россия    Период оригинала: 17 век",ИКОНА,,50,70,,,"Стиль: Дерево ценных пород; Другое: акварель; Без оклада/ризы/басмы ?; Белый металл: Олово (сплавы) ?/ Белая жесть ? / Другое ?, Стекло (киот ?)    Размеры: В. 50, Ш. 70 (приблизительно, киот ?) / В. 70, Ш. 50 (приблизительно, киот ?)"
2095,2016-06-14T09:44:40Z,"ГЭСстрой (название изначальное)    Автор: Мурзабеков Камиль Арсланалиевич (художник)    Школа / Место издания: Россия, Северный Кавказ    Период оригинала: 2 половина 20 век",ЖИВОПИСЬ,,150,157,,,"Размеры: В. 150, Ш. 157 (приблизительно, без обрамления)    Ссылка на каталоги / инвентари: ЧГОМ: № 152"
7302,2016-06-14T09:45:28Z,Образ Святых мучеников (название старое); Святые мученики и Предстоящие Святые (название последнее)    Автор: Аноним (иконописец)    Школа / Место издания: Россия ?    Период оригинала: 2 половина 19 век,ИКОНА,,33.6,29,,,"Размеры: В. 33.6, Ш. 29 (доска)    Ссылка на каталоги / инвентари: В источнике не указаны количество Святых, их имена, школа, требуется уточнение."
16289,2016-06-14T09:46:22Z,Господь Вседержитель в силе и славе (название придуманное); Спас в силах (название употребляемое)    Школа / Место издания: Россия    Период оригинала: 17 век,ИКОНА,,30,20,,,"Размеры: В. 30, Ш. 20    Инвентарный номер: Б/н"
994,2016-06-14T09:44:29Z,Илья Пророк на колеснице (название старое); Огненное вознесение Ильи Пророка (название употребляемое); Огненное восхождение Илии (название изначальное); Огненное восхождение Илии Пророка (название последнее)    Автор: Аноним (иконописец)    Школа / Место издания: Россия    Период оригинала: 18 век; 1 четверть 18 век,ИКОНА,,31.5,27,,,"Стиль: Дерево: шпонки врезные, встречные; С ковчегом: двойной ковчег    Размеры: В. 31.5, Ш. 27 (доска) / В. 27, Ш. 31.5 (доска)    Характер подписи: [Огненное восхождение стаго про Илии] (верхнее поле)    Ссылка на каталоги / инвентари: Состояние: осыпи красочного слоя; кракелюр.  Надпись: точность воспроизведения нуждается в уточнении.  Быв. Рег. № 2.1./991.2"
11195,2016-06-14T09:46:16Z,Бумажник,,,9.5,14.8,,,"Размеры: В. 9.5, Ш. 14.8"
13957,2016-06-14T09:46:08Z,Ваза,,,12,40,,,"Размеры: В. 12.0, Ш. 40.0"
18478,2016-06-14T09:46:41Z,"Святой Пантелеймон целитель    Автор: Аноним    Школа / Место издания: Россия    Период оригинала: 17 век, 18 век, 19 век, 20 век (?)",ИКОНА,,100,60,,,"Размеры: В. 100, Ш. 60,    Инвентарный номер: 046"
924,2016-06-14T09:44:23Z,Илья на колеснице (название старое); Огненное вознесение Ильи Пророка (название употребляемое); Огненное восхождение Илии (название изначальное); Огненное восхождение Илии Пророка (название последнее)    Автор: Аноним (список)    Школа / Место издания: Россия    Период оригинала: 19 век,ИКОНА,,75,60,,,"Стиль: Темпера ?; Без оклада/ризы/басмы?    Размеры: В. 75, Ш. 60 (доска)"
5208,2016-06-14T09:45:04Z,"Буква У (название придуманное)    Автор: Павлов Иван Николаевич (художник, гравер)    Школа / Место издания: Россия    Период оригинала: 4 четверть 19 век ?; 1 половина 20 век ?",ОТТИСК,,11.1,8.2,,,"Размеры: В. 11.1, Ш. 8.2 (лист ?), В. 2.9, Ш. 2.7 (доска ?)"
6228,2016-06-14T09:45:18Z,Троица Ветхозаветная (название придуманное); Явление Аврааму трех ангелов (название изначальное); Троица (название употребляемое)    Автор: Аноним (иконописец)    Школа / Место издания: Россия ?,,,26,30,,,"Размеры: В. 26, Ш. 30 (доска, в окладе ?) / В. 30, Ш. 26 (доска, в окладе ?)"
14077,2016-06-14T09:46:09Z,Ваза,,,6.5,28.5,,,"Размеры: В. 28.5, Д. 6.5"
4491,2016-06-14T09:44:59Z,Утоли моя печали (название изначальное); Богоматерь Утоли моя печали (название придуманное)    Автор: Аноним (иконописец)    Школа / Место издания: Россия,ИКОНА,,35,45,,,"Стиль: Дерево поделочное    Размеры: В. 35, Ш. 45 (доска) / В. 45, Ш. 35 (доска)"
14331,2016-06-14T09:46:10Z,Подставка настольная,,,35,14,,,"Размеры: В. 35.0, Ш. 14.0"
5404,2016-06-14T09:45:08Z,Дорога у опушки (название старое); Дорога у опушки леса (название предполагаемое)    Автор: Базурин ? (художник)    Школа / Место издания: Россия    Период оригинала: 19 век,ЖИВОПИСЬ,,25,30,,,"Размеры: В. 25, Ш. 30 (без обрамления ?)"
8425,2016-06-14T09:44:46Z,Архангел Михаил (название изначальное); Архангел Михаил воевода (название употребляемое); Архистратиг Михаил (название старое)    Автор: Аноним (ювелир)    Школа / Место издания: Россия    Период оригинала: 18 век,,,40,50,,,"Стиль: С окладом/ризой ? / С басмой ?, Серебро    Размеры: В. 40, Ш. 50 (приблизительно) / В. 50, Ш. 40 (приблизительно)"
6021,2016-06-14T09:45:14Z,"Богородица Умиления (название старое); Богоматерь Умиление (название придуманное); Сладколобзающая / Умиление (название изначальное)    В русском оригинале (переводе): Гликофилуса / Елеуса (греческий, название изначальное)    Автор: Аноним (иконописец); Аноним (ювелир)    Школа / Место издания: Россия ?    Период оригинала: 19 век",ИКОНА,,138,88,,,"Стиль: С окладом/ризой: Серебро    Размеры: В. 138, Ш. 88 (в окладе ?); Вес 9 кг ?"
133,2016-06-14T09:44:16Z,Море (название употребляемое)    Автор: Куинджи Архип Иванович (художник)    Школа / Место издания: Россия    Период оригинала: 4 четверть 19 век; 1 четверть 20 век,ЖИВОПИСЬ,,31,25,,,"Размеры: В. 31, Ш. 25 (приблизительно) / В. 31, Ш. 24 (без обрамления ?) / В. 24, Ш. 30 (без обрамления)    Ссылка на каталоги / инвентари: ЧИХМ: № 114    Ссылка на каталоги / инвентари: Состояние: повреждена в годы ВОВ, после реставрации на месте (1961), в реставрации (1961 до/после) ?   Техника, материал из ЧГК, размеры из ЧГК и Отчета, последние размеры - из ГРМ, см. Источники."
3682,2016-06-14T09:44:52Z,"Господь Вседержитель (название старое); Спас (название употребляемое); Иисус Христос Вседержитель (название изначальное); Спас Вседержитель (название придуманное)    В русском оригинале (переводе): Пантократор (греческий, название изначальное)    Автор: Аноним (иконописец)    Школа / Место издания: Россия    Период оригинала: 2 половина 18 век ?; 19 век ?; 1 четверть 20 век ?",ИКОНА,,23,27,,,"Стиль: Дерево ?    Размеры: В. 23, Ш. 27 (приблизительно) / В. 27, Ш. 23 (приблизительно)"
8421,2016-06-14T09:45:30Z,Святой Николай Чудотворец (название изначальное)    Автор: Аноним (мастер)    Школа / Место издания: Россия ?,,,20,30,,,"Размеры: В. 20, Ш. 30 (в окладе ?) / В. 30, Ш. 20 (в окладе ?)"
21075,2019-03-12T06:33:55Z,"Бум., акрил 160х230, 2004 г. Автор: Кострикова Татьяна",ЖИВОПИСЬ,Объект является культурной ценностью,160,230,,,
1228,2016-06-14T09:44:31Z,"Петербург, колонна (название придуманное); Александрийская колонна перед Зимним дворцом (название (название предполагаемое); Петербург / Коломна (название предполагаемое)    Автор: Кондратенко Гавриил Павлович (художник)    Школа / Место издания: Россия    Период оригинала: 4 четверть 19 век; 1 четверть 20 век",ЖИВОПИСЬ,,27,38,,,"Размеры: В. 27, Ш. 38  (приблизительно)?; В. 38, Ш. 27 (приблизительно)?;"
1193,2016-06-14T09:44:28Z,"Корнелия с сыновьями Гракхами (название изначальное)    Автор: Аноним (с оригинала); Аноним (копировал)    Школа / Место издания: Россия, Санкт-Петербург; Западная Европа (с оригинала)    Императорский фарфоровый завод    Период оригинала: 2 четверть 19 век",КЕРАМИКА,,44.7,40.5,,,"Стиль: С росписью надглазурной    Размеры: В. 44.7, Ш. 40.5 (пластинка)"
13928,2016-06-14T09:46:08Z,Шкафик-бюро,,,0.42,0.305,1.34,,"Размеры: Дл. 0.42, Ш. 0.305, В. 1.34"
2632,2016-06-14T09:44:27Z,Золотая Звезда (название изначальное); ГЕРОЙ СССР (название записано; русский; оборотная сторона)    Период оригинала: 2 четверть 20 век,,,15,19.5,15,,"Стиль: Серебро / Золоченое серебро / Бронза, Золочение: колодочка    Размеры: Д. 15 мм; Вес 21.5 грамма; В. 15 мм, Ш. 19.5 мм (колодочка)    Характер подписи: (О., чекан ?)    Ссылка на каталоги / инвентари: СОВЕТСКИЕ НАГРАДЫ / 1996: с. 14, № 1. 2; ОРДЕНА и МЕДАЛИ СССР : сс. 88-89; ОРДЕНА И МЕДАЛИ СССР / 1983    Ссылка на каталоги / инвентари: Фото: слева"
2552,2016-06-14T09:44:40Z,Портрет Дахкильговой Л. (название изначальное)    Автор: Бездетный М. (художник) ?; Бессмертный Михаил Саввич (художник) ?    Школа / Место издания: Россия    Период оригинала: 20 век,ЖИВОПИСЬ,,117,74,,,"Размеры: В. 117, Ш. 74 (приблизительно, без обрамления ?)    Ссылка на каталоги / инвентари: ЧГОМ: № 534 (529 п.ф.)"
5128,2016-06-14T09:45:03Z,Крестьянская девушка в лесу (название придуманное)    Автор: Штемберг В. (художник); Штемберг Виктор Карлович (художник) ?    Школа / Место издания: Россия    Период оригинала: 2 половина 19 век ?; 1 четверть 20 век ?,ЖИВОПИСЬ,,29,19.7,,,"Стиль: Белый: белила, Гуашь ?    Размеры: В. 29, Ш. 19.7 (лист)"
1062,2016-06-14T09:44:24Z,"Летняя тройка (название употребляемое)    Автор: Вишняков Осип Филиппович (мастерская)    Школа / Место издания: Россия, Жостово    Вишняков О.Ф. с сыновьями (фабрика лаковых изделий)    Период оригинала: 4 четверть 19 век",ЖИВОПИСЬ,,15.6,10,4.8,,"Стиль: Масло ?; Олово: станиоль, фольга ( внутреннее покрытие)    Размеры: В. 4.8, Дл. 15.6, Ш. 10 (предмет) / В. 15.6, Ш. 10 (крышка)    Характер подписи: 3 медали (?); корона (над 3 медалями); орел двуглавый (средняя медаль); Вишняковъ съ сыновьями (?)    Ссылка на каталоги / инвентари: СПИСОК ГИМ, 1989: № 13"
6554,2016-06-14T09:45:16Z,Богоматерь Целительница (название изначальное); Богородица Больных Исцеление (название придуманное)    Автор: Аноним (иконописец)    Школа / Место издания: Россия ?    Период оригинала: 18 век,ИКОНА,,35,45,,,"Размеры: В. 35, Ш. 45 (доска) / В. 45, Ш. 35 (доска)"
5539,2016-06-14T09:45:06Z,Богоматерь с младенцем (название придуманное); Богоматерь и Святой (название предполагаемое)    Автор: Аноним (иконописец); Аноним (чеканщик)    Школа / Место издания: Россия ?,ИКОНА,,25,36,,,"Стиль: С окладом: Медь    Размеры: В. 25, Ш. 36 (в окладе ?) / В. 36, Ш. 25 (в окладе ?)    Ссылка на каталоги / инвентари: Состояние: лики стерты"
7251,2016-06-14T09:45:28Z,Река Воронеж у Успенской церкви (название изначальное)    Автор: Васильев Аркадий Павлович    Школа / Место издания: Россия    Период оригинала: 3 четверть 20 век,ЖИВОПИСЬ,,19,17,,,"Размеры: В. 19, Ш. 17 (без обрамления)    Ссылка на каталоги / инвентари: В источнике нет сведений о наличии подписи / надписи."
14617,2016-06-14T09:46:18Z,"В лугах    Автор: А.Ф. Калинин    Школа / Место издания: Россия    Период оригинала: 20 век, 4 четверть",,,70,100,,,"Размеры: В. 70, Ш. 100    Инвентарный номер: НХГ Ж-219"
4982,2016-06-14T09:45:02Z,"Екатерина Алексеевна (название изначальное)    Автор: Гроот Георг Христоф (манера); Штенглин Иван (гравер, приписано)    Школа / Место издания: Россия    Период оригинала: 2 четверть 18 век",ОТТИСК,,52.9,34.9,,,"Стиль: Гравюра на металле: черная манера / меццотинто    Размеры: В. 52.9, Ш. 34.9 (доска ?); В. 55.7, Ш. 41.7 (лист ?); В. 7.6 дюйм фр., Ш. 5.10 дюйм фр. (доска ?)    Ссылка на каталоги / инвентари: РОВИНСКИЙ/1887: стб. 776 (фото), 777, № 4    Ссылка на каталоги / инвентари: Фото: см. Ссылку.  В описании использован каталог, см. Ссылку.  От редактора, из каталога: единственный известный экземпляр с нижним полем, покрытым царапинами, находится ( в 1887) в СПБ Публ. Библ. (из собрания Штелина)."
