id,registration,name,category,сultural_property,height,width,depth,preservation,description
17791,2016-06-14T09:46:39Z,Коробка из-под чая,,,7.5,9,6,,"Размеры: Дл. 7,5; Ш. 9; В. 6    Инвентарный номер: КП-5525"
18504,2016-06-14T09:46:41Z,"Вознесение Господне (название употребляемое); Вознесение Христово (название изначальное)    Автор: Аноним    Школа / Место издания: Россия    Период оригинала: 20 век, 1 четверть (приблизительно)",ИКОНА,,55,40,,,"Размеры: В. 55, Ш. 40; В. 40, Ш. 55 (?)"
1184,2016-06-14T09:44:28Z,"Владимирская Пресвятая Богородица (название старое); Богоматерь Владимирская  (название придуманное); Сладколобзающая / Умиление (название изначальное) ; Богоматерь Умиление Владимирская (название последнее)    В русском оригинале (переводе): Гликофилуса / Елеуса (греческий, название изначальное)    Автор: Аноним    Школа / Место издания: Россия    Период оригинала: 19 век",ИКОНА,,31,25.5,,,"Стиль: Ткань: паволока    Размеры: В. 31, Ш. 25.5 (доска); Ш. 3.2 (поля)    Ссылка на каталоги / инвентари: Состояние: вздутия левкаса; трещины красочного слоя; доска изъедена жучком / точильщиком; после реставрации ( восстановлена утраченная часть доски)."
1304,2016-06-14T09:44:34Z,"Иван - царевич (название употребляемое); Иван  Царевич на сером волке (название последнее)    Автор: Вакуров Иван Петрович (художник)    Школа / Место издания: Россия, Палех    Художественно-производственные мастерские Палехского отделения Худфонда РСФСР    Период оригинала: 20 век",ЖИВОПИСЬ,,18,12,,,"Размеры: В. 18, Ш. 12 (крышка ?)    Характер подписи: 73 ?"
18043,2016-06-14T09:46:36Z,"""Натюрморт""    Автор: Corneliu Baba",,,43,45,,,"Размеры: В. 43, Ш. 45"
7297,2016-06-14T09:45:23Z,Благовещение (название изначальное) # Успение Богоматери (название изначальное)    Автор: Аноним (иконописец)    Школа / Место издания: Россия    Период оригинала: середина 19 век; 2 половина 19 век,ИКОНА,,37,63.5,,,"Размеры: В. 37, Ш. 63.5 (доска)"
13787,2016-06-14T09:46:07Z,Голова херувима    Автор: Бём Е.М.,,,8,8.8,,,"Размеры: В. 8.0, Ш. 8.8"
12163,2016-06-14T09:45:56Z,Безделушка,,,5,2.5,,,"Размеры: В. 5.0, Ш. 2.5"
3914,2016-06-14T09:44:55Z,Святитель иконный (название придуманное) ?; Святой Николай Чудотворец (название предполагаемое)    Автор: Аноним (иконописец)    Школа / Место издания: Россия,ИКОНА,,50,70,,,"Стиль: С окладом: Латунь ?/ Медь ?/ Серебро ?/ Сталь ?/ Белая жесть ?/ Другое ?    Размеры: В. 50, Ш. 70 (приблизительно) / В. 70, Ш. 60 (приблизительно)"
12947,2016-06-14T09:46:01Z,Тетрадь,,,17.8,22.5,,,"Размеры: В. 17.8, Ш. 22.5"
12934,2016-06-14T09:46:01Z,Тетрадь,,,17.8,22.5,,,"Размеры: В. 17.8, Ш. 22.5"
2894,2016-06-14T09:44:43Z,Горы (название употребляемое); Горные вершины (название придуманное)    Автор: Ардити Жорж (художник)    Школа / Место издания: Франция ?    Период оригинала: 4 четверть 20 век,ЖИВОПИСЬ,,101,82,,,"Размеры: В. 101, Ш. 82 (без обрамления)    Характер подписи: 1976    Ссылка на каталоги / инвентари: В источнике не воспроизводится подпись."
16478,2016-06-14T09:46:30Z,ВОСШЕСТВИЕ ДЕВЫ    Автор: Луис Кадена    Период оригинала: 19 век,,,131,163.5,,,"Размеры: В.131, Ш.163.5 см"
14701,2016-06-14T09:45:46Z,"Икона четырехчастная ""Богоматерь Казанская"", ""Воскресение Христово"", ""Святой Георгий"", ""Избранные святые: Никола, Анна, Анастасия, Никита"".",ИКОНА,,32,27.5,,,"Размеры: В. 32,0, Ш. 27,5, Вес 414,8 г    Характер подписи: 1794/АВ- пробирного мастера А.И. Вихляева, АО/П- неизвестного альдермана.    Ссылка на каталоги / инвентари: Из Дзержинского РАЙФО г. Ленинграда по акту от 15.07.1985 г. КП ОИРК 2899-3. Акт № 252 от 06.04.1990 г.    Инвентарный номер: ЭРО-9938, СВ-4860"
2764,2016-06-14T09:44:44Z,Сборы Шамиля (название придуманное)    Автор: Аноним (художник) ?    Школа / Место издания: Россия,,,65,85,,,"Размеры: В. 65, Ш. 85 (без обрамления ?)    Ссылка на каталоги / инвентари: В источнике не указаны автор, школа, дата/период, техника, основа."
4345,2016-06-14T09:44:58Z,"Портрет девушки (название употребляемое); Натурщица (название придуманное)    Автор: Боткин ? (художник); Боткин Федор Владимирович (художник) ?    Школа / Место издания: Россия, Франция    Период оригинала: 2 половина 19 век ?; 20 век ?",ЖИВОПИСЬ,,72.5,52.5,,,"Размеры: В. 72.5, Ш. 52.5 (без обрамления ?)    Ссылка на каталоги / инвентари: Состояние: после реставрации на месте (1961)"
6063,2016-06-14T09:45:17Z,"Ели, освещенные солнцем (название придуманное); Летний лесной пейзаж (название употребляемое)    Автор: Шишкин Иван Иванович (художник)    Школа / Место издания: Россия    Период оригинала: 4 четверть 19 век",ЖИВОПИСЬ,,63.4,38,,,"Размеры: В. 63.4, Ш. 38 (без обрамления ?)    Характер подписи: [И Шишкин ?] (см. фото)    Характер подписи: [1897 ?] (П., см. фото)    Ссылка на каталоги / инвентари: Подпись: в источнике не воспроизводится, требуется уточнение."
2425,2016-06-14T09:44:39Z,"Натюрморт с айвой (название придуманное)    Автор: Шамурзаев Шамиль Алиевич (художник)    Школа / Место издания: Россия, Северный Кавказ    Период оригинала: середина 20 век; 2 половина 20 век",ЖИВОПИСЬ,,77,65,,,"Размеры: В. 77, Ш. 65 (приблизительно, без обрамления)    Ссылка на каталоги / инвентари: ЧГОМ: № 277"
2329,2016-06-14T09:44:40Z,Вечер в ауле (название придуманное)    Автор: Храмов С. (художник); Храмов Алексей Дмитриевич (художник) ?; Храмцов Николай Андреевич (художник) ?    Школа / Место издания: Россия    Период оригинала: 2 половина 19 век ?; 20 век ?,ЖИВОПИСЬ,,70,100,,,"Размеры: В. 70, Ш. 100 (приблизительно, без обрамления)    Ссылка на каталоги / инвентари: ЧГОМ: № 173    Ссылка на каталоги / инвентари: Ср. с Рег. № 1625; возможно этот же автор ( опечатка в списке ?), требуется уточнение."
14644,2016-06-14T09:45:45Z,"Богоматерь Умиление.    Школа / Место издания: Россия, Москва    Мастер Михайлов Н.    Период оригинала: 19 век, 2 четверть",ИКОНА,,31.5,27.5,,,"Размеры: В. 31,5, Ш. 27,5; Вес: 2052,7 г.    Характер подписи: «АК/1846»;  «НМ»; герб Москвы, проба «84».    Ссылка на каталоги / инвентари: Через ЭЗК ГЭ у гр-ки А.Т. Тамулевич за 1 000 рублей.  КП ОИРК 2704-1. Акт № 122 от 15.02.1988 г.    Инвентарный номер: ЭРО-9576; СВ-5058"
7546,2016-06-14T09:45:25Z,Богородица (название старое); Богоматерь (название употребляемое)    Автор: Аноним (иконописец)    Школа / Место издания: Россия ?,,,20,17,,,"Стиль: Дерево ?    Размеры: В. 20, Ш. 17 (доска ?)    Ссылка на каталоги / инвентари: В источнике не указаны иконография, датировка, материал и техника, требуется уточнение."
16265,2016-06-14T09:46:27Z,Полотенце льняное с вышивкой и кружевами    Период оригинала: 19 век,,,245,32,,,"Размеры: Дл. 245, Ш. 32    Инвентарный номер: ЕКМ 4947"
10474,2016-06-14T09:45:47Z,Лампа керосиновая,,,5,39,,,"Размеры: В. 39.0, Д. 5.0"
17180,2016-06-14T09:46:20Z,"ЧУДО ГЕОРГИЯ О ЗМИЕ    Школа / Место издания: Центральная Россия (Поволжье?)    Период оригинала: 16 век, середина",ИКОНА,,37.2,30.5,,,"Размеры: В. 37.2, Ш. 30.5"
18500,2016-06-14T09:46:41Z,"Святые Великомученицы Екатерина и Валентина (Алевтина)    Автор: Аноним    Школа / Место издания: Россия    Период оригинала: 19 век, 1 четверть (приблизительно)",ИКОНА,,37,30,,,"Стиль: Фон позолоченный, практически стерт до белого грунта    Размеры: В. 37, Ш. 30"
13940,2016-06-14T09:46:08Z,Скатерть,,,2.01,1.405,,,"Размеры: В. 2.01, Ш. 1.405"
7707,2016-06-14T09:45:26Z,Казанская Богоматерь (название употребляемое); Богоматерь Казанская (название придуманное)    Автор: Аноним (иконописец)    Школа / Место издания: Россия,ИКОНА,,90,110,,,"Стиль: Синий: голубой, по периметру    Размеры: В. 90, Ш. 110 (доска) / В. 110, Ш. 90 (доска)    Ссылка на каталоги / инвентари: Состояние: хорошее.  В источнике не указаны датировка, техника, требуется уточнение."
11558,2016-06-14T09:45:51Z,Акварель. Цветы Иван-да-Марья лилового тона (три),,,28,12,,,"Размеры: В. 28.0, Ш. 12.0"
5930,2016-06-14T09:44:30Z,"Русская красавица (название придуманное, название цикла/серии); Девушка собирает ягоды (название последнее)    Автор: Ливанова Ирина Вадимовна (художник); Гаттенбергер Н.Л. (ювелир)    Школа / Место издания: Россия, Палех    Художественно-производственные мастерские Палехского отделения Худфонда РСФСР    Период оригинала: 4 четверть 20 век",,,3,3.4,,,"Стиль: Круг: живописная пластинка, Темпера, Лак, Папье-маше; Черный: фон; Красный: одежда девушки    Размеры: Д. 3 (пластинка живописная, в обрамлении ?); В. 3.4 (кольцо)    Характер подписи: [Инв. № Р-4042] (внутри на бумажной наклейке ?)    Ссылка на каталоги / инвентари: Добрых рук мастерство: с. 242 (Предмет 5.)    Ссылка на каталоги / инвентари: Другие элементы гарнитура см. Предмет 4."
14089,2016-06-14T09:46:09Z,Доска шахматная,,,0.62,0.39,,,"Размеры: Дл. 0,62; Ш. 0,39"
5227,2016-06-14T09:44:18Z,Встреча иконы Владимирской Богоматери (название употребляемое); Сретение иконы Богоматери Владимирской (название изначальное); Сретение иконы Богоматери Владимирской и Святые (название последнее)    Автор: Аноним (иконописец)    Школа / Место издания: Россия    Период оригинала: 17 век,ИКОНА,,31.5,27,,,"Стиль: Темпера: яичная; С ковчегом: двойной ковчег; Дерево: одна доска, 2 встречные шпонки; Ткань: паволока    Размеры: В. 31.5, Ш. 27, Т. 2.5 (доска)    Характер подписи: Амфилохий, епископ, Углич; Ростов    Характер подписи: [заголовок] (верхнее поле); 1888 г Iюня 17 дня поступила в Ростовский Музей от Преосвещеннейшего Амфилохия Епископа Углическаго (О. под верхней шпонкой, чернила)    Ссылка на каталоги / инвентари: ГМЗ РК: № 4    Ссылка на каталоги / инвентари: Надпись: ""Преосвещеннейшего "" нуждается в уточнении, т.к. должно быть ""Преосвящ...""   Состояние: надпись с заголовком почти полностью утрачена; изображение Святого на правом поле сохранилось фрагментарно (1981); трещины, многочисленные утраты левкаса, следы от гвоздей, олифа, шелушение (1981); изображения Святых на полях могут быть утрачены полностью."
1300,2016-06-14T09:44:36Z,"Буревестник (название изначальное)    Автор: Зиновьев Николай Михайлович (художник)    Школа / Место издания: Россия, Палех    Художественно-производственные мастерские Палехского отделения Худфонда РСФСР    Период оригинала: 20 век",ЖИВОПИСЬ,,10,12,,,"Размеры: В. 10, Ш. 12 (крышка ?)    Характер подписи: 85 ?    Ссылка на каталоги / инвентари: ЗИНОВЬЕВ: табл. 36.    Ссылка на каталоги / инвентари: Фото: варианты, конкретный нуждается в подтверждении."
15565,2016-06-14T09:46:22Z,Эскизный проект кубрика личного состава,,,51,34.5,33,,"Размеры: Дл. 51, В. 33, Ш. 34.5 см    Инвентарный номер: 22422"
17387,2016-06-14T09:46:32Z,"Портрет генерала екатерининского времени    Автор: Аноним    Период оригинала: 18 век, 2 половина",ЖИВОПИСЬ,,4.2,3.5,,,"Размеры: В. 4,2, Ш. 3,5    Инвентарный номер: КП-7701 ОР-2146"
3667,2016-06-14T09:44:53Z,"Андрей Первомученик (название придуманное, название изменяемое); Святой Стефан Первомученик архидьякон (название изначальное)    Автор: Аноним (иконописец)    Школа / Место издания: Россия    Период оригинала: 19 век",ИКОНА,,69,39,,,"Размеры: В. 69, Ш. 39 (приблизительно) / В. 39, Ш. 69 (приблизительно)"
3109,2016-06-14T09:44:46Z,Святая Наталья (название придуманное)    Автор: Аноним (иконописец)    Школа / Место издания: Россия ?    Период оригинала: 19 век,,,9,11,,,"Размеры: В. 9, Ш. 11 (приблизительно) / В. 11, Ш. 9 (приблизительно)"
5717,2016-06-14T09:45:11Z,Богородица (название старое)    Автор: Аноним    Школа / Место издания: Россия ?,,,25,30,,,"Стиль: Дерево ?    Размеры: В. 25, Ш. 30 (доска ?) / В. 30, Ш. 25 (доска ?)"
4379,2016-06-14T09:45:00Z,Морской пейзаж (название употребляемое); Морской пейзаж с кораблем (название придуманное)    Автор: Лагорио Лев Феликсович (художник)    Школа / Место издания: Россия    Период оригинала: 2 половина 19 век; 1 четверть 20 век ?,ЖИВОПИСЬ,,100,80,,,"Размеры: В. 100, Ш. 80 (без обрамления) / В. 80, Ш. 100 (без обрамления)    Ссылка на каталоги / инвентари: Описание изображений в оповещении иное, см. Комментарий."
11761,2016-06-14T09:45:53Z,Рельеф,,,12.3,8.2,,,"Размеры: В. 12.3, Ш. 8.2"
17938,2016-06-14T09:46:36Z,"""Дама за чайным столиком""    На языке оригинала: Aftermoontea    Автор: Max Hammerl (1856-1886)",,,37,28,,,"Размеры: В. 37, Ш. 28"
4374,2016-06-14T09:44:58Z,"Воскресение с двунадесятыми праздниками (название употребляемое); Сошествие во ад / Воскресение Христово и Праздники (название последнее)    Автор: Аноним (иконописец); Аноним (ювелир, эмальер)    Школа / Место издания: Россия",,,48.5,45,,,"Стиль: С окладом: Латунь; Эмаль: ?    Размеры: В. 48.5, Ш. 45 (в окладе)"
3597,2016-06-14T09:44:53Z,Святой Даниил Пророк (название изначальное)    Автор: Аноним (иконописец)    Школа / Место издания: Россия    Период оригинала: 18 век,ИКОНА,,90,100,,,"Размеры: В. 90, Ш. 100 (приблизительно) / В. 100, Ш. 90 (приблизительно)"
1245,2016-06-14T09:44:31Z,Пейзаж с рекой (название употребляемое)    Автор: Джогин Павел Павлович (художник)    Школа / Место издания: Россия    Период оригинала: 3 четверть 19 век,ЖИВОПИСЬ,,39,63,,,"Размеры: В. 39, Ш. 63 (без обрамления ?)"
10282,2016-06-14T09:45:46Z,Принцесса Виктория,,,4.3,6,,,"Размеры: В. 4.3, Ш. 6.0"
2843,2016-06-14T09:44:44Z,Импровизация (название употребляемое)    Автор: Блохин В.М. (художник)    Школа / Место издания: Россия    Период оригинала: 20 век,ЖИВОПИСЬ,,90,90,,,"Стиль: Холст ?/ Хлопок ?/ Ткань ?/ Лен ?    Размеры: В. 90, Ш. 90 (без обрамления)    Характер подписи: Не имеется ?"
8409,2016-06-14T09:44:56Z,Спас (название употребляемое); Иисус Христос Вседержитель (название изначальное); Спас Вседержитель (название придуманное)    В русском оригинале (переводе): Пантократор (название изначальное; греческий)    Автор: Аноним (ювелир)    Школа / Место издания: Россия    Период оригинала: 18 век,,,32,35,,,"Стиль: С окладом: Серебро    Размеры: В. 32, Ш. 35 (приблизительно) / В. 35, Ш. 32 (приблизительно)"
3475,2016-06-14T09:44:49Z,Господь Вседержитель (название старое); Спас (название употребляемое); Иисус Христос Вседержитель (название изначальное); Спас Вседержитель (название придуманное)    В русском оригинале (переводе): Пантократор (название изначальное; греческий)    Автор: Аноним (иконописец)    Школа / Место издания: Россия    Период оригинала: 18 век ?,ИКОНА,,24,30,,,"Стиль: Золочение: позолота, фон    Размеры: В. 24, Ш. 30 (приблизительно) / В. 30, Ш. 24 (приблизительно)"
5218,2016-06-14T09:45:03Z,На переднем крае обороны (название придуманное)    Автор: Финогенов Константин Иванович (художник)    Школа / Место издания: Россия    Период оригинала: 20 век,РИСУНОК,,47,62,,,"Стиль: Бумага тонированная    Размеры: В. 47, Ш. 62 (лист)"
5619,2016-06-14T09:45:10Z,Распятие Иисуса Христа (название изначальное); Распятие Иисуса Христа и Святые (название последнее)    Автор: Аноним (иконописец); Аноним (мастер)    Школа / Место издания: Россия ?    Период оригинала: середина 19 век,ИКОНА,,33,28,,,"Стиль: Другое: врезной крест; Крест / Распятие: Отливка, Рельеф, Латунь ?/ Бронза ?/ Медь ?/ Другое ?;  Золочение: позолота , фон иконы      Размеры: В. 33, Ш. 28 (доска); В. 26, Ш. 11.7 (крест)"
14168,2016-06-14T09:46:09Z,Шкаф книжный,,,1.32,0.505,1.32,,"Размеры: Дл. 1.32, Ш. 0.505, В. 1.32"
1067,2016-06-14T09:44:24Z,"Мать и дитя (название старое); Крестьянка с сыном (название придуманное)    Автор: Аноним (художник); ? (с оригинала);  Лукутин Александр Петрович (фабрикант) ?; Лукутин Николай Александрович (фабрикант) ?    Школа / Место издания: Россия, Федоскино    Лукутины (фабрика лаковых изделий)    Период оригинала: 2 половина 19 век",ЖИВОПИСЬ,,15.5,13,,,"Стиль: Синий: юбка; Красный: кокошник на женщине, рубашка на ребенке; Белый: рубашка на женщине    Размеры: В. 15.5, Ш. 13 / В. 13, Ш. 15.5    Ссылка на каталоги / инвентари: СПИСОК ГИМ, 1989: № 19"
3077,2016-06-14T09:44:46Z,Спаситель (название старое); Спас (название употребляемое); Христос Спаситель (название употребляемое); Иисус Христос Вседержитель (название изначальное)    В русском оригинале (переводе): Пантократор (название изначальное; греческий)    Автор: Аноним (иконописец)    Школа / Место издания: Россия ?,,,25,18,,,"Размеры: В. 25, Ш. 18 (приблизительно)"
21064,2019-03-12T06:33:55Z,"Бум., акрил 160х230, 2004 г. Автор: Кострикова Татьяна",ЖИВОПИСЬ,Объект является культурной ценностью,160,230,,,
13461,2016-06-14T09:46:04Z,Княжна Ольга Александровна в детстве,,,10.2,16,,,"Размеры: В. 10.2, Ш. 16.0"
