id,registration,name,category,сultural_property,height,width,depth,preservation,description
6425,2016-06-14T09:45:20Z,Горы (название употребляемое) # Горный пейзаж (название употребляемое)    Автор: Розен Г. (художник); Розен Герард Владимирович (художник) ?    Школа / Место издания: Россия    Период оригинала: 2 половина 19 век ?; 1 четверть 20 век ?,ЖИВОПИСЬ,,16.2,25.8,,,"Размеры: В. 16.2, Ш. 25.8 (живописная поверхность ? / лист ?)    Характер подписи: ? (О.)    Ссылка на каталоги / инвентари: Состояние: после реставрации (1967)."
21044,2019-03-11T12:30:53Z,"Крафт, акрил, 200х400,2007 г. Автор: Кострикова Татьяна",ЖИВОПИСЬ,Объект является культурной ценностью,200,400,,,
4568,2016-06-14T09:44:59Z,Спас (название употребляемое); Иисус Христос Вседержитель (название изначальное)    В русском оригинале (переводе): Пантократор (название изначальное; греческий)    Автор: Аноним (иконописец)    Школа / Место издания: Россия ?,ИКОНА,,25,35,,,"Стиль: Дерево поделочное    Размеры: В. 25, Ш. 35 (доска) / В. 35, Ш. 25 (доска)"
16020,2016-06-14T09:46:25Z,Житие Иисуса Христа,,,182,141,,,"Размеры: В.182, Ш.141 см    Ссылка на каталоги / инвентари: МУК ""Краеведческий музей муниципального образования ""Балахнинский район"". 606400, Нижегородская область, г. Балахна, пр. Революции, д. 17    Инвентарный номер: КП-1884"
3795,2016-06-14T09:44:52Z,Николай Чудотворец(название употребляемое); Святой Николай Чудотворец (название изначальное); Николай Угодник (название старое)    Автор: Аноним (иконописец)    Школа / Место издания: Россия    Период оригинала: 2 половина 18 век ?; 19 век ?; 1 четверть 20 век ?,ИКОНА,,23,27,,,Размеры: В. 23 Ш. 27(приблизительно) / В. 27 Ш. 23(приблизительно)
4097,2016-06-14T09:44:57Z,Святые Минея  (название придуманное); Избранные Святые (название употребляемое)    Автор: Аноним (иконописец)    Школа / Место издания: Россия,,,30,25,,,"Стиль: Дерево поделочное    Размеры: В. 30, Ш. 25 (приблизительно) / В. 25, Ш. 30 (приблизительно)"
3465,2016-06-14T09:44:51Z,Нечаянная Радость (название изначальное); Богородица Нечаянная радость (название употребляемое)    Автор: Аноним (иконописец)    Школа / Место издания: Россия    Период оригинала: 4 четверть 19 век,ИКОНА,,25,30,,,"Размеры: В. 25, Ш. 30 (приблизительно, триптих) / В. 30, Ш. 25(приблизительно, триптих)"
11377,2016-06-14T09:45:50Z,Портрет девушки,,,15.5,24,,,"Размеры: В. 15.5, Ш. 24.0"
18450,2016-06-14T09:46:41Z,"Никола Чудотворец (название старое); Святой Николай Чудотворец (название изначальное)    Школа / Место издания: Россия    Период оригинала: 19 век, 4 четверть; 20 век, 1 четверть",ИКОНА,,74,61,,,"Размеры: В. 74, Ш. 61"
4013,2016-06-14T09:44:55Z,Святая Троица (название изначальное); Отечество  (название употребляемое); Новозаветная Троица (название придуманное)    Автор: Аноним (эмальер)    Школа / Место издания: Россия    Аноним (литейщик),ЭМАЛЬ,,7,7,,,"Стиль: Эмаль: Выемчатая ?/ По рельефу ?    Размеры: В. 7, Ш. 7 (приблизительно)"
5200,2016-06-14T09:45:04Z,Махровый мак (название придуманное); Цветок махрового мака (название последнее)    Автор: Аноним (художник)    Школа / Место издания: Россия,ЖИВОПИСЬ,,30,19,,,"Стиль: Бумага: Синий, голубой оттенок    Размеры: В. 30, Ш. 19 (лист ?)    Характер подписи: Д.Л. (?)"
21024,2019-03-11T09:43:34Z,"Холст, акрил,35х55, 2013 г. Автр: Костриковы Сергей и Татьяна",ЖИВОПИСЬ,Объект является культурной ценностью,35,55,,,
10988,2016-06-14T09:46:14Z,"Образок Божией Матери ""Отрада и Утешение""",,,9,11,,,"Размеры: В. 9.0, Ш. 11.0"
11493,2016-06-14T09:45:51Z,Императрица Мария Федоровна верхом,,,21,15.7,,,"Размеры: В. 21.0, Ш. 15.7"
6356,2016-06-14T09:45:16Z,Богородица (название старое); Богоматерь с младенцем (название употребляемое)    Автор: Аноним (иконописец); Аноним (мастер)    Школа / Место издания: Россия (народная),ИКОНА,,25,40,,,"Стиль: Масло: тусклое, матовое; Золочение: позолота; С окладом: Латунь ?/ Медь ?/ Другое ?    Размеры: В. 25, Ш. 40 (доска, в окладе ?) / В. 40, Ш. 25 (доска, в окладе ?)    Ссылка на каталоги / инвентари: В источнике не указана иконография, материл и техника оклада, требуется уточнение."
1891,2016-06-14T09:44:35Z,"Монахиня (название придуманное)    Автор: Аноним (художник)    Школа / Место издания: Россия ?, Западная Европа    Период оригинала: середина 18 век",,,30,42,,,"Размеры: В. 30, Ш. 42 (без обрамления ?)"
13611,2016-06-14T09:46:06Z,Портрет членов семьи Романовых,,,19,28.5,,,"Размеры: В. 19.0, Ш. 28.5"
14536,2016-06-14T09:46:12Z,Кружка для сбора денег,,,13.8,21,,,"Размеры: В. 21.0, Д. 13.8"
4719,2016-06-14T09:45:01Z,Для мировых посредников (название изначальное)    Школа / Место издания: Россия    Монетный двор    Период оригинала: 3 четверть 19 век,,,63.5,63,63,,"Стиль: Ручное изготовление: опиливание; Круг, Неправильной формы: 4 большие и 4 малые дуги    Размеры: В. 63 мм ?, Ш. 63 мм ? / Д. 63.5 мм (штемпель)    Характер подписи: МИРОВОЙ, / ПОСРЕДNИКЪ (слева и справа); 1861 ГОДА / 19 ФЕВРАЛА (О, под крестом)    Ссылка на каталоги / инвентари: ГМЗ РК: № 314, № 315; СМИРНОВ: № 802    Ссылка на каталоги / инвентари: Описание составлено по каталогу, см. Ссылку.  См. Надписи, латинская буква ""N"" возможно опечатка в каталоге или на медали, требуется проверка."
10964,2016-06-14T09:46:14Z,Датская военная форма    Автор: Брок Г.,ЖИВОПИСЬ,,18,14,,,"Размеры: В. 18.0, Ш. 14.0"
4509,2016-06-14T09:44:59Z,Семь Спящих Отроков Эфесских (название предполагаемое)    Автор: Аноним (иконописец)    Школа / Место издания: Россия ?,ИКОНА,,15,15,,,"Стиль: Дерево поделочное    Размеры: В. 15, Ш. 15 (доска)"
10597,2016-06-14T09:45:48Z,Портсигар,,,9.5,6,,,"Размеры: В. 9.5, Ш. 6.0"
12526,2016-06-14T09:45:58Z,Лампа настольная,,,17,44,,,"Размеры: В. 44.0, Д. 17.0"
452,2016-06-14T09:44:21Z,"Святой Григорий  (название употребляемое); Святой Григорий Богослов из Деисуса (название придуманное); Святой Григорий Богослов в Молении (название последнее)    В русском оригинале (переводе): Деисус (греческий, название изначальное)    На языке оригинала: St. Gregory (название употребляемое)    Автор: Аноним    Школа / Место издания: Россия    Период оригинала: 16 век",ИКОНА,,110,38.5,,,"Размеры: В. 110, Ш. 38.5,  Т. 4.5 (доска)    Характер подписи: ? ( в.л. устав)"
46,2016-06-14T09:44:15Z,"Море ( название употребляемое); Парусники в штормовом море (название последнее)    Автор: Лагорио Лев Феликсович (художник)    Школа / Место издания: Италия, Россия    Период оригинала: 2 четверть 19 век; 2 половина 19 век; 1 четверть 20 век",ЖИВОПИСЬ,,19,27,,,"Стиль: Прямоугольник горизонтальный    Размеры: В. 19, Ш. 27 (картон ?); В. 18, Ш. 27 (картон ?)    Ссылка на каталоги / инвентари: В источниках информации содержатся разные данные о размерах, не содержатся данные о  периоде/ дате, цветах, наличии  подписи, надписей."
1087,2016-06-14T09:44:30Z,"Распятие с предстоящими (название употребляемое); Распятие Христа (название изначальное, в центре) # Святой Козьма (название изначальное, слева) # Святой Дамиан (название изначальное, справа) # Троица Новозаветная (название придуманное); Святая Троица (название изначальное); Отечество  (название употребляемое, в центре, верхний ряд) #  Георгий поражает дракона (название употребляемое); Чудо Георгия о змие (название изначальное); Георгий Победоносец (название придуманное); Чудо Георгия Победоносца о змие  (название последнее, слева, верхний ряд) #  Архангел Михаил воевода (название придуманное); Архистратиг Михаил (название старое); Архангел Михаил (название изначальное, справа, верхний ряд);    Автор: Аноним (переработчик)    Школа / Место издания: Россия    Период оригинала: 19 век",,,60,51,,,"Стиль: Икона: Золочение (фон, поля); Резьба по левкасу: растительный орнамент (поля); Дерево; Левкас;  Серый: конь под Георгием; Красный: Змий, конь под Михаилом; #  Киот: Покрашенная ?, Коричневый; Позолоченная, Рельефная работа (профиль, лепной орнамент); Дерево; Стекло; Левкас ?    Размеры: В. 60, Ш. 51(в свету); В. 75, Ш. 66 (в обрамлении, киот)    Характер подписи: ? ( красные); ? (черные, на кресте)    Ссылка на каталоги / инвентари: ПОДЛИННИК ИКОНОПИСНЫЙ: с.52, с. 140.    Ссылка на каталоги / инвентари: Название иконы слева, верхний ряд:  ""Георгий Победоносец"" , относящееся к иной иконографии Георгия, здесь использовано в связи с новой традицией и для облегчения поиска по тексту; старое название см. Ссылку ."
10343,2016-06-14T09:46:13Z,Сигнализация флажками,,,23,10.5,,,"Размеры: В. 23.0, Ш. 10.5"
11748,2016-06-14T09:45:53Z,Коробочка,,,2.7,5,,,"Размеры: В. 2.7, Ш. 5.0"
1994,2016-06-14T09:44:37Z,Разлив (название придуманное)    Автор: Зверьков Ефрем Иванович (художник)    Школа / Место издания: Россия    Период оригинала: 3 четверть 20 век; 2 половина 20 век,ЖИВОПИСЬ,,60,90,,,"Размеры: В. 60, Ш. 90 (приблизительно)    Ссылка на каталоги / инвентари: ЧГОМ: № 532 (527 п.ф.)"
554,2016-06-14T09:44:26Z,"Святая Троица (название изначальное); Троица Новозаветная (название придуманное); Отечество  (название употребляемое); Троица Новозаветная в Силах (название последнее)    Автор: Аноним (рисовал, переработчик)    Школа / Место издания: Россия    Период оригинала: 19 век",ИКОНА,,31,27,,,"Стиль: Дерево ?    Размеры: В. 31, Ш. 27, Т. 3 (без обрамления)    Ссылка на каталоги / инвентари: В источнике : стиль русский народный ?"
2047,2016-06-14T09:44:40Z,В дождливый день (название придуманное)    Автор: Катков Герман Петрович (художник)    Школа / Место издания: Россия    Период оригинала: 2 четверть 20 век; 2 половина 20 век,ЖИВОПИСЬ,,51,70,,,"Размеры: В. 51, Ш. 70 (картон)    Ссылка на каталоги / инвентари: ЧГОМ: № 77    Ссылка на каталоги / инвентари: Фото: Предметы 4. и 5."
19000,2017-03-02T14:36:20Z,Крест запрестольный,РЕЛИГИОЗНЫЙ ПРЕДМЕТ,Объект является культурной ценностью,70,30,,,
12442,2016-06-14T09:45:57Z,Гребень,,,11,6.5,,,"Размеры: В. 11.0, Ш. 6.5"
5022,2016-06-14T09:45:02Z,Святые в медальонах (название придуманное)    Автор: Васильев Михаил Николаевич (художник)    Школа / Место издания: Россия    Период оригинала: 2 половина 19 век,ЖИВОПИСЬ,,45,54.8,,,"Стиль: Круг ?/ Овал ?: медальоны    Размеры: В. 45, Ш. 54.8 (картон); Об. 8 медальонов"
7893,2016-06-14T09:45:28Z,Святой Николай Чудотворец (название изначальное)    Автор: Аноним (иконописец); Аноним (мастер)    Школа / Место издания: Россия ?,ИКОНА,,15,25,,,"Стиль: Дерево ?; С окладом/ризой: Латунь ?/ Медь ?/ Другое ?, Желтый металл    Размеры: В. 15, Ш. 25 (в окладе ?) / В. 25, Ш. 15 (в окладе ?)    Ссылка на каталоги / инвентари: Состояние: царапина (глаз Святого).  В источнике не указаны датировка, техника, материал оклада, требуется уточнение."
2780,2016-06-14T09:44:45Z,Пейзаж с дворцом (название придуманное)    Автор: Майоров В. (художник)    Школа / Место издания: Россия    Период оригинала: 20 век,ЖИВОПИСЬ,,40,30,,,"Размеры: В. 40, Ш. 30 (приблизительно)    Характер подписи: MAYOR"
15878,2016-06-14T09:46:23Z,4 апостола,ИКОНА,,70,40,,,"Стиль: Грунт, паволока. Две шпоны врезные.    Размеры: В.70, Ш.40, Т. 6 см    Ссылка на каталоги / инвентари: Удмуртская Республика , Камбарский район, с. Балаки, пер. Клубный, д. 7.  Русская православная старообрядческая церковь."
7149,2016-06-14T09:45:07Z,Ермолов А.И. (название старое); Ермолов (название употребляемое); Ермолов Алексей Петрович (название изначальное)    Автор: Аноним (художник); Доу Джордж (с оригинала)    Школа / Место издания: Россия; Англия / Великобритания (с оригинала)    Период оригинала: 1 четверть 19 век ?,ЖИВОПИСЬ,,68,59,,,"Размеры: В. 68, Ш. 59 (без обрамления ?)    Ссылка на каталоги / инвентари: ЭРМИТАЖ (1981): № 7876, сс.252-253 (оригинал, Предмет 1.)    Ссылка на каталоги / инвентари: Фото: оригинал, по последнему источнику.  От редактора: описание, приведенное в Источнике (портрет поколенный, профиль вправо), а также в  некоторых деталях (меховая накидка и т.д.) не соответствует фото оригинала, требуется уточнение."
10313,2016-06-14T09:45:47Z,Принцесса Виктория,,,6.7,11,,,"Размеры: В. 6.7, Ш. 11.0"
1054,2016-06-14T09:44:24Z,"Парочка (название употребляемое); Поцелуй (название последнее)    Автор: Аноним (художник); Лукутин Николай Александрович (фабрикант); ? (с оригинала)    Школа / Место издания: Россия, Федоскино    Лукутины (фабрика лаковых изделий)    Период оригинала: 4 четверть 19 век",ЖИВОПИСЬ,,9,6.5,2,,"Стиль: Зеленый: внешнее покрытие; Черный: внутреннее покрытие; Прямоугольник: портсигар; Овал, Неправильной формы: пасхальное яйцо-медальон, в котором изображена сцена;    Размеры: В. 2, Дл. 9, Ш. 6.5 (предмет); В. 9., Ш. 6.5 (крышка)    Характер подписи: 3 орла ( О. крышка, золотом); Фаб. Лукутина (О. крышка, золотом)    Ссылка на каталоги / инвентари: СПИСОК ГИМ, 1989: № 8"
2568,2016-06-14T09:44:41Z,"Ленин (название изначальное)    Автор: Боровский ? (художник) ?; Боровский Давид Борисович (художник) ?; Боровский Исаак Юльевич (художник) ?; Бобровский Григорий Михайлович (художник)    Школа / Место издания: Россия ?, Белоруссия ?    Период оригинала: 20 век",,,63,72,,,"Размеры: В. 63, Ш. 72 (приблизительно, основа)    Ссылка на каталоги / инвентари: ЧГОМ: № 562 (557 п.ф.)    Ссылка на каталоги / инвентари: В источнике не указаны техника, основа( возможно гуашь, картон)"
3054,2016-06-14T09:44:46Z,Покров Богоматери (название изначальное); Покров Святой Богородицы (название употребляемое)    Автор: Аноним    Школа / Место издания: Россия,,,10,15,,,"Стиль: На металле: Латунь ?/ Медь ?    Размеры: В. 10, Ш. 15 (приблизительно) / В. 15, Ш. 10 (приблизительно)"
18454,2016-06-14T09:46:41Z,"Господь Вседержитель  (название старое); Вседержитель  (название изначальное); Христос Вседержитель (название придуманное); Спас Вседержитель (название последнее)    В русском оригинале (переводе): Пантократор (греческий, название изначальное)    Автор: Аноним    Школа / Место издания: Россия    Период оригинала: 17 век, 18 век, 19 век, 20 век (?)",ИКОНА,,28,22,,,"Стиль: В окладе желтого металла    Размеры: В. 28, Ш. 22"
3145,2016-06-14T09:44:49Z,Святой Илия Пророк (название изначальное)    Автор: Аноним    Школа / Место издания: Россия,ИКОНА,,27,30,,,"Размеры: В. 27, Ш. 30 (приблизительно) / В. 30, Ш. 27 (приблизительно)"
14517,2016-06-14T09:46:12Z,Папка с фотографиями,,,42,34.5,,,"Размеры: В. 42.0, Ш. 34.5"
15060,2016-06-14T09:46:18Z,Портрет Уильяма Галлахера    Автор: Вучетич Е.В.    Школа / Место издания: Россия    Период оригинала: 20 век,,,51,26,,,"Размеры: В. 51, Ш. 26, Т. 22    Инвентарный номер: С - 70, КП - 1836"
5129,2016-06-14T09:45:03Z,Сакля Шамиля (название придуманное)    Автор: Щебальский ? (художник)    Школа / Место издания: Россия    Период оригинала: 19 век ?,РИСУНОК,,23.9,33,,,"Стиль: Картон ? / Карандаш ? (см. Общий комментарий)    Размеры: В. 23.9, Ш. 33 (лист ?)    Ссылка на каталоги / инвентари: В источнике: бумага, картон, возможно, ошибка - не картон, карандаш, требуется уточнение."
16120,2016-06-14T09:46:25Z,Военный билет № 4142125    Период оригинала: 3 четверть 20 век,,,12,8.5,,,"Размеры: В.12, Ш.8.5 см    Ссылка на каталоги / инвентари: Сосновский районный краеведческий музей.  606170, Нижегородская область, п. Сосновское, ул. Матвеева, д. 36    Инвентарный номер: КП-588"
6453,2016-06-14T09:45:20Z,Фрина соблазняет Конократа  ? (название придуманное)    Автор: Равене ? (гравер); ? (с оригинала)    Школа / Место издания: Франция ?    Период оригинала: 18 век,,,53,39.3,,,"Размеры: В. 53, Ш. 39.3 (доска ?, лист ?)    Характер подписи: ? (О.)    Ссылка на каталоги / инвентари: В источнике не указана техника.  Состояние: после реставрации (1970)."
6566,2016-06-14T09:45:18Z,Святой Николай Чудотворец (название изначальное); Николай Святитель (название придуманное)    Автор: Аноним (гравер)    Школа / Место издания: Россия ?,,,10,8,,,"Размеры: В. 10, Ш. 8 (пластинка)"
6998,2016-06-14T09:44:43Z,Гостиница Астория (название изначальное)    Автор: Валентинов-Миллер Эрик Эдуардович (художник)    Школа / Место издания: Россия    Период оригинала: 20 век,ЖИВОПИСЬ,,61,40,,,"Размеры: В. 61, Ш. 40 (картон) / В. 40, Ш. 61 (картон)    Ссылка на каталоги / инвентари: ЧГОМ: № 551 (546 п.ф.); № 552 (547 п.ф.)"
