id,registration,name,category,сultural_property,height,width,depth,preservation,description
1175,2016-06-14T09:44:29Z,"Вид Холуя (название рукописное; русский; лицевая сторона, крышка)    Автор: Кротов Валентин Александрович (художник)    Школа / Место издания: Россия, Холуй    Холуйская фабрика художественной лаковой миниатюры (фабрика лаковых изделий)    Период оригинала: 3 четверть 20 век",ЖИВОПИСЬ,,3.8,3,2.2,,"Размеры: В. 2.2, Дл. 3.8, Ш. 3 (предмет); В. 3, Ш. 3.8 (крышка, сцена)    Характер подписи: [Кротов ?] (крышка, под сценой)    Характер подписи: 1969 (крышка, под сценой)"
10524,2016-06-14T09:45:48Z,Кресло,,,61.5,58,98.5,,"Размеры: Дл. 61.5, Ш. 58.0, В. 98.5"
256,2016-06-14T09:44:17Z,"Смоленский образ Божьей Матери (название старое); Путеводительница / Богохранимая (название изначальное); Богоматерь Одигитрия (название придуманное); Богоматерь Одигитрия Смоленская с клеймами земной жизни (название употребляемое);  Богоматерь Одигитрия Смоленская с житием (название последнее)    В русском оригинале (переводе): Одигитрия (греческий, название изначальное)    Автор: Аноним (иконописец)    Школа / Место издания: Россия, Верхняя Волга    Период оригинала: 4 четверть 15 век; 1 четверть 16 век; 1 половина 16 век",ИКОНА,,127.5,97.5,,,"Стиль: Без оклада/ризы/басмы: золоченая риза, выполненная в 1821 г. бежецким мастером Иваном Татыковым, не сохранилась.   С ковчегом: двойной ковчег; Дерево: доска из 4 частей; Прямоугольник: вертикальный (доска, средник, клейма в навершии и по низу), горизонтальный ( клейма слева, 2 ряд сверху; клейма справа, 2 и 4 ряд сверху) ; Квадрат: почти ( клейма нижние угловые, слева 4 клеймо сверху, справа 3 и 5 клейма сверху);  Золотистый: фоны средника и клейм;  Красный: вишнево-коричневый мафорий;Синий: голубой чепец;  Зеленый: хитон младенца; Коричневый: светло-коричневый санкирь и гиматий на младенце    Размеры: В. 127.5, Ш. 97.5 (доска)    Ссылка на каталоги / инвентари: Устюжна: сс. 28 - 30, 1 илл. между сс. 31- 33; Устюжна/1995: илл. 206, 207, 208, с. 316    Ссылка на каталоги / инвентари: Фото: см. Ссылку;   В источниках информации не содержатся данные о надписях .  Состояние: раскрытие живописи (1962 , по акту); после реставрации (ВСНРПМ, 1968); следы от крепления венцов и ризы в среднике, вертикальных трещин между частями  доски.  Уже в середине 16 века почиталась как чудотворная; особенно прославилась как покровительница   Устюжны Железопольской после успешного отражения польско-литовского нашествия в 1609 г.; до 1917 г. пользовалась всероссийской известностью; главная реликвия, палладиум города Устюжны  ( Рыбаков А.А.) .  Уникальное и наиболее раннее произведение устюженской иконописной мастерской, сформировавшейся в нач. 16 века в рамках верхневолжской / ростово-суздальской школы живописи  ( Рыбаков А.А.); живопись отличается свободной и легкой манерой, прозрачностью красочного слоя,   тонко сгармонированным колоритом - на фоне желтоватых и розоватых ""горок"" выделяются голубые, киноварные и белые  пятна ""риз"" и ""палат"" ( Рыбаков А.А., Устюжна)."
18049,2016-06-14T09:46:36Z,"""Портрет женщины""    Автор: Nicolae Grigorescu",,,32,45,,,"Размеры: В. 32, Ш. 45"
2473,2016-06-14T09:44:40Z,"Перед праздником (название придуманное)    Автор: Шабанов Магомед Магомедович (художник)    Школа / Место издания: Россия, Северный Кавказ    Период оригинала: 2 половина 20 век",ЖИВОПИСЬ,,200,103,,,"Размеры: В. 200, Ш. 103 (приблизительно, без обрамления)    Ссылка на каталоги / инвентари: ЧГОМ: № 303"
18992,2017-03-02T14:36:20Z,Плащаница,РЕЛИГИОЗНЫЙ ПРЕДМЕТ,Объект является культурной ценностью,140,80,,,
11517,2016-06-14T09:45:51Z,"Фотография с картины ""Иуда у распятия""",,,14.6,24.2,,,"Размеры: В. 14.6, Ш. 24.2"
10786,2016-06-14T09:46:13Z,Стол,,,105.5,58,76.5,,"Размеры: Дл. 105.5, Ш. 58.0, В. 76.5"
12419,2016-06-14T09:45:57Z,Александр III,,,17,21,,,"Размеры: В. 17.0, Ш. 21.0"
11767,2016-06-14T09:45:53Z,Модель головы старика,,,2.2,3,,,"Размеры: В. 2.2, Ш. 3.0"
13523,2016-06-14T09:46:05Z,Фотография мужчин в военных мундирах,,,13.5,18.6,,,"Размеры: В. 13.5, Ш. 18.6, В. 12.8, Ш. 18.4"
6723,2016-06-14T09:45:14Z,"Буддийское божество (название употребляемое); Защитник Дхармы (название в переводе)    В русском оригинале (переводе): Дхармапала (санскрит); Генин-Дарма (тибетский) ?    Школа / Место издания: Китай, Тибет ?",,,9,5,,,"Стиль: Декоративная / медальерная техника: чеканка    Размеры: В. 9, Ш. 5    Ссылка на каталоги / инвентари: Требуется уточнение, так как в источнике приводится противоречивое описание и имеются неточности в написании названий."
10409,2016-06-14T09:45:47Z,Альбом,,,11,18,,,"Размеры: В. 11.0, Ш. 18.0"
6572,2016-06-14T09:45:18Z,Святой Николай Чудотворец (название изначальное); Николай Угодник (название старое)    Автор: Аноним (иконописец)    Школа / Место издания: Россия ?,ИКОНА,,40,30,,,"Стиль: Другое: акварель сочных контрастных тонов; Дерево ?/ Бумага ?; Прямоугольник: рама    Размеры: В. 40, Ш. 30 (в обрамлении ?)"
8125,2016-06-14T09:45:31Z,Автор: Аноним (скульптор) ?    Школа / Место издания: Россия ?    Период оригинала: 20 век ?; 19 век ?,,,39,73,99,,"Стиль: Рельеф: барельеф    Размеры: В. 99, Ш. 73, Гл. 39 / В. 99, Ш. 39, Гл. 72 / В. 72, Ш. 39, Гл. 99    Ссылка на каталоги / инвентари: ЧГОМ: № 62 (скульптура)"
5347,2016-06-14T09:45:06Z,На мосту (название изначальное)    Автор: Верещагин Василий Васильевич (художник)    Школа / Место издания: Россия    Период оригинала: 1 четверть 20 век,ЖИВОПИСЬ,,27,33,,,"Размеры: В. 27, Ш. 33 (без обрамления)"
11873,2016-06-14T09:45:54Z,Дорожный бювар,,,61,37,,,"Размеры: В. 61.0, Ш. 37.0"
17345,2016-06-14T09:46:21Z,"Явление Богоматери и Николая Чудотворца пономарю Юрышу    Школа / Место издания: Новгород, Россия    Период оригинала: 17 век, 2 половина",ИКОНА,,31.3,26.7,,,"Размеры: В. 31,3, Ш. 26,7"
16206,2016-06-14T09:46:29Z,Альбом для фотографий    Школа / Место издания: Россия    Период оригинала: 19 век,,,21.5,16,,,"Размеры: В. 21,5; Ш. 16    Инвентарный номер: ПГОИАХМЗ  14152"
16684,2016-06-14T09:46:32Z,Картина  образ Буддиста Санно Хончи,,,113.1,40.4,,,"Размеры: В.113.1, Ш.40.4 см"
14504,2016-06-14T09:46:12Z,Мешочек,,,38,18,,,"Размеры: В. 38.0, Ш. 18.0"
7335,2016-06-14T09:45:25Z,Святой апостол Лука (название употребляемое); Святой Апостол Лука Евагелист (название изначальное)    Автор: Аноним (иконописец)    Школа / Место издания: Россия ?,,,20,42,,,"Стиль: Дерево ?    Размеры: В. 20, Ш. 42 (доска ?) / В. 42, Ш. 20 (доска ?)    Ссылка на каталоги / инвентари: В источнике указан оклад, не указаны материал, техника, требуется уточнение."
19042,2017-03-23T10:28:14Z,"Знак члена Попечительства о народной трезвости, кон. 19- нач. 20вв, бронза, эмаль цветная, штамповка, эмалирование, серебрение, золочение",РАЗНОЕ,Объект является культурной ценностью особого значения,5.6,4.2,,,"№ по КИК В 1352,№ по ИК Н-4986, № по ГК 413866"
13372,2016-06-14T09:46:04Z,Скамеечка для ног,,,37.5,25,11,,"Размеры: Дл. 37.5, Ш. 25.0, В. 11.0"
13636,2016-06-14T09:46:06Z,Фигурка животных,,,2.3,1.4,4.3,,"Размеры: Дл. 2.3, Ш. 1.4, В. 4.3"
6998,2016-06-14T09:44:43Z,Гостиница Астория (название изначальное)    Автор: Валентинов-Миллер Эрик Эдуардович (художник)    Школа / Место издания: Россия    Период оригинала: 20 век,ЖИВОПИСЬ,,61,40,,,"Размеры: В. 61, Ш. 40 (картон) / В. 40, Ш. 61 (картон)    Ссылка на каталоги / инвентари: ЧГОМ: № 551 (546 п.ф.); № 552 (547 п.ф.)"
15849,2016-06-14T09:46:23Z,Св. Георгий Победоносец    Период оригинала: конец 19 века,ИКОНА,,70,50,,,"Размеры: В.70, Ш.50 см    Ссылка на каталоги / инвентари: Кировская область, Арбажский  район, с. Сорвижи, Троицкая церковь.  Кража - 31.07.2006 г."
2785,2016-06-14T09:44:45Z,Лежащая обнаженная женщина (название употребляемое)    Автор: Аноним (художник)    Школа / Место издания: Западная Европа    Период оригинала: 17 век ?; 18 век ?; 19 век ?,ЖИВОПИСЬ,,25,37,,,"Размеры: В. 25, Ш. 37 (доска)"
6990,2016-06-14T09:44:43Z,Автор: Валентинов-Миллер Эрик Эдуардович (художник)    Школа / Место издания: Россия    Период оригинала: 20 век,,,80,23,,,"Размеры: В. 80, Ш. 23    Ссылка на каталоги / инвентари: ЧГОМ: № 574 (569 п.ф.)"
13916,2016-06-14T09:46:08Z,Стул,,,48,40.5,85.5,,"Размеры: Дл. 48.0, Ш. 40.5, В. 85.5"
5568,2016-06-14T09:45:07Z,Всех Святых (название употребляемое); Все Святые года (название придуманное)    Автор: Аноним (иконописец)    Школа / Место издания: Россия,ИКОНА,,25,25,,,"Стиль: Дерево ценных пород    Размеры: В. 25, Ш. 25 (доска)"
17427,2016-06-14T09:46:32Z,"Примечания на Историю древней и нынешней России г. Леклерка. Т.2.    Автор: Болтин И.Н.    Школа / Место издания: Россия, Санкт-Петербург    Период оригинала: 18 век, 4 четверть",,,26.5,20,,,"Размеры: В. 26,5; Ш. 20; Грав. тит.л., 558, [1] с.    Характер подписи: орешковыми чернилами    Ссылка на каталоги / инвентари: переплет кожаный с золотым тисн. на корешке, обрез желтый; на многих страницах пометы в виде крестиков и отчеркиваний    Инвентарный номер: КП (К) 48647 I-32"
15769,2016-06-14T09:46:23Z,Целитель Пантелеймон    Автор: Никандр Медведев    Период оригинала: 18 век,ИКОНА,,200,150,,,"Стиль: Весь фон чеканка по левкасу, сусальное золото.    Размеры: В.200, Ш.150 см    Ссылка на каталоги / инвентари: Ярославская обл., Некрасовский  район, с. Никольское, Храм Святителя Николая. Похищение произошло 24.04.2007 г."
13742,2016-06-14T09:46:06Z,Альбом фотографий,,,26,32,,,"Размеры: В. 26.0, Ш. 32.0"
5162,2016-06-14T09:45:02Z,Туя (название изначальное); Деревце туя (название придуманное)    Автор: Голубкина А.С. (художник); Голубкина Анна Семеновна (художник) ?    Школа / Место издания: Россия    Период оригинала: 19 век ?,ЖИВОПИСЬ,,34.2,28.2,,,"Размеры: В. 34.2, Ш. 28.2 (лист ?)"
3409,2016-06-14T09:44:49Z,"Богородица Одигитрия Казанская (название придуманное); Богоматерь Тобольская (название предполагаемое)    В русском оригинале (переводе): Одигитрия (греческий, название изначальное) ?    Автор: Аноним (иконописец)    Школа / Место издания: Россия    Период оригинала: 1 половина 19 век",ИКОНА,,25,20,,,"Размеры: В. 25, Ш. 20 (приблизительно)"
19011,2017-03-02T14:36:20Z,"Иконе ""Святой Апостол Фома"", 19 век, дерево, масло",ИКОНА,Объект является культурной ценностью,39,35,,,
7286,2016-06-14T09:45:23Z,"Богоматерь Смоленская (название старое); Путеводительница / Богохранимая (название изначальное); Богоматерь Одигитрия Смоленская (название последнее)    В русском оригинале (переводе): Одигитрия (греческий, название изначальное)    Автор: Аноним (иконописец)    Школа / Место издания: Россия    Период оригинала: 19 век",ИКОНА,,29.5,23,,,"Размеры: В. 29.5, Ш. 23 (доска) / В. 23, Ш. 29.5 (доска)"
2884,2016-06-14T09:44:44Z,Осень (название употребляемое)    Автор: Семенов С.П. (художник)    Школа / Место издания: Россия    Период оригинала: 20 век,ЖИВОПИСЬ,,55,45,,,"Размеры: В. 55, Ш. 45 (без обрамления)"
3414,2016-06-14T09:44:51Z,Святой Пантелеймон Целитель (название изначальное)    Автор: Аноним (иконописец)    Школа / Место издания: Россия,ИКОНА,,40,45,,,"Размеры: В. 40, Ш. 45 (приблизительно) / В. 45, Ш. 40 (приблизительно)"
7166,2016-06-14T09:45:21Z,Школа / Место издания: Франция ?    Период оригинала: середина 19 век,,,60,31,,,"Стиль: Корпус / футляр: Дерево, Маркетри, Накладки металлические, Бронза, Отливка, СКУЛЬПТУРА / СТАТУЯ (детали украшения, ножки), Бронза, Отливка, Стекло (дверца), Полукруг - очертание верхней части корпуса; Циферблат: Бронза, Отливка, Рельеф, Круг, Эмаль (поля с цифрами); Маятник: Бронза, Отливка, Рельеф    Размеры: В. 60, Ш. 31    Ссылка на каталоги / инвентари: В источнике не указаны изготовитель, надписи, цвет, сохранность, требуется уточнение."
18300,2016-06-14T09:46:42Z,Святой Михаил Архангел    Период оригинала: 18 век,ЖИВОПИСЬ,,89,62,,,"Размеры: В. 89, Ш. 62    Ссылка на каталоги / инвентари: инвентарный номер 1996/683    Ссылка на каталоги / инвентари: похищена 13 декабря 2011 г. из Национального музея археологии, антропологии и истории Перу"
12146,2016-06-14T09:45:55Z,Статуэтка,,,7,7.5,,,"Размеры: В. 7.0, Ш. 7.5"
5834,2016-06-14T09:45:09Z,Святой Апостол Марк Евангелист (название изначальное)    Автор: Аноним (художник)    Школа / Место издания: Россия ?    Период оригинала: 19 век,ЖИВОПИСЬ,,9.6,7.7,,,"Размеры: В. 9.6, Ш. 7.7 (лист ?)"
1298,2016-06-14T09:44:36Z,"Поединок (название изначальное)    Автор: Буторин Дмитрий Николаевич (художник)    Школа / Место издания: Россия, Палех    Художественно-производственные мастерские Палехского отделения Худфонда РСФСР    Период оригинала: 1 четверть 20 век ?; 1 половина 20 век",ЖИВОПИСЬ,,12,10,,,"Стиль: Красный: плащи воинов    Размеры: В. 12, Ш. 10 (крышка ?)  / В. 10, Ш. 12 (крышка ?) ?    Характер подписи: 79 ?"
3045,2016-06-14T09:44:46Z,Святой Илия Пророк (название изначальное)    Автор: Аноним    Школа / Место издания: Россия,ИКОНА,,50,60,,,"Размеры: В. 50, Ш. 60 (приблизительно) / В. 60, Ш. 50 (приблизительно)"
15864,2016-06-14T09:46:23Z,Богородица,ИКОНА,,60,50,,,"Стиль: Поволока, грунт. Две шпоны врезные.    Размеры: В.60, Ш.50, Т. 4.5 см    Ссылка на каталоги / инвентари: Удмуртская Республика , Камбарский район, с. Балаки, пер. Клубный, д. 7.  Русская православная старообрядческая церковь."
14858,2016-06-14T09:46:16Z,Богородица,ИКОНА,,15,20,,,"Стиль: Шпонки    Размеры: В. 15, Ш. 20"
17353,2016-06-14T09:46:29Z,"Шествие    Автор: Лиоли, Юрий Константинович    Школа / Место издания: Россия    Период оригинала: 20 век 4 четверть",ЖИВОПИСЬ,,1.5,2,,,"Размеры: В. 1,5 , Ш. 2,0    Характер подписи: ""Юрий Лиоли 89 г.""    Характер подписи: Юрий Лиоли    Инвентарный номер: Б/н"
2188,2016-06-14T09:44:40Z,"[...] красят (название придуманное; неполное)    Автор: Полонкоев Мурад Махиевич (художник)    Школа / Место издания: Россия, Северный Кавказ    Период оригинала: 2 половина 20 век",ЖИВОПИСЬ,,44,48,,,"Размеры: В. 44, Ш. 48 (лист ?)    Ссылка на каталоги / инвентари: ЧГОМ: № 245"
11528,2016-06-14T09:45:51Z,Пейзаж    Автор: Хис К.,,,12.5,9.5,,,"Размеры: В. 12.5, Ш. 9.5"
5385,2016-06-14T09:44:19Z,Базар (название придуманное)    Автор: Коровин Константин Алексеевич (художник)    Школа / Место издания: Россия    Период оригинала: 4 четверть 19 век; 1 половина 20 век,ЖИВОПИСЬ,,55,87,,,"Размеры: В. 55, Ш. 87 (приблизительно)    Ссылка на каталоги / инвентари: В источнике не указана основа, требуется уточнение.  Надписи: может иметься штамп с текстом, где имеется слово ""СССР"".  Подпись: требуется уточнение."
5633,2016-06-14T09:45:12Z,"Святой Серафим Саровский (название изначальное); Святой Преподобный Серафим Саровский Чудотворец (название записано; вверху, лицевая сторона)    Автор: Аноним (иконописец)    Школа / Место издания: Россия    Период оригинала: 4 четверть 19 век; 20 век",ИКОНА,,22,25,,,"Стиль: Зеленый: цвет одежды    Размеры: В. 22, Ш. 25 (доска) / В. 25, Ш. 22 (доска)"
348,2016-06-14T09:44:22Z,Сошествие во ад / Воскресение Христово и Праздники со Страстями (название последнее)    Автор: Аноним (список); Аноним (ювелир)    Школа / Место издания: Россия    Период оригинала: 2 половина 19 век,,,97,76,,,"Стиль: Темпера ?; С ризой: Литье ?, Штамповка ?; Латунь, Серебрение ? /  Серебро ? / Сталь ? / Белая жесть ? / Нейзильбер ?    Размеры: В. 97, Ш. 76 (в окладе ?)    Ссылка на каталоги / инвентари: В источнике не содержатся сведения  о технике и металле оклада, надписях."
3776,2016-06-14T09:44:53Z,Богородица без младенца (название придуманное); Богоматерь (название употребляемое); Дева Мария (название изначальное)    Автор: Аноним (иконописец)    Школа / Место издания: Россия,,,25,35,,,"Стиль: Дерево ?    Размеры: В. 25, Ш. 35 (приблизительно) / В. 35, Ш. 25 (приблизительно)"
6204,2016-06-14T09:45:16Z,Святитель Николай в житиях  (название употребляемое); Святой Николай Чудотворец с житием (название последнее)    Автор: Аноним (иконописец)    Школа / Место издания: Россия ?    Период оригинала: 18 век ?; 19 век ?,ИКОНА,,20,30,,,"Стиль: Масло мягких пастельных тонов    Размеры: В. 20, Ш. 30 (доска) / В. 30, Ш. 20 (доска)"
5200,2016-06-14T09:45:04Z,Махровый мак (название придуманное); Цветок махрового мака (название последнее)    Автор: Аноним (художник)    Школа / Место издания: Россия,ЖИВОПИСЬ,,30,19,,,"Стиль: Бумага: Синий, голубой оттенок    Размеры: В. 30, Ш. 19 (лист ?)    Характер подписи: Д.Л. (?)"
