title,type,rating,price,description,preparation_time,preparation_amount,Бисквитный,Мёд,Цитрусы,Цветочный,Фруктовый,Пряные травы,Специи,Ржаной хлеб,Древесный,Ягодный,Мятный,Сухофрукты,Осенний лист,Грибной,Сливочный,Ореховый,Бальзамический,Хлебный,Овощной,Землистый,Шоколадный,Горчинка,Копченый,Черносливовый,Темный солод,Минеральный,Травянистый,Табачный,Молочный,Коньячный,Шампанское,Кислинка,Терпкость,Кофейный,Жареные семечки подсолнуха,Сладость,Хвойный,Зеленое яблоко
"Лао Фошоу Чао Ча, 2015",ulun,100,1730,"Cделан в округе Мэйчжоу по аутентичной технологии чао ча. В сухом виде: мелкие, лилово-коричневые фрагменты скрученных листиков. Аромат сдержанный, пряно-древесный. Настой прозрачный, горчично-желтого оттенка. Букет готового чая выдержанный, многогранный, пряно-древесный, с фруктовыми, ореховыми, табачными и бисквитными нотками. Аромат сложный, древесно-ореховый. Вкус плотный, немного терпкий, шелковистый, сладковатый, с ягодной кислинкой, нюансами специй и долгим послевкусием. Заваривать горячей водой (80-90°С) в фарфоровой гайвани или чайнике из пористой глины. Пропорция заварки к воде: 3-4 г на 100 мл. Для первого раза дайте настояться в течение 5-8 секунд, далее пейте проливом с постепенным увеличением экспозиции. Выдерживает 8 завариваний. Воздействие согревающее, тонизирующее.",1,4,60,,,,40,80,,,80,,,,,,,60,,,,,,,,,,,,,,,,,,,,,,
"Цзе Чжэн Шэн Ча Бин (2007), 345 г.",puer,90,10247,"345-граммовый блинчик средней плотности, разделяется на буро-коричневые скрученные листики, почки и тонкие черенки. Аромат сдержанный, фруктово-бальзамический. Настой прозрачный, янтарного оттенка. Букет готового чая зрелый, многогранный, фруктово-древесный, с нотками пряных трав и осенних листьев. Аромат теплый, сложный, фруктово-древесный. Вкус плотный и гладкий, приятно вяжущий, сладковатый, с фруктовой кислинкой, нюансами специй и долгим, освежающим послевкусием. Заваривать горячей водой (90-95°С) в чайнике из пористой глины или в гайвани. Пропорция заварки к воде: 6 г на 100 мл. Для первого раза настоять 10 секунд, далее пить проливом с постепенным увеличением экспозиции. Сохраняет вкус и аромат 10 завариваний. Прекрасный образец выдержанного шэн пуэра с многогранным вкусом и медитативным воздействием.",3,6,,,,,80,60,,,60,,,,60,,,,,,,,,,,,,,,,,,,,,,,,,
"Ци Лань (чжун хо, средний огонь)",ulun,94,440,"Улун «Ци Лань» («Чудесная орхидея»). В сухом виде: крупные, бордово-коричневые жгутики чайных листьев. Аромат интенсивный, пряно-цветочный. Настой прозрачный, оттенка белого винограда. Букет готового чая многогранный и яркий, пряно-цветочный, с древесными, цитрусовыми и ягодными нотками. Аромат нежный, высокий, цветочный. Вкус сочный и сладкий, плотный, чуть вяжущий, с ягодной кислинкой, нюансами специй и долгим, освежающим послевкусием. Заваривать горячей водой (80-90°С) в чайнике из пористой глины или в фарфоровой гайвани. Пропорция заварки к воде: 6 г на 100 мл. Для первого раза настоять 5 секунд, после чего пить проливом с постепенным увеличением экспозиции. Держит вкус и аромат 6-7 завариваний. Очень приятный, «цветочный» даньцун: многогранный, достаточно мягкий и очень позитивный.",1,6,,,60,80,,60,,,60,60,,,,,,,,,,,,,,,,,,,,,,,,,,,,
Хэй Чу Хао (май 2023),green,90,410,"Видеообзор с участием этого чая. Зеленый чай провинции Гуанси урожая 2023 г В сухом виде: небольшие спиральки серо-зеленых почек и их фрагменты. Аромат интенсивный, пряно-травянистый. Настой прозрачный, виноградно-желтого оттенка. Букет готового чая яркий, многогранный, пряно-травянистый с нотками ягод и печеных каштанов. Аромат густой, пряно-ягодный. Вкус сочный, плотный, немного терпкий, сладковатый, с ягодной кислинкой и нюансами специй. Послевкусие сочное и долгое. Заваривать горячей водой (80-90°С) в гайвани или фарфоровом чайнике. Пропорция заварки к воде: 3-4 г на 100 мл. Пить проливом с постепенным увеличением экспозиции. Выдерживает 6-7 завариваний. Отличный выбор для повседневных чаепитий – яркий, многогранный, тонизирующий.",1,4,,,,,,60,,,,80,,,,,,60,,,,,,,,,,,80,,,,,,,,,,,
Пиннань Бай Шуй Лань Хун Ча,red,0,7980,"В сухом виде: среднего размера, темно-коричневые листики и почки. Аромат сдержанный, древесно-ягодный. Настой прозрачный, янтарного оттенка. Букет готового чая яркий, многогранный, фруктово-древесный, с медовыми, ягодными и пряными нотками. Аромат нежный, фруктово-древесный. Вкус плотный, гладкий и сладкий, с ягодной кислинкой, нюансами специй и долгим послевкусием. Заваривать горячей водой (95°С) в чайнике из пористой глины с толстыми стенками или в керамической гайвани. Пропорция заварки к воде: 6 г на 100 мл. Для первого раза настоять 15 секунд, далее, начиная с экспозиции в 10 секунд и доведя время выдержки до 3 минут, можно заварить 8 раз. Превосходный красный чай для гурманов и искушенных любителей.",10,6,,60,,,,,60,,80,80,,80,,,,,,,,,,,,,,,,,,,,,,,,,,
Вэньшань Баочжун Чэнь Нянь Ча (1986),ulun,100,17100,"В сухом виде: среднего размера бордово-коричневые жгутики скрученных листьев, их фрагменты и тонкие черенки. Аромат сдержанный, древесный с ноткой сухофруктов. Настой прозрачный, оттенка красного дерева. Букет готового чая зрелый, многогранный, фруктово-древесный, с коньячными, бальзамическими и пряными нотками. Аромат теплый, сложный, фруктовый. Вкус мягкий, шелковистый, сладковатый, с фруктовой кислинкой и нюансами специй – сильно меняется на протяжении чаепития, играя множеством оттенков. Заваривать горячей водой (95°С) в чайнике из пористой глины с толстыми стенками. Пропорция сухого чая к воде: 6 г на 100 мл. Для первого раза настоять 30 секунд, после, начиная с экспозиции в 10 секунд и доведя время до 2 минут, можно заварить 12 раз. Отличный выдержанный чай, с многогранным вкусом, чарующим ароматом и согревающим, расслабляющим воздействием.",10,6,,,,,80,60,,,80,,,,,,,,60,,,,,,,,,,,,,60,,,,,,,,
"Чарующий шу (Мэнхай У Цзи, 2019), 100 г",puer,82,708,"100-граммовый блинчик средней плотности, состоящий из спрессованных, скрученных, темно-коричневых листиков и их фрагментов. Аромат сдержанный, древесный. Настой темного каштанового оттенка. Букет готового чая зрелый, ореховый с нотками хлеба, древесных смол, прелых осенних листьев и сухофруктов. Аромат густой и теплый, ореховый с ноткой чернослива. Вкус плотный, немного терпкий, бархатистый, сладковатый, с легкой горчинкой какао-бобов. Заваривать горячей водой (95°С) в чайнике из пористой глины или в гайвани. Пропорция заварки к воде: 6-8 г на 100 мл. Для первого раза настоять 10 секунд, после чего пить проливом с постепенным увеличением экспозиции. Сохраняет вкус и аромат 9 завариваний. Отличный шу пуэр - бодрящий, яркий и ароматный.",3,7,,,,,,,,,80,,,60,,,,80,60,60,,,,,,,,,,,,,,,,,,,,
"Лао Люй Чао Ча, 2015",ulun,82,2980,"Сделан в округе Мэйчжоу по аутентичной технологии чао ча. В сухом виде: лилово-коричневые фрагменты скрученных почек, тонкие черенки. Аромат сдержанный, древесный. Настой прозрачный, оттенка красного дерева, в процессе заваривания желтеет. Букет готового чая выдержанный, многогранный, пряно-древесный, с ореховыми, бисквитными, табачными и ягодными нотками. Аромат нежный, теплый, древесно-ягодный. Вкус плотный, шелковистый, сладковатый, с нежной терпчинкой, ягодной кислинкой и долгим послевкусием. Заваривать горячей водой (80-90°С) в фарфоровой гайвани или чайнике из пористой глины. Пропорция заварки к воде: 5-6 г на 100 мл. Залейте чай горячей водой, дайте настояться в течение 5-7 секунд, далее пейте проливом с постепенным увеличением экспозиции. Выдерживает 9 завариваний. Воздействие согревающее, медитативное.",2,5,60,,,,,,60,,80,60,,,,,,60,,,,,,,,,,,,,,,,,,,,,,
"Лао Цзюньшань Юй Цзянь, 2005",green,90,3000,"Выдержанный зеленый чай «Нефритовые Лезвия с острова Цзюньшань» из провинции Хунань. В сухом виде: небольшие, тонкие, бежево-серые, пушистые почки. Аромат сдержанный, пряно-травянистый с ноткой душицы. Настой прозрачный, виноградно-желтый с легким розовым оттенком. Букет готового чая выдержанный, пряно-травянистый с нотками мяты и луговых цветов. Аромат тонкий, пряно-цветочный. Вкус мягкий, шелковистый, с легкой древесной терпчинкой, кислинкой зеленого яблока, мятной прохладой и едва уловимым нюансом копченостей. Сочное, долгое, освежающее послевкусие. Заваривать горячей водой (75-85°С) в фарфоровой гайвани или чайнике из пористой глины. Пропорция заварки к воде: 3-4 г на 100 мл. Для первого раза настоять 15-20 секунд, после чего пить проливом с постепенным увеличением экспозиции. Выдерживает 9-10 завариваний. Воздействие освежающее, легкое тонизирующее, самое позитивное.",5,4,,,,40,,80,,,40,,,,,,,,,,,,,,,,,,,,,,,,,,,,,
Чэнь Жоу Гуй (2018),ulun,100,4700,"Выдержанный сильно-ферментированный улун из побегов сорта Жоугуй. В сухом виде: крупные, темно-коричневые чайные листья продольной скрутки. Аромат сдержанный, копченый. Настой прозрачный, оттенка темного янтаря. Букет готового чая теплый, многогранный, пряно-древесный с фруктовыми, хлебными, копчеными и табачными нотками. Аромат глубокий, сложны, хлебно-пряный. Вкус плотный, мягкий, сладковатый, минеральный, с легкой фруктовой терпчинкой, нюансами специй и освежающим послевкусием. Заваривать горячей водой (92-95°С) в чайнике из пористой глины или в гайвани. Пропорция заварки к воде: 6 г на 100 мл. Для первого раза настоять 10 секунд, после чего пить проливом, постепенно увеличивая экспозицию. Выдерживает 7 завариваний. Прекрасный выбор для церемонии гунфуча. Воздействие согревающее, медитативное.",3,6,,,,,60,60,,,80,,,,,,,,,80,,,,,,,,,,40,,,,,,,,,,
"Лао Цзюньшань Цзы Я, 2005",green,94,4560,"Выдержанный зеленый чай «Пурпурные почки с острова Цзюньшань» из провинции Хунань. В сухом виде: тонкие, остроконечные, бурые почки, покрытые серебристым пушком Аромат сдержанный, древесный. Настой прозрачный, виноградно-желтого оттенка. Букет готового чая выдержанный, пряно-древесный с ореховыми и фруктовыми нотками. Аромат спокойный, пряно-травянистый. Вкус плотный, маслянистый, сладковатый, с нежной древесной терпкостью, нюансами специй и сочным послевкусием. Заваривать горячей водой (70-75°С) в фарфоровой гайвани или чайнике из пористой глины. Пропорция заварки к воде: 4 г на 100 мл. Для первого раза настоять 30 секунд, после чего, начиная с экспозиции в 5-7 секунд и доведя время выдержки до 2 минут, можно заварить еще 8-9 раз. Воздействие освежающее, легкое тонизирующее, медитативное.",5,4,,,,,40,80,,,60,,,,,,,60,,,,,,,,,,,,,,,,,,,,,,
Хун Гунфу Лун,red,0,790,"В сухом виде: среднего размера, темно-коричневые листики, скрученные вдоль оси. Аромат сдержанный, фруктово-древесный. Настой прозрачный, янтарного оттенка. Букет готового чая яркий, фруктово-древесный, с медовыми, хлебными и пряными нотками. Аромат интенсивный, фруктово-древесный. Вкус плотный, темного терпкий, сладковатый, с ягодной кислинкой, нюансами специй и освежающим послевкусием. Заваривать горячей водой (95°С) в чайнике из пористой глины с толстыми стенками или в керамической гайвани. Пропорция заварки к воде: 6 г на 100 мл. Для первого раза настоять 15 секунд, далее, начиная с экспозиции в 10 секунд и доведя время выдержки до 3 минут, можно заварить 6 раз. Воздействие согревающее, мягкое тонизирующее.",10,6,,40,,,80,,40,60,80,,,,,,,,,,,,,,,,,,,,,,,,,,,,,
Гуйчжоу Те Гуаньинь,ulun,0,1860,"Весенний урожай 2023 года. В сухом виде: среднего размера комочки скрученных чайных побегов, оливково-зеленого оттенка, с небольшими черенками. Аромат сдержанный, цветочный. Настой прозрачный, светло-зеленого оттенка. Букет готового чая свежий, травянисто-цветочный с пряными, молочными и фруктовыми нотками. Аромат нежный, травянисто-цветочный. Вкус плотный, шелковистый, сладковатый, с легкой терпкостью виноградной кожицы, ягодной кислинкой и освежающим послевкусием. Заваривать горячей водой (85-90°С) в чайнике из пористой глины или в фарфоровой гайвани. Пропорция заварки к воде: 6 г на 100 мл. Для первого раза настоять 10 секунд, после чего пить проливом, постепенно увеличивая экспозицию. Выдерживает 8 завариваний. Воздействие освежающее, мягкое тонизирующее.",5,6,,,,80,60,,40,,,,,,,,,,,,,,,,,,,,100,,40,,,,,,,,,
Тэ Гун Люань Хэй Ча (2019),black,92,2785,"Черный чай «Тэ Гун» («Дворцовый, высшее качество») из Люань (провинция Аньхой) урожая 2019 г. В сухом виде: небольшие, изогнутые темно-коричневые жгутики чайных почек. Аромат сдержанный, пряно-древесный, с фруктовой ноткой. Настой прозрачный, оттенка белого винограда. Букет готового чая многогранный, пряно-древесный с нотками осеннего леса, древесных смол и печеных фруктов. Аромат тонкий, фруктово-бальзамический. Вкус плотный, сочный, сладковатый, немного терпкий, с легкой кислинкой и освежающим послевкусием. Заваривать горячей водой (90-95°С) в гайвани или чайнике из пористой глины. Пропорция заварки к воде: 5 г на 100 мл. Для первого раза настоять 8-10 секунд, после чего пить проливом с постепенным увеличением экспозиции. Выдерживает 7-8 завариваний. Воздействие согревающее, тонизирующее. Идеальный кандидат для закладки на многолетнюю выдержку и развитие.",3,5,,,,,60,60,,,80,,,,40,,,,,,,,,,,,,,,,,,,,,,,,,
"Таиландский ГАБА Ассам красный чай, дикорастущие деревья. Moychay Tea Forest Project, batch03-2022 (limited 178 pieces), 357 г",red,88,15350,"В сухом виде: спрессованные крупные, изогнутые, бордово-коричневые жгутики скрученных листиков с тонкими черенками, серебристо-бежевые почки. Аромат интенсивный, медово-цветочный. Настой прозрачный, янтарного оттенка. Букет готового чая яркий, медово-цветочный, с нотками игристых вин, осенних листьев, свежих ягод, мяты и специй. Аромат теплый, нежный, медово-цветочный. Вкус плотный, шелковистый, сладковатый, с ягодной кислинкой, нюансами специй и освежающим послевкусием Заваривать горячей водой (90-95°С) в чайнике из пористой глины или в фарфоровой гайвани. Пропорция заварки к воде: 5-6 г на 100 мл. Для первого раза настоять 10 секунд, после чего пить проливом, постепенно увеличивая экспозицию. Выдерживает 10 завариваний. Превосходный чай для искушенных любителей с многогранным вкусом и мощным медитативным воздействием.",3,6,,80,,80,,,80,,,80,60,,,,,,,,,,,,,,,,,,,,,,,,,,,
