title,type,rating,price,description,preparation_time,preparation_amount,Бисквитный,Мёд,Цитрусы,Цветочный,Фруктовый,Пряные травы,Специи,Ржаной хлеб,Древесный,Ягодный,Мятный,Сухофрукты,Осенний лист,Грибной,Сливочный,Ореховый,Бальзамический,Хлебный,Овощной,Землистый,Шоколадный,Горчинка,Копченый,Черносливовый,Темный солод,Минеральный,Травянистый,Табачный,Молочный,Коньячный,Шампанское,Кислинка,Терпкость,Кофейный,Жареные семечки подсолнуха,Сладость,Хвойный,Зеленое яблоко
"Куприт, хэйча из Аньхуа (Moychay.ru, 2017), 1 кг",black,86,491,"Черный чай из Аньхуа (уезд Иян, провинция Хунань) урожая 2017 года. В создании этого чая принимает участие микроб Eurotium Cristatum или Цзинь Хуа (Золотые цветы, разновидность), чрезвычайно полезный для здоровья. Его колонии выглядят как жёлтые крупинки, рассыпанные по поверхности чайного листа. 1000-граммовый брикет средней плотности, легко расслаивается на крупные темно-коричневые листики с черенками. Аромат сдержанный, фруктово-древесный. Настой прозрачный, янтарного оттенка. Букет готового чая зрелый, многогранный, фруктово-древесный с нотками прелых осенних листьев и пряных трав. Аромат глубокий, сложный, фруктово-пряный. Вкус мягкий и гладкий, сладковатый, с ягодной кислинкой и освежающим послевкусием. Заваривать горячей водой (90-95°С) в гайвани или чайнике из пористой глины. Пропорция заварки к воде: 6-8 г на 100 мл. Для первого раза настоять 8-10 секунд, после чего пить проливом с постепенным увеличением экспозиции. Выдерживает 10 завариваний. Отличный образец выдержанного хэйча. Особенно рекомендуется всем тем, кто предпочитает фруктовый вкусо-ароматический профиль.",2,7,,,,,80,60,,,60,,,,60,,,,,,,,,,,,,,,,,,,,,,,,,
Лишань Улун Циньвэй,ulun,0,5900,"Высокогорный улун с горы Лишань, весенний урожай 2023. В сухом виде: небольшие темно-зеленые комочки скрученных чайных побегов. Аромат интенсивный, пряно-цветочный. Настой прозрачный, светлого, зеленовато-желтого оттенка. Букет готового чая свежий, многогранный, пряно-цветочный с фруктовыми и ореховыми нотками. Аромат высокий и нежный, пряно-цветочный. Вкус плотный и гладкий, маслянистый, сладкий, с нюансами специй, легкой терпкостью виноградной кожицы, фруктовой кислинкой и освежающим послевкусием. Заваривать горячей водой (85°С) в чайнике из пористой глины или в фарфоровой гайвани. Пропорция сухого чая к воде: 6 г на 100 мл. Для первого раза настоять 10 секунд, после чего пить проливом, постепенно увеличивая экспозицию. Держит вкус и аромат 12 завариваний. Превосходный чай, выбор гурманов и искушенных любителей.",2,6,,,,80,60,,80,,,,,,,,,60,,,,,,,,,,,80,,,,,,,,,,,
Буланшань Шу Пуэр (2019),puer,70,710,"В сухом виде: небольшие, коричневые, скрученные листики и их фрагменты, рыжие почки и тонкие черенки. Аромат сдержанный, древесно-ореховый. Настой темного каштанового оттенка. Букет готового чая зрелый, орехово-древесный, с хлебными, осенними и бальзамическими нотками. Аромат теплый, орехово-древесный. Вкус мягкий, бархатистый, сладковатый, с легкой горчинкой и нюансами специй. Заваривать горячей водой (95°С) в чайнике из пористой глины с толстыми стенками. Пропорция сухого чая к воде: 7-8 г на 100 мл. Для первого раза настоять 10 секунд, после пить проливом с постепенным увеличением экспозиции. Держит вкус и аромат 6 завариваний. Воздействие согревающее, умеренно тонизирующее.",3,7,,,,,,60,,,80,,,,80,,,60,,,,,,60,,,,,,,,,,,,,,,,
Цивэй Да Ву Е,ulun,94,890,"Сделан в мае 2018 года в чайном хозяйстве Цивэй (округ Чаочжоу) из весенних побегов сорта Да Ву Е (Большой темный лист). В процессе обработки чайный лист прошел через легкую ферментацию и слабый огонь. В сухом виде: крупные жгутики скрученных буро-коричневых листьев с тонкими черенками. Аромат интенсивный, пряно-травянистый. Настой прозрачный, виноградного оттенка (в процессе заваривания желтеет). Букет готового чая яркий, пряно-травянистый с цветочными, древесными и ягодными нотками. Аромат свежий, высокий, пряно-цветочный. Вкус сочный, чуть терпкий, с ягодной кислинкой и долгим, освежающим послевкусием. Заваривать горячей водой (80-95°С) в фарфоровой гайвани или чайнике из пористой глины. Пропорция заварки к воде: 4-5 г на 100 мл. Пить проливом с постепенным увеличением экспозиции. Выдерживает 9 завариваний. Отличный природный энергетик с сочным, ярким вкусом и освежающим, тонизирующим воздействием.",1,4,,,,60,,60,,,40,40,,,,,,,,,,,,,,,,,80,,,,,,,,,,,
Гаошань Дундин Дун Ча,ulun,100,3100,"Высокогорный зимний «Дундин» сделан поздней осенью 2022 в районе Лугу округа Наньтоу. В сухом виде: среднего размера, оливково-зеленые комочки скрученных чайных побегов. Аромат интенсивный, пряно-цветочный. Настой прозрачный, виноградного оттенка, в процессе заваривания желтеет. Букет готового чая свежий, травянисто-цветочный с пряными, ореховыми и фруктовыми нотками. Аромат яркий, пряно-цветочный. Вкус плотный, гладкий и сладкий, маслянистый, чуть пряный, с фруктовой кислинкой и освежающим послевкусием. Заваривать горячей водой (85-90°С) в чайнике из пористой глины или в фарфоровой гайвани. Пропорция сухого чая к воде: 6 г на 100 мл. Для первого раза настоять 15 секунд, после чего пить проливом, постепенно увеличивая экспозицию. Держит вкус и аромат 10 завариваний. Прекрасный выбор для церемонии гунфуча. Воздействие освежающее, умеренно тонизирующее.",3,6,,,,80,60,,60,,,,,,,,,60,,,,,,,,,,,80,,,,,,,,,,,
"Грузинский красный, май 2023, batch05-01",red,100,2340,"В сухом виде: крупные, изогнутые жгутики темно-коричневых чайных листочков с длинными черенками. Аромат сдержанный, фруктово-древесный. Настой прозрачный, янтарного оттенка. Букет готового чая теплый, фруктово-древесный, с пряными и цветочными нотками. Аромат нежный, фруктово-цветочный. Вкус сочный, крепкий, пряный, с нюансами специй, фруктовой кислинкой и освежающим послевкусием. Заваривать горячей водой (95°С) в чайнике из пористой глины или в гайвани. Пропорция заварки к воде: 6 г на 100 мл. Для первого раза настоять 15-20 секунд, далее пить проливом с постепенным увеличением экспозиции. Сохраняет вкус и аромат 8 завариваний. Воздействие согревающее, тонизирующее. В чае допустимо наличие до 10-15 % мелкой фракции листа.",10,6,,,,60,80,80,60,,80,,,,,,,,,,,,,,,,,,,,,,,,,,,,,
Мэнхай Шу Шэнтай Пуэр (2020),puer,92,830,"В сухом виде: среднего размера, коричневые, скрученные листики, рыжие почки и тонкие черенки. Аромат очень сдержанный, древесный с тонкой овощной ноткой. Настой прозрачный, каштанового оттенка. Букет готового чая зрелый, ореховый, с нотками древесных смол, специй, какао бобов и печеного картофеля. Аромат густой и теплый, древесно-ореховый. Вкус плотный, гладкий, маслянистый, сладковатый, пряный, с мятной прохладой, кислинкой сухих ягод и бархатистым послевкусием. Заваривать горячей водой (95°С) в чайнике из пористой глины. Пропорция сухого чая к воде: 6-7 г на 100 мл. Для первого раза настоять 10 секунд, после пить проливом с постепенным увеличением экспозиции. Держит вкус и аромат 8 завариваний. Воздействие согревающее, умеренно тонизирующее.",5,7,,,,,,,80,,80,,,,,,,100,,,80,,40,,,,,,,,,,,,,,,,,
Айцзяо Улун,ulun,88,2050,"Cделан из осенних побегов чайного куста Ай Цзяо. История сорта Ай Цзяо или Низкорослый (высота куста не превышает 120 см) ведет свое начало из сунских императорских Северных садов Бэй Юань (ныне уезд Цзяньоу, Фуцзянь). В 90-е годы ХХ века сорт был клонирован на основе материала, взятого с вековых материнских деревьев из старого сада поселка Дунфэн чжэнь. В сухом виде: изогнутые, буро-коричневые жгутики скрученных листиков среднего размера. Аромат интенсивный, пряный. Настой прозрачный, оттенка лугового меда. Букет готового чая теплый, пряно-древесный с ореховыми, фруктовыми и цветочными нотками. Аромат теплый, пряно-древесный, холодный аромат сладкий, цветочный. Вкус сочный, шелковистый, чуть вяжущий, с легкой кислинкой. Сочное, освежающее послевкусие. Заваривать горячей водой (95°С) в чайнике из пористой глины для сильно-ферментированных улунов или в гайвани. Пропорция заварки к воде: 5-6 г на 100 мл. Пить проливом, постепенно увеличивая экспозицию. Выдерживает 7 завариваний. Отличный выбор для психо-эмоциональной перезагрузки во второй половине дня. Согревает, снимает усталость и переключает внимание. Понравится тем любителям яньча, кто ценит в них тонкую, цветочную составляющую.",1,6,,,,60,60,60,,,60,,,,,,,60,,,,,,,,,,,,,,,,,,,,,,
Юньлун Лао Янь Ча,ulun,90,3888,"Выдержанный утёсный улун из чайного хозяйства Юньлун. Сделан в середине 2000-х. В сухом виде: крупные, изогнутые, темно-коричневые жгутики скрученных листиков. Аромат глубокий и теплый, хлебно-пряный. Настой прозрачный, оттенка темного янтаря. Букет готового чая теплый, выдержанный, многогранный, хлебно-пряный с фруктовыми, древесными, коньячными и бальзамическими нотками. Аромат теплый, сложный, фруктово-древесный. Вкус мягкий, объемный, сладковатый, с едва уловимой кислинкой, нюансами специй и минеральными нотками, характерными для яньча. Устойчивое, сочное послевкусие. Заваривать горячей водой (95°С) в чайнике из пористой глины или в фарфоровой гайвани. Пропорция заварки к воде: 5 г на 100 мл. Пить проливом, постепенно увеличивая экспозицию. Выдерживает 8 завариваний. Превосходный выдержанный чай для коллекционеров и искушенных ценителей, с классической «мелодией утёсов» во вкусе и аромате. Воздействие согревающее, расслабляющее, медитативное.",1,6,,,,,40,40,,,60,,,,,,,,60,60,,,,,,,,,,,,,,,,,,,,
"Таиландский шэн пуэр с диких деревьев, полностью ручное производство, Moychay Tea Forest Project, batch-First-2022, (limited 72 pieces), 357 г",puer,80,14970,"357-граммовый блинчик средней плотности, легко разделяется на бурые жгутики скрученных листиков и серебристо-бежевые почки. Аромат нежный, пряно-травянистый. Настой прозрачный, оттенка белого винограда. Букет готового чая свежий, многогранный, пряно-травянистый с цветочными, бальзамическими и фруктовыми нотками. Аромат сложный, пряно-травянистый. Вкус плотный, очень мягкий, маслянистый, чуть вяжущий, с фруктовой кислинкой, нюансами специй и долгим мятным послевкусием. Заваривать горячей водой (90°С) в гайвани или чайнике из пористой глины. Пропорция заварки к воде: 6 г на 100 мл. Для первого раза настоять 10 секунд, после чего пить проливом с постепенным увеличением экспозиции. Выдерживает 9 заварок. Превосходный молодой шэн пуэр с насыщенным, мягким вкусом и мощным медитативным воздействием. При правильном хранении с годами обещает быть только лучше (если избежит участи быть выпитым немедленно).",3,6,,,,60,40,80,,,,,60,,,,,,80,,,,,,,,,,,,,,,,,,,,,
"Даньцун Чао Ча, 2017",ulun,100,3850,"Сделан в округе Мэйчжоу по аутентичной технологии чао ча. В сухом виде: лилово-коричневые фрагменты скрученных почек, тонкие черенки. Аромат интенсивный, пряно-цветочный. Настой прозрачный, оттенка красного дерева, в процессе заваривания желтеет. Букет готового чая яркий, многогранный, пряно-цветочный, с древесными и ягодными нотками. Аромат высокий, сложный, цветочно-ягодный. Вкус плотный, терпкий, сладковатый, с легкой горчинкой грейпфрута, ягодной кислинкой, нюансами специй и долгим послевкусием. Заваривать горячей водой (80-90°С) в фарфоровой гайвани или чайнике из пористой глины. Пропорция заварки к воде: 4 г на 100 мл. Залейте чай горячей водой, дайте настояться в течение 5-7 секунд, далее пейте проливом с постепенным увеличением экспозиции. Выдерживает 8 завариваний. Воздействие согревающее, тонизирующее.",2,4,,,60,100,,80,,,60,100,,,,,,,,,,,,,,,,,,,,,,,,,,,,
Хуа Ган Улун,ulun,60,5700,"В сухом виде: среднего размера, оливково-зеленые комочки скрученных чайных побегов. Аромат интенсивный, пряно-цветочный. Настой прозрачный, виноградного оттенка, в процессе заваривания желтеет. Букет готового чая свежий, травянисто-цветочный с пряными, ореховыми и фруктовыми нотками. Аромат яркий, пряно-цветочный. Вкус плотный, мягкий и сладкий, маслянистый, с фруктовой кислинкой и освежающим послевкусием. Заваривать горячей водой (85-90°С) в чайнике из пористой глины или в фарфоровой гайвани. Пропорция сухого чая к воде: 6 г на 100 мл. Для первого раза настоять 15 секунд, после чего пить проливом, постепенно увеличивая экспозицию. Держит вкус и аромат 10 завариваний. Прекрасный выбор для церемонии гунфуча. Воздействие освежающее, умеренно тонизирующее",3,6,,,,80,60,,60,,,,,,,,,80,,,,,,,,,,,80,,,,,,,,,,,
"Аньхуа Шоу Чжу Фу Чжуань (Moychay.ru, 2014), 500 г",black,92,5150,"«Чайный кирпич долголетия, сделанный вручную» из Аньхуа (провинция Хунань).В создании этого чая принимает участие микроб Eurotium Cristatum или Цзинь Хуа (Золотые цветы), чрезвычайно полезный для здоровья. Его колонии выглядят как жёлтые крупинки, рассыпанные по поверхности чайного листа. Помимо чая Золотые Цветы живут на Грибах Долголетия, Фу Лин (Poria cocos, Пория кокосовидная), что неслучайно и в некотором смысле роднит их. 500-граммовый чайных брикет из спрессованных чайных листьев с одеревенелыми черенками. Аромат спокойный, древесно-бальзамический. Настой прозрачный, оттенка желтой охры. Букет готового чая зрелый, многогранный, пряно-древесный, с нотками дубового мха, осенних листьев, грибов и сухофруктов. Аромат глубокий и теплый, пряно-древесный. Вкус мягкий, маслянистый, сладковатый, с легкой древесной терпкостью и фруктовой кислинкой. Приятное, освежающее послевкусие Заваривать горячей водой (95°С) в гайвани или чайнике из пористой глины. Пропорция заварки к воде: 6 г на 100 мл. Пить проливом с постепенным увеличением экспозиции. Выдерживает 9-10 завариваний. Хорошо подходит для варки и заварки в термосе. Воздействие согревающее, умеренно тонизирующее.",2,6,,,,,40,60,,,80,,,,60,,,,60,,,,,,,,,,,,,,,,,,,,,
Бадашань Шу Пуэр (2019),puer,92,650,"В сухом виде: небольшие, коричневые, скрученные листики и их фрагменты, рыжие почки и тонкие черенки. Аромат интенсивный, древесно-ореховый. Настой темного каштанового оттенка. Букет готового чая зрелый, орехово-древесный, с хлебными, осенними и бальзамическими нотками. Аромат теплый, орехово-древесный. Вкус мягкий, гладкий, сладковатый, с легкой горчинкой какао-бобов и нюансами специй. Заваривать горячей водой (95°С) в чайнике из пористой глины с толстыми стенками. Пропорция сухого чая к воде: 7-8 г на 100 мл. Для первого раза настоять 10 секунд, после пить проливом с постепенным увеличением экспозиции. Держит вкус и аромат 6 завариваний. Воздействие согревающее, умеренно тонизирующее.",3,7,,,,,,,40,,80,,,,60,,,80,,,,,,60,,,,,,,,,,,,,,,,
