name,address,longitude,latitude,description,subordination,creation_time,modification_time,mo_from,mo_to,tu_from,tu_to,we_from,we_to,th_from,th_to,fr_from,fr_to,sa_from,sa_to,su_from,su_to,dedication
Библиотека № 10 – Центр обменно-репозитарного хранения,"г Москва,г Москва,пер Стрельбищенский,д 5 к 3",37.536895,55.758418,"Библиотека № 10 расположена в Пресненском районе Москвы. Для читателей представлен большой фонд художественной и документальной литературы, исторических справочников. Сейчас количество экземпляров – более 30 000. В 2016 году в пространстве библиотеки появился отдел детской литературы. Сегодня здесь расположен книжный зал (для поиска книг) и читальный зал, в котором пользователи могут познакомиться с актуальной периодикой. Весь фонд открыт посетителям для ознакомления. Большим спросом среди посетителей читальни пользуется компьютерный зал, в котором обеспечен доступ к основным интернет-ресурсам.",Москва,2021-08-16T09:07:19Z,2023-02-21T05:21:36Z,50400,64800,50400,64800,50400,64800,50400,64800,50400,64800,NA,NA,NA,NA,NA
Центральная городская молодежная библиотека имени М. А. Светлова. Абонемент,"г Москва,г Москва,ул Садовая-Кудринская,д 23/1",37.589545,55.76559,"Центральная городская молодежная библиотека имени М. А. Светлова – первая в Москве и одна из старейших в России библиотек для молодежи. Появившись перед войной в апреле 1941 года, библиотека открыла свои двери читателям и больше не закрывала их. Сегодня библиотека, известная также как Светловка, – современный информационно-культурный центр для молодежи.Абонемент Светловки располагается в здании культурного наследия – доходном доме М. Н. Чижиковой 1901 года. В отделе представлен универсальный книжный фонд, который постоянно пополняется новинками и бестселлерами, а также свежими периодическими изданиями от научно-популярных и до развлекательных. Также абонемент располагает богатым фондом литературы по искусству, коллекцией грампластинок, нот, научно-популярных и художественных фильмов, альбомов с репродукциями картин. В помещениях абонемента работает бесплатный Wi-Fi, установлена станция самообслуживания, расположены компьютеры с выходом в интернет и места для чтения, предоставляются услуги печати, сканирования, ксерокопирования и другие. Также в отделе расположена музыкальная комната, где предоставляется возможность проводить уроки игры на электронном и акустическом пианино.Также в библиотеке есть еще детский отдел и медиацентр.",Москва,2015-07-27T06:48:37Z,2023-02-17T09:25:05Z,NA,NA,36000,75600,36000,75600,36000,75600,36000,75600,36000,75600,36000,72000,им. М. А. Светлова
Библиотека № 233 г. Москвы,"г Москва,г Москва,пер Митинский 3-й,д 2",37.353432,55.848539,"Новогодним подарком в январе 1951 года для всех ребятишек города было открытие первой детской библиотеки. Она находилась на Сходненской улице, в полуподвальной части дома № 28. Первоначальный фонд состоял из 5 000 книг, переданных для детей Российской государственной библиотекой им. В. И. Ленина и взрослой библиотекой № 55, которая находилась в Строительном проезде. В 1953 году в библиотеке открылся читальный зал. В начале 60-х годов детская библиотека № 1 переехала в новое помещение на первом этаже дома № 13 по Сходненской улице. В конце 1994 года фонд детской библиотеки № 30 был передан библиотеке № 252, которая открыла свои двери в январе 1995 года, изначально обслуживая и взрослых, и детей всего района.В конце 1995 года под детскую библиотеку в Митине выделили помещение общей площадью 207,8 кв. м и передали ей оставшийся книжный фонд детской библиотеки вместе с ее номером (№ 30). А в январе 1996 года детская библиотека № 30 распахнула свои двери.Сегодня библиотечный фонд – 34 726 экземпляров, состав фонда универсален по содержанию и комплектуется с учетом разнообразных читательских интересов. В практике работы – самые разнообразные мероприятия. Посещений за 2021 год – 38 292. В библиотеке работает языковый клуб «Чеширский кот».",Москва,2015-07-23T21:42:20Z,2023-02-17T09:52:19Z,NA,NA,36000,79200,36000,79200,36000,79200,36000,79200,36000,75600,43200,72000,NA
Библиотека № 232 (подразделение № 1) г. Москвы,"г Москва,г Москва,проезд Тушинский 1-й,д 4",37.422368,55.833375,"Детская библиотека № 150 открыла свои двери для читателей в 1979 году. В 2015 году она стала подразделением библиотеки № 232 13-го микрорайона Тушино. Микрорайон Комсомолка, где расположена библиотека, находится в отдаленной части района Покровское-Стрешнево, библиотека является местом притяжения местной детворы. Дети часто приходят в библиотеку, чтобы взять любимые книги, посидеть и полистать журналы, поиграть в компьютерные и настольные игры или просто пообщаться друг с другом. Для читателей действует постоянная выставка новых поступлений. Работает клуб «ИЗО» (изобразительное искусство для дошкольников и младших школьников). Есть клуб робототехники (знакомство с азами программирования, конструирование мини-роботов), занятия нацелены на развитие у детей базовых исследовательских и проектных умений, имеющих основополагающее значение для научных и инженерных профессий. Посещений за 2021 год – 10 406. Фонд – 15 813 экз.",Москва,2015-07-23T22:24:48Z,2023-02-21T14:08:09Z,NA,NA,43200,75600,43200,75600,43200,75600,43200,75600,43200,75600,43200,72000,NA
Центральная городская молодежная библиотека имени М. А. Светлова. Детский отдел,"г Москва,г Москва,пер Тишинский Б.,д 24",37.574031,55.769226,"Центральная городская молодежная библиотека имени М. А. Светлова – первая в Москве и одна из старейших в России библиотек для молодежи. Появившись в апреле 1941 года, библиотека открыла свои двери читателям и больше не закрывала их.Сегодня библиотека, известная также как Светловка, – современный информационно-культурный центр для молодежи. Светловка располагает универсальным книжным фондом, широким диапазоном периодических изданий, коллекцией грампластинок, нот, научно-популярных и художественных фильмов, альбомов репродукций. Библиотека оснащена информационными ресурсами: электронным каталогом, станциями самостоятельного обслуживания на основе RFID-технологий, интернетом и Wi-Fi-зоной.Детско-юношеский абонемент был присоединен к Светловке в 2016 году, а в 2018 году в нем был закончен ремонт, что придало детскому отделу новый вид. Фонд представлен детской литературой от 0 до 12 лет, большим выбором книг для чтения по программным школьным спискам, литературными новинками ведущих издательств, классической литературой, энциклопедиями, отраслевой литературой по экономике, философии и т. д. для подростков, специализированным фондом для родителей по воспитанию детей, свежими журналами для детей, подростков и их родителей, а также настольными играми.В детско-юношеском абонементе регулярно проводятся лекции для родителей, занятия для детей, спектакли, мастер-классы, встречи с детскими писателями, семейные викторины и праздники.В помещениях детско-юношеского абонемента работает бесплатный Wi-Fi, установлена станция самообслуживания, предоставляются услуги печати, сканирования, ксерокопирования и другие.",Москва,2017-01-30T10:10:28Z,2023-02-17T09:26:49Z,NA,NA,36000,75600,36000,75600,36000,75600,36000,75600,36000,75600,36000,72000,им. М. А. Светлова
Библиотека № 44 им. В. Г. Короленко (филиал № 3),"г Москва,г Москва,ул Смольная,д 11",37.498285,55.846062,"Библиотека была открыта для читателей в 1970 году. В настоящее время входит в состав библиотеки № 44 им. В. Г. Короленко. Универсальный фонд насчитывает 63 100 единиц хранения, представлена литература по естественным, техническим, общественно-политическим наукам, литература по искусству, художественные произведения отечественных и зарубежных авторов. Для тех, кто хотел бы развить свои творческие способности, на базе библиотеки проводятся различные культурно-массовые мероприятия в рамках творческой лаборатории «Северное сияние». Развивается краеведческое направление. Библиотека работает в тесном контакте со школой № 1583 имени К. А. Керимова, с тремя ветеранскими организациями Головинского района.Принадлежит ГБУК г. Москвы «ЦБС CАО».",Москва,2016-04-06T09:59:57Z,2023-02-21T09:16:46Z,NA,NA,43200,79200,43200,79200,43200,79200,43200,79200,43200,79200,43200,72000,им. В. Г. Короленко
Библиотека № 121 (филиал № 2) г. Москва,"г Москва,г Москва,ул Петра Романова,д 6",37.68067,55.708308,"Свою деятельность библиотека № 121, ранее № 149, начала в 1945 году. В основу фонда легли частные пожертвования и коллекции граждан, а также государственное комплектование. С 1977 года библиотека являлась центральной библиотекой Пролетарского района Москвы, затем вошла в состав централизованной библиотечной системы № 2 на правах филиала. В 1984 году получила в дар от библиотеки № 85 нотно-музыкальный фонд и приобрела статус библиотеки музыкального воспитания. В 2015 года библиотека вошла в состав библиотеки № 121 ЦБС ЮВАО. С момента основания, благодаря крупному книжному фонду, библиотека стала культурным и просветительным центром в Кожухове. В 60-70 е годы 20 века, во время массового увлечения вечерними и заочными формами получения высшего образования, библиотека привлекала огромное количество рабочей молодежи: ведь рядом с библиотекой располагались Цементный, Шинный, Шарикоподшипниковский заводы. Также библиотека специализировалась на работе с трудными подростками – проводились вечера, беседы, встречи с передовиками производства. Основное направление работы библиотеки – пропаганда музыкального искусства, она работает не только со взрослым населением района, но и с молодежью и школьниками. Отдел искусства имеет большой фонд литературы по всем видам искусства, а также фонд нотно-музыкальной литературы, видео и аудиотеку, уникальное собрание грампластинок. Библиотека активно сотрудничает с Центром социального обеспечения Южнопортового района, где библиотекари проводят беседы и лекции, колледжем ГМПИ им. М.М. Ипполитова-Иванова, Московской филармонией и др. В уютной музыкальной гостиной проходят камерные музыкальные вечера с участием студентов и выпускников музыкальных вузов столицы, а также лауреатов российских и международных конкурсов. В 2022 году в библиотеке №121 завершился капитальный ремонт, обновлена материально-техническая база.Книжный фонд: более 34 тыс. экз. (включая аудиовизуальные материалы).Структура библиотеки: абонемент, читальный зал, отдел искусств (нотно-музыкальный отдел), музыкальная гостиная. Имеется доступ к бесплатным электронным ресурсам: ЛитРес, НЭБ. Бесплатный WI-FI.",Москва,2015-07-23T07:14:08Z,2023-02-21T08:59:58Z,NA,NA,43200,79200,43200,79200,43200,79200,43200,79200,43200,79200,43200,72000,NA
Библиотека № 29 (филиал № 1) г. Москвы,"г Москва,г Москва,ш Дмитровское,д 50",37.569351,55.845572,"Библиотека была основана в 1938 году. С 1963 года и по настоящее время располагается по адресу Дмитровское шоссе, д. 50.Универсальный фонд библиотеки насчитывает 36 000 единиц хранения.С 2003 года в библиотеке существует любительское объединение «Я – человек», где люди с ограниченными возможностями занимаются творчеством, встречаются с интересными людьми и просто общаются в уютной обстановке. Регулярно члены объединения проводят мероприятия для посетителей библиотеки и жителей района.Литературные, художественные и образовательные мероприятия организуются библиотекой вместе с партнерами: Управлением по особо охраняемым территория САО, районными образовательными учреждениями, учреждениями культуры, соцзащиты.Библиотека принадлежит ГБУК г. Москвы «ЦБС САО».",Москва,2015-07-27T01:57:24Z,2023-02-21T09:14:28Z,NA,NA,39600,70200,39600,70200,39600,70200,39600,70200,39600,70200,NA,NA,NA
Центральная детская библиотека № 14. Отдел «Научка»,"г Москва,г Москва,ул Дубининская,д 20",37.636554,55.726239,"Библиотека основана в 1937 году. Свое наименование она получила в соответствии с приказом Департамента культуры города Москвы от 17 сентября 2014 года «Об упорядочении наименований государственных публичных библиотек Департамента культуры города Москвы» в связи с начавшимся процессом оптимизации сети библиотек. Сегодня «Научка» – это просветительский проект, созданный и развивающийся в самом центре столицы. В читальне представлена коллекция научно-популярных книг и журналов, постоянно проводятся научно-популярные лекции и презентации книг. Библиотека стала пространством для встреч и общения научного сообщества. Среди гостей и постоянных спикеров библиотеки можно увидеть обладателя премии «Просветитель», ученого, автора научно-популярных книг Александра Панчина; члена-корреспондента РАН проф. Виктора Ивановича Данилова-Данильяна; научного сотрудника Крымской астрофизической обсерватории Сергея Назарова; ведущую научно-популярной программы телеканала «Живая планета» Евгению Тимонову; популяризатора космонавтики, автора книг и статей Виталия Егорова; антрополога и автора бестселлеров Станислава Дробышевского. В библиотеке можно не только взять книгу или попасть на научно-популярное мероприятие, но и поработать над своим проектом (есть зона коворкинга). Помимо научно-популярной литературы, в библиотеке есть и пул самой востребованной художественной классики и бестселлеров.",Москва,2015-07-26T22:14:03Z,2023-02-21T06:37:40Z,NA,NA,36000,75600,36000,75600,36000,75600,36000,75600,36000,75600,36000,72000,NA
Центральная библиотека № 190 г. Москва,"г Москва,г Москва,ул Профсоюзная,д 115",37.519629,55.630101,"Библиотека основана в 1969 году и расположена в центре Юго-Западного округа, рядом со станцией метро «Коньково». В абонементе выдается на дом литература на русском и иностранных языках. Редкие и ценные издания могут быть выданы в режиме ""читального зала"".В отделе детской литературы и творческого развития собраны книги по школьной программе, классика и лучшие образцы современной детской литературы.В компьютерном зале – широкий перечень сервисных услуг, доступ к информационно-правовой системе ""Консультант+"", Национальной электронной библиотеке и базе данных периодических изданий ""East View"".Совокупный фонд библиотеки насчитывает 63 221 единиц хранения.В 2022 году библиотеку посетили 63 605 человека. В библиотеке располагается администрация ОКЦ ЮЗАО.",Москва,2016-04-08T06:44:40Z,2023-10-06T14:21:08Z,NA,NA,43200,79200,43200,79200,43200,79200,43200,79200,43200,79200,43200,72000,NA
