name,address,longitude,latitude,description,subordination,creation_time,modification_time,mo_from,mo_to,tu_from,tu_to,we_from,we_to,th_from,th_to,fr_from,fr_to,sa_from,sa_to,su_from,su_to,dedication
Библиотека № 72 (фонд детской литературы) г. Москва,"г Москва,г Москва,ул Уссурийская,д 9",37.8190666437149,55.8240456644906,"Площадка библиотеки № 72 (ул. Уссурийская, 9) открылась как Детская библиотека в 1983 году.Структура библиотеки: младший абонемент для детей дошкольного и младшего школьного возраста 1–4 классов;старший абонемент для читателей старшего школьного возраста 5–9 классов;читальный зал;компьютерный зал.Фонд библиотеки насчитывает более 30 тыс. единиц хранения.Сегодня библиотека – это учреждение, воспитывающее у детей и подростков любовь к книге, стремление к знаниям, к систематическому чтению; осуществляет справочно-библиографическое и информационное обслуживание детей и руководителей детского чтения. Библиотека активно ищет и развивает новые формы работы, сохраняя лучшие традиции. Специалисты библиотеки строят свою работу, используя разнообразные формы, организуя встречи с писателями, интересными людьми, проводя тематические встречи, мастер-классы с юными читателями, способствуя развитию личности, самообразованию и чтению лучших книг. Библиотека приглашает всех желающих на авторские мастер-классы, в кружки и студии на платной основе:«Книжная графика»;«Волшебная кисточка»: живопись; «Игра на гитаре»;«Музыкальное развитие»;«Танцевальное вдохновение»;«Английский язык»;«Немецкий язык»;«Карате».",Москва,2015-07-22T16:49:17Z,2023-02-21T07:19:43Z,NA,NA,43200,75600,43200,75600,43200,75600,43200,75600,43200,75600,43200,72000,NA
Библиотека № 248 г. Москвы,"г Москва,г Москва,ул Маршала Катукова,д 19",37.410151,55.807946,"Библиотека открылась в апреле 1947 года на территории села Троицкое-Лыково Кунцевского района Московской области. Она находилась в деревянном доме. Во время пожара строение сгорело. С 1957 года библиотека находилась в помещении Дома культуры села Троицкое-Лыково на ул. Колхозной. В 1960 году территория села вошла в состав Краснопресненского района Москвы, и 9 мая 1961 года библиотека получила наименование массовой библиотеки № 58 Краснопресненского района.В 1969 году, в связи с образованием новых районов, библиотека была переведена в Хорошевский (в 1970–1990 гг. – Ворошиловский) район. В июне 1979 года она стала филиалом ЦБС Ворошиловского (в 1990–1991 гг. – Хорошевский) района Москвы. На территорию жилого массива Строгино библиотека переехала в 1981 году. С 1982 года по сей день находится по адресу: ул. Маршала Катукова, д. 19, корп. 2, где занимает квартиры 75–76. Одним из важнейших направлений деятельности библиотеки является обеспечение пользователей всеми видами информации для поддержания образования и самообразования. Библиотека самостоятельно и совместно с другими организациями реализует образовательные, информационные и иные программы и проекты, проводит культурные акции (встречи, концерты, вечера, лекции, конкурсы и т. д.). Объем фонда составляет 30 281 экз. Посещений – 15 611. Работают шахматный клуб «Шах и мат», краеведческий клуб «Вокруг света без границ», изобразительный клуб «Будь счастлив!».",Москва,2015-07-23T23:31:02Z,2023-02-17T13:28:13Z,NA,NA,43200,79200,43200,79200,43200,79200,43200,79200,43200,79200,43200,72000,NA
Библиотека № 117 (филиал № 1) г. Москва,"г Москва,г Москва,ул Вольская 2-я,д 20",37.920871,55.686127,"История библиотеки начинается с 20-х годов прошлого столетия и связана со строительством Люберецких полей орошения. Библиотека начиналась с избы-читальни в поселке Некрасовка.В небольшом двухэтажном здании, где днём была столовая для рабочих ЛПО, а вечером так называемая «чайная», где можно было попить чайку с вареньем, поиграть в шахматы и почитать свежие газеты. Шло время, чайная становилась тесной. Молодежь нуждалась в просторном помещении. В 1922 году был построен клуб, где одно из помещений было выделено под комнату с книгами.Во время Великой Отечественной войны книги в минуты отдыха читали бойцы мотострелковой военной части. Бывало и так, что бойцы увозили книги с собой на передовую…В 1989 году Люберецкая станция аэрации построила новое двухэтажное типовое здание, где и поныне расположена библиотека. В 2005 году была установлена мемориальная доска первому библиотекарю, энтузиасту просвещения Сидорковой Александре Фёдоровне.Имея богатейшую историю, библиотека по-прежнему остается значимым культурным центром района Некрасовка. Имеет универсальный книжный фонд. Гостями литературно-музыкальной гостиной часто бывают музыканты, писатели, поэты. Организуются выставки, проводятся творческие конкурсы. В 2022 году в Библиотеке №117 прошел капитальный ремонт, обновлена материально-техническая база.Книжный фонд: более 43 524 экз. (включая аудиовизуальные материалы). Структура библиотеки: детский и взрослый абонемент, читальный зал, Wi-Fi, компьютерный класс, гостиная.",Москва,2015-07-23T06:37:26Z,2023-02-21T08:58:13Z,NA,NA,43200,79200,43200,79200,43200,79200,43200,79200,43200,79200,43200,72000,NA
Библиотека № 44 им. В. Г. Короленко (филиал № 2),"г Москва,г Москва,ул Онежская,д 17",37.5173717737198,55.8512444752776,"Библиотека была открыта для читателей в 1968 году. В настоящее время входит в состав библиотеки № 44 им. В. Г. Короленко. Универсальный фонд насчитывает 57 300 единиц хранения.Библиотека обслуживает детское и взрослое население. Основные проекты библиотеки: «Библиотека – родители – дети», направленный на продвижение традиций семейного чтения, и краеведческая программа «Любимый уголок Москвы – родное Головино». Для дошкольников и младшеклассников в библиотеке открыта студия авторской игрушки «Мальвина». На занятиях проходят мастер-классы по лепке и раскрашиваю изделий из глины, рисованию акварелью и многому другому. Для читателей и всех жителей района в библиотеке работает «Клуб любителей кошек» при поддержке Ассоциации породных кошек, где проходят консультации специалистов и регулярные выставки животных.Библиотека ведёт тесное партнёрство с писательницей Народицкой Алиной Давидовной, при поддержке и участии которой организуются литературные встречи. Принадлежит ГБУК г. Москвы «ЦБС САО».",Москва,2015-07-27T02:56:54Z,2023-02-21T09:18:23Z,NA,NA,43200,79200,43200,79200,43200,79200,43200,79200,43200,79200,43200,72000,им. В. Г. Короленко
Библиотека № 101 г. Москва,"г Москва,г Москва,ул Лухмановская,д 17",37.895457,55.722847,"31 марта 2015 года открыла свои двери первая библиотека в микрорайоне Кожухово района Косино-Ухтомский – библиотека семейного чтения открытого доступа для москвичей и гостей города.Библиотека обслуживает более 3 000 читателей, посещаемость – свыше 24 000 человек, книжный фонд – 20 000 единиц хранения.Библиотека № 101 обслуживает читателей всех возрастных категорий от 0+.В структуре библиотеки: детский абонемент 0+, взрослый и юношеский абонемент 14+, конференц-зал на 40 мест.В библиотеке действует свободная зона Wi-Fi, читатели имеют доступ к ресурсам электронно-библиотечной системы «ЛитРес». Библиотека № 101 – учреждение нового типа, в котором традиционные библиотечные формы работы сочетаются с представлением информационных услуг, досуговой и культурно-массовой деятельностью. В библиотеке регулярно проходят массовые мероприятия: литературные вечера, конкурсы, квесты, детские и семейные праздники, встречи с интересными людьми, выставки работ художников, мероприятия в помощь школьной программе в рамках сотрудничества с образовательными учреждениями. Каждую субботу сотрудники библиотеки проводят мастер-классы по различным видам рукоделия для детей и взрослых. С первых дней работы библиотека сотрудничает с Советом ветеранов и центром социального обслуживания населения района Косино-Ухтомский. Один раз в месяц сотрудники библиотеки проводят мероприятия в КЦСО, литературные среды в библиотеке, мероприятия в рамках цикла «Семья в библиотеке».В течение рабочего дня в детском абонементе и конференц-зале юные читатели могут не только читать книги и журналы, но и играть в настольные игры и мягкими игрушками, рисовать, смотреть фильмы.В библиотеке создан музей «Изба-читальня Бабы-яги». В рамках проекта мероприятий «Изба-читальня Бабы-яги» для детей (0+) по пятницам в 17:00 и в другие дни по предварительной записи проходят чтения вслух «Баба-яга приглашает по пятницам». Детей встречает «настоящая» Баба-яга, знакомит с библиотекой и музеем, со сказочными героями, предметами из русского фольклора и русских народных сказок.В библиотеке на платной основе работает театральная студия «Английский и французский язык детям», 4+, 300 руб./час.Библиотека № 101 приспособлена для обслуживания читателей с ограниченными возможностями, входная группа библиотеки оборудована пандусом и поручнями.",Москва,2015-07-26T22:35:09Z,2023-03-01T11:24:29Z,NA,NA,43200,79200,43200,79200,43200,79200,43200,79200,43200,79200,43200,72000,NA
Детская библиотека № 22 им. Л. А. Кассиля (филиал № 1),"г Москва,г Москва,ш Ленинградское,д 114",37.463969,55.866116,"Библиотека создана в 1962 году на базе библиотеки села Аксиньино, которая начала свою работу в Ленинградском районе г. Москвы в 1960 году с книжным фондом 6 000 экземпляров. Сейчас является библиотекой для взрослого населения в составе Детской библиотеки № 22 им. Льва Кассиля.Библиотека располагает универсальным фондом с элементами специализации: литература на иностранных языках, который насчитывает 59 420 единиц хранения.В библиотеке проводится большое количество культурных мероприятий. Все значимые памятные даты и праздники отмечаются бесплатными праздничными концертами, поэтическими вечерами. Библиотека активно сотрудничает с хором «Левобережье» и Детской музыкальной школой им. К. В. Молчанова. Одним из главных проектов библиотеки является клуб любителей кино «Дневной сеанс». В ходе клубных встреч проходят беседы об истории создания фильмов, творческом пути актеров, об экранизируемых книгах и их авторах, живой обмен мнениями.Принадлежит ГБУК г. Москвы «ЦБС САО».",Москва,2015-07-27T03:20:57Z,2023-02-21T09:15:29Z,NA,NA,43200,79200,43200,79200,43200,79200,43200,79200,43200,79200,43200,72000,им. Л. А. Кассиля
Библиотека № 11 имени Д. В. Давыдова г. Москвы,"г Москва,г Москва,проезд Мукомольный,д 9",37.522701,55.75362,"Библиотека основана в 1948 году. Имя Дениса Давыдова присвоено в 2012 году в связи с празднованием 200-летия победы России в Отечественной войне 1812 года. Свое нынешнее наименование получила в соответствии с приказом Департамента культуры города Москвы от 17 сентября 2014 года «Об упорядочении наименований государственных публичных библиотек Департамента культуры города Москвы» в связи начавшимся процессом оптимизации сети библиотек, подведомственных Департаменту культуры города Москвы.В библиотеке сформирован фонд литературы по истории, представлены артефакты двух Отечественный войн. Учреждение сотрудничает с Русским географическим обществом, историко-патриотическим объединением «Багратион», Обществом потомков участников Бородинской битвы.Фонд – более 22 000 единиц хранения. Библиотеку за прошлый год посетили 22 313 читателей.",Москва,2015-07-26T21:54:04Z,2023-02-20T13:58:54Z,43200,79200,43200,79200,43200,79320,43200,79200,43200,79200,43200,79200,NA,NA,им. Д. В. Давыдова
Библиотека № 28 г. Москвы,"г Москва,г Москва,ул Алабяна,д 12",37.501735,55.799957,"Библиотека начала свою работу в 1962 году как передвижной фонд Отдела культуры Ленинградского райисполкома г. Москвы и размещалась по адресу: ул. Лизы Чайкиной, д. 5/23. В 1974 году переехала на ул. Алабяна д. 12, к. 4, где находится в настоящее время. С 1996 года работает как массовая библиотека для взрослых и юношества.Универсальный фонд в настоящее время включает 46 200 единиц хранения.Библиотека реализует собственные программы для детей «Все начинается с детства», «Психология &amp; педагогика», сотрудничает со школами и детскими садами. Проводится цикл мероприятий «Путешествие в историю».Принадлежит ГБУК г. Москвы «ОКЦ САО».",Москва,2015-07-27T05:51:18Z,2023-02-21T08:50:02Z,NA,NA,39600,70200,39600,70200,39600,70200,39600,70200,39600,70200,NA,NA,NA
Детская библиотека № 242 г. Москвы,"г Москва,г Москва,наб Карамышевская,д 2/1",37.485484,55.770016,"Детская библиотека № 242 имеет богатую и увлекательную историю, которую ведет от детской библиотеки № 81 Ленинградского района. Точной даты и места основания библиотеки установить не удалось. Предположительно, она была основана в 1948 году. Библиотека комплектовала свои фонды, отдавая приоритет естественнонаучной литературе. Сейчас она знакомит с новинками детской литературы, организовывает досуг юных читателей, проводит увлекательные беседы, творческие встречи, праздничные программы, ведет большую эколого-краеведческую работу. Круглый год в библиотеке работают кружки и студии, проходят выставки детского творчества, фотовыставки, городские акции, пешеходные прогулки в рамках краеведческого проекта #ПрочтиРайон и летние читальни на улице около библиотеки. Размер фонда – 47 265 экз. Пользователей за 2022 год – 1 080 человек. Посещений – 11 767.",Москва,2015-07-23T23:11:03Z,2023-02-17T14:19:49Z,NA,NA,43200,75600,43200,75600,43200,75600,43200,75600,43200,75600,43200,72000,NA
Библиотека № 6 имени В. В. Вересаева,"г Москва,г Москва,пер Ружейный,д 4",37.580894,55.743553,"Библиотека открылась в 1932 году и носит имя В. В. Вересаева, русского писателя, литературоведа, известного пушкиниста, переводчика и врача. Мемориальная экспозиция, посвященная В. В. Вересаеву, – одна из особенностей библиотеки. Вещи личного обихода, старинные фотографии и картины создают уголок начала ХХ века. Наиболее ценную часть многоотраслевого библиотечного фонда составляют прижизненные издания автора. Сегодня библиотека ведет многоплановую деятельность, содействуя популяризации имени В. В. Вересаева. Вересаевское общество занимается изучением и исследованием жизни и творчества писателя. Объединение «Медицинская этика» поддерживает просветительские традиции писателей-врачей.Галерея «Живая жизнь» предлагает выставочные проекты художников. Арт-салон «Мастер» предоставляет поэтам и музыкантам возможность поделиться своим творчеством. В литературном клубе «Серебряный рассвет» проводятся мероприятия, посвященные жизни и творчеству выдающихся писателей и поэтов.Фонд читальни включает более 21 000 единиц хранения. Библиотеку посещает более 20 тысяч читателей.",Москва,2015-07-26T21:33:54Z,2023-02-21T06:51:32Z,NA,NA,36000,79200,36000,79200,36000,79200,36000,79200,36000,79200,36000,72000,им. В. В. Вересаева
