name,address,longitude,latitude,description,subordination,creation_time,modification_time,mo_from,mo_to,tu_from,tu_to,we_from,we_to,th_from,th_to,fr_from,fr_to,sa_from,sa_to,su_from,su_to,dedication
Библиотека № 92 – Культурный центр К. И. Чуковского,"г Москва,г Москва,ул Металлургов,д 5",37.778973,55.757136,"Библиотека открыта в 1950 году. В 2011 году за многолетнюю плодотворную работу в области пропаганды чтения библиотека получает имя К.И.Чуковского и становится Детской библиотекой – Культурным центром К. И. Чуковского.Возрастной ценз литературы – 6+. Объем книжного фонда – 39 757 экз.Отделы библиотеки:Читальный зал на 35 мест. Обслуживает читателей от 6 лет, является местом проведения уроков внеклассного чтения, литературно-музыкальных вечеров, семинаров, конференций и т.д.; содержит большой объем справочной литературы. Абонемент для дошкольников и учащихся 1-4 классов. Обслуживает читателей от 6 лет, обеспечивает выдачу детских книг (в том числе аудиокниг) и периодических изданий по различным отраслям знаний.Абонемент для учащихся 5-9 классов. Обслуживает читателей от 12 лет, обеспечивает выдачу общественно-политической, естественно-научной, художественной литературы, а также печатных изданий по искусствоведению, технике, медицине, спорту, литературоведению и языкознанию и аудиокниг.В библиотеке предусмотрены составляющие «безбарьерного пространства» для лиц с ОВЗ: поручни, кресла для людей с нарушением опорно-двигательного аппарата. Санитарная комната оборудована специальными поручнями.В библиотеке обеспечен свободный доступ к сети Интернет, бесплатному Wi-Fi, электронным каталогам ЦБС, картотекам статей.",Москва,2015-07-22T20:39:23Z,2023-02-28T14:02:16Z,NA,NA,43200,75600,43200,75600,43200,75600,43200,75600,43200,75600,43200,72000,NA
Библиотека № 80 г. Москвы,"г Москва,г Москва,ул Челябинская,д 24",37.837327,55.779241,"Библиотека была создана в 1896 году Первым Московским обществом трезвости и находилась на Благуше. В 1906 году она стала земской библиотекой-читальней. Это была одна из первых бесплатных публичных библиотек Москвы. В 1918 году на Благуше был организован рабочий клуб по адресу ул. Ткацкая, 25, в который переехала и библиотека. В 1978 году с богатейшим фондом литературы библиотека переведена в микрорайон Южное Измайлово. С 1993 году она стала библиотекой семейного чтения, так как здесь было открыто детское отделение.В настоящее время фонд библиотеки № 80 насчитывает 57 327 изданий, она обслуживает 6754 читателей в год. Библиотека работает по тематическим программам. Она доступна для всех категорий пользователей, оснащена техникой для слабовидящих, имеет выход в Интернет.Отделы библиотеки: абонемент и читальный зал для взрослых, юношеская кафедра, детское отделение с абонементом и читальным залом.Возрастной ценз литературы: во взрослом отделении 14+, в детском отделении 0+, 6+, 12+, 18+ (литература для руководителей детского чтения).Клубно-досуговые формирования:– клуб общения ветеранов «Субботние посиделки», занятия 1 раз в месяц, 18+, бесплатно.– клуб «Патриот», занятия 1 раз в месяц, 6+, бесплатно.– клуб семейного общения «Светлячок», занятия 2 раза в месяц, 0+, бесплатно.– кружок «Детская академия», 2 раза в неделю, платный по договору коворкинга, 5+.В библиотеке имеется Wi-Fi, оборудование для слабовидящих (два увеличителя Topaz и светильник бестеневой с линзой).Библиотека доступна для людей с нарушениями опорно-двигательного аппарата.Возможна печать документов.Проезд общественным транспортом: от станции метро «Первомайская» автобусы № 97 и 664, от станции метро «Новогиреево» автобус № 776, маршрутное такси № 505, от станции метро «Шоссе Энтузиастов» автобус № 702 до остановки «Библиотека».Санитарный день: второй четверг месяца.",Москва,2015-07-22T19:53:24Z,2023-02-27T12:48:41Z,NA,NA,43200,79200,43200,79200,43200,79200,43200,79200,43200,79200,43200,75600,NA
Библиотека № 1 имени А. С. Грибоедова г. Москвы,"г Москва,г Москва,ул Переяславская Б.,д 15",37.640156,55.78645,"Библиотека открыта еще в 1910 году по решению Московской городской думы. Свое нынешнее наименование получила в соответствии с приказом Департамента культуры города Москвы от 17 сентября 2014 года «Об упорядочении наименований государственных публичных библиотек Департамента культуры города Москвы» и в связи с начавшимся процессом оптимизации сети библиотек, подведомственных Департаменту культуры города Москвы. В 1916 году было организовано «Общество друзей Грибоедовской библиотеки». Сегодня здесь собрана вся информация об А. С. Грибоедове, проводятся экскурсии по мемориальной экспозиции. Известные режиссеры документального кино представляют свои фильмы. В большом зале проходят концерты, встречи с известными писателями и поэтами. Посетители мастер-классов учатся рисовать картины и изготавливать сувениры. А любители изобразительного искусства регулярно знакомятся с выставками работ московских художников.Ежегодный «Грибоедовский бал» гостеприимно открывает двери для всех друзей библиотеки.Фонд включает около 70 000 экземпляров.",Москва,2015-07-26T21:21:07Z,2023-02-20T11:12:53Z,NA,NA,43200,72000,43200,72000,43200,72000,43200,72000,43200,72000,43200,72000,им. А. С. Грибоедова
Библиотека № 75 имени А. С. Серафимовича (детский сектор),"г Москва,г Москва,ш Открытое,д 24",37.756838,55.827788,"Почти 50 лет назад библиотека имени А. С. Серафимовича получила прописку в районе Метрогородок. В библиотеке было решено создать мемориальную экспозицию, посвященную жизни и творчеству наставника молодого донского писателя М. А. Шолохова – А. С. Серафимовича. Начался поиск и сбор документов, фотографий. Работа в московских архивах продолжается.В библиотеке работают абонемент и читальный зал. Книжный фонд – более 46 тысяч экземпляров. Это книги, рассчитанные на читателей от 14 лет. Но это не значит, что все читатели – это старшеклассники и взрослые. В библиотеке есть литература и для самых маленьких. Специально для малышей создан детский уголок. Пока родители выбирают литературу для себя, ребенок может поиграть, посмотреть интересные книжки, порисовать. Также есть компьютерный класс с доступом к интернету.Особенно много внимания библиотека уделяет трудным подросткам. Специально для них организуются встречи с интересными людьми, писателями, журналистами, литераторами, проходит цикл литературно-художественных чтений.Много внимания библиотека уделяет выставочной работе. Небольшой выставочный зал демонстрирует картины, посвященные общественным деятелям, благотворительным миссиям, людям прошлого.В библиотеке работают как бесплатные, так и платные кружки для детей и взрослых: кружок по рукоделию «Веселые петельки», кружки изобразительного искусства, изучения иностранных языков и актерского мастерства.",Москва,2015-07-22T16:24:51Z,2023-02-28T09:26:46Z,NA,NA,43200,75600,43200,75600,43200,75600,43200,75600,43200,75600,43200,72000,им. А. С. Серафимовича
Библиотека № 180 имени Н. Ф. Федорова г. Москвы,"г Москва,г Москва,ул Профсоюзная,д 92",37.528433,55.649114,"Библиотека № 180, основанная в 1969 году, – отличное место для маленьких и больших читателей. В настоящее время в библиотеку записано более 5 тысяч человек. Здесь можно найти и мировую классику, и самые востребованные новинки художественной и нон-фикшен-литературы. Особый фонд составляют труды русских философов-космистов, исследовательские работы, им посвященные. Всего в фонде около 40 тысяч книг. Событийный план библиотеки ориентирован на самые разные по возрастам и интересам аудитории. В библиотеке приходят встречи с известными писателями, педагогами, художниками, кинематографистами. Творческие способности детей развивают кружки и студии: изобразительная, иностранных языков, хореографическая, фольклорная, литературно-историческая.Работающий при библиотеке Музей-библиотека Н. Ф. Федорова при участии известных российских филологов, историков, философов, культурологов, искусствоведов проводит популярные лектории и философские семинары, посвященные отечественной культуре и истории первой трети XX века. Библиотека № 180 – это не стены и не просто книги. Это сообщество людей, объединенных общими интересами и целями.",Москва,2015-05-13T10:40:20Z,2023-02-20T14:17:40Z,NA,NA,43200,79200,43200,79200,43200,79200,43200,79200,43200,79200,43200,72000,им. Н. Ф. Федорова
Библиотека № 23 имени М. Горького (филиал № 2),"г Москва,г Москва,ул Астрадамская,д 4",37.565946,55.81173,"Библиотека обслуживает детское и юношеское население района. Универсальный фонд включает более 25 000 экземпляров, среди которых ноты, музыкальная литература; детская литература, литература для юношества. В библиотеке оборудована детская игровая зона. Библиотека является центром для интеллектуального и творческого развития детей и подростков. Активно сотрудничает с образовательными и культурными учреждениями района, оперативно откликаясь в своей работе на актуальные запросы местного сообщества. Культурно-досуговые мероприятия для детей и юношества включают в себя как развлекательные, так и познавательные компоненты. Проводится большое количество квестов, конкурсов, исторических турниров, встреч, экскурсий и т. д. Реализуются мемориальные программы «Горький – детям» и «Горький – юношеству». Работают кружки и студии для детей от 4 лет.Библиотека принадлежит ГБУК г. Москвы «ОКЦ САО».",Москва,2015-07-27T01:48:01Z,2023-02-21T09:01:05Z,NA,NA,39600,70200,39600,70200,39600,70200,39600,70200,39600,70200,NA,NA,им. М. Горького
Библиотека № 74 (фонд детской литературы № 2),"г Москва,г Москва,ул Краснобогатырская,д 75",37.707305,55.808801,"В 1916 году на основе частных дарений был сформирован фонд для чтения детей и подростков в библиотеке-читальне «Богородское». В 1924 году состав детской литературы позволил открыть самостоятельную детскую библиотеку. В 1973 году библиотека получает новое помещение, которое позволяет ей осуществлять работу с детьми разных возрастов в отдельных залах с отраслевым хорошо организованным фондом и справочно-библиографическим аппаратом.В настоящее время фонд библиотеки составляет 76 тыс. единиц хранения. Это активно действующий фонд, способный удовлетворить запросы детей, подростков, родителей, педагогов.Хорошо организованные книжные выставки, массовые мероприятия привлекают внимание жителей района, тематика их всегда интересна, раскрывает богатый книжный фонд, учит любить книгу и ориентироваться в огромном книжном мире.В библиотеке проводятся массовые мероприятия по различной тематике, дни открытых дверей, встреча с писателями, интересными людьми. Работа библиотеке отмечена положительными отзывами наших читателей и педагогов.К услугам читателей:Младшее отделение – литература для читателей дошкольного и младшего школьного возраста (1-11 лет);Старшее отделение – литература для читателей среднего и старшего школьного возраста (12-17 лет);Читальный зал на 25 посадочных мест;Концертный зал на 100 посадочных мест.Более 10 лет работает в библиотеке клуб «Зеркало», где с ребятами занимаются воспитанием культуры чтения, поведения в быту и в обществе. Отзывы педагогов и родителей о его деятельности свидетельствуют о том, что в клубной работе достигаются положительные результаты. Занятия проходят 2 раза в месяц (1-й и 4-й четверг) с 13:30 по 14:30 (60 мин). Возрастной ценз – 6+, клуб работает на бесплатной основе.Клуб Vita, занятия в котором способствуют здоровому образу жизни, борьбе с негативными явлениями в обществе. Занятия проходят 1 раза в месяц (2-я среда месяца) с 13:30 до 14:30 (60 мин). Возрастной ценз – 12+, клуб работает на бесплатной основе. Клуб «Мы – москвичи!». Клуб всестороннего и гармоничного развития личности способствует возрождению духовности у юного поколения, дает дополнительные знания по истории, краеведению, культуре, литературе, экологии нашей планеты. Занятия проходят 2 раза в месяц (2-й и 4-й вторник) с 16:00 до 18:00 (по 120 мин). Возрастной ценз – 12+, клуб работает на бесплатной основе.Клуб «Калейдоскоп кино» – знакомит учащихся с жанровым и стилистическим многообразием современного кинематографа, с фильмами, ставшими классикой мирового киноискусства, с деятельностью и творчеством выдающихся режиссеров, на занятиях ведется обсуждения экранизации любимых произведений книг. Занятия походят 1 раз в неделю, (среда) с 16:00 до 17:00 (60 мин). Возрастной ценз – 6+, клуб работает на бесплатной основе.Школа раннего развития «Малыш» способствует развитию: речи, мелкой моторики, координации, даются основы математических представлений и многое, многое другое. Занятия проводятся 2 раза в неделю – (вторник, четверг) с 11:00 до 19:00 (по 60 мин). Возрастной ценз – 0+, клуб работает на платной основе.Изокружок «Учимся рисовать» – развивает эстетические вкусы, учит рисовать, готовит к поступлению в художественные школы, занятия проводятся 1 раз в неделю (среда) с 16:00 до 19:00 (по 60 мин). Возрастной ценз – 0+, занятия проводятся на платной основе.",Москва,2015-07-22T16:15:47Z,2023-02-28T09:52:20Z,NA,NA,43200,75600,43200,75600,43200,75600,43200,75600,43200,75600,43200,72000,NA
Библиотека № 2 имени Ю. В. Трифонова г. Москвы,"г Москва,г Москва,ул Тверская-Ямская 4-Я,д 26/8",37.593857,55.774558,"Библиотека № 2 имени Ю. В. Трифонова основана в 1939 году как библиотека № 18 парткабинета Советского райкома КПСС. Имя писателя Ю. В. Трифонова библиотека получила в 2006 году. Другом и постоянным гостем библиотеки является вдова Юрия Валентиновича – Ольга Романовна Трифонова. В зале библиотеки находятся подлинные вещи писателя: письменный стол, печатная машинка, портфель, знаменитые очки.Фонд библиотеки рассчитан на все читательские аудитории. В нем можно найти и книги по истории, естествознанию, науке, и классику художественной литературы, и новые книги лауреатов российских и международных премий. Для юных читателей открыта детская игровая комната, в которой проходят творческие мастерские и мастер-классы.В рамках проекта «Литературная гостиная» посетителей библиотеки ждут литературные вечера, встречи с режиссерами, актерами, писателями, музыкантами. В теплое время года для всех желающих сотрудники библиотеки проводят экскурсию «Прогулки по Тверской».Фонд библиотеки включает более 22 000 единиц хранения.",Москва,2015-07-26T21:12:20Z,2023-02-20T09:49:35Z,NA,NA,43200,72000,43200,72000,43200,72000,43200,72000,43200,72000,NA,NA,им. Ю. В. Трифонова
