author,title,total_words,n_hapax_legomenon
"Flint, Homer Eon",The Lord of Death and the Queen of Life,48940,2765
"Wollheim, Donald A.",The Secret of the Ninth Planet,48653,2770
"Griffith, George Chetwynd",A Honeymoon in Space,66074,2631
"Farmer, Philip José",The Green Odyssey,60717,3217
"Stratemeyer, Edward","Young Captain Jack; Or, The Son of a Soldier",51795,1742
"Hall, Austin",The Blind Spot,110446,3640
"Stoddard, William O.",Dab Kinzer: A Story of a Growing Boy,70946,2438
"Franklin, Jay",The Rat Race,83576,3827
"Brown, Charles Brockden","Wieland; Or, The Transformation: An American Tale",83980,2887
"Buchan, John",Greenmantle,101433,4386
"Gallun, Raymond Z.",People Minus X,54581,3390
"Sutphen, Van Tassel",The Doomsman,80401,4112
"Grisewood, R. Norman (Robert Norman)",Zarlah the Martian,35760,1788
"Ballantyne, R. M. (Robert Michael)",Martin Rattler,62860,3308
"Falkner, John Meade",Moonfleet,84900,2983
"Sutton, Jeff",First on the Moon,58769,2973
"Sacher-Masoch, Leopold, Ritter von",Venus in Furs,43958,2658
"Benoît, Pierre",Atlantida,66635,4083
"Farley, Ralph Milne",The Radio Planet,76164,3165
"Meredith, George",Vittoria — Volume 1,24821,2641
"McCann, Edson",Preferred Risk,61062,3236
"Bangs, John Kendrick","R. Holmes & Co.
Being the Remarkable Adventures of Raffles Holmes, Esq., Detective and Amateur Cracksman by Birth",34327,2504
"Sutton, Lee",Venus Boy,41316,1520
"Ebers, Georg",The Bride of the Nile — Volume 08,23252,2032
"Higgins, Charlotte M.","The Angel Children
or, Stories from Cloud-Land",29400,1706
"Flint, Homer Eon",The Blind Spot,110446,3640
"Freeman, R. Austin (Richard Austin)",The Mystery of 31 New Inn,80889,3061
"Perrin, Alice",Star of India,79805,3987
"Balzac, Honoré de",The Chouans,112413,3778
"Shelley, Mary Wollstonecraft","Frankenstein; Or, The Modern Prometheus",73828,2950
"Leighton, Robert",Olaf the Glorious: A Story of the Viking Age,90735,2543
"Lane, Mary E. Bradley","Mizora: A Prophecy
A MSS. Found Among the Private Papers of the Princess Vera Zarovitch",55129,3141
"Starzl, Roman Frederick",The Martian Cabal,29236,2776
"Evans, E. Everett (Edward Everett)",Man of Many Minds,69574,3102
"Lynch, Lawrence L.",The Last Stroke: A Detective Story,72352,3045
"Piper, H. Beam",A Slave is a Slave,21907,2022
"Gilmore, Anthony",The Affair of the Brains,25199,2206
"Burnett, Frances Hodgson","His Grace of Osmonde
Being the Portions of That Nobleman's Life Omitted in the Relation of His Lady's Story Presented to the World of Fashion under the Title of A Lady of Quality",109530,3579
"Christie, Agatha",Poirot Investigates,55281,2939
"Crake, A. D. (Augustine David)","Alfgar the Dane or the Second Chronicle of Aescendune
A Tale of the Days of Edmund Ironside",77218,3375
"Stoker, Bram",The Lair of the White Worm,57066,2739
"Marryat, Frederick",The Children of the New Forest,117118,2405
"Hale, Edward Everett","The Man Without a Country, and Other Tales",79356,4140
"Altsheler, Joseph A. (Joseph Alexander)",The Forest of Swords: A Story of Paris and the Marne,85293,2544
"Astor, John Jacob",A Journey in Other Worlds: A Romance of the Future,92356,3813
"Leroux, Gaston",The Phantom of the Opera,88100,3003
"Hornung, E. W. (Ernest William)",The Shadow of the Rope,80254,3468
"Pratt, Fletcher",The Onslaught from Rigel,69310,3077
"Blanchard, Amy Ella",Little Maid Marian,39043,1865
"Milne, A. A. (Alan Alexander)",The Red House Mystery,63553,1782
"De Quincey, Thomas",Confessions of an English Opium-Eater,39200,3308
"Dickens, Charles",The Mystery of Edwin Drood,99645,4568
"Bradley, Marion Zimmer",The Colors of Space,47911,2804
"Alger, Horatio, Jr.","Young Captain Jack; Or, The Son of a Soldier",51795,1742
"Barr, Robert",The Face and the Mask,73501,3238
"Nield, Jonathan",A Guide to the Best Historical Novels and Tales,21524,2189
"Gale, Floyd C.",Someone to Watch Over Me,22401,1727
"Bryce, Charles, Mrs.",The Ashiel mystery: A Detective Story,89184,3323
"Crane, Stephen",The Red Badge of Courage: An Episode of the American Civil War,47631,3123
"Smith, E. E. (Edward Elmer)",The Skylark of Space,87912,3353
