author,title,total_words,n_hapax_legomenon
"Grisewood, R. Norman (Robert Norman)",Zarlah the Martian,35760,1788
"Lane, Mary E. Bradley","Mizora: A Prophecy
A MSS. Found Among the Private Papers of the Princess Vera Zarovitch",55129,3141
"Sutton, Lee",Venus Boy,41316,1520
"Rockwell, Carey",Sabotage in Space,47718,2207
"Aguilar, Grace",The Days of Bruce: A Story from Scottish History. Vol. 1,148475,3517
"Brazil, Angela",A Popular Schoolgirl,66794,3741
"Train, Arthur Cheney",The Man Who Rocked the Earth,44159,3423
"Hastings, Milo",City of Endless Night,87446,3779
"MacDonald, George","St. George and St. Michael, Volume 1",48956,3111
"Farley, Ralph Milne",The Radio Planet,76164,3165
"Ellis, Edward Sylvester",The Boy Patriot,26226,2081
"Farmer, Philip José",The Green Odyssey,60717,3217
"Bryce, Charles, Mrs.",The Ashiel mystery: A Detective Story,89184,3323
"Wallace, Edgar",The Clue of the Twisted Candle,60334,3202
"Lewis, Myron R.",The Dueling Machine,22437,2133
"Douglass, Ellsworth","Pharaoh's Broker
Being the Very Remarkable Experiences in Another World of Isidor Werner",72787,3162
"Hudson, W. H. (William Henry)",A Crystal Age,61049,3031
"Chesterton, G. K. (Gilbert Keith)",The Wisdom of Father Brown,73696,3857
"Ebers, Georg",The Bride of the Nile — Volume 08,23252,2032
"Franklin, Jay",The Rat Race,83576,3827
"Arnold, Edwin Lester",Gulliver of Mars,72310,3810
"Bradley, Marion Zimmer",The Colors of Space,47911,2804
"Yonge, Charlotte M. (Charlotte Mary)","Stray Pearls: Memoirs of Margaret De Ribaumont, Viscountess of Bellaise",133497,4010
"Hogg, James",The Private Memoirs and Confessions of a Justified Sinner,85235,3737
"Stevenson, Burton Egbert",The Holladay Case: A Tale,46952,2192
"Delany, Samuel R.",The Jewels of Aptor,54107,2428
"Smith, E. E. (Edward Elmer)",The Skylark of Space,87912,3353
"Bangs, John Kendrick","R. Holmes & Co.
Being the Remarkable Adventures of Raffles Holmes, Esq., Detective and Amateur Cracksman by Birth",34327,2504
"Stoddard, William O.",Dab Kinzer: A Story of a Growing Boy,70946,2438
"Putnam, Ruth","The Count of the Saxon Shore; or The Villa in Vectis.
A Tale of the Departure of the Romans from Britain",72788,3199
"Bassett, Sara Ware",Ted and the Telephone,50488,2882
"Morrison, Arthur","The Red Triangle: Being Some Further Chronicles of Martin Hewitt, Investigator",63497,2370
"Crake, A. D. (Augustine David)","Alfgar the Dane or the Second Chronicle of Aescendune
A Tale of the Days of Edmund Ironside",77218,3375
"Wollheim, Donald A.",The Secret of the Ninth Planet,48653,2770
"Peacock, Thomas Love",Nightmare Abbey,28533,2910
"Prince, Mary","The History of Mary Prince, a West Indian Slave",27855,1943
"Donovan, Francis",The Short Life,21208,2287
"Green, Anna Katharine",The Mystery of the Hasty Arrow,96476,3111
"Bennett, John",Master Skylark: A Story of Shakspere's Time,76603,3367
"Dunn, Jonathan",The Revolutions of Time,47048,2763
"Ashwell, Pauline",The Lost Kafoozalum,23299,1943
"Lang, Andrew","A Monk of Fife
Being the Chronicle Written by Norman Leslie of Pitcullo, Concerning Marvellous Deeds That Befell in the Realm of France, in the Years of Our Redemption, MCCCCXXIX-XXXI",108361,3325
"Ballantyne, R. M. (Robert Michael)",Martin Rattler,62860,3308
"Bramah, Ernest",Max Carrados,71011,3723
"Nowlan, Philip Francis",The Airlords of Han,31195,2398
"Alger, Horatio, Jr.","Young Captain Jack; Or, The Son of a Soldier",51795,1742
"Christie, Agatha",Poirot Investigates,55281,2939
"Alger, Horatio, Jr.","Bound to Rise; Or, Up the Ladder",49665,1986
"Pratt, Fletcher",The Onslaught from Rigel,69310,3077
"Lucian, of Samosata",Trips to the Moon,37357,2950
"Hall, Austin",The Blind Spot,110446,3640
"Janifer, Laurence M.",Slave Planet,40725,1920
"Milne, A. A. (Alan Alexander)",The Red House Mystery,63553,1782
"De Quincey, Thomas",Confessions of an English Opium-Eater,39200,3308
"Hyne, Charles John Cutcliffe Wright",The Lost Continent,99630,3790
"Harrison, Harry",Planet of the Damned,57569,3055
"Wilde, Oscar",The Picture of Dorian Gray,81366,3309
"Crane, Stephen",The Red Badge of Courage: An Episode of the American Civil War,47631,3123
"Goodwin, Harold L. (Harold Leland)",Rip Foster in Ride the Gray Planet,53285,1983
"Wylie, Philip",Gladiator,77444,4413
