id,text,date,cause
216367,"Поздравляю тебя Вера с днем рождения и желаю тебе счастья, долгих лет жизни и успех[а] в работе. Пожелаю хорошо [п]ровести данный день.",1964-07-26,birthday
249176,Дорогая Галичка поздравляю тебя с Днем Рожденья[^Рождения]! 2/VIII - 1950 года,1950-08-02,birthday
238595,"Дорогая Катя! Сердечно поздравляю тебя с днем рождения! Желаю здоровья на долгие годы, счастья в жизни и радостных дней в твоей жизни. Не знаю почему ты не пишешь все ли хорошо со здоровьем? Не знаю, когда пишу тебе передо мной [?вешает] картина нашей молодежи лучших дней в жизни, а теперь я угасаю с каждым днем и так делается грустно на душе. Сейчас мое единственное счастье. {Привет от Гали и Марковых} {Сейчас мое единственное счастье что я не так одинока. Целую тебя. Шура} {21/VII 55}",1955-07-21,birthday
250113,"Милая Леночка! Поздравляю тебя с днем рождения. Желаю тебе счастья, здоровья и долгих лет жизни. 5.XII.64 [подпись]",1964-12-05,birthday
227675,"Дорогой братик! Сердечно поздравляю тебя с днем рождения! Желаю тебе крепкого здоровья и всего самого, самого наилучшего целую Света 1/XI 79",1979-11-01,birthday
220335,"Дорогая Зиночка. Поздравляем с днем рождения желаем счастья и здоровья твои друзья Клава, Тамара, Рая, Нина и Татьяна Сергеевна 29/X 53г.",1953-10-29,birthday
238951,"Дорогую Валюшку с днем рожденья поздравляю счастья, радости желаю славной, милой и здоровой чтобы ты всегда была Валя. 12/IV 1966 г[од]",1966-04-12,birthday
249883,"Дорогая дочь Аля! Поздравляю тебя с днем рождения! 15 декабря 1957г. Желаю счастья, здоровья и лучшей жизни! целую крепко! мама.",1957-12-15,birthday
213658,"Дорогую и уважаемую Лидию Васильевну поздравляю с днем рождения! От всей души желаем хорошего здоровья, большого счастья, необьятной любви и до глубокой старости дожить, незная старости. С уважением к[^ко] Всей семье Бабенко, семья Князевых и семья Бадыкиных. 26 января 1968 г",1968-01-26,birthday
227058,"Дорогую Танечку поздравляю с Днем рождения! Желаю много-много счастья в жизни, успехов в учебе, отличного здоровья. Светлана",1962-10-26,birthday
101379,"<u>Милая Томка! </u> Эта открытка немного опоздала (почти на месяц), только сегодня она поступила к нам. Но если она опоздала к Новому году, то разреши через эту открытку поздравить тебя с днем рождения. Пока она дойдет до Тюмени и будет день твоего рождения. Крепко целует тебя <u>Ленька</u>. 28.1.42 г.",1942-01-28,birthday
239755,"Дорогая мамочка! Поздравляю тебя с днем рождения. от всей души желаю тебе побольше жизни, поменьше болезни, и быть веселой и не сердиться. {Твоя дочка Света.} {1966 года 5 мая.}",1966-05-05,birthday
223379,Володя! Поздравляем тебя с днем рождения. Желаем тебе отличных успехов в учебе и хорошего настроения. 8 февраля 1962 года Кондаковы,1962-02-08,birthday
233026,"5.XI.72
Поздравляю всех с праздником а братца с днем рождения. Желаю всего самого наилучшего. Я уже снова в Корсакове. Пишите по старому адресу.
Д.",1972-11-05,birthday
237427,Поздравляю с днем Рождения дорогую девочку и желаю ей повыше роста и здоровья во второй половине девятнадцатого столетия. Целую крепко в обе щечки. Орлова  {28.12.50..},1950-12-28,birthday
1573,"{г. Одесса, 13 августа 1910 г.} Поздравляю и крепко целую дорогую Наташеньку. Лизочка. Дорогая Наташа, целую и поздраляю тебя с днем рождения. Поцелуй маму, папу, Митю, Раю, Леночку, Колю и Мишеньку. Кланяюсь т. Тане. Будь здорова. Еще раз целую, твой дядя [нрзб]",1910-08-13,birthday
245526,"25 окт[ября] 53 г[года]. Кострома Крепко, крепко целую мою дорогую доченьку, поздравляю с днем рождения, здоровья и исполнения желаний. Ты, Танюшка, к своим двадцати-пяти годам во многом преуспела, а, самое главное, что теперь ты ждешь детеныша. Береги его и берегись сама. Мы очень хотим, чтобы и он получил крымские витамины в виде яблочек из Доброго. [?Ксенечка] послала тебе и конфетки. Напиши как все дошло. Целую дорогих Марию Максимовну и [?Жениха] и еще раз желаю всем Вам здоровья и [?в] счастья. Твоя мама. [?Мишуку] тоже, конечно, привет!",1953-10-25,birthday
236057,"11.03.88. Игорь! Поздравляю тебя с днем рождения Желаю тебе крепкого здоровья, расти на радость маме и папе. Саша Тернивчук",1988-03-11,birthday
221495,"Дорогая Ниночка! Поздравляю тебя с днем рождения. Желаю счастья в жизни и успехов в учебе. "" Пусть жизнь твоя, как в мае день, душевных бурь, тревог не знает, цветет как ландышь[^ландыш] и сирень."" <подпись> {""Наше дество, словно поезд, только разница одна. Поезд может воротится, наше детсво никогда."" Сестре Ниночке от сестры Люды. 13/IV - 62г.}",1962-04-13,birthday
246834,"Дорогая подруга Лариса! Поздравляю тебя с днем рождения. Желаю хороших успехов в учебе, отличного здоровья, счастья в личной жизни, и хорошо отдохнуть, и хорошо провести этот день. 29.9.64 г. Одноклассница Ц. Алла. {И пусть твоя жизнь, также [^так же] будет цветущей, как эти очаровательные розочки.}",1964-09-29,birthday
100156,Дорогая мамочка! Поздравляю тебя с днем рождения! Желаю тебе здоровья и радости. Лена. 4.06.89,1989-06-04,birthday
229376,"Стан[ция] Болодная. 4го мая 1905го г. Дорогая моя Ликуся! Поздравляю тебя с днем рождения! Уже тебе, цыпленок мой дорогой девять месяцев. Какая ты верно большая и интересная. Эх как папка тебя хочет видеть. Я тебе, цыпленок, уже много картинок послал, а ты не пишешь получаешь ли? Ты напиши. Напиши также часто ли тебя мамка шлепает по сахарнице, лучше всего записывай, а когда я приеду, то мы вдвоем отшлепаем мамку. Целую тебя крепко крепко [^крепко-крепко], а ты мамку. Твой папка.",1905-05-04,birthday
104456,14/VII 1901. Сердечно поздравляю с днем рождения. [?Навсегда] <Андреев>,1901-07-14,birthday
247018,"Дорогие друзья! Поздравляем всех вас с праздником и Димушку с днем рождения! Желаем всего самого доброго! Моля ви се, не проклинайте нас, потому что мы думаем и помним о вас все время. Будьте здоровы, дорогие наши. Целуем всех. Все Степаненко. 6.X.75. София.",1975-10-06,birthday
247064,"Сердечно поздравляю Тамусеньку с днем рождения и от души желаю здоровья и полного успеха и счастья в жизни. 
Дедушка раннего флота <подпись>
12/11-54г.",1954-11-12,birthday
103042,"Дорогой Сашенька поздравляю тебя с днем рождения, желаю здоровья счастья. Целую тетя Юля 12.08.1956",1956-08-12,birthday
211957,"Поздравляем Вас, дорогая Лизочка, с днем рождения. Передавайте мой привет Елене Максимовне и всем другим домашним. Ви[нрзб] [?Бекман]",1905-12-12,birthday
104397,Поздравляю с днем рождения Маркус {Керчь 15/IX 1913.},1913-09-15,birthday
228077,"<u>Дорогая, Светочка!</u> Поздравляем тебя с днем рождения! Так много счастья, как листа на клёне, Хотим тебе сегодня пожелать И клён твой будет пусть всегда зелёным, Ты листопад попробуй задержать! - Будь здорова и счастлива! Всего всего тебе доброго! Целуем. мама папа 22/IV -87 г.",1987-04-22,birthday
205784,Дорогой папочка! Поздравляем Тебя с днем рождения и желаем Тебе всего хорошего. Желают Эрика и мама. 16 июля 1915 г.,1915-07-16,birthday
227878,"Наташенька! Поздравляем тебя с днем рождения! Желаем счастья, здоровья, успехов в труде, учебе, весеннего настроения! Дедушка Яша, т. Галя {23/II 79 г.}",1979-02-23,birthday
227885,"Дорогая доченька, Галочка, поздравляем тебя с днем рождения и 63-ей годовщиной Великого Октября! Желаем сердечно всех благ в жизни, крепкого-крепкого здоровья, огромного личного и семейного счастья, успеха и радости в работе и жизни!!! Не унывай, моя хорошая, все плохое уже позади, будь всегда весела, радостна, и над нами засияет прекрасная звезда будущего счастья! Кр[епко]-кр[епко] целуем тебя - твои Мама, Папа.",1980-11-07,birthday
228088,"Дорогой папулька! Поздравляем тебя с днем рождения. Желаем счастья, крепкого здоровья, неиссекающего оптимизма и юмора, исполнения всех твоих желаний {Целуем крепко крепко - Гагуся и Сережа 16. VII -87г. }",1987-07-16,birthday
205683,"Дорогая Катя. Благодарю тебя за внимание, я так всегда разстроена [^расстроена] и вместе с тем рада когда вижу от всех Вас внимание и желание хоть чем нибудь [^чем-нибудь], порадовать мою тяжелую, во всех отношениях жизнь. крепко поцелуй Володя, поздравь его с днем рождения, мысленно в этот день буду с Вами от души желаю ему здоровья и душевного покоя, котрый нам всем, этот покой необходим. Будь здорова целую крепко, крепко Любящая тебя Лиза {24/II 37г. Саратов.}",1937-02-24,birthday
208601,"Дорогая Таня! Поздравляем тебя с днем рождения. Желаем успехов в учёбе и в труде. Бабушка Поля, бабушка Аня, Маруся, Вова, Шурик и Люба.",1963-03-03,birthday
213590,"Поздравляю тебя с Днем рождения! Желаю счастья, здоровья, успехов в учебе. Весело жить и с мальчиками хорошими дружить. С уважением подруга и одноклассница Виктория Щербинина.",1994-01-14,birthday
221810,"Мама! Поздравляю тебя с днем рождения. Желаю всего наилучшего. Хорошего здоровья, хороших успехов в работе.  23/XII 1968 г. 44 года.",1968-12-23,birthday
103287,"Дорогой Иосиф! Целуем и поздравляем тебя с Днем Рождения. Желаем доброго здоровья, хороших успехов в работе, в охоте и рыбалке. Киру Николаевну поздравляем с дорогим новорожденным. Желаем большого счастья в вашей жизни. Ваши Морозовы Милочка и Павел.",1961-12-03,birthday
225548,Люда! Поздравляем тебя с днем рождения! Желаем крепкого здоровья и всего самого светлого и радостного в жизни! Гаёвы 18/I-80 г[од],1980-01-18,birthday
218660,"Здравствуйте наши дорогие Шура, Слава, Володя! По приезду[^приезде] написала Вам письмо - ответа не получила. Послала конверт с фотографиями - ответа не получила. (желательно их выслать обратно) Поздравления с праздником не получила. Поздравления с днем рождения не получила. Может быть что-то случилось? Может быть что-то надо? Володя, напиши хотя бы открытку как дела со стройкой? Как себя чувствует Слава? Помню он все жаловался, но устал... У нас сейчас тоже напряжение У Леночки сессия У меня годовой отчет У Саши в школе сумасшествия а все выдержать надо того и вам желаю Саша. Лена. Света. {29/11 78 Терентьева.}",1978-11-29,birthday
205880,Дорогой Юра! Поздравляем тебя с днем рождения! Шлем самые наилучшие пожелания! Как вы живете? Здоровы? У нас все хорошо. Ждем от вас ответа. Всем привет от нас! Целуем. Мама и папа,1964-02-02,birthday
224363,"Варшава, 19го октября, 1913 года. Дорогая, милая, Катя! Сердечно поздравляю Вас с днем рожденья и желаю всего-всего наилучшего. Ваша любящая вас Рита.",1913-10-19,birthday
208385,"Дорогой Валерий Александрович! Сердечно поздравляю Вас с днём рождения! Желаю вам здоровья, здоровья и здоровья! Наталью Евгеньевну и всех родных поздравляю с именинами! С глубочайшим уважением и любовью, Андрей Матыков. 16 авг 1988",1988-08-18,birthday
228126,{1957 г. 5 августа. рождение.} Дорогая моя Внуческа! Оленька поздравляю тебя С днем рождения! желаю тебе здоровья счастья успеха в учебе и во всех делах твоих будь счастлива! обнимаю и целую мою любимую. Бабушка Муся.,1957-08-05,birthday
217315,"{4.2.64 г} С Днем Рождения Дорогая моя Ниночка! Желаем тебе доброго здоровья! самого, наилучшего в твоей жизни! Исполнение[^Исполнения] всех твоих желаний! Целуем все ждем всегда. Березайцы",1964-02-04,birthday
237992,"<u>Дорогая Света!</u> Поздравленья с днем рождения шлем тебе от всей души. А конкретно вот такое: Не знай горести и печали, Дни только радостные мчались и будь счастливой, в будущем и сейчас. И во все свои лета Как теперь будь молода! Без слов, но от души. [Васи…] Юдин [Ники…] 12.08.80 г.",1980-01-12,birthday
239659,"Дорогая Гелия Андреевна! Поздравляем Вас с Днем Рождения! Желаем всего самого хорошего, здоровья и успехов. 29.02.80 г. Валя <подпись>",1980-02-29,birthday
221523,"Дорогой Шурик! Поздравляем тебя с днем рождения! Желаем тебе крепкого здоровья, успехов в труде, отличного настроения, исполнения всех желаний и всего самого наилучшего. {Целуем. Тормозовы. <u>19 октября 1977 года</u>}",1977-10-19,birthday
222511,<u>Володя</u>!!! Поздравляю тебя с днем рождения. Желаю всего самого наилучшего. С глубоким увожением [^уважением]. <u>Барис</u> [^Борис] <u>Мамадиев</u> {25.09.1970г.},1970-09-25,birthday
208378,"Дорогой Валерий Александрович! Поздравляю Вас и Альбину (не знаю отчества) Шульгину с днём рождения! Желаю Вам радости творчества и торжества духовности в нашем мире. Будьте здоровы, жизнерадостны, работоспособны. Низкий поклон Вам за Вашу работу! С уважением, любовью и признательностью - Матыков Андрей. {3 авг. 1986г.}",1986-08-03,birthday
225454,"Дорогой дедуся, поздравляю Вас с днём рождения. Желаю Вам счастья, здоровья и долгих лет жизни. Целует внучка Алла. {21/XI-51 года}",1951-11-21,birthday
251374,"Дорогая Тамара! Поздравляем тебя с днем рождения! Желаем здоровья, счастья, успехов!!! Приглашаем всех Глазковых: Анну Ивановну, Алексея Михайловича, Генадия, Толика и тебя на встречу 1го мая к нам в Стерлитамак. Целуем <подпись>. 13/Ⅳ-62г.",1962-04-13,birthday
213442,"Наташенька! Поздравляю тебя с днем рождения! Желаю тебе здоровья, счастья, расти большой - большой и веселой. Учиться на 5 и быть жизнерадостной на радость всем. Соня. 22/II-63г.",1963-02-22,birthday
210169,Дорогая Ира поздравляю с днем рождения и желаю всего хорошего и главное доброго здоровья Варя.,1967-04-15,birthday
215731,{Кума поздравляет с днем рождения и желает счастливого пути}. Его Высокоблагородию Павлу Васильевичу Константинову,1901-09-28,birthday
228567,Дорогой Эрнст! Сердечно поздравляю с днем рождения и от всей души желаю всего наилучшего. Твоя Annie. Благодарю за открытку.,1909-07-09,birthday
239271,"Дорогая наша Мамочка! Поздравляем тебя с днем рождения! От всей души желаем здоровья покрепче, всегда хорошего настроения. Пусть сбудуться[^сбудутся] все твои желания! 27.XI.79г. Твои дети Светлана и Капиталина.",1979-11-27,birthday
245202,"Дорогая Люда, поздравляю тебя с днем рождения и днем твоего ангела и всех вас со светлым Христовым воскресеньем, желаю всего хорошего, а главное здоровья. 3/IV-77 А. Кукина",1977-04-03,birthday
246960,Дорогой Вадик! Поздравляю Вас с днем рождения «‎Каждому хочется счастья найти:- Любить и быть любимым...»‎ Желаю Вам найти это счастье! С Уважением Анна Николаевна. Магадан. 19.XII.1966 г.,1966-12-19,birthday
228216,"<u>Дорогая Мария!</u> Поздравляем тебя с Днем Рождения! Желаем тебе хорошего здоровья, спокойной и счастливой жизни, благополучия, успехов во всех твоих трудах и больших достижений к твоему очередному Юбилею - дню Совершеннолетия! Обнимаем целуем. Соня, Вася, Шура",1979-07-17,birthday
222007,"<u>Дорогой Саша!</u> Поздравляем тебя с днем Рождения! Энергии, силы, добра и удачи, В делах вдохновения, везенья, пусть будут по силам любые задачи, пусть радость несет День Рожденья [^Рождения]! Здоровья, достатка, счастливых событий, поддержки родных и знакомых, пусть ждет еще множество новых открытий и ждут с нетерпением дома! С любовью Лариса и Вера. 05.05.2013 г. С Рождеством Христовым.",2013-05-05,birthday
216738,"Дорогую Нину Дмитриевну от души поздравляю с Днем рождения!  Радости Вам светлой, улыбок искренних, здоровья крепкого, молодости вечной! Обнимаю и целую, Ваша Галка",1981-02-04,birthday
236360,"Радий Николаевич! Поздравляем Вас, всей семьей, с днём рождения! Желаем Вам, самое главное — здоровья! Желаем в жизни только весенних дней, радостных и солнечных. Ну, а так как жизнь не бывает без огорчений, то пусть они будут кратковременными, как редкие облака на чистом весеннем небе и таким же проходящими, как весенние грозы. Все мы Попелыгины P.S. Это — дед Радий и внуки 3.12.76 г.",1976-12-03,birthday
