id,text,date,cause
208385,"Дорогой Валерий Александрович! Сердечно поздравляю Вас с днём рождения! Желаю вам здоровья, здоровья и здоровья! Наталью Евгеньевну и всех родных поздравляю с именинами! С глубочайшим уважением и любовью, Андрей Матыков. 16 авг 1988",1988-08-18,birthday
213674,"Дорогая Надя! Поздравляем тебя с днем рождения! Желаем тебе крепкого здоровья, успехов в работе и хорошего настроения. Привет дедушке и бабушке. Целуем Набоковы.",1974-09-05,birthday
214610,"Ира! Поздравляю тебя с Днем рождения. Желаю тебе всего самого лучшего, отличного здоровья и учебы. Саша 09.01.1971 года. {г. Бобруйск}",1971-01-09,birthday
239273,"Дорогая Света!! Поздравляю тебя с днем рождения. Желаю тебе счастья, здоровья, успехов в учебе и всего самого наилучшего. Твоя подруга Марина. 11.8.73.",1973-08-11,birthday
237509,"Дорогая Лиза! Поздравляю с днем рождения, желаю здоровья, счастья, успеха в работе и жизни. Целую, Шура. 4/XII 63 г. {Очень жаль, что не смогу поздравить лично. Сегодня легла на обследование + [?печени] в больницу. Подарок за мной}",1963-12-04,birthday
221495,"Дорогая Ниночка! Поздравляю тебя с днем рождения. Желаю счастья в жизни и успехов в учебе. "" Пусть жизнь твоя, как в мае день, душевных бурь, тревог не знает, цветет как ландышь[^ландыш] и сирень."" <подпись> {""Наше дество, словно поезд, только разница одна. Поезд может воротится, наше детсво никогда."" Сестре Ниночке от сестры Люды. 13/IV - 62г.}",1962-04-13,birthday
239610,"С днем рождения родная, Наталья Леонидовна! Желаем Вам дорогой наш, необыкновенный человек, всего самого-самого наилучшего в жизни. Будьте бодры и здоровы. Крепко целуем Ваши Миша, Фрида. P.S. Как давно Вы нам не писали о себе. Забыли? Конечно нет! Очень жду весточки. {2/V-58г.}",1958-05-02,birthday
227611,"Дорогая Танюша! Поздравляю тебя с днем рождения. Желаю счастья, здоровья, долгих лет жизни, хорошо провести этот праздничный день, а также самых наилучших успехов в труде, в учебе и, разумеется в любви. И еще больше всего желаю исполнения задуманной мечты, хорошо оттдохнуть за оставшиеся дни до школы и самоотверженно встретить новый учебный год. 20/VIII-65 г. Крепко целую твоя подруга Оля [По...]",1965-08-20,birthday
222007,"<u>Дорогой Саша!</u> Поздравляем тебя с днем Рождения! Энергии, силы, добра и удачи, В делах вдохновения, везенья, пусть будут по силам любые задачи, пусть радость несет День Рожденья [^Рождения]! Здоровья, достатка, счастливых событий, поддержки родных и знакомых, пусть ждет еще множество новых открытий и ждут с нетерпением дома! С любовью Лариса и Вера. 05.05.2013 г. С Рождеством Христовым.",2013-05-05,birthday
237870,"Догорая Люда! Поздравляем тебя с днем рождения, желаем крепкого здоровья, успехов в труде, отличного настроения, любви и согласия в семье.",1983-08-20,birthday
244075,Поздравляю дорогого Юрочку с днём рождения с пожеланиями всего лучшего <подпись>,1913-10-13,birthday
247018,"Дорогие друзья! Поздравляем всех вас с праздником и Димушку с днем рождения! Желаем всего самого доброго! Моля ви се, не проклинайте нас, потому что мы думаем и помним о вас все время. Будьте здоровы, дорогие наши. Целуем всех. Все Степаненко. 6.X.75. София.",1975-10-06,birthday
239271,"Дорогая наша Мамочка! Поздравляем тебя с днем рождения! От всей души желаем здоровья покрепче, всегда хорошего настроения. Пусть сбудуться[^сбудутся] все твои желания! 27.XI.79г. Твои дети Светлана и Капиталина.",1979-11-27,birthday
103621,"20/I.1906 г.
Сердечно поздравляем с днем рождения. [? Юревич] с семейством",1906-01-20,birthday
212736,"Алиса! Поздравляю с днем рождения. Желаю быть такой красивой, как поутру цветок в росе, желаю быть такой счастливой, чтобы завидовали все. В учебе - дальнейшего успеха, Улыбок - в будни, в праздник - смеха, И чтобы всем чертям назло Тебе везде всегда везло. Пусть вечно будут в твоей власти Здоровье, молодость и счастье! ЯНКА",2001-01-28,birthday
245513,"Дорогой наш, родной внучек Витинька! Поздравляем тебя с днем рождения желаем тебе крепкого здоровья, учиться хорошо, быть послушным хорошим мальчиком. Крепенько, крепенько тебя целуем! Дедушка Шура, бабуся Юля 20/VI 64",1964-06-20,birthday
247207,Дорогая Надя поздравляю тебя с днем рождения. Желаю успехов в работе и твоей личной жизни. От Наташи 30/IX/ 60г.,1960-09-30,birthday
251105,"Поздравляем нашу милую Анечку с Днем рождения, желаем крепкого здоровья. Целуем: Коля (""большой"") и Коля (""маленький"") Аделя Оля Люся Ира Рая {22/IX 1961г.}",1961-09-22,birthday
227716,"Дорогая тётя Нелля! Поздравляю вас с днём рождения. Желаю много, много счастья, русского веселья, сибирского здоровья, кавказского долголетия Люда {11/VII.73 г.}",1973-07-11,birthday
215945,"Валерочка милый! Поздравляем тебя с днем рождения, желаю счастья, здоровья, успехов в учебе. Слушайся маму и папу и всегда жалей обоих Крепко целую Галина Саша и д[ядя] Коля 13/XI 61г.",1961-11-13,birthday
229376,"Стан[ция] Болодная. 4го мая 1905го г. Дорогая моя Ликуся! Поздравляю тебя с днем рождения! Уже тебе, цыпленок мой дорогой девять месяцев. Какая ты верно большая и интересная. Эх как папка тебя хочет видеть. Я тебе, цыпленок, уже много картинок послал, а ты не пишешь получаешь ли? Ты напиши. Напиши также часто ли тебя мамка шлепает по сахарнице, лучше всего записывай, а когда я приеду, то мы вдвоем отшлепаем мамку. Целую тебя крепко крепко [^крепко-крепко], а ты мамку. Твой папка.",1905-05-04,birthday
227675,"Дорогой братик! Сердечно поздравляю тебя с днем рождения! Желаю тебе крепкого здоровья и всего самого, самого наилучшего целую Света 1/XI 79",1979-11-01,birthday
219888,"Дорогой Толя! Поздравляю с днем Рождения, желаю хорошего здоровья, счастья и успехов в труде целую Юлия",1963-04-24,birthday
103871,"т[етя] Зина! Вся семья Хохряковых поздравляет вас с Днем рождения и желает бодрости, здоровья, долгих лет жизни и вечной любви своих детей и внуков! Крепко целуем, Зина, Боря, Ванюша. 24/X - 83 г[од]",1983-10-24,birthday
228859,"Дорогая Галачка [^Галочка]!!! Поздравляем тебя с Днем рождения, желаем быть здоровой счастливой, горестей не знать и с успехом окончить учебный год. Крепко, крепко обнимаем целуем Любящие Коля, Аня, Женя 11/X 1958 г[од]",1958-10-11,birthday
2817,"11.04.2019 
Степа, поздравляем тебя с днем рождения приветом из Японии! Мы приехали сюда на свадьбу нашего японского друга и заодно посетили Осаку, Киото, Хиросиму, Токио... очень много впечатлений {и уже хочется приехать снова. Юля и Крис.}",2019-04-11,birthday
220670,"Дорогая Зиночка! Поздравляю тебя с днем рождения. Желаю тебе всего наилучшего в жизни. Целую Твой брат Лева. Сообщи, как поступила ты с переводами. Удивляюсь, почему от тебя нет писем. Целую еще раз Лева привет маме Казань 5/I 15",1915-01-15,birthday
207191,Вера поздравляю тебя с днем рождения и желаю тебе долгих лет жизни и хорошо провести свою жизнь твои сестры Аля и Шура  9/II 1953 года. Невзроровы,1953-02-09,birthday
238951,"Дорогую Валюшку с днем рожденья поздравляю счастья, радости желаю славной, милой и здоровой чтобы ты всегда была Валя. 12/IV 1966 г[од]",1966-04-12,birthday
238702,"Адусик! Поздравляю тебя с Днем Рождения, Новым годом, желаю тебе много, много [^ много-много] здоровья, счастья в жизни и наилучших успехов в учебе. Желаю быть и в дальнейшем такой же хорошей. Анатолий. 29.XII-1961 г.",1961-12-29,birthday
227477,"Виктор Алексеевич! Поздравляю тебя с Днем рождения! Счастья тебе, удачи, успехов на нелегком трудовом поприще, оставться всегда молодым, весёлым хорошим человеком, каким я тебя знаю все эти годы!!!  Галина Алексеенко 30.09.1995 г. Псков <подпись>",1995-09-30,birthday
223556,"23/ix - 1909 г. пущено письмо божье
Поздравляю с днём рождения и желаю тебе всего наилучшего в твоей спитальнической жизни. Твой старый слуга до гроба поручик А. А. Чичиков-Аменов.",1909-09-23,birthday
237427,Поздравляю с днем Рождения дорогую девочку и желаю ей повыше роста и здоровья во второй половине девятнадцатого столетия. Целую крепко в обе щечки. Орлова  {28.12.50..},1950-12-28,birthday
247064,"Сердечно поздравляю Тамусеньку с днем рождения и от души желаю здоровья и полного успеха и счастья в жизни. 
Дедушка раннего флота <подпись>
12/11-54г.",1954-11-12,birthday
210169,Дорогая Ира поздравляю с днем рождения и желаю всего хорошего и главное доброго здоровья Варя.,1967-04-15,birthday
246856,"Глубокоуважаемая Галина Николаевна! Поздравляем Вас с днем рождения, желаем больших успехов [^в] Вашем почтенном труде воспитания молодого поколения, благотворной научно-иссследовательной работе и крепкого здоровья, счастья и всего наилучшего Вам и вашей семье. Ваши монгольские друзья Г. Санжмяков Ц Башсууль  г. Ростов на Дону [^Ростов-на-Дону]. 26/IV.1978 г[од]",1978-04-26,birthday
250113,"Милая Леночка! Поздравляю тебя с днем рождения. Желаю тебе счастья, здоровья и долгих лет жизни. 5.XII.64 [подпись]",1964-12-05,birthday
229249,Дорогая Таня! Поздравляю тебя с Днем Рождения! Желаю быть здоровой и очень умной. твоя любимая бабушка. Агафья Степановна. 23/I.59г.,1959-01-23,birthday
243940,"{10-Х-33 г.} Родного и дорого внука Мусика, поздравляем с днем рождения и одиннадцатилетним возрастом, желаем тебе счастья, здоровья, и чтобы ты хорошо учился, и чтобы ты вырос и жил, на радость и утешение своим папочке и мамочке. Маму и папу поздравляем с рождением твоим. Прости что немного опоздали, но я замоталас [^замоталась] c солн. [нрзб] {Крепко любящая тебя твоя бабуня и дедушка}",1933-10-10,birthday
219718,"Дорогая наша Танечка! В твой торжественный и славный юбилей-десятилетие, от всей души поздавляем тебя с днем Рождения! Желаем тебе здоровья, успехов в скрипичной игре и отличных успехов в школьных занятиях! Живи, расти и развивайся на радость всей нашей Родины! Крепко тебя обнимаем и целуем. Любящие тебя: папа, мама, дедушка. <Таганрог. 12.05.1961 год.>",1961-05-12,birthday
206792,"Поздравляю милую Таточку с днем рождения маму и папу с новорожденной. Желаю вырости [^вырасти] через год до 25 лет, чтобы получить 25 рубл[ей]. Любящ[ий] Дядя Витя 16.05.1910 г.",1910-05-16,birthday
236057,"11.03.88. Игорь! Поздравляю тебя с днем рождения Желаю тебе крепкого здоровья, расти на радость маме и папе. Саша Тернивчук",1988-03-11,birthday
213590,"Поздравляю тебя с Днем рождения! Желаю счастья, здоровья, успехов в учебе. Весело жить и с мальчиками хорошими дружить. С уважением подруга и одноклассница Виктория Щербинина.",1994-01-14,birthday
206581,"Дорогой Иосиф! Целуем и поздравляем тебя с днем рождения. желаем тебе доброго здоровья, хороших успехов в работе, в охоте и рыбалке. Киру Николаевну поздравляем с дорогим новорожденным. Желаем больше счастья в Ваших жизнях. Ваши Морозовы Милочка и Павел 3/12 1961 г.",1961-12-19,birthday
239699,"Дорогая Геля! Поздравляем тебя с днем рождения, желаем здоровья и успехов в работе. Привет Юре и Тане. Целуем Зензиновы г[ород] Киев. 25. II. 68 г[од].",1968-02-25,birthday
228126,{1957 г. 5 августа. рождение.} Дорогая моя Внуческа! Оленька поздравляю тебя С днем рождения! желаю тебе здоровья счастья успеха в учебе и во всех делах твоих будь счастлива! обнимаю и целую мою любимую. Бабушка Муся.,1957-08-05,birthday
239753,"Поздравляя с днем рождения Мы хотим, чтоб в воскресенье и в субботу иногда Все заботы и  тревоги оставляли Вас всегда Чтобы каждый день рабочий Приносил Вам радость... Впрочем, Так бывает иногда. И это важно не всегда. Вот день рожденья - это да! сотрудники ухтл 28.02.1975",1975-02-28,birthday
100827,Милую мамочку Поздравляю с днем рождения Желаю всего всего наилучшего <подпись> 1914 г. 23 августа,1914-08-23,birthday
236047,"Дорогие мои! Сегодня по[!лу]чила ваше апрельское письмо с фотографиями, о чем спешу сообщить (открытки обычно идут быстрее). Мне очень стыдно, но я так еще и не отправила письмо с фотографиями, которые обещала еще в июне - просто закрутилась. Передайте от меня поздравление Лиде с днем рождения и самые лучшиие пожелания ей, Илюше и тете Люде. Постарайтесь не сердиться на меня - обязательно напишу в ближайшее время. 4 июля звонил Семен Абрам. об этом подробнее в письме. Целую вас всех. Привет от моих. <подпись>",1985-07-09,birthday
250046,"Сегодня с новым счастьем хочу поздравить Вас. Живите долго, долго, долго!! И наслаждайтесь каждый час. Лида 15.07.1949 г[од] Кишенев. {С днем рождения Алочка!}",1947-07-15,birthday
216963,"Дорогая Валентина Максимовна! Поздравляю Вас с днем рождения! Желаем Вам крепкого здоровья, бодрого весеннего настроения и побольше солнечных дней в Вашей жизни. Будьте терпеливы и счастливы. <подпись>",1994-05-13,birthday
103105,Дорогая Сашулинка! Поздравляю с днем рождения Целую Дедушка 16/VI-58 <подпись>,1958-06-16,birthday
251411,Леночка! Поздравляем тебя с днём рождения! Желаем тебе здоровья. Слушайся и помогай маме счастья тебе в жизни.,1989-03-20,birthday
222171,"{29/I-61г.} Дорогая Людочка! Поздравляем тебя с днем рождения. Желаем тебе здоровья, успехов в учебе, только отличных. Инна и Лена Брук.",1961-01-29,birthday
103287,"Дорогой Иосиф! Целуем и поздравляем тебя с Днем Рождения. Желаем доброго здоровья, хороших успехов в работе, в охоте и рыбалке. Киру Николаевну поздравляем с дорогим новорожденным. Желаем большого счастья в вашей жизни. Ваши Морозовы Милочка и Павел.",1961-12-03,birthday
228266,"Дорогая Мария В. Поздравляю тебя с днем Рождения. Желаю тебе крепкого здоровья, счастья, благополучия и просто земного счастья. Долгих лет жизни тебе. Целую. Лида.",1985-04-01,birthday
104359,"15/VIII-33 г. Дорогой Ванюша! Поздравляем тебя с днем рождения и шлем всякие самые лучшие пожелания. Как недавно был тот день, когда нам сказали, что Ваня родился, — а уже 15 лет прошло! Всех твоих —с новорожденным. Целуем крепко. Дядя [?Гриня] Тетя Ага Сима Люда.",1933-08-15,birthday
100317,Милая Витя! Поздравляем тебя с днем рождения и желаем тебе всего наилучшего. Рая и Фира. {III/V 1923},1923-05-03,birthday
101379,"<u>Милая Томка! </u> Эта открытка немного опоздала (почти на месяц), только сегодня она поступила к нам. Но если она опоздала к Новому году, то разреши через эту открытку поздравить тебя с днем рождения. Пока она дойдет до Тюмени и будет день твоего рождения. Крепко целует тебя <u>Ленька</u>. 28.1.42 г.",1942-01-28,birthday
213658,"Дорогую и уважаемую Лидию Васильевну поздравляю с днем рождения! От всей души желаем хорошего здоровья, большого счастья, необьятной любви и до глубокой старости дожить, незная старости. С уважением к[^ко] Всей семье Бабенко, семья Князевых и семья Бадыкиных. 26 января 1968 г",1968-01-26,birthday
216962,"Дорогая Галочка! Поздравляю с Днём рождения! Чтобы быть тебе счастливой, и здоровой, и красивой, быть - орлицей, дома - ласковою[^ласковой] львицей, быть веселой,молодой, вообщем [^в общем], будь сама собой!! Л.Н.",1977-03-07,birthday
221777,"Валечка! Поздравляю тебя с днем рождения. Желаю тебе счастья, здоровья и отличных успехов в учёбе и труде. Будь всегда, как эта Розочка. {29.08.59г. Р. Павел. Краснодарский край МК-85}",1959-08-29,birthday
211460,"Дорогая Лелечка, поздравляю тебя с днем рождения и желаю в грядущем 20-ом году твоей жизни много счастья. <Варя> {Пусть жизнь твоя течет струею, Пусть будет вся во множестве цветов, и пусть всегда живет с тобою, Надежда, вера и любовь.}",1946-10-13,birthday
227952,"Дорогая Мария В.! Поздравляю тебя с днем Рождения. Желаю тебе здоровья, и благополучия на долгие годы. Все остальное прийдет[^придет] само. Целую, Лида.",1984-04-01,birthday
