id,text,date,cause
228158,"Добрый час супруги Яшина и Алымов! Поздравляю Павла Федоровича с днем рождения. Желаем ему доброго здоровья и счастья! Павел Федорович, приходите к нам на кружок, мы нуждаемся в ""солидных причинах"". Очень большой привет от Павла Ивановича. В.Н. Курбатова. {6/III 1966 г.}",1966-03-06,birthday
246229,"{24/IX 1917 года} Дорогая Зиночка, Поздравляю тебя с днем Рождения, пусть этот день послужит началом твоей новой жизни и мой тебе совет: ""Шути любя, но не люби шутя!"" Домашние тебя поздравляют а крестница крепко, крепко целует. Любящ[ая] тебя Женя.",1917-09-24,birthday
227970,"Дорогая Машенька, сердечно поздравляем тебя с Днем рождения, от души желаем здоровья, бодрости, долголетия, счастья и радости. ""Сколько прожито лет Их не надо считать, В этот день праздничный день мы хотим пожелать: не болеть, не стареть, не грустить, не скучать, и еще много лет по дороге шагать."" 17/VII-93. Колено. Обнимаем тебя - Ты - Я и Тих[он] Дм[итриевич]",1993-07-17,birthday
217673,"Дорогая Нина Дмитриевна! Поздравляю Вас с днем рождения! Желаю Вам долгих лет счастливой жизни, отличного здоровья, успехов в труде, мирного неба и всех земных благ. Целую. Вера Николаевна. 1 февраля 1983 г.",1983-02-01,birthday
239276,"Дорогая мамочка! Поздравляем тебя с днем рождения! Желаем здоровья и всегда хорошего настроения. Юра, Света. 27.XI.85 г.",1985-11-27,birthday
237509,"Дорогая Лиза! Поздравляю с днем рождения, желаю здоровья, счастья, успеха в работе и жизни. Целую, Шура. 4/XII 63 г. {Очень жаль, что не смогу поздравить лично. Сегодня легла на обследование + [?печени] в больницу. Подарок за мной}",1963-12-04,birthday
233194,"Дорогая подрушка [^подружка] Валя Поздравляю тебя с днем рожденья Желаю тебе 11 лет. счатье [^счастье], хорошой [^хорошей] учебе  {твоя Лена подруга Курданова и от Таи Плтуховой 12/XII 64г[од]}",1964-12-12,birthday
250023,"Дорогая моя Аля! Поздравляю с днем рождения Желаю счастья, здоровья На долгие годы твоя мама 15/12-62",1962-12-15,birthday
250195,Ниночка! Поздравляю с днем рождения и желаю успехов в жизни и учебе и еще хорошо слушаться маму! 17/XI - 58 г[ода] Толя К.,1958-11-17,birthday
223049,"Аленушку поздравляем  с Днем рождения! Это твоя первая юбилейная дата - праздник. А после него пора учить азбуку. Расти умненькой, послушной дочкой. Целуем тебя тетя Таня, дядя Валя и Женя 21/I-83г.",1983-01-21,birthday
238340,"Здравствуйте дорогие Саша и Маруся! Поздравляем вас с праздником Октября, а дорогую сестричку Марусю поздравляем с днем рождения желаем от всей души здоровья, счастья, долгих лет жизни, чистого неба, мягкого хлеба, прозрачной воды и ни капли беды. Дорогие наши мы живем все также, а жизнь такая же, как и везде. Таня живет у нас учится на IIом курсе в художественному училище. Аня с Николаем на пенсии не работают. Пишите, как вы живете, большой вам привет ото всех родных. Целуем мы все родные. Катя 2/xi-91",1991-11-02,birthday
224983,Поздравляю с днем рождения и желаю милой новорожденной всяческих успехов. Всех целую любящий Н. [Ленорин] 09.XI.[1]907,1907-11-09,birthday
220087,"Дорогой сыночек, Витенька, сердечно поздравляю тебя с днем рождения и желаю счастливых и радостных лет, хороших и веселых друзей, счастливых детских забав, в днях сладостных. Твой папа. {С 3х летием поздравляю.} {2/X 45 г.}",1945-10-02,birthday
227718,"Дорогая моя доченька Нели. Поздравляю тебя с днём Рождения . Желаю теб[е] счасте [^счастья] здоровя [^здоровья] хороших успехов в твоей жизни долгих лет жизни . Писть [^пусть] тебе светит радостное солнышко , пусть отходят от тебя грустние [^грустные] минуты . От твоей мамы Головановой М.Г.",1973-07-12,birthday
227477,"Виктор Алексеевич! Поздравляю тебя с Днем рождения! Счастья тебе, удачи, успехов на нелегком трудовом поприще, оставться всегда молодым, весёлым хорошим человеком, каким я тебя знаю все эти годы!!!  Галина Алексеенко 30.09.1995 г. Псков <подпись>",1995-09-30,birthday
228274,"Дорогая бабушка! Поздравляю тебя с Днем рождения. Желаю счастья, здоровья и долгих лет жизни. Твой внук Андрей.",1981-05-24,birthday
222239,"Дорогой Серёжа! Поздравляю тебя с днем рождения! Желаю тебе счастья, отличного здоровья, успехов в труде и учебе, веселого настроения. Сереже от мамы Веры. 23/XI - 86 год",1986-11-23,birthday
217356,"Дорогая Валечка! Поздравляем тебя с днём рождения. Желаем тебе здоровья, успеха в работе и счастья. Папу и маму поздравляем с новорожденной. Крепко вас целуем. Любящие вас сестры Садиковы",1963-05-15,birthday
228295,"{19 декабря 1993 г[ода]} Дорогие мои детки! Ромочка, Тасечка, Славичка, добрый день или вечер! Поздравляем Вас 1994г. Крепкого здоровья, счастья, долгих лет жизни. И Ромочку и Славичку с днём рождения, пусть Вас охраняет Ангел Ваш. желаю счастья и благополучия. Шлите привет и сожаление по поводу смерти отца и тебя Слава очень жаль! Утрата неисправима. По себе сужу. Царство небесное всем и Вам крепкого здоровья. Вообщем собирайтесь. Таичка[^Таечка] побольше каши или [?полуфабрикаты] что не успеешь. Цел[ую] об. мама. <подпись> Света",1993-12-19,birthday
244846,"гор. Челябинск. 2 января 1916г. без [нрзб] 2ч [?ночи] Здравствуй Дорогая Нина! Поздравляю тебя с днем рождения шлю сердечный привет и наилучшие пожелания Маму и Юлю поздравляю с рожденной. Ну как ты Ниночка поживаеш[^поживаешь] весело ли провела праздник и встретила Новый год. как погостила у стаса удивились ли Вы с Мамой появлением украшенной у Вас елки. Третьего дня я получил от тебя и Юли поздравительные письма. за что чувствительно тронут. я вот сейчас пью чай прежде еще ходил искать сахару т к в нашей лавочке нет и нашол [^нашел] в 5 роте дали! а ходите ли кататся [^кататься] [?хочешь] сал. на каток. Ну и пока, до свидания передай привет Маме и Юле. Будь здорова Люб[ящий] тебя Ваня",1916-01-02,birthday
207396,"Поздравляю с днем рождения и именин и желаю моей [?Ленки] всего, всего наилучшего <подпись>",1900-05-26,birthday
227611,"Дорогая Танюша! Поздравляю тебя с днем рождения. Желаю счастья, здоровья, долгих лет жизни, хорошо провести этот праздничный день, а также самых наилучших успехов в труде, в учебе и, разумеется в любви. И еще больше всего желаю исполнения задуманной мечты, хорошо оттдохнуть за оставшиеся дни до школы и самоотверженно встретить новый учебный год. 20/VIII-65 г. Крепко целую твоя подруга Оля [По...]",1965-08-20,birthday
227612,"Дорогая Маруся! Поздравляю тебя с днем рождения. Желаю тебе крепкого здоровья, земного счастья, благополучия и долгих лет жизни. Целую, Лида, Галя. Живи на радость детям. 1.IV-1987 {С уважением к вам. Привет Николаю Владимировичу от Шевченко Л. К.}",1987-04-01,birthday
251411,Леночка! Поздравляем тебя с днём рождения! Желаем тебе здоровья. Слушайся и помогай маме счастья тебе в жизни.,1989-03-20,birthday
204983,"Поздравляю тебя моя родненькая и любимая доченька с днем рождения.  Желаю тебе [? здоровья], счастья и успехов. Посмотри листочки, как эти дети, даже играя, делают полезное. Мой тебе совет в этот торжественный для тебя и всех нас день помнить, что только полезный труд, скромность и аккуратность украшают человека. Целую тебя, моя птичка. Твоя [?няня]",1946-01-16,birthday
238881,"Дорогой Сережик! Поздравляем тебя с днем рождения! Желаем тебе здоровья, успеха в школе и во всем. Счастья, родости[^радости]. По-больше[^побольше] друзей. Крепко целуем тебя. Бабоша, мама, папа, Антоша. 23.01.97 г.",1997-01-23,birthday
216957,"Дорогая Оленька! Поздравляю с днем рождения - 18.6.71 г. ! Желаю здоровья и счастья. Шлю большой привет. Целую. Рига, 16.6.71 г.",1971-06-16,birthday
227716,"Дорогая тётя Нелля! Поздравляю вас с днём рождения. Желаю много, много счастья, русского веселья, сибирского здоровья, кавказского долголетия Люда {11/VII.73 г.}",1973-07-11,birthday
243067,"Надюша! Поздравляю с днем рождения! От всей души желаю самого наилучшего в твоей жизни. Целую, Нина <подпись>",1956-12-23,birthday
211460,"Дорогая Лелечка, поздравляю тебя с днем рождения и желаю в грядущем 20-ом году твоей жизни много счастья. <Варя> {Пусть жизнь твоя течет струею, Пусть будет вся во множестве цветов, и пусть всегда живет с тобою, Надежда, вера и любовь.}",1946-10-13,birthday
234602,"Дорогая, любимая мамочка! Поздравляю с днем рождения и желаю счастья и здоровья в твоей жизни. Олежка. 12/I-62 г. <подпись>",1962-01-12,birthday
223556,"23/ix - 1909 г. пущено письмо божье
Поздравляю с днём рождения и желаю тебе всего наилучшего в твоей спитальнической жизни. Твой старый слуга до гроба поручик А. А. Чичиков-Аменов.",1909-09-23,birthday
222935,"Уважаемая Нина Тарасовна! Поздравляю с днем рождения. Желаю здоровья, успехов во всем. Не обращайте внимание на годы - цветите внешне, как эти цветы. 11/II-80 <подпись>",1980-02-11,birthday
213601,"Бабушка, мимик и Наташа поздравляют дорогую мамочку с Днем Рождения и желают ей в жизни всего самого хорошего, светлого и здоровья. Наташенька.",1963-05-29,birthday
214868,"Дорогая Светочка! Искренне поздравляю с юбилеем: Все что есть хорошее Все что есть прекрасное Самое чудесное И для счастья важное Все тебе сегодня Искренне желаю То есть с Днем рожденья Тебя поздравляю!!! Не говори что трудно жить Умей среди жизненных развалин Бороться, верить и любить!!! Целую Т. Н. Романова 12.07.98 г",1998-07-12,birthday
246611,"{14 апреля 1956 г.} дорогую тетю Мусю поздравляем с днем рождения! Желаем ей здоровья, счастья в жизни и еще многих лет прибывания [^пребывания] в земной жизни, на благо молодого талантливого поколения. Усачевы (Мария, Петя, Люда).",1956-04-14,birthday
225539,"Дорогая Людмила Викторовна! А жизнь идет. И чем круглее наши даты, тем ярче юности далекие года. Сердечно поздравляю Вас с Днём рождения! Любые отойдут несчастья и в непогоду веселей, когда у Вас так много верных, всегда Вас любящих друзей. Позвольте мне сказать сегодня словами русской старины: Дай Бог Вам доброго здоровья! И долгих лет без горькой седины. Целую. Ваша Маргарита Авенировна. {13.10.96 г}",1996-10-13,birthday
215945,"Валерочка милый! Поздравляем тебя с днем рождения, желаю счастья, здоровья, успехов в учебе. Слушайся маму и папу и всегда жалей обоих Крепко целую Галина Саша и д[ядя] Коля 13/XI 61г.",1961-11-13,birthday
244075,Поздравляю дорогого Юрочку с днём рождения с пожеланиями всего лучшего <подпись>,1913-10-13,birthday
103245,Дорогая Аничка [^Анечка] поздравляю тебя с днем рождения и желаю от души здоровья. Приду лично поздравить в воскресенье 16/III часов 5-6. Целую тебя крепко. Привет Гого. Твоя <подпись>.,1958-03-14,birthday
221469,"т. Галя! Поздравляю Вас с днем рождения. Желаю Вам успехов в работе и в семейной жизни, живите долго и еикогда [^никогда] не болейте. <подпись>",1981-04-08,birthday
208362,"Дорогая Эллен! Сердечно поздравляю тебя с днем рождения и желаю тебе всего наилучшего. Извини, что я так опоздал, но Ида мне вчера писала только. Привет всем, всем. Пишите нам, пожалуйста, если у Вас время. Серд[^ный] привет. <подпись>",1917-01-30,birthday
208342,Дорогая Эмилия Ивановна! Сердечно поздравляю с днем рождения. Целую. Ася.,1932-10-26,birthday
236047,"Дорогие мои! Сегодня по[!лу]чила ваше апрельское письмо с фотографиями, о чем спешу сообщить (открытки обычно идут быстрее). Мне очень стыдно, но я так еще и не отправила письмо с фотографиями, которые обещала еще в июне - просто закрутилась. Передайте от меня поздравление Лиде с днем рождения и самые лучшиие пожелания ей, Илюше и тете Люде. Постарайтесь не сердиться на меня - обязательно напишу в ближайшее время. 4 июля звонил Семен Абрам. об этом подробнее в письме. Целую вас всех. Привет от моих. <подпись>",1985-07-09,birthday
222145,"Здравствуй дорогая Зиночка! Поздравляю тебя с днем рождения. Желаю быть тебе здоровой, хорошо учиться в 8ом классе и интересно отдохнуть в оставшиеся дни каникул. {Лена} {9.7.61}",1961-07-09,birthday
250909,"Юра! От всей души поздраляем тебя с Днем рождения! Желаем тебе окончить курс науки и встать твердым шагом в жизнь. Желаем тебе всего самого наилучшего в твоей молодой, цветущей жизни.",1980-11-07,birthday
249739,"Дорогой Тихон Александрович! Сердечно поздравляю Вас с Новым 1992 годом и горячо желаю, чтобы произошел в жизни поворот к оздоровлению и восстановлению нормальных условий. Вам лично- доброго здоровья, оптимизма, веры в добро и справедливость, за которыми - будущее, чтобы не иссякали творческие силы, чтобы хорошо отдохнуть во время отпуска и пополнить ресурсы научного поиска. Видимо, Вы не получили моего недавнего письма. Я просил Вашего мнения о посылке своей статьи ""Особенности вегетации растений реликтовой средиземноморской р-ты ЮБК"" в редакцию Бюл. МОИП. Все же я решаюсь ее послать: 2 экз. в редакцию, и 1экз. - Вам. Ну, если не подойдет, значит такова судьба и я смиренно ее приемлю. Вам экз. возвращать мне не надо. Я уже благодарил Вас и за статью с [био...] [?папа] и за статью совместно с Совой, верстку последней я правил и отправил в редакцию. О литературе пишу на вкладыше. Сердечно признателен за поздравление с Новым Годом! Ваш <подпись> {20.XII.1991}",1991-12-20,new year
103193,"Уважаемые Александр Дмитриевич, Толя! Поздравляем с Новым годом! Желаем здоровья, бодрости и всего, всего хорошего в жизни. Поздравление и привет семье Ляли. Живем без перемен. Привет от Татьяны с Федором. 21.XII.70 г. С приветом Емельяновы.",1970-12-21,new year
250190,"Поздравляем с новым годом, с новым счастьем и желаем в новому году хорошего здоровья. Мама и тетя Маня 29/XII-55г.",1955-12-29,new year
102409,"Зренянин 26 - XII - 58 Дорогой Андрюша, поздравляю Вас с Новым Годом. Что я вам могу пожелать? Только самого лучшего и светлого в Вашей жизни. Ваш подарок который мне так дорог я получила и письмо также. Искренне Вам благодарна за Ваше внимание. На днях отправлю вам более обширное письмо. Моя мама и я шлем поздравление А.В. Шилову. С искренним приветом <подпись>",1958-12-26,new year
250295,"{Живи, учись и <u>не ленись</u>} С новыми успехами. С новыми весельями поздравляю тебя. Кира {Женичке от Киры С новым годом!} {9/V 48 г.}",1948-05-09,new year
238656,"Москва 24/XII-48г. Здравствуй старый друг! пишу тебе открытку, т.к.  ты ведь знаешь мою любовь к письмам. Читал твое письмо к Столику. Как ты смог написать такое длинное письмо. Жду от тебя когда-то обещанных фотографий и писем поздравляю с Новым годом тебя, отца и Е.А. Пиши. Желаю счастья крепко жму руку твой К.",1948-12-24,new year
244765,Илюша! Поздравляю с Новым годом и желаю исполнения Ваших желаний. Шлю привет. Шуры. [*Шура] 31.XII.1915г.,1915-12-31,new year
216897,"Дорогой Саша!!!
Поздравляю тебя с Новым Годом! Желаю тебе крепчайшего здоровья и больших успехов в Новом году!
С горячим приветом 
Володя.",1968-12-28,new year
244325,"Дорогия Меланья Капитоновна и Оксана! Поздравляем вас с Новым 1989 годом! Пусть сбудутся все ваши желанья [^желания] в Новом году! Добрым словом мы помянем года старого уход, начиная утром ранним Новый день и Новый год! Желаем в этом Вам году не знать ни горя, ни беду, налить шампанского вина и выпить сразу все до дна! Пусть Новый год со счастьем новым под сказку сна в Ваш дом войдет, и вместе с запахом еловым согласье, радость принесет! С Новым годом! С Новым счастьем! Семья Тынд. 12/I - 1989 г.",1989-01-12,new year
226438,Поздравляем с Иринкой с Новым годом! Пожелаем здоровья хороших успехов в работе в новом году. Получили с Иринкой ваш подарок. Первые два дня я спала с шапкой. Как только возьму [?слез] целый воз. Спасибо за все. До свидание [^свидания]  [?Мира] и Ира,1964-12-27,new year
