id,text,date,cause
249157,"30/XII 56 Дорогие мои Мурочка и Алекс. Александр. поздравляем Я и Петя с Новым годом 1957 г. Желаем вам счастья и здоровья и больших успезов в Вашей жизни, а тебя Муся Целую крепко, и жду к себе {я <u>вольна</u> Линя}",1956-12-30,new year
212495,"Валентина, Николай поздравляем вас с Новым годом 1968. Желаем вам крепкого здоровья, счастья в труде и жизни. Успехов в учебе. Юрий и Валя.",1967-12-29,new year
244510,"{Нашего дома здесь нет.} Женя дикутет! Дорогие и милые Бабушка, тетя Саша, дядя Митя, Витя и Анна Александровна! Поздравляю всех с новым годом, с новым счастьем (с старым [?носом]!)! Мама уже написала, как я [?встретил] новый год. Я очень доволен и вообще мне хорошо. Как Вы поживаете? Как поживает Коть? Спасибо т[ете] Саше и Анне Алек[сандровне], что Вы пишите мне, но мне самому некогда отвечать. Ваше я очень люблю, когда мама читает мне письма. Пожалуйста пишите и маме и мне, целую бабушке руку и всех целую. Женя",1929-01-04,new year
210157,"Дорогой Витя! Поздравляю тебя, маму и бабушку с новым годом и наступающими праздниками. Желаю тебе здоровья, вырсоти большим и умным. На этой карточке, нарисованы ты и Тамарочка , гуляя по Гатчинскому парку. Будет ли у Вас елочка? Желаем всего лучшего. Любящие тебя Володя и Сережа. {Тамара} {Витя} {<u>6/I-1922</u>} {Д. С.}",1922-01-06,new year
249997,"Зина и Настя поздравляю вас с наступающим Новым годом. Желаю вам счастье, здоровье и долгой жизни. Желаем вам самых наилучших успехов. с новым годом. 18.12.61г[од]",1961-12-28,new year
222605,25.12.22 -4°C РС - 996246 Привет из Череповца! Поздравляю с Новым годом! Пусть он будет удачным во всех отношениях и приносит только яркие события. Юля,2022-12-25,new year
250435,"Дорогие Клавдия Ивановна, Василий Корнеевич и Оля, поздравляю вас с Новым годом, желаю отличного здоровья, счастья, успехов и исполнения всех желаний 28.12.73. Валя И.",1973-12-28,new year
225977,"{21/I 16 г.} Дорогая Лиза! Вашу милую открытку мне переслали в Петрогр, куда мы с мужем переехали теперь жить. Спасибо большое за поздравление. С своей стороны и мы поздравляем Вас и всех Ваших с Новым Годом. Мама и Коля с семьей действительно переехали тоже в ПТР[^Петроград]; но сейчас мама уехала в санаторий ""Тайцы"" по Балтийск[ой] ж.д., где пробудет месяца полтора или два. Наш адрес: Мойки, 60 Гостин[ица] Россия. Меня все зовут знакомые в Кисловодск но жаль оставлять здесь мужа одного. {Целую Вас. Всего лучшего. Муж кланяется. Ваша Вера.} {Адрес Коли: ПГР. Мытнинская ул.29, к.54.  -//- Володи: п. Буй, Костр[омская] губ[ерния] [нрзб] [нрзб]}",1916-01-21,new year
100146,"Здесь!
Дорогие Клавдия Степановна, Мария Степановна, Ваши дети, внуки, сестра! Поздравляем Вас с Новым годом - 1986! Желаем Вам доброго здоровья, бодрости, счастья, [нрзб] долголетия. Пусть будет хороший и счастливый у Вас год. Всего Вам доброго, целую всех О.Т",1985-12-21,new year
244717,"Мама и Вадя, поздравляем вас с новым годом желаем всего, всего хорошего в 1967 г. Целуем Аня, Леночка. 27.12.66",1966-12-27,new year
251327,"Гульсум Рамозановна! Поздравляем Вас с Новым годом. Желаем крепкого здоровья, долгих лет жизни. Приглашаем на утренник 30.12 - 71 в 10 часов.",1971-12-30,new year
219268,"С Новым годом , дорогая Тамара, с новым счастьем! "" С Новым годом тебя поздравляю, от души твою руку я жму, счастья, радости много желаю В наступающем Новом году!"" {Милой Тамарочке от Калинки 1.I.1954 г. София}",1954-01-01,new year
207972,"<u>Дорогая Лилиана</u>, поздравляю тебя, маму и папу с Новым Годом! Желаю вам отличного здоровья, счастья в жизни, успехов в работе, а тебе в учёбе. Прими также поздравления от моих родных. {Твоя Светлана.} {25/XII-62 г.} {<u>авио</u> Румыния}",1962-12-25,new year
228938,"С Новым Годом! Старый год скончался. Хороший покойничек был! Новый год народился. Что год грядущий нам готовит? Петя! Напиши о бывшей ревизии библиотеки у вас и о семинарии. это очень нужно. В Новом году желаю Вам благоденствовать, а [нрзб] - ра[нрзб] и цвести... Всего хорошего! Мой привет д. Грише, [нрзб]. Ваш <подпись> 1909, 1-3.",1901-01-03,new year
251390,"Дорогие мои, Валентина Александровна, Борис Васильевич, Анюта и Боря! Поздравляю вас с Новым Годом! Желаю крепкого здоровья, бодрого праздничного настроения. Тамара, Инночка. Приедем с дочкой 2/Ⅱ-70",1970-02-02,new year
209131,Поздравляю с Новым Годом. Клавдюша. Дек. 31/904 г.,1904-12-31,new year
244270,"8 января 1909 г. Дорогая Зинаида Сергеевна! Письмо Ваше получила в [?Ялте] благодарствую за Ваше доброе дружеское отношение. [Нрзб] и поздравляю его с Новым годом, спасибо, сердечно желаю здоровья и всего лучшего. Я в Ялте устроилась очень хорошо. Чудный вид на море и на Ялту. Погода теплая солнце [?зелень]. С 2го янв[варя]: буря и холод, несколько дней пришлось сидеть дома. Я буду Вам писать, [пед...] [пну...] от [цен] [?вплетечку]. Преданная Вам МБекишина Ялта. Ливадийские [шни] для [?Ратенек].",1909-01-08,new year
219711,"С новым годом тебя поздравляю, Новогодний привет тебе шлю. Много счастья в жизни желаю,  И на память открытку дарю. На память дорогой сестре Любочке от Ани. Люба поздравляю тебя с новым 1957 годом и желаю счастья в твоей молодой жизни!",1956-12-29,new year
234207,"{Москва: малая Спаская [^Спасская]. дом №16 кв[артира] 26 Соковы} {2-I-17г.} Дорогая Кланька сегодня начала учить уроки русский обязательно сегодня кончу. Мне теперь кажется некуда ходить, только 3го на концерт. Приезжай скорей, мне кажется что тебе скучно. Сегодня по тел[ефону] спрошу адрес Соковых. Дорогая Клавденька, поздравляю тебя с Н[овым] Годом. Пиши нам письма. Адреса еще не узнали, сейчас Леночка позвонит Мироновым и напишет тебе. {Люб[лю] тебя Нас[?тя]} Дорогая Клавденька поздравляю с Новым Годом!! вот, адрес <u>соковых</u> <u>Москва:</u> <u>малая Спаская [^Спасская] улица №16</u> дом, квартира 26",1917-01-02,new year
208855,"Дорогая дунечка! Поздравляю тебя с Новым годом! Поздравь всех раньше, а также Гильмана и пожелай им всех благ и счастья. Слушай, я была в Большом театре 3 раза, в художественном 2 раза, у Корша 2 раза и в Новом театре 1 раз. Почти каждый день я в театре. Целую тебя",1908-12-31,new year
211899,"Татьяна Васильевна, поздравляем вас с днем вашего ангела и с Новым годом. Будьте здоровы, нескучайте [^не скучайте]. Привет Николаю Петровичу и Колюне. 8/I-32. Ваши воспитанницы Лиза, Шура и Тоня.",1932-01-08,new year
251325,"Здравствуйте Женя Люся и Светочка. Поздравляем с Новым годом. Желаем счастья, здоровья и многих лет счастливой жизни. Света не болей, будь веселенькой. С приветом Лариса, Нина, Николай, Илья 28/ XII 65.",1965-12-28,new year
216364,Нижна 19.12.67 Много успехов с Новым годом желает [? Дана Rebai]. P.s. Посылаю Вам одну открытку женщины,1967-12-19,new year
239837,26.12.34 С Новым годом дорогие бабушка Женя и дядя Коля спасибо за книги. У нас есть елка Таничка[^Танечка] и я целуем вас крепко. Твой <подпись>,1934-12-26,new year
218054,"Шлю Вам, Сергей Николаевич, свое поздравление, увы... уже с прошедшими праздниками и С Новым Годом. Вашу открыточку получила - сердечно благодарна за память. Для Нового года желаю здоровья и счастья. Сестры и тетя шлют привет. В. Лебедева",1917-01-06,new year
237341,"Светлана Николаевна, здравствуйте! Сердечно поздравляем вас с Новым годом! Пусть в вашей жизни всегда живут радости и благополучие! Будьте бодры и здоровы, успехи в труде и учебе. С новым счастьем! З.К.П . 25.12.80 г.",1980-12-25,new year
240749,"Уважаемый Михаил Константинович. Поздравляем с Новым годом! От всей души желаем крепкого здоровья и всего самого лучшего в вашей жизни. Валя, Валентин. 31.XII.81 г.",1981-12-31,new year
228585,"Дорогую, хорошую Марию Петровну поздравляем с праздником Рож.[дества] Хр.[истова] и с Новым Годом. От всей души желаем вам здоровья, радости, душевного спокойствия и во всем благополучия. Передайте, пожалуйста, наши поздравления с праздником и наилучшие пожелания многоуважаемому Николаю Николаевичу. Крепко целую вас и деток любящая Вас М. и Ц. [?Цильк] 1913 г. 27 декабря",1913-12-27,new year
236007,"Дорогие, милые, любимые мои родные Лида, Николай, Светлана и маленький Павлик! С Новым годом! С новым счастьем! Примите наши новогодние пожелания – доброго здоровья, успехов, радости, бодрого чувства! Дай Вам бог счастья и благополучия во всем! Большое спасибо за варенье вкусное. Там мне хочется побывать у Вас! Даже очень! Бог даст, что летом или весной побываю. Теперь же не могу. Как живем – расскажет Люся, она приехала 22/XII и уезжает обратно 27/XII. И то у меня радостей было столько. Таня с дочкой Аней жили с 11/XI до 17/XII. С ними было мне хорошо! Приезжайте сами! Буду очень рада. С уважением и любовью Анна Сом., Сергей с семьей. 25/XII - 77 г. с. Усть-Цильма",1977-12-25,new year
227398,"Здравствуй внучок Миша, поздравляем тебя с наступающим с Новым годом 1988. Желаем тебе огромного здоровья и успехов в учебе. Твой деда и Надежда Т. 29го декабря 1987 г.",1987-12-28,new year
216650,"24. XII. 74 г. Лида, Поздравляю тебя, дорогая, с Новым годом. Море счастья тебе, море любви, - пусть грезы твои никогда не будут утраченными. Целую, Альгис. P.S. Лида, ты извини, пожалуйста, что я такой не хороший. Но ведь ты знаешь, что я не люблю писать письма. А вот получать очень люблю и очень рад твоим письмам. Счастливого тебе пути в Казахстан. Письмо я тебе обещаю написать в начале Нового года, т.е. в январе. Хорошо? Еще раз целую, Альгис.",1974-12-24,new year
216159,Дорогие родные! Поздравляем Вас с Новым годом! Желаем здоровья и большого счастья! Пусть 1967 год будет годом исполнения всех Ваших желаний! Привет и поздравления Вите. 28/XII 66 г. Ульяновы.,1966-12-28,new year
247656,"Шлю привет дорогому Брату Костюше. Поздравляю с Новым Годом с новым счастьем, почему ты мне, Костюша ничего не пишешь, я обиделась на это, когда будет тебя [^у тебя] отпуск, буду ждать когда напишешь. С[естра] Нина Кормильцева 19 13/I 13 г.",1913-01-13,new year
205887,"Поздравляю с Новым Годом и желаю тебе встретить весело и счастливо, и поздравляют все родные Василий Иларивонович и Нюша. Нюра. Прощай Целую тебя твоя Тася. Миша велит писать [?на] [?имя] дяди {Я приеду 6 января [?вновь] [?4] числа, 1916.}",1916-01-04,new year
101550,"1 янв. 1911 г. Дорогой папа! Поздравляем тебя с новым годом и желаем <s>всего</s> исполнения желаний. [?Праздниками] вместе с Павлушей и [?Марией] Степановной осматривала Эрмитаж, Петропавловский и другие соборы, домик Петра Великого. Погода январские - морозы. Целую дочь - <подпись>",1911-01-01,new year
235966,Здраствуйте [^здравствуйте] дорогие. брат Николай невестка Лида племяник [^племянник] Владимир и Светлана. Поздравляем вас с новым годом. Желаем хорошего здоровья счастья успехов в труде хорошо провести праздник. Жизни [^В жизни] особых новостей нет. Пока до свидья [^до свидания] крепко обнимаем с Приветом ваши родные Тетя Софья Миша Ваня Нина и Васик. Марфа. 31 декабря - 71 года.,1971-12-31,new year
221891,"Дорогие Саша, Лида и Марина! Шлём Вам самые сердечные поздравления с Новым Годом! Счастья, здоровья вам и отличного настроения. Валя, Залик и Миша. 27.12.81.",1981-12-27,new year
2191,"13 декабря 1909 г.
Здравствуйте, Раиса Cавельевна. Поздравляю Вас с Новым Годом и при этом желаю всех земных благ. Хотелось бы о многом чем поговорить с Вами, но открытка до того мало может поместить, что нестоит [^не стоит] и браться, лучше всего постараюсь как либо в следующий рез сделать это. В ноябре месяце я послал было Вам письмо заказное, получили ли Вы его? мой брат все таки получил и писал что он послал А.А. мое письмо. Но я ответа от него не получил. Чем объяснить его молчание никак не пойму. Простите, что я шлю Вам такую открытку, которая напоминает много трагического. Эта открытка много родила у меня мыслей, которые записаны в списках; их я когда-нибудь пришлю Вам.
Живу я постарому [^по-старому], только одно что раздобыл учителя языка ""эсперанто"" и каждый день зубрю его, а так же один товарищ передал бумагу и карандаши, так что рисую и картину. О как я люблю это искусство! Всей душой предан ему. Вместе с этим письмом я посылаю письмо и к [нрзб]
Как Вы живете - можете? Как живут Вера и Агриппина Антоновна здоровы ли? Как видно они ленятся ко мне писать, скажите им пусть пишут. Я буду очень рад и их письмо много собой будут приносить мне радостей. Поверьте тот день, та минута, в которые я получаю письма благословенные, и в этот день я бываю очень весел и много чего приходится делать, мысли както [^как-то] сами рождаются.
Целую крепко Ваши руки. К. Русаков",1909-12-13,new year
215612,"Галя унуча [^внуча] поздравляю тебя с новым годом 1993 с новым счастьем жилаю [^желаю] тебе хорошего здаровья [^здоровья] в твоей молодой цветущий [^цветущей] жизни и еще жилаю [^желаю] самой [^самое] главно [^главное] в жизни любимого друга для жизни вмести [^вместе], и еще в работи [^работе] и в труде, и оснавное [^основное] незабывать [^не забывать] папу и маму, да и меня как свою родную бабу марусю [^Марусю], и за дедушку незабывай [^не забывай], если пишишь [^пишешь] письмо то спомни [^вспомни] и за его 25-12-1992 г баба Маруся и деда Коля",1992-12-25,new year
216047,"Дорогая Антонина Константиновна! Сердечно поздравляем Вас и Вашу семью с Новым Годом! Искренне желаем Вам здоровья , бодрости; благополучия и радости в Ваш дом. Жмем руки. {Ант. кв. Лид. кв.} {27 XII 63г.)}",1963-12-27,new year
236798,"Здравствуйте дорогие тётя Лиза, Василий Григорьевич и Лёва. Поздравляем Вас с Новым годом, с новым счастьем. Желаем вам счастья, успеха и много радостей в Вашей счастливой жизни. Крепко Вас всех целуем. Ира и Юра. 22.12.58 г.",1958-12-22,new year
102403,"29/ХII 1957
Дорогая [?Лерушенька], поздравляю тебя с днем твоего рождения и желаю здоровья, удачи, успеха во всех делах, а главное успеха в личной жизни - хорошего умного поклоника [^поклонника]. Желаю, чтобы ты была счастлива и улыбалась, как [та] пара ребят на тройке сказочных коней... Если [?удастся], позвоню по телефону 30/XII. Была в [Москве] 26/XII (ездила от [нрзб]кома на автомобиле на один день) звонила тебе на службу в 15 30, но не застала. Ездила в Мытищи через Москву. Очень занята службой. Хлопочу отпуск. После нового года приеду в Москву. Поздравляю [также] и с новым годом. Бог даст он будет дл[!я] нас счастливый. Целую крепко. Мама",1957-12-29,new year
226116,28/XII 1916 г. Поздравляю с Новым Годом и желаю всего наилучшего <подпись>,1916-12-28,new year
247987,"С Новым годом Дорогая Оничка! и от души тебе желаю, здоровья и счастья. Искренно [искренне] любящий тебя твой Митя",1916-01-03,new year
216815,"Дорогие дети, мамы и папы! Родительский комитет и коллектив ясли/сада сердечно поздравляют Вас с Новым годом! Желаем доброго здоровья, счастья, успехов во всех делах! {Род. комитет. 28.12.79}",1979-12-28,new year
247196,"27/12/71г Милых и дорогих крепко, крепко целуем. Поздравляем с Новым годом! Желаем счастья, здоровья, исполнения всех желаний и полного благополучия. Любящие Ваганова Корчагины и Лоскович",1971-12-27,new year
223198,СНовымГодом [^С Новым Годом] М.Хмелинская 1/1 1910 г.,1910-01-01,new year
205530,"Лариса Федоровна, Поздравляю Вас и всех Ваших с Новым Годом 31 XII 1911 г. Ник. Крутиков",1911-12-31,new year
217122,"Уважаемая Нина Дмитриевна! Поздравляю Вас с Новым годом! Желаю Вам большого счастья, здоровья, успехов во всём, хорошего настроения. С уважением, Перегудова Эля. <24.12.72>",1972-12-24,new year
