id,text,date,cause
236007,"Дорогие, милые, любимые мои родные Лида, Николай, Светлана и маленький Павлик! С Новым годом! С новым счастьем! Примите наши новогодние пожелания – доброго здоровья, успехов, радости, бодрого чувства! Дай Вам бог счастья и благополучия во всем! Большое спасибо за варенье вкусное. Там мне хочется побывать у Вас! Даже очень! Бог даст, что летом или весной побываю. Теперь же не могу. Как живем – расскажет Люся, она приехала 22/XII и уезжает обратно 27/XII. И то у меня радостей было столько. Таня с дочкой Аней жили с 11/XI до 17/XII. С ними было мне хорошо! Приезжайте сами! Буду очень рада. С уважением и любовью Анна Сом., Сергей с семьей. 25/XII - 77 г. с. Усть-Цильма",1977-12-25,new year
206938,"Здравствуйте, уважаемая семья Кутыревых! Поздравляю вас с наступающим новым 1990 годом. Счастья, здоровья и успехов в перестройке, как бойцам передовых рядов! Саша, ты обещала в прошлой пятилетке большое письмо. Я жду его терпеливо, и думаю, что в 1990 году мои ожидания сбудутся. С новым годом, с новым счастьем!",1989-12-12,new year
216897,"Дорогой Саша!!!
Поздравляю тебя с Новым Годом! Желаю тебе крепчайшего здоровья и больших успехов в Новом году!
С горячим приветом 
Володя.",1968-12-28,new year
218623,"28/XII58 г. {перевод получила большое спасибо думаю послать бандеролью вышевку  [^вышивку]}

Дорогие мои Мурочка Слава и Володя! поздравляю вас с новым годом, желаю вам здоровья и благополучия во всех ваших делах, Мурочка твой заказ уже исполнен Мадону  [^Мадонну] моя соседка уже вышела [^вышила], если желаете можете выменить своей картиной есть маленькое изменение а именно на шляпи  [^шляпе] отделка голубыми нитками вышета  [^вышита] если вам понравится, мне например больше голубыми ниткоми  [^нитками] нравится, я за работу, заплатила 70 руб а ты мне на 10 р меньше посчетай купи [нрзб] угости чем нибудть  [^чем-нибудь] дисертом  [^десерт], они мне прислали туфли и ретузы

{Я счетаю  [^считаю] что в мою сумму оне не вложилес  [^вложились] по этому  [^поэтому] когда вы будети  [^будете] у них скажете что я их угочаю  [^угощаю], сегодня Саничка должна приехать из Ялты 28 г дек. а завтра 29 го едить  [^едет] в Кишинев ждем Саничку поехала на курорт в Ялту на целый месяц, привет от всех целую ваша мама}",1958-12-12,new year
219849,С Новым Годом! Пусть в этот Новый год минуют все несчастья Пусть совершится поворот и улыбнется счастье. Дорогая Вера поздравляю тебе с новым годом и желаю тебе счастья и успеха. <подпись> 31.12.1952,1952-12-31,new year
219997,"С Новым Годом, друзья, с 1960 годом. <подпись> {27/XII 1959 г.}",1959-12-27,new year
103818,"Оленька, поздравляю тебя с Новым Годом. Будь здорова, бодра и весела. Слушай родителей, деда с бабкой и своего дядьку Юру. 31.12.68 Дядя Юра.",1968-12-31,new year
251261,"Люся! Поздравляю с Новым годом, поздравление пишу под баян и желаю море счастья и любви океан. Поздравляю с новым наступающим 1956 годом и желаю счастья столько сколько снежинок <s>в</s> зимой. Если будет с тобой ненастья [^ненастье], пускай будет оно с тобой! На память Люсе Бронниковой от Макуловой Фиды. III курс. Б. К. т. 31/XII-55 г[од]",1955-12-31,new year
104174,1911 года 30го декабря. Многоуважаемый Яков Иванов[ич] и Любовь Ар. Поздравляем вас с новым годом с нов[ым] счастьем и желаем вам встретить и пров[ести] доброго здоровья и клан[яется] крестница Маня Никол[аевна] Алексеев[а] и Прасков[ья] Иван[овна] кланяется вам крес[тница] Маня и целует дорогую кресную [^крестную] без четные [^бессчётные] разы Затем досвидания [^до свидания],1911-12-30,new year
221655,"Дорогой братик Павлуша, поздравляю тебя с Новым Годом, с Новым счастьем, желаю тебе здоровье и счастья в твоей жизни. Павлушенька я очень хорошо отдыхаю, сейчас уже явился аппетит. Приниаю нарзановые ванны и циркулярн[нрзб] дух [?душ], гимнастика каждый день и сон на воздухе 1 час, в общем но скаль[нрзб] Я с трудо хотела ехать в Кисловодск но  [нрзб]льку не жеда. ехать обратно. [нрзб] новый год. Буду дома вероятно числа 20 <подпись>",1958-12-31,new year
211107,"Уважаемая [?Доминика] Дмитриевна и Ваши дети; Лида и Володя и так-же [^также] внучата; Слава и Виолетта. Поздравляем Вас всех с Новым годом! С Новым сщастьем [^счастьем]! И желаем Вам самых наилучших пожеланий в Вашей жизни. Ваш зять Тима, племянница Тома, [нрзб] деда Витя, Люся и Саша.",1956-12-27,new year
205310,"С Новым годом, с новым счастьем сердечно поздравляю Вас всех с праздником зимы! Желаю наилучших успехов в труде и учебе, радостей и здоровья. С приветом <ИВ>  {привет и поздравляем [нрзб] домочадцев}",1966-12-25,new year
103580,"Дорогая Варветочка, поздравляю Вас с Новым Годом и желаю в этом году избавиться от всех недугов, быть доброй и веселой. Остальных также поздравляю и шлю лучшие пожелания. Поздравляю Вас и домашних. Аввдокимова. 01.01.1915",1915-01-01,new year
228938,"С Новым Годом! Старый год скончался. Хороший покойничек был! Новый год народился. Что год грядущий нам готовит? Петя! Напиши о бывшей ревизии библиотеки у вас и о семинарии. это очень нужно. В Новом году желаю Вам благоденствовать, а [нрзб] - ра[нрзб] и цвести... Всего хорошего! Мой привет д. Грише, [нрзб]. Ваш <подпись> 1909, 1-3.",1901-01-03,new year
247181,"Дорогих Вагановых! Поздравляем с Новым Годом! Желаем здоровья, счастья! Леметы Велло, Ася, Вова, Михкель. 29/XII 70 г.",1970-12-29,new year
225996,"Дорогие Соня и Шура! Бабушка, Валя, Миша, Юра и я поздравляем Вас с новым годом и желаем всего наилучшего. Сашу тоже поздравьте с новым годом. У Нормы было три щенка, одного оставили. Она не отходит от него ни на одну минуту, и чужому человеку нельзя мимо пройти: бросается и кусать. Дорогой Шура! Письмо твое получил, благодарю за пожелания и очень рад, что мне удалось добиться, чтобы выслали программу. Крепко любящий Вас Коля <подпись>",1904-12-30,new year
247867,"{[?Химек] 15. XII. 904} {Поздравляю Вас, тетя Зина, и всех ваших с новым годом, желаю всего лучшего от всей души. Любящий Вас Жорж} {С театра военных действий}",1904-12-15,new year
237619,"Поздравляю тебя дорогая Оленька с Новым Годом и от всей души желаю тебе всего всего наилучшего. Может быть зайдешь ко мне в контору, мне бы очень хотелось с тобой повидатьтся занятия у нас эти дни кажется до 1 или 2. Буду тебя ждать. Поклон всем твоим и передай поздравление им с Новым Годом. Целую тебя. крепко остаюсь верная подруга Надя. // 30 декабря 1901 г.",1901-12-30,new year
208096,"Здравствуй дорогой друг! Поздравляю тебя, Марина, с Новым Годом, желаю крепкого здоровья, счастья и всего доброго. Твое предложение-совет писать докторскую справедливо и заманчиво, но меня всё время лимитирует здоровье. Написать её, конечно можно, но защищать её – противопоказано. Мне даже выезд в Подмосковье, на санаторное лечение, запрещён и я буду отдыхать и накапливать силы дома. Какие же могут быть разговоры о защите?! Разве шутка, за короткий срок перенести полиомиелит, три инфаркта, ампутацию и др. мелочи?! Работаю лишь потому, что соблюдаю строжайший режим-питания распорядок дня, постоянный контроль крови др. Надоело всё это страшно, но другого выхода нет и не предвидится. Я не реагирую (вернее стараюсь), не обращаю внимание на неприятности, избегаю всякие неприятные разговоры, сторонюсь и избегаю все неприятного. Получается своеобразная самоизоляция. Работаю потому, что имеются некоторые возможности, живой и интересных характер работа [работы], общение с специалистами (по письмам и их приездам) и др. Получаю лестную оценку моих новых форм винограда из Молдавии, Одессы, Москвы, Краснодара и др. Привет от Ек[атерины] Ант[оновны] И самые добрые пожелания. Рад твоим письмам и с удовольствием отвечаю на них. Будь здорова. С приветом Саша. {28 декабря 1960 г.} {Эта девочка ннапоминает мне мою внучку Аленушку}",1960-12-28,new year
223529,"С Новым Годом! С Новым счастьем! Поздравляю Вас, мои дорогие, Витя и Тамара! Харьков. Мама. 1/I-1951 г.",1951-01-01,new year
232839,Дорогие друзья! От души поздравляю всех Вас с Новым Годом! Желаю в Новом году Вам здроровья и успехов в жизни. Петр.,1962-12-29,new year
208195,"{Тиша и [?Веруся]} Дорогой папуся! Поздравляем с Новым Годом, желаем здравствования и счастливого года! А в 1917 году ты проси Боженьку и молись чтобы мы смогли нашего, дорогого папусю обнять и сладко, сладко поцеловать. Горячо любящие тебя твои малыши. Тиша и [?Веруся] Белые",1917-01-01,new year
235954,"А-У Люсенька! С Новым годом. Люсенька за какой веткой спряталась? Люсенька сама «Красная Шапочка» шагает [к] бабушке [в] гости с корзинкой, а [в] корзинке несет хорошие оценки «5» и «4». И какие-то лакомства т. е. конфетки. Дядя Володя новый год наверно[е] [в] Сыктывкаре будет встречать. До встречи [в] новом году. Дядя Юра
31/12-70",1970-12-31,new year
227518,"Поздравляю с Новым годом! Желаю здоровья, счастья и всего наилучшего. Нина",1965-12-31,new year
215401,"Приветствую Вашу Маму и Вас с Новым годом, желаю благополучно добраться. Часто мысленно бываю в Томске среди друзей. 25/12 Ваш <подпись>",1912-12-25,new year
232237,"{32-30/XII 915} Дорогая моя Нюшка! Поздравляю тебя с Новым годом дай бог тебе полного счастья и исполнения всех желаний и неразлучной нашей жизни. Милая Нюша сию получил повестку на посылку и вот сижу и жду 6-6,5 ч[асов] чтоб ее получить. Славный песик получила ли ты мое закр. № <s>31</s> 31-й как бы оно не пропало? Пиши скорей об этом. Про себя скажу что сильно скучаю и потеряла всякую надежду тебя увидеть. Ради бога прими уш [^уж] все старания чтобы приехать как хорошо устроится с учеником а то дак [?нанимай на меса уч] и немедленно выезжай. Ну а пока моя радость [?прощай] крепко тебя целую горячо [люб...] {Нюша это старинная церковь как говорят ей более 300 лет}",1915-12-30,new year
217452,"{22.12.1973} Дорогая крестная. Поздравляем Вас с Новым Годом! Желаем доброго здоровья и всего, всего наилучшего в жизни. Целуем. Лариса, Лена, Нина и Светочка.",1973-12-22,new year
220505,"Уважаемая Зинаида Александровна! поздравляем с Новым Годом и желаем здоровья, здоровья и еще раз здоровья. Наши поздравления и наилучшие пожелания Лиде. С уважением М. и А. Луцкины {24/XII 73.}",1973-12-24,new year
238831,Уважаемый А. Е. Шевченко Поздравляю вас и вашу семью с новым годом. желаю в новом году счастья и успеха в работе. От техбюро 340 31/XII-57,1957-12-31,new year
207974,"Дорогой Константин!
С Новым годом!
С новым счастьем, с новыми стихами.
Твой Мих[аил] Лапыгин
28. XII. 1968",1968-12-28,new year
100594,"Поздравляю вас дядя Андрюша и тетя  Даша и Аркаша, с Новым годом и посылаю вам привет из Москвы и желаю вам от Бога всего хорошего  в жизни.  А в Славянске был в воскрес[енье] 29-ого дек[абря 11 ч[асов] дня]. {покл.[он] всем В. Грибачев}",1913-11-29,new year
243922,Поздравляем с Новым Годом! А. и К. [? Ульяницкие] {19.01.1914 г.},1914-01-19,new year
232994,"Дорогие Костя и Наташа! Поздравляем Вас с Новым годом. Шлем Вам сердечный привет с пожеланиями крепкого здоровья, человеческого счастья, благополучия и всего хорошего
Целуем Соня <подпись> 25/XII-69 года",1969-12-25,new year
222400,"Мои милые, родные Ира и Миша! Поздравляю Вас с Новым годом-1991! Желаю здоровья счастья, благополучия и всего доброго, хорошего! Целую мама и она же баба Вера. 31/XII-1990г.",1990-12-31,new year
206890,Шлю новогодний привет тебе и Л. Н.! Вал. Ш. С новым годом дорогие Петя и Танечка. Целую и дружески жму руки. А. Ш. Долго же ты собираешься писать.,1910-12-31,new year
247987,"С Новым годом Дорогая Оничка! и от души тебе желаю, здоровья и счастья. Искренно [искренне] любящий тебя твой Митя",1916-01-03,new year
250992,Поздравляю с Новым Годом и желаю всего хорошего. Будь здорова.Нина. {25/XII 64 г.},1964-12-25,new year
237341,"Светлана Николаевна, здравствуйте! Сердечно поздравляем вас с Новым годом! Пусть в вашей жизни всегда живут радости и благополучие! Будьте бодры и здоровы, успехи в труде и учебе. С новым счастьем! З.К.П . 25.12.80 г.",1980-12-25,new year
226262,"{23.IV.78} Дорогие Наташа и Костя! Сердечно поздравляю вас с праздниками - 1е Мая и Днем Победы! Желаю вам здоровья, бодрости, семейного благополучия. Радости и счастья! Как поживаете, как себя чувствуете? Напишите, я по телефону к сожалению теперь поговорить не могу. Вы говорите, и в обиде на меня, что я не поздравила вас с Новым годом. Это недрозумение[^недоразумение]. Я поздравляю вас совсеми[^со всеми] праздниками. Целую вас [?Генели]. {P.S. Пришлите мне адрес Вали, я его забыла}",1978-04-23,new year
207030,"Милая Таня,  поздравляю тебя  с Новым годом! Желаю тебе всего самого наилучшего: здоровья, добра и счастья. с приветом Рита. 31/XII 74 г.",1974-12-31,new year
219781,"Дорогие Грига, Аня, Ксения Епифановна, Эличка и все члены Вашей семьи! Поздравляем Вас с Новым годом и желаем всем отличного здоровья, счастья и успехов во всех делах. С приветом. Тося и Яков Андреевич.",1964-12-26,new year
102401,"Здравствуй, дорогая Нина, Христина Ив. Люся, Леночка, Наташа и Танечка. Поздравляю вас всех с Новым Годом желаю крепкого здоровья и успехов в труде и учёбе. С приветом к вам, Лида и Лёша, Егоровы. 28/XII-57 г.",1957-12-28,new year
219268,"С Новым годом , дорогая Тамара, с новым счастьем! "" С Новым годом тебя поздравляю, от души твою руку я жму, счастья, радости много желаю В наступающем Новом году!"" {Милой Тамарочке от Калинки 1.I.1954 г. София}",1954-01-01,new year
209823,Дорогие Грани - многогранные! Поздравляем Вас с новым годом! Пожелаем Вам наидобрейшего. Роза Яковлевна и Галя с семеством. 01.01.1971,1971-01-01,new year
234877,"Натульчик! Поздравляю тебя с Новым годом Желаю тебе успехов в учебе, в музыке, а главное-здоровья. Крепко, крепко тебя целую! Нина. Москва <u>1/I. 1960 год.</u>  С Новым годом поздравляю И успехов всем желаю",1960-01-01,new year
2669,"Поздравляем с новым годом и новосельем и желаем Вам всем здоровья, замечательных успехов в труде и счастья в семейной жизни, а Таничке желаем хорошо трудиться и настойчиво учиться. Вчера вечером при Вас Лида заболела, а сегодня вечером температура 40. Лежит и бредит. Досвидания [^ до свидания] [?Роза], Ваня. 25.12.1962",1962-12-25,new year
104955,"27/XII65 Дорогая Павла Николаевна С Новым годом, со здравием, со всем самым хорошим и Вас и все Ваше семейство. Я очень беспокоилась о Вас. Почему вы ничего не пишете? Что случилось? Я писала Вам к Ноябрю, а от Вас ни слова. Обязательно напишите хоть несколько строк. Крепко целую Вас и всех ваших <подпись>",1965-12-27,new year
249997,"Зина и Настя поздравляю вас с наступающим Новым годом. Желаю вам счастье, здоровье и долгой жизни. Желаем вам самых наилучших успехов. с новым годом. 18.12.61г[од]",1961-12-28,new year
225885,{С.П.Б. 17.12.1913} Поздравляем с праздником и с Новым Годом. Володины,1913-12-17,new year
228132,1909 г. 30 декабря. С Новым Годом дорогие Тетя и Зина! Желаю от души всего всего лучшаго [^лучшего] в новом году! И. В. Мария,1909-12-30,new year
247184,"Вагановим! С новым годом! Желаю Вам в новом году успехов в жизни, службе и конечно новой квартире Велло. 28.12.65 г. г. Североморск",1965-12-28,new year
230192,"Поздравляю с Новым годом, дорогих мамочку, Мишу, Фросю и Светочку, желаю всем здоровья, счастья и долгих, долгих лет жизни. Крепко целую Валя. 31.12.1954 г.",1954-12-31,new year
225131,С Новым годом! С новым счастьем! С новыми успехами в учебе. На память Валечке от Маргариты. Желаю тебе горячей и крепкой дружбы.,1951-12-30,new year
237960,"Светочка! Поздравляю тебя с Новым годом! С Новым счастьем! Желаю в новом году всего хорошего тебе, всего доброго, счастья тебе, здоровья. Антонина {20.12.87 г.}",1987-12-20,new year
