country,year_of_discovery,find_spot_id,find_spot_name,total_number_of_coins,terminal_year_earliest,terminal_year_latest,lat,long,summary,disposition,century
Germany,1990,17231,STEINSTRAß 1990,343,282,283,50.93333,6.48333,"A hoard of 343 barbaric antoninianii (Gallienus - Carus, incl. Tetricus) and an unstruck flan were found in the substructure of a bathhouse of a villa rustica (HA 206).",NA,III century
Romania,1966,16362,TÂRPEȘTI,137,228,231,47.147378,26.433183,"Over 137 silver coins found with a ceramic vessel: 136 denarii, 1 drachm: Republic – Severus Alexander (AD 228-231).","History Museum, Târgu Neamț (24 coins); Local Museum, Târpești (44 coins)",III century
France,1807,6374,MONTÉLIMAR,11,253,260,44.553,4.75,"The hoard comprised a large quantity of coins, although only 11 were identified. They included issues of Gordian III, Gallienus and Salonina. It seems likely that this is the same hoard as one mentioned by M. Faujas de Saint-Fond in 1810 which comprised 'a very large number of medium and small bronze Roman coins from Gallienus to the House of Constantine'.",NA,III century
Belgium,1898,3962,WERKEN,102,260,268,51.034,2.969,"102 coins: 5 antoniniani, 23 sestertii, 74 bronze (sestertii?): Domitian - Gallienus/Postumus (AD 260-268); silver weight: 4.0-12.1 g.","Musées royaux des Beaux-Arts de Belgique, Bruxelles, Belgium (102 coins)",III century
Belgium,1930,3914,SAINT-MARD 1930,229,270,275,49.5593,5.5271,"(300) 229 coins: 1 sestertius, 228 antoniniani (radiates): Domitian - Aurelian (AD 270-275); silver weight: 64.2-669.9 g.","Collection Dr. Dordu (229 coins), in 1938",III century
Bulgaria,1975,12357,SHIROKO POLE,175,249,251,41.637,25.467,175 antoniniani entered museum collection in Kardzhali: Gordian III - Philip I (AD 244-249). No further information.,"Regional History Museum, Kardzhali, Bulgaria",III century
Germany,1906,17015,KASTELL ZUGMANTEL KELLER 83,14,223,230,50.18977,8.20364,14 denarii (late Republic to Severus Alexander) were found in 1906 in front of the door sill of cellar 83 (in the Roman settlement).,NA,III century
Germany,1927,3767,LEIMERSHEIM,365,259,260,49.1242608,8.345698,"In 1927 about 360 denarii and antoniniani (Caracalla - Postumus) were unearthed. The coins were strewn on the ground, on a place located on the floodplain of the river Rhine. There was also half of a longsword, remnants of scissors, 4 bronze rings and 50 tokens of glass and glass base.","Historisches Museum, Speyer",III century
Italy,1942,16205,MASI 1942,22,244,247,45.9563,12.5324,"The surviving part of a larger hoard includes 16 denari and 6 antoniniani (radiates) from Mark Antony to Philip I (32 BC-247 AD) kept in a private collection. The original amount of the hoard remains unknown. Given the very little distance between the two findspots, Masi I and Masi II should be two sections of the same hoard deposited in different places by its owner.",Private collection,III century
Luxembourg,1856,3682,ETTELBRÜCK 1856,600,262,269,49.8467,6.0933,600 antoniniani (radiates): Gordian III - Postumus (AD 260-269). Found close to the hoard ETTELBRÜCK 1889. Silver: 592 coins; Silver weight: 161.1-740.3g.,Mr. Kieffer,III century
France,1964,7074,CHÂTEAUBLEAU CENTRAL POOL,27,260,269,48.588,3.108,The deposit was discovered over the course of several seasons of excavation at the major Gallo-Roman spring sanctuary site and comprised 27 bronze coins of Postumus.,NA,III century
Germany,1906,3359,NIEDERBIEBER 1906,889,253,260,50.468045388375,7.4725760085976,"A small bronze cauldron containing a linen bag with the coins. The money consists of 889 antoniniani (radiates) from Elagabalus to Valerian I and Gallienus. Two pieces of silver-plated crockery, a plate and a platter, were found next to the cauldron.",NA,III century
Croatia,1839,6957,POŽEGA 1839 - NEAR,93,276,282,45.331,17.674,The hoard comprised 93 antoniniani (radiates) from Valerian I and Gallienus to Probus with a tpq of AD 282.,"Franciscan monastery, Požega",III century
Netherlands,1966,12676,AARDENBURG 1966,52,271,274,51.274,3.445,"52 coins: 1 denarius, 31 antoniniani (radiates), 5 antoniniani (radiates) imitations, 12 sestertii, 1 dupondius, 2 unknown denomination: Vespasian - Tetricus I (AD 271-274).",Municipality of Aardenburg,III century
Bulgaria,1933,10246,VELIKO TARNOVO - COUNTY 1933,100,238,244,43.099,25.71,"More than 100 bronze coins have been found. 68 were seen: Commodus - Gordian III - minted in Nicopolis ad Istrum 35, Marcianopolis 27, Hadrianopolis 3, Anchialus 2, Serdica. 19 are kept in the museum collection in Lyaskovets.",NA,III century
Hungary,1953,3403,RÁBAKOVÁCSI,3,255,256,47.164,16.87,"Three aurei part of a chain, 2 mounted in pendants: Valerian I (2), Valerianus II Caesar) (AD 255-256)",NA,III century
Germany,1928,16839,TRIER - EROSKELLER/STEINUMRAHMUNG VII,15,202,210,49.746399025501,6.6410619735656,"51H includes the coins which were found in front of the temple, in the court by an urn.","Rheinisches Landesmuseum, Trier, Germany (inv.no. F 7104a)",III century
France,1951,3808,NEUVY-BOUIN,1454,276,282,46.677,-0.461,"The hoard comprised a jug containing an agglomeration of 1,454 Roman coins found with a small ceramic vessel. Gallia states that 1,458 coins were found, but only 1,454 were detailed. TAF suggests that a further 4 unidentified coins could be added: Gordian III - Probus (AD 276-282); silver weight: c.248.3-1144.0g.",NA,III century
Hungary,1934,5281,KECEL 1934,2596,214,217,46.524,19.245,"2,596 denarii (among: 1 plated, 47 'barbarous'): Republic - Caracalla (AD 214).","Magyar Nemzeti Múzeum Budapest, Hungary",III century
France,1800,3123,TRONCHOY,2001,222,235,49.828,1.865,"Over 2,000 aurei found with a ceramic vessel: Tiberius - Severus Alexander (AD 222-235); gold weight: c. 12801.4-15598.6g.",NA,III century
France,1876,4028,ÉCOUIS,4084,276,282,49.3103,1.4313,The hoard comprising a large earthenware vessel covered with a tile containing between 40 and 80kg of silver and billon coinage (denarii and radiates). A catalogue of 4084 coins was given to J. de Witte by the owner. A portion of the assemblage belonging to the finder was sold. ; Silver weight: 737.8-11636.9g.,Mathéus,III century
Russia,1915,3013,SEVENKI,200,218,222,51.8863,35.3378,"Hoard found during ploughing, 200 denarii: Vespasian - Septimius Severus (AD 193-211).",Hoard returned to finder,III century
Hungary,1961,2821,KISTORMÁS,809,258,258,46.5,18.565,"809 silver coins: 91 denarii, 718 antoniniani: Antoninus Pius (Faustina II) - Valerian I (AD 258). Found with two ceramic vessels.","Town museum, Szekszárd, Hungary",III century
France,1952,3987,BAVAY 1952,6263,287,289,50.298,3.794,"6,263 denarii and antoniniani (radiates): Rome (4,921); Viminiacum (4); Milan (340), Ticinum (6); Cologne (44); Trier (38); Lyon (2); Siscia (216); Sirmium (2); Antioch (2); Cyzicus (12); uncertain (4); imitations (1,068): Gordian III - Diocletian (AD 287-289). Found during the laying of electrical cables.",NA,III century
Spain,1988,4781,VILAUBA,47,258,259,42.0994,2.7425,"47 coins - 1 antoninianus (radiate), 45 sestertii, 1 as - found with a ceramic vessel in a Roman villa: Antoninus Pius - Valerian I and Gallienus (AD 258-259).",NA,III century
France,1843,7101,CONCEVREUX,1200,235,235,49.377,3.788,"The hoard comprised an urn containing 1,200 coins, mostly thought to be dupondii ('moyens bronzes'), but with some asses ('petits bronzes') and denarii. The coins range from issues of Vespasian to Severus Alexander.",NA,III century
Belgium,1990,8643,HABAY-LA-VIEILLE 1990-1991,32,260,265,49.723,5.619,"32 coins: 23 sestertii, 7 dupondii and 2 antoniniani (radiates): Titus - Postumus (AD 260-268).",NA,III century
Serbia,1914,3949,VLADIMIRCI,1739,270,275,44.615,19.782,"1,739 antoniniani (radiates): Philip I - Aurelian (AD 270-275); silver weight: c. 541.0-2499.0 g.","National Museum, Blegrade, Serbia (1,739 coins) - 1981",III century
Croatia,1895,3807,MEDAK,100,270,275,44.450055,15.496686,"Hoard of circa 100 antoniniani (radiates), of which only 39 pieces were seen: Gallienus (sole) - Aurelian (AD 270-275).",AM Zagreb (39); dispersed,III century
Luxembourg,1920,3998,BURMERANGE,313,275,285,49.486,6.323,The hoard comprised a terracotta vessel containing at least 313 antoniniani (radiates) radiates: Valerian I and Gallienus - Aurelian (AD 270-275).,"Cabinet des Médailles du Musée d'Histoire et d'Art, Luxembourg; private collection",III century
France,1904,6968,PARIS VE (QUARTIER SORBONNE) 1904,73,276,282,48.844,2.345,The hoard comprised a copper-alloy vase containing 73 antoniniani (radiates) (or 60 according to Blanchet) from Gallienus to Probus.,NA,III century
France,1875,5721,SANDOUVILLE,1500,284,293,49.496903,0.3191899,"The hoard was found in a large ceramic vessel. Within the vessel were five corroded blocks of coins, each coated with very hard clay. Two thirds of the hoard was cleaned (except for 2 blocks weighing 5.5kg) and it appears that there were approximately 1,500 coins (bronzes and radiates). Between 200 and 250 coins were of the emperors between Augustus and Gallienus. The others were of Aurelian, Probus and Diocletian. The hoard was found by a farm labourer.",NA,III century
Bulgaria,1946,10400,GRADISHTE,2000,244,249,43.3287,26.8389,2000 silver coins found during road repairing works: Trajan - Philip I (AD 244-249).,NA,III century
Bulgaria,1960,12105,BLATNITSA,56,211,217,42.3733,24.4046,Unknown number of denarii. 56 coins entered the museum collection in Plovdiv: Nero - Caracalla (AD 211-217).,"Museum of Archaeology, Plovdiv, Bulgaria; inv.no. 2590",III century
Georgia,1942,16070,UREKI 1942,7,275,276,41.995809,41.761906,"One aureus of Tacitus, one gold barbarous imitation of an aureus, 4 drachms Hadrian, 1 denarius Septimius Severus were found in a grave together with jewelry.",NA,III century
Belgium,1870,3343,MORIALMÉ,137,241,243,50.277,4.564,"(169) 137 coins: 5 denarii, 1 antoninianus (radiate), 1 as: Domitian - Gordian III (AD 241-243); silver weight: 10.0-16.2 g","Archaeological Museum, Namur, Belgium (137, maybe 169 coins)",III century
France,1889,4097,NEUVILLE-SUR-AIN,9,287,287,46.1,5.393,"The hoard comprised a greyware vessel containing 9 aurei, some gold jewellery and a jet amulet. Gold: 9 coins; Gold weight: 45.4-46.0g. The entire hoard was acquired by Dr. E. Poncet for his private collection.",Dr E. Poncet private collection,III century
Bulgaria,1956,3220,DRAGOSINOVO,12,244,249,42.367,23.561,"30 silver coins, denarii and antoniniani. 12 pieces were recovered: 5 antoniniani, 7 denarii: Septimius Severus - Philip I (AD 244-249); silver weight: 39.0-70.0 g.",NA,III century
Egypt,1907,7899,EGYPT A103,1128,270,275,26.821,30.802,"1,126 billon Alexandrian tetradrachms, 2 Ptolemaic bronze coins: Ptolemaic dynasty - Aurelian (AD 270-275). 'Acquired in Egypt by Dattari, who sold it to Milne and Currelly'.","Partly in Oxford, partly in Toronto. Detailed list in Oxford",III century
Bulgaria,1960,10255,KOPRIVETS 1960-1961 2,42,243,244,43.406,25.879,Unknown number of silver coins. 42 pieces are kept in the Regional History Museum in Ruse: Caracalla - Gordian III (AD 243-244).,"Ruse Regional Museum of History, Bulgaria; inv.no. 1600 1-43",III century
Bulgaria,1968,10056,LUKOVIT 1968,2,211,217,43.208,24.163,Unknown quantity of provincial bronze coins. 2 pieces of Caracalla minted in Serdica are known,NA,III century
Romania,1942,2630,DRĂGĂŞANI,155,238,239,44.63,24.297,"154 silver coins: 149 denarii, 5 antoniniani (radiates): Vespasian - Gordian III (AD 238-239); silver weight: 217.9-454.5 g.",NA,III century
Romania,2012,18895,CRAIOVA - METRO,10,241,243,44.3137,23.8858,"Unknown original number of coins. Only 10 pieces were recovered: 8 denarii, 1 antoninianus (radiate), 1 plated denarius: Trajan - Gordian III (AD 241-243).","Muzeul Olteniei, Craiova, Romania",III century
Romania,1962,7744,BÂRCA 1962,1931,244,249,43.969,23.61,"The hoard comprises 1,931 denarii and antoniniani (radiates) from Vespasian to Philip I, as well as a single drachm of Geta from Caesarea in Cappadocia. Found with a ceramic vessel.","Museum of Oltenia, Craiova, Romania (inv.nos. 3557/1-1918; 29150-29195)",III century
Germany,1925,17735,MAINZ 1925,21,244,249,49.9956,8.2595,"18 (?) silver coins, found 1925 on the street 'Am Römerwall'. 21 coins are mentioned in the inventory of the Altermusmuseum, but the coins are now lost.",NA,III century
Bulgaria,1925,2748,LIPNIK 1925,170,238,244,43.59,26.53,"170 provincial coins: Nicopolis ad Istrum 77, Marcianopolis 69, Hadrianopolis 6, Odessos 4, Anchialus 9, Philippopolis 1, Pautalia 1: Caracalla - Gordian III (AD 238-244).","History Museum, Razgrad, Bulgaria",III century
Italy,1979,13871,ISOLA ROSSA,17,276,282,41.013091,8.874893,17 antoniniani (radiates) found while building a house: Valerian I and Gallienus (Gallienus) - Probus (AD 276-282).,"Museo Nazionale ""G.A. Sanna"", Sassari, Italy",III century
Bulgaria,1921,3395,POLSKI SENOVETZ,45,249,251,43.303,25.603,45 silver coins: Caracalla - Trajan Decius (AD 249-251); silver weight: 63.1-128.9 g.,NA,III century
Bulgaria,1954,12066,GOLYAMO KONARE 1954,80,222,235,42.27,24.54,Hoard found in a ceramic vessel consisting of 80 denarii. One denarius of Severus Alexander is known.,NA,III century
Serbia,1952,2785,SIKIRICA 1952,292,247,249,43.782,21.411,"(303) 292 silver coins: 240 denarii, 52 antoniniani (radiates): Vespasian - Philip I (AD 247-249); silver weight: 380.4-892.2 g.","National Museum Belgrade, Serbia, (292 coins) - 1981",III century
Switzerland,1935,9331,OLTEN - DÜNNERN SO 1935,1101,270,275,47.352,7.898,"Scattered hoard, found in the Dünnern river bed during correction works of the river bed. Over 1100 coins reported, 906 of them preserved. 8 coins from the 1st/2nd c. AD, the others range from Septimius Severus to Aurelian and Postumus to Tetricus II. Mostly antoniniani, except for the 1st/2nd c. coins and a denarius of Gordian III. Large numbers of coins from Gallienus and Claudius II.","Kantonsarchäologie, Solothurn",III century
Germany,1913,19959,BRECKERFELD,15,251,253,51.259473933929,7.4673332513817,"The 15 (lost) coins, ""mostly poorly preserved middle bronzes from Augustus to Trebonianus Gallus"", were found in 1913/14 during earthworks on the edge of a ravine near the Bühren estate. ""The coins were scattered over 100 m, 1 m deep.""",NA,III century
Belgium,1938,3656,DENDERLEEUW,20,260,269,50.88,4.07,(40) 20 silver coins: Septimius Severus - Postumus (AD 263); silver weight: c.14.6-84.0 g.,"Collection Derjicke, Iddergem, Belgium (20 coins), in 1965",III century
Romania,1931,3496,VÂRTOP,53,239,241,44.209543,23.346049,Few hundreds coins found with a large ceramic vessel and wonderful jewelry. 53 coins were studied: Trajan - Gordian III (AD 239-241); silver weight: 75.8-153.3 g.,"Museum of Oltenia, Craiova, Romania (53 coins).",III century
France,1826,7349,SAINT-BEAUZIRE,600,253,260,45.85,3.182,The hoard was found in a small wooden box and comprised between 5 and 600 antoniniani (radiates) from Gordian III to Valerian I and Gallienus (AD 253-260).,NA,III century
Germany,1898,3442,SPESBACH,42,260,268,49.4266998,7.5052019,"In 1898 42 coins (1 denarius and 41 antoniniani, Macrinus - Postumus) coins came into view during peat digging on the field 'Am Schachen' in the area of Spesbach. The coins were concealed together in a clump, 70-80 cm below the surface. The coins were lost during WWII.",NA,III century
Austria,1990,13277,ZILLINGTAL-STEINBRUNN,61,255,257,47.815,16.408,"61 coins found during fieldwalking and research at the place: 59 antoniniani, 2 denarii: Elagabalus - Valerian I and Gallienus (AD 255-257).",NA,III century
"England, United Kingdom",2013,14836,SWAFFHAM AREA 2013,4,258,260,52.642789,0.5259386,Four radiates foundfused together.,NA,III century
Greece,2004,6908,DION 2004,14,244,249,40.17724,22.49293,"14 bronze coins, ranging from Caracalla to Philip, found in a clay vessel in the destruction layer of a building in the north section of the Agora. More than 100 bronze (provincial, judging from those ill. in fig. 4 in AEMTh 18, 2004, p. 382) coins were also found in the same layer.",NA,III century
France,1878,7042,CHAMBRY,20,271,274,49.591,3.655,The hoard comprised Roman coins dating to the third century AD.,NA,III century
Bulgaria,1964,2757,IGNATICA,332,253,259,43.068,23.592,"332 silver coins: 45 denarii, 287 antoniniani: Septimius Severus - Valerian I (AD 253-259); silver weight: 383-758.6 g. Found in a ceramic vessel.","Regional History Museum, vratsa, Bulgaria; inv.no. M II 3011-3330 (320 coins)",III century
Austria,1879,2868,WIEN 1879,8,222,235,48.208,16.374,8 denarii found stuck together within a necropolis: Elagabalus - Severus Alexander (AD 222-235).,NA,III century
France,1908,3199,CLÈRES,230,251,253,49.5998,1.11,The hoard comprised more than 230 denarii and antoniniani (radiates): Septimius Severus (Geta and Julia Domna) - Trebonianus Gallus (AD 251-253); silver weight: 288.1-596.9 g.,Musée des Antiquités de Rouen (198 coins; inv.nos. III 2099-2102); Musée d'Avranches (32 coins),III century
Bosnia-Herzegovina,1885,3393,PODASTINJE,160,258,259,43.958,18.078,160 silver coins: Septimius Severus - Valerian I (AD 253-260).,AM Zagreb (41); ZM Sarajevo (114); Fojnica monastery; dispersed,III century
Germany,1832,3307,LANDSTUHL,11,244,247,49.4141464,7.5709052,"in 1852 on a hoard was dug out on a hill in a peat deposit of the Landstuhl municipality, on the island called Krimm. 11 silver coins (denarii and antoniniani, Geta - Philip) were published, but it remains unclear if this is the entire find or not.",NA,III century
Italy,2019,20622,VARZI,1300,270,275,44.822928303438,9.1948541350563,"1,300 antoniniani (radiates). ""Due to the poor state of preservation of the radiates hidden in Varzi, which were completely covered by corrosive elements… The first group of 95 radiates were restored between 2020 and 2021 […] The issuing authorities are Gallienus (3%), Claudius II (64%), Quintillus (8%) and Aurelianus (3%). The remaining part (22%) consists of unidentifiable specimens. Only 43 radiates can be attributed (for now) to a specific mint: the majority to the Siscia one (86%), followed by Rome (11%) and Mediolanum (3%).""","Soprintendenza Archeologia Belle Arti e Paesaggio, Pavia, Italy",III century
Portugal,1956,4820,BORBA,600,271,274,38.807,-7.458,"The hoard comprised approximately 600 coins. However, only 268 coins were catalogued: . The rest were sold: Valerian I and Gallienus - Aurelian /Tetricus I (AD 271-274).","Instituto Arqueologia de la Universidade de Coimbra, Portugal (200 coins); Mário de Castro Hipólito collection (68 coins)",III century
Italy,1930,14442,CASSANO MAGNAGO 1930,30,284,293,45.675951,8.826694,Hoard of antoniniani (radiates). Only 30 coins were seen: Gallienus (sole) - Maximian I (AD 284-293),NA,III century
Egypt,1760,7947,UPPER EGYPT A129,65,292,293,25.687,32.64,65 billon Alexandrian tetradrahms: Nero - Diocletian/Maximian (AD 292-293). 'Presented to the owner by Felix Cary in Marseilles and reported to have been found in Upper Egypt in 1760.','Probably now in Gotha as the rest of Schachmann's collection',III century
Italy,1979,13885,AOSTA 1979,11,241,244,45.740168,7.315757,11 bronze coins: Hadrian - Gordian III (AD 241-244).,"Museo Archeologico Regionale, Aosta, Italy",III century
Netherlands,1997,9991,PASSEWAAIJ 1997 - 2,27,205,205,51.871,5.4,27 denarii: Vespasian for Titus (Caesar) - Septimius Severus (AD 205).,"scattered in post pole - interpreted as save hoard, not ritual construction votive",III century
Turkey,2000,4751,ZEUGMA 2000 - I,462,243,244,37.057,37.869,"462 coins, mostly provincial issues of Caesarea in Cappadocia (150 coins) and imperial bronzes (130 coins), other bronze provincial issues and some imperial silver, closing with Gordian III, found in a deposit associated with the mid-third-century destruction of Zeugma.",NA,III century
Bulgaria,1962,2794,BELO POLE 1962,101,251,253,43.651,22.902,"101 coins: 16 denarii, 85 antoniniani: Caracalla - Trebonianus Gallus (AD 251-253); silver weight 122.1-240.8 g.","Regional Historical Museum, Vidin, Bulgaria; inv.no. 591",III century
Spain,1975,12937,LEÓN  - ARCO DE ‘LA CÁRCEL’,72,271,274,42.599,-5.567,Unknown originally number of coins. 72 antoniniani (radiates) were available for study: Valerian I and Gallienus - Aurelian (AD 270-275).,Museo de León,III century
France,1972,7200,ARLEUF 1972,24,249,249,47.059,4.008,"On the site of the Roman theatre, a hoard of 24 sestertii wrapped in cloth was found .",NA,III century
Bulgaria,1972,3401,PROLESHA,54,244,249,42.778,23.149,"54 silver coins: 26 antoniniani, 28 denarii: Commodus - Philip I (AD 244-249); silver weight: 72.6-130.1 g.","National Archaeological Institute with Museum, Sofia, Bulgaria; inv. no. CCXX",III century
Romania,1969,2692,ADAMCLISI 1969,1548,204,204,44.091,27.944,"1,548 denarii found with a ceramic vessel: Nero - Septimius Severus (AD 204); silver weight: 2,788.4-4,765.7 g.","Institute of Archaeology, Bucharest, Romania",III century
France,1953,5523,BAVAY 1953,8,240,243,50.259,3.801,The hoard comprised 8 dupondii from Titus to Gordian III.,NA,III century
Italy,1950,16206,NAVE,14,244,247,45.978,12.5036,The hoard includes 6 denari and 8 antoniniani (radiates) from Trajan to Philip I (AD 103-247) kept in a private collection.,Private collection,III century
Italy,1926,14377,MONTIGLIO MONFERRATO,60,268,270,45.067082,8.097209,"Hoard of circa 60 antoniniani (radiates) with coins from Gallienus, Salonina, Claudius II (AD 268-270).",NA,III century
Italy,1913,4040,GIGNOD,600,284,293,45.781812,7.297278,"600 antoniniani (radiates), of which 122 were recovered: Valerian I and Gallienus - Diocletian (AD 284-293); silver weight: 22.3-146.6 g.",NA,III century
France,1922,7428,ETRIGNY 1922,4066,275,276,46.592,4.804,"The hoard comprised a red ceramic vessel containing 4,066 radiates of Postumus, Macrianus, Tetricus I, Tetricus II, Victorinus, Gallienus, Claudius II, Aurelian and Tacitus.",NA,III century
Croatia,1952,3728,IMBRIOVEC,420,259,268,46.256,16.821,"Originally were 420 silver coins. 274 pieces were recovered: 1 denarius, 273 antoniniani (radiates): Caracalla - Gallienus/Postumus (AD 259-268).","Town Museum Koprivnica, Croatia (274 coins); partly dispersed - 1982",III century
Italy,1854,14256,GATTINARA,230,260,268,45.613645,8.36542,230 antoniniani (radiates): Gordian III - Gallienus (sole) (AD 260-268).,NA,III century
France,1801,7578,MISSERY,52,271,274,47.31,4.373,"The hoard comprised an unknown number of small radiates (officials or imitations?), from Victorinus to Tetricus I (AD 271-274).",NA,III century
Bulgaria,1942,3311,LEŠTA-HAN,5,238,244,42.386,23.874,"25 silver coins, 5 recovered: Septimius Severus Gordian III (AD 238-244); silver weight: 7.1-9.3 g.",NA,III century
Belgium,1872,3779,LOMPRET,370,269,269,50.064,4.378,370 antoniniani (radiates): Elagabalus - Marius (AD 269); silver weight: 102.2-959.7 g.,"Archaeological Museum Charleroi, Belgium (245 coins)",III century
"Scotland, United Kingdom",2000,18585,EAST WEMYSS,6,218,222,56.1592,-3.0677,"Six denarii ""fairly close together, possibly a small purse hoard. Not possible to obtain details of 2 of these, but the remaining 4 consists of: Hadrian, Antoninus Pius, Marcus Aurelius for Faustina II, Elagabalus (AD 218-222).",NA,III century
Spain,2005,12922,BENALMÁDENA,100,251,253,36.599,-4.517,100 sestertii found together on an opus signinum floor: Hadrian - Trebonianus Gallus (Volusian Augustus) (AD 251-253).,NA,III century
Spain,1920,12964,PEAL DEL BECERRO,1325,276,282,37.913,-3.125,"1,325 antoniniani (radiates) found with a ceramic vessel: Philip I - Probus (AD 276-282).",NA,III century
"Russia, Ukraine",1958,18241,SUDAK,1016,242,291,44.850516811101,34.975261674744,"A hoard of 1,016 of coins was found with an amphora. The majority of coins were bronze issues of the Bosporus kingdom. A billon antoninianus (radiate) of Gordian III was found among the coins.","Institute of Archaeology of the Academy of Sciences, Simferopol",III century
Bulgaria,1968,10318,ZVEZDA,105,244,249,43.279,26.236,Unknown number of provincial bronze coins. 105 pieces entered the museum collection in Popovo and Targovishte: Trajan - Philip I (AD 244-249).,"History Museum, Popovo, Bulgaria; inv.no. 306 (92 coins); History Museum, Targovishte, Bulgaria; inv.no. 689 (13 coins)",III century
Belgium,1944,8537,TOURNAI IX,1938,276,282,50.606,3.388,"1889 antoniniani, 43 imitations, 6 forgeries and some fragments: Elagabalus - Probus (AD 276-282).",NA,III century
"England, United Kingdom",1979,14735,"IVY CHIMNEYS, WITHAM 1979",329,275,285,51.786376,0.62280373,"254 radiate imitations and a single radiate found as a dispersed hoard over 4x1.5m area, within depth of up to 0.20m of soil. No sign of a container. No further contextual details.",NA,III century
Turkey,1954,3438,SMYRNA 1954,1244,257,257,38.419,27.129,1243 antoniniani (radiates) and one denarius from Caracalla to Valerian I.,unidentified US based private collector.,III century
Germany,1938,3540,ALZEY 1938,382,268,268,49.7462012,8.1171135,"A hoard of 381 silver coins (denarii and antoniniani ranging from Geta to Postumus) and 1 provincial coin, found in a vessel surrounded by fire rubble in a building located in front of the SE corner of the Roman fort. The coins had been contained in a bag made of hemp. A large number of ornaments had been placed on top to the vessel.",Alzey museum,III century
Hungary,1918,7501,PÉLIFÖLDSZENTKERESZT II,244,251,253,47.709,18.588,"244 silver coins: 117 denarii, 127 antoniniani: Nero - Trebonianus Gallus (AD 251-253). Found in a bronze vessel.",NA,III century
Bulgaria,1982,10341,TARGOVISHTE - COUNTY 1982-1983,38,238,244,43.359,26.315,Unknown number of Roman provincial bronze coins were found in unknown circumstances. 38 pieces are kept in the museum collection in Ruse: Septimius Severus - Gordian III (AD 238-244).,"National History Museum, Sofia, Bulgaria; inv. nos. 22168-22205",III century
