country,year_of_discovery,find_spot_id,find_spot_name,total_number_of_coins,terminal_year_earliest,terminal_year_latest,lat,long,summary,disposition,century
Bulgaria,1981,2702,GIGEN 1981,17,238,244,43.708,24.465,(Circa 20) 17 silver coins: Elagabalus - Gordian III (AD 238-244).,"Okrazen Istoriceski Muzej, Pleven, Bulgaria; inv.no. 1832 1-17",III century
Bulgaria,1990,12326,PREOBRAZHENTSI,114,244,249,42.795,27.332,114 provincial bronze coins: Antoninus I (Faustina I) - Philip I (AD 244-249).,"Regional Museum of History, Burgas, Bulgaria; inv.no. inv.no.741-758, 760-766,768-770,772-780, 782-842, 845-855, 982",III century
France,1927,6268,"PARIS - ""DANTON"" 1927",142,253,260,48.844871,2.339683,"142 coins in two vessels containing 71 sestertii from Titus to Septimius Severus and 71 antoniniani (radiates) from Gordian III to Gallienus. Only 54 were recovered and studied: 30 sestertii, 24 antoniniani (radiates).",NA,III century
France,1912,3933,TREPT,2110,260,270,45.686,5.318,"6.6 kg of coins, 2110 or 2400? antoniniani (radiates): Trebonianus Gallus - Claudius II/Postumus (AD 268-270) silver weight: 570.7-2636.5 g.",NA,III century
Belgium,1930,3502,VILVOORDE,17,241,241,50.927,4.426,"17 coins: 16 denarii, 1 dupondius: Hadrian - Gordian III (AD 241); silver weight: 23.9-44.2 g.","Cabinet des Médailles, Bruzelles, Belgium (1 coin); Collection H. Verlooy of Vilvoorde (16 coins), in 1967",III century
Austria,2006,13258,WACKERSBACH,28,256,256,48.296,13.974,28 antoniniani found during a fieldwalking: Elagabalus - Valerian I and Gallienus (AD 256).,"Oberösterreichischen Landesmuseum, Linz, Austria",III century
Russia,1958,18370,TAMAN 1958,198,266,278,45.211940939251,36.718454144933,"Hoard of 198 coins of the Bosporan kings, Rhescuporis V, Pharsanzes, Sauromates IV, Teiranes (AD 266-278).",NA,III century
Bulgaria,1962,3334,MIHAYLOVO 1962,26,247,249,42.249,25.524,"Large hoard. Only 25 silver coins are known: 9 denarii, 19 antoniniani (radiates): Gordian III - Philip I (AD 247-249); silver weight: 32.6-59 g.","Museum of History, Stara Zagora, Bulgaria; inv. no. 3343",III century
France,1565,6985,ALFORTVILLE,14,270,275,48.815,2.413,"The hoard comprised 'a large number of bronze coins, apparently in gold or silver. Fourteen were identified as issues of Aurelian.",NA,III century
France,1859,3839,OISY-LE-VERGER,123,260,269,50.251399,3.122178,"The hoard comprised 152 coins of which 128 were studied by Dancoisne. There were 12 sestertii and 116 denarii and antoniniani (radiates), although Dancoisne does not specify which coins are which! The hoard was found by workmen by the side of the river: -116 coins; silver weight: 34.0-336.1g.",NA,III century
Israel,2006,7727,SHU'AFAT 2006,117,222,235,31.813847371519,35.234378621922,The hoard comprised 117 bronze coins dated between Ptolemy I (323-283/2 BC) and Severus Alexander (AD 222-235).,Israel Antiquities Authority (IAA 100886-101000; 113001-2),III century
Germany,1900,20557,NIEDERBIEBER 1900 B,389,257,259,50.467712323519,7.472183558613,"Within lumps, the coins were arranged in stacks shifted sideways, 389 silver coins - denarii and antoniniani (radiates). All coins were covered with a light green patina. There are 88 denarii: Clodius Albius to Gordian III and 301 antoniniani (radiates): Macrinus Valerian I and Gallienus).",NA,III century
Romania,2002,16373,BUMBEŞTI-JIU 2002,92,238,244,45.1783,23.3811,Unknown originally coin number. 5 antoniniani (radiates) and 87 denarii are known: Septimius Severus - Gordian III (AD 238-244).,NA,III century
Greece,1939,6749,ANTHOCHORI,19,238,244,39.7347,21.1336,"The hoard comprised one silver coin and 18 bronze coins dating from the 3rd c. AD, found close to Metsovo (BCH 1939). Touratsoglou mentions 18 sestertii (Maximinus Thrax - Gordian III), next to 1 denarius / antoninianus, with the find spot Anthochori. No further information available.","Numismatic Museum, Athens",III century
Tunisia,1961,5372,LA CHEBBA,36,260,268,35.236,11.153,"Hoard given to Sfax Museum in October 1961, examined by Salama: 36 antoniniani: Valerian I and Gallienus - Gallienus (sole)? (AD 260-268).","Musée de Sfax, Tunisia",III century
Belgium,1819,3575,BEEZ,5000,271,274,50.468,4.922,(5000+) 14 antoniniani (radiates): Gallienus - Tetricus I (AD 271-274),"Archaeological Museum, Namur, Belgium (13 coins)",III century
Bulgaria,1987,10469,ASPARUHOVO 1987,758,244,249,43.18,27.889,758 imperial and provincial bronze coins entered the museum collection in Sofia: Titus - Philip I (AD 244-249).,"National History Museum, Sofia, Bulgaria; inv. nos. 42288-46046",III century
"England, United Kingdom",2012,14726,CHESHUNT 2012,74,239,239,51.727711,-0.061206292,"Assemblage of 95 Roman coins (1st century BC to 4th century AD) and eight Roman objects submitted as a potential Treasure case (the objects were considered unrelated to the coin hoard). Those coins and objects were found within 50 yd radius on a possible Roman site beside the projected course of Ermine Street with the aid of a metal detector.V. Drost writes; ""Among this assemblage are 66 copper alloy sestertii and sestertius fractions which could possibly be part of a hoard. The coins range from Vespasian (AD 69-79) to Gordian III (AD 238-44) and the composition is very similar to that of the Cowbit Hoard (BM ref.: 2003 T76). Most of the coins are dating to the 2nd century AD and are extremely worn as a result of an extended circulation until the deposition of the hoard well into the 3rd century AD. However, some of the coins struck under the Antonine dynasty are in a fairly good condition and it cannot be assured that all of the coins were originally part of the hoard. Eight silver denarii dating to the 1st and 2nd centuries AD could potentially be part of the hoard as well, even if hoards mixing silver coins and copper-alloy coins are not common. Nevertheless, it is difficult to ascertain that each one of those coins belong to the hoard. Note: a gold aureus of Trajan was previously found nearby.On the other hand, the 20 radiates or nummi dating to the 3rd and 4th centuries AD are very unlikely to be part of the hoard and can reasonably be considered as single finds."" (Unpublished catalogue).The denarii of Augustus and Vespasian are plated.",NA,III century
Croatia,1887,16765,VINKOVCI 1887,10,276,282,45.2855,18.803082,10 antoniniani (radiates) ranging from Claudius II to Probus (276-282) found in a grave.,AM Zagreb.,III century
Belgium,1831,8225,ELLEZELLES,79,269,271,50.734,3.68,79 antoniniani (radiates): Philip I - Victorinus (AD 269-271).,NA,III century
Portugal,1900,12935,SINTRA (?) - AREA,13,268,270,38.803,-9.382,13 antoniniani (radiates) of Gallienus and Claudius II part of a larger hoard?,"Museu Nacional de Arqueologia, Lisboa, Portugal",III century
Tunisia,1940,5366,GAFSA-GABÈS,133,253,259,34.429,8.781,133 sestertii studied from a total of 300 found: Trajan - Valerian I and Gallienus (AD 2543-259).,NA,III century
Syria,1936,9764,DURA EUROPOS 1,788,253,256,34.747,40.73,"A hoard of 788 tetradrachms (Caracalla - Trebonianus Gallus), denarii (Julia Mamaea) and antoniniani (Caracalla - Gallienus) found during the excavations at Dura Europos, in a jar under the embankment beside the Palmyra Gate.",Yale University,III century
Bulgaria,1924,12063,RAZHEVO 1,4453,283,285,42.371,24.801,A large ceramic vessel containing 15 kg of silver coins. 4453 antoniniani were published (Moushmov 1936): Aemilian - Carinus (AD 283-285).,"National Archaeological Institute with Museum, Sofia, Bulgaria; inv. no. LXIX (in 1925); 1,231 coins",III century
"England, United Kingdom",1974,14924,WATERCROOK ROMAN FORT,4,271,285,54.303243,-2.7544966,"3rd century. Roman fort at Watercrook S of Kendal was excav by Potter in 1975-5. In square stone guard chamber to NE gate of fort, one charcoal rich layer sandwiched in between two occupation layers/phases of use contained a 'large quantitity of objects' incl. pottery, bronze finger ring, arrowhead, calthrops, iron lock & building fittings, a surgical probe, & 4 coins close together. These dated to post-AD 268-273, & were of Claudius II, radiate copies of Victorinus, & Tetricus I. T.W. 1979. Romans in North-west England. Excavations at the Roman Forts of Ravenglass, Watercrook, and Bowness-on-Solway, pp. 158-160, figs. 60-61.",NA,III century
Greece,1948,6713,ATHENS AGORA SOUTH HOUSE B,40,267,267,37.9738,23.7205,"A hoard of 40 provincial coins from Athens (periods VB, VB/C, VC and VI), found among brocken crockery on the floor of the kitchen of the south house, on the northern slope of the Hill of the Nymphs.",NA,III century
Italy,1927,3705,GRUMELLO,3428,270,275,45.193315,9.8674,"3,428 antoniniani (radiates) found with a copper alloy pitcher: Trebonianus Gallus - Aurelian (AD 270-275); silver weight: 922.5-4265.3 g.","Museo Civico «Ala Ponzone» di Cremona, Italy",III century
Romania,1964,2658,LEURDA,26,251,251,44.7939,22.9935,"26 silver coins: 17 denarii, 9 antoniniani (radiates): Septimius Severus - Trajan Decius (AD 251); silver weight: 35.5-53.2 g.","Oltenia's Museum, Craiova, Romania (inv. no. 16.317)",III century
Spain,1985,12918,VALENCIA 1985,4,249,251,39.473981258732,-0.37424929717227,"The four coins appeared together in the west corner, belonging to a room structure erected with walls of opus vittatum.",NA,III century
Germany,1935,17199,BREMEN MAHNDORF,4,223,225,53.036079,8.940781,"Four coins (Syracuse, Augustus, Tiberius for Agrippa and Severus Alexander), allegedly found in the bed of the River Weser at low tide, at 'der Tiefer'. FMRD has listed this find under Bremen-Mahndorf, but doubts that it is genuine.",NA,III century
Egypt,1977,7946,MALLAWI A128,98,291,292,27.7334,30.8496,98 billon tetradrachms of Alexandria found with a ceramic vessel: Probus - Diocletian/Maximian I (AD 291-292). Briefly examined by Martin Price.,Dispersed. Handwritten list in London,III century
Slovenia,1963,5300,GRAČIČ,431,253,253,46.370222,15.413047,"431 coins: 295 denarii, 136 antoniniani: Commodus - Trebonianus Gallus (AD 253); silver weight: 584.0-1024.5 g.",Missing.,III century
Croatia,1899,2883,BARBARIĆI KRAVARSKI,1000,258,259,45.603,16.083,(+1000) 92 antoniniani: Gordian - Valerian I (AD 253-259,"Archaeological Museum Zagreb, Croatia (63 coins); dispersed -1981",III century
Bulgaria,1960,10316,DOLNA ROSITSA,500,238,244,43.142,26.295,(+500) provincial bronze coins. 37 pieces entered the museum collection in Targovishte: Septimius Severus - Gordian III (AD 238-244).,"History Museum, Targovishte, Bulgaria; inv.no. 48",III century
Syria,1999,20581,GINDAROS,123,222,235,36.384102,36.702106,"A hoard of 97 tetradrachms (Nero–Severus Alexander), 25 denarii, and 1 antoninianus, found in a trench excavation at Gindaros. As no further excavations were done araound that trench, the archaeological context remains so far uncertain.",Alep museum,III century
Bulgaria,1948,10399,VARBITSA,300,244,249,42.995,26.672,Unknown initial number of silver coins. 300 coins have been examined by Dr. Haralanov: Septimius Severus - Philip I (AD 244-249).,NA,III century
Israel,1993,7739,AVDAT 1993,6,215,217,30.794535073648,34.773853730908,The hoard comprised 5 tetradrachms (Trajan-Caracalla) and 1 denarius (Faustina II).,Israel Antiquity Authority (IAA 58824-58827; 58829-58830),III century
Egypt,1925,7886,KOM AUSHIM A98,860,268,269,29.52002,30.90223,860 billon tetradrachms: Marcus Aurelius - Claudius II (AD 268-269) found during excavations beneath the floor of an underground room of a house.,849 in Ann Arbor. The rest in various Egyptian museums,III century
Belgium,1856,3929,TOERNICH,3000,270,275,49.652,5.779,(c. 3000) 1831 antoniniani (radiates): Valerian I - Aurelian (AD 270-275); silver weight: c. 811.0-3749.0 g.,"Archaeological Museum, Arlon, Belgium (2259 coins)",III century
Bulgaria,1954,9734,VISHOVGRAD 1954,1716,244,249,43.157,25.299,"Initial quantity of silver coins: 13 kg, Studied: 9 kg (Gerov, B.) = 1790 coins: Septimius Severus - Trajan Decius (AD 249-251); silver weight: 2238.1-4652.9 g.","Archaeological Museum, Veliko Tarnovo, Bulgaria; inv.nos. 843-856 (1716 coins, stolen 1407)",III century
Romania,1935,16376,MANGALIA 1935,200,259,268,43.812223,28.582064,Hoard of circa 200 coins. Only 17 antoniniani (radiates) were recovered: Trajan Decius - Valerian I and Gallienus (AD 259).,NA,III century
Belgium,1873,8385,HESBAYE,170,284,289,50.542950849555,5.2179931520104,"170 bronze coins: 83 official, 87 provincial of Alexandria (Domitian - Maximian I). During excavations in this region, where many Roman settlements are known, this lot was presented to de Looz by the mayor of Hannut.",Unknown,III century
Italy,1886,14233,SETTIMO TORINESE,800,222,235,45.136847,7.770415,Around 800 denarii found with a copper alloy vessel: Vitellius - Severus Alexander (AD 222-235).,NA,III century
"England, United Kingdom",1940,14938,SEAHAM 1940-6,6,276,282,54.843059,-1.3475181,NMR record of 6 coins of Probus found in a field at Seaham and given to the Newcastle Society of Antiquaries. No further details.,NA,III century
Austria,1881,13255,VIRUNUM 1881-1883,67,270,275,46.698,14.367,67 antoniniani discovered in a room with hypocaust of a Roman edifice: Valerian I and Gallienus/Gallienus (sole) - Aurelian (AD 270-275).,Lost,III century
Romania,1974,2638,BOIŢA,214,238,244,45.63,24.25,"The hoard comprised 214 denarii and radiates from Commodus to Gordian III which are today lost. Also found in the excavations as isolated finds were a denarius of Septimius Severus, and 2 bronzes of Severus Alexander. Hobbs estimates a silver weight of 313.3-487.1g",Dispersed,III century
Egypt,1933,7930,KOM AUSHIM A111,127,282,283,29.51997,30.90218,127 tetradrachms of Alexandria: Claudius II - Carus (AD 282-283) found on the floor of an underground room during excavations of a house.,"102 coins in Ann Arbor, the rest in Cairo",III century
France,1983,5780,ÉVREUX 1983,294,241,244,49.0236,1.155,"294 bronze coins: 292 sestertii, 2 small bronzes, found with the fittings of a wooden box: Vespasian - Gordian III (AD 241-244).","Musée d’Évreux, France",III century
Greece,1981,6885,SINDOS 1981A,30,244,249,40.672,22.802,"A hoard of 30 coins (2 uncertain, 1 Imperial Roman; 27 provincial coins: Dion, Odessa, Pella, Koinon of Macedonia, Thessalonica, Cassandrea), found in a grave in Sindos in 1981, ending with coins of Philip.",NA,III century
Spain,1949,4758,COCA 1949-1950,18,214,214,41.2157967,-4.5220553,Originally between 80 and 100 coins were found of which only 2 aurei and 16 denarii were retained: Trajan - Caracalla (AD 214).,"Escuela de Capataces forestales (Castillo de Coca), Madrid",III century
Bulgaria,1946,12121,DRAGOMIR 1946,5,218,222,42.3697,24.4693,Unknown number of bronze coins. 5 pieces were examined: Caracalla - Elagabalus.,NA,III century
Bulgaria,1935,12163,SHANOVO,2000,235,238,42.557,25.633,"Circa 2,000 denarii but only 20 pieces indicate emperors from Antoninus Pius to Maximinus I Thrax.",NA,III century
Bulgaria,1963,3432,SLADAK KLADENETS 1963,12,244,249,42.403,25.389,"12 silver coins: 4 denarii, 8 antoniniani: Septimius Severus - Philip I (AD 244-249); silver weight: 16-26.8 g.",NA,III century
France,1861,5952,ASSÉRAC,5,260,269,47.44,-2.384,Bizeul described 5 antoniniani (radiates) found in Quénet which may be part of a larger hoard or perhaps the contents of a purse.,NA,III century
Bulgaria,1993,3316,LIPNIK 1993,619,249,250,43.59,26.53,"(619) 607 silver coins: 1 republican denarius, 235 imperial denarii and 371 antoniniani: M. Antony to Trajan Decius (AD 249-250); silver weight: 775.8-2053.0 g.","Regional Museum of History, Razgrad, Bulgaria; inv.no. IF, hoard 13",III century
Jordan,1956,5282,TELL KALAK,2350,222,225,32.031,35.898,"A hoard of 1985 denarii (Nero-Julia Mamaea); 310 drachms of Arabia (242 of which depict Arabia and 68 show a camel, some overstruck on Nabataean kings); 1 Caesarean drachm (Domitian); 31 tetradrachms of Antioch (Nero-Hadrian); 2 Lycian drachms (Trajan); 2 Amisus drachms (Hadrian), found in a village near Amman.","American Numismatic Society (2333, 2321 of which are still listed in ANS records), American University in Beirut (17)",III century
France,1911,6982,NOISY-LE-SEC,300,260,269,48.8923,2.4591,"The hoard comprised a ceramic vessel containing approximately 300 Roman coins including denarii, dupondii, asses and radiates terminating in a single issue of Postumus.",NA,III century
France,1868,4117,ROUEN 1868,25,295,296,49.449,1.098,"The Musée de Rouen has preserved 25 coins from this find, initially, it consisted of 33 antoniniani (radiates).","Musée des Antiquités de Rouen (collection Thaurin), France",III century
Bosnia-Herzegovina,1955,2834,OBUDOVAC,786,268,268,44.973,18.601,"Initially 805 antoniniani (radiates). 786 antoniniani (radiates): Gordian III - Postumus (AD 268). It included issues from the mint of Siscia, but the number is not given. Data for other mints was not recorded.",NA,III century
Czech Republic,1930,15903,KARLE 1930-1939,2,240,240,49.872156,16.30853,"Unknown originally number of coins. Only 2 asses are known: Nero, Gordian III.",Lost.,III century
Bulgaria,1955,10174,VARZULITSA,10,211,217,43.4282,25.4629,"10 provincial bronze coins. 1 of Septimius Severus, 1 of Caracalla, minted in Nicopolis ad Istrum and Marcianopolis.",NA,III century
Monaco,1879,4067,LA CONDAMINE,9,276,276,43.7342,7.4203,"The hoard comprised 9 gold coins: 1 multiple of 6 1/2 aurei, 8 aurei: Trajan (Plotina) - Florian (AD 276). Together were found jewelry: small gold male bust, three old bracelets, three gold armillae, rolled gold band, jet (or black glass paste) bracelet, black material bracelet, six small jet (or black glass paste) pieces, bronze pin.",NA,III century
Greece,1986,6893,METHONE 1986 GRAVE 8,12,244,249,40.447,22.59,"12 provincial coins ranging from Commodus to Philip (Dium, Thessalonica, Koinon of Macedononia) found in grave 8 in Methone.","Archaeological museum, Thessaloniki",III century
Bulgaria,1935,10320,KREPCHEA 1,156,249,251,43.482,26.135,1200 denarii found in ceramic vessel. 156 pieces entered the museum collection in Svishtov: Septimius Severus - Trajan Decius (AD 249-251).,"History Museum, Svishtov, Bulgaria; inv. nos. 1072-1142",III century
Greece,1976,6853,AMPHIPOLIS 1976,39,268,270,40.82442,23.84618,"The hoard comprised 1 radiate of Claudius II and 38 Provincial coins of the early third century AD, found in a grave (Grave Θ) in Amphipolis in 1976","Archaeological Museum, Kavala",III century
France,1928,12443,PRIMELLES,187,222,235,46.928,2.212,It comprised 187 sestertii found with a ceramic vessel: Nerva - Severus Alexander (AD 222-235).,"Bourges Museum, France",III century
France,1994,12994,PÉDERNEC 1994,2266,277,277,48.597,-3.27,"2,266 antoniniani (radiates) found in a bronze vessel: Septimius Severus - Probus (AD 277).",NA,III century
Belgium,1988,9211,TOURNAI XVII,1937,276,282,50.606,3.388,"1,937 antoniniani (radiates): Elagabalus - Probus (AD 276-282).",Musées Royaux d'Art et d'Histoire - Koninklijk Musea voor Kunst en Geschiedenis (Brussels),III century
France,1927,12384,SAINTE-MONTAINE,93,244,249,47.4901,2.3199,It comprised 93 sestertii found with a ceramic vessel. Only 88 are now recorded: Trajan - Philip I (AD 244-249).,NA,III century
Germany,2002,7430,XANTEN 2002 2,5,235,236,51.665,6.447,The hoard was found during the excavation of the courtyard of House L in Insula 27 at Colonia Ulpia Traiana. It comprised 5 denarii of Maximinus dating to AD 235-236. The excavation archives provide no further details about the circumstances of discovery.,NA,III century
Romania,1978,2708,MANGALIA 1978,43,238,244,43.817,28.583,43 silver coins: Vitellius - Gordian III (AD 238-244); silver weight: 61.6-125.1 g.,NA,III century
France,1847,5622,LENS 1847,12,238,244,50.42893,2.83183,The hoard comprised an 'unknown number of sestertii and 12 silver coins of Gordian III': Nerva - Gordian III (AD 238-244).,NA,III century
Belgium,1967,3198,CLAVIER 1967,1679,254,254,50.41,5.36,"1,680 silver coins: 1085 denarii, 595 antoniniani: Commodus - Valerian I (Gallienus (AD 254); silver weight: 2151.6-3837.1 g.","Musée Curtius, Liège, Belgium",III century
Bulgaria,2014,12358,PRESLAVETS,49,244,249,41.979,25.882,"49 coins were discovered near an ancient settlement during archaeological excavations: 31 antoniniani, 17 denarii, 1 provincial bronze: Septimius Severus - Philip I (AD 244-249).",NA,III century
Bulgaria,1914,10481,GROZDYOVO,60,244,249,43.027,27.544,60 silver and bronze coins found by workers 19 provincial bronze coins were aquired by the Varna Archaeological Society: Gordian - Philip I (AD 244-249).,NA,III century
Germany,1853,3112,SCHROTZBURG AUF DEM SCHIENERBERG,10,222,235,47.70292,8.89929,"10 coins found at Schrotzbug, which is a medieval castle on the Schienerberg: 1 dupondius, 2 aurei and 7 denarii, ranging from Titus Caesar to Severus Alexander.",NA,III century
Morocco,1965,16186,VOLUBILIS 1965,190,283,285,34.073,-5.557,190 coins found with a pot: Gordian III - Carinus (AD 283-285).,NA,III century
Slovenia,1910,8118,LJUBLJANA 1910-1911 - INTRA MUROS,29,276,282,46.046,14.501,29 antoniniani (radiates): Aurelian - Probus (AD 276-282).,"Deutscher Ritterorden, Vienna, Austria",III century
Belgium,1994,8581,WEST-VLAANDEREN,303,260,269,50.504,4.47,"Only 303 antoniniani (radiates) are identified. The exact findspot is not known, but it is possible that it comes from Oudenburg, Gistel or Torhout: Gordian III - Postumus (AD 260-269).",NA,III century
Romania,1872,2651,BAND,20,244,247,46.576,24.374,"Unknown initial number of coins. 20 silver coins: 19 antoniniani, 1 denarius: Elagabalus - Philip I (AD 244-247); silver weight of 25.1-49.1 g.",Dispersed,III century
Bulgaria,1967,3391,PLOVDIV 1967 A,17,238,244,42.135,24.745,"17 coins: 1 denarius, 16 provincial bronzes: Commodus - Gordian III (AD 238-244).","Museum of Archaeology, Plovdiv, Bulgaria; inv. no. 2491",III century
"England, United Kingdom",2014,14615,WEST KNOYLE CP,6,223,223,51.087089,-2.2298176,IARCH record for a scattered hoard of 6 denarii. Other coins have been recorded from the immediate area but they were not considered to be part of this hoard. For full details and images see SOM-D0A907.,NA,III century
France,1971,6087,DONTREIX,57,222,235,45.986,2.559,"The hoard comprised 57 bronzes dating to the second and third century AD. Sherds of pottery were recovered at the same time as the hoard suggesting that it was originally stored in a vessel. The hoard was discovered in a molehill. Although mentioned in numerous publications, it has never been studied in any detail. It was kept by the Club archéologique d'Auzances.","Club archéologique d'Auzances, France",III century
France,1875,5534,CAMBRAI,700,270,275,50.174,3.237,"700 radiates The hoard was bought by H. Rigaux, but doesn't appear to have gone to Lille Museum with the rest of his collection.","Rigaux, H.",III century
Greece,2006,6907,PELLA WEST CEMETERY 2006 (KER. 52),8,222,235,40.763,22.526,"A hoard of 8 Roman Provincial coins from the mints of Thessalonica, Edessa, Pella and the Macedonian Koinon from the period AD 222-235, found in grave 52 in the western cemetery of Pella.",NA,III century
Italy,2003,12497,CURAGO,11,244,246,46.176,12.366,The hoard comprised 11 sestertii: Hadrian-Philip I (117-246 AD).,"Soprintendenza per i Beni Archeologici del Veneto, Padova, Italy",III century
France,1886,17494,PUYCASQUIER,1447,293,298,43.746158393296,0.74775388963543,"1,447 antoniniani (radiates): Valerian I and Gallienus/Gallienus (sole) - Diocletian-Maximianus I (AD 293-294).",NA,III century
France,1962,12980,"BOURG-BLANC 1962, 1980",980,272,272,48.5,-4.507,"980 antoniniani (radiates) found in two lots, in 1962, 1980, in a ceramic vessel: Septimius Severus (Geta Caesar/Augustus) - Tetricus I (AD 272).","Cabinet des Médailles du Bibliotheque Nationale de France, Paris",III century
France,1954,7454,LOUHANS,147,247,249,46.6294,5.2255,"The hoard comprised a copper-alloy spoon and 147 copper-alloy coins from Titus, Domitian, Nerva, Trajan, Hadrian, Antoninus Pius, Faustina I, Marcus Aurelius, Faustina II, Lucilla, Commodus, Septimius Severus, Julia Domna, Caracalla, Julia Mamaea, Severus Alexander, Maximinus, Pupienus, Gordian III and Philip II.",NA,III century
France,1734,7875,AUXERRE 1734,4000,271,274,47.798,3.574,The hoard comprised c. 3/4000 antoniniani (radiates) ending with coins of Tetricus I (AD 271-274).,NA,III century
Bulgaria,1965,3504,VINITSA,90,244,249,43.083,26.767,"90 silver coins: 23 denarii, 67 antoniniani: Antoninus Pius - Philip I (AD 244-249); silver weight: 125.5-252.4 g.",NA,III century
"Wales, United Kingdom",1842,2911,ABERGELE 1842 B,800,201,206,53.274167,-3.571707,"About 800 denarii (Mark Antony to Caracalla) and fragments of a possible ceramic container found by workmen digging a ditch near Bron-y-Berllan farm. The original size of the find is uncertain; Davies (1929) records that the workmen who made the find pocketed an unknown number of coins, and that the remainder of the hoard was split between the British Museum (18 coins) and the Verney family of Bodelwyddan Castle, Anglesey. The size and condition of the hoard cannot be accounted for until 1918, when only 333 coins were transferred from Bodelwyddan to the Bangor museum. Robertson's examinations of the hoard in 1937 and 1948 identified 350 coins split between Bangor and the British Museum; the whereabouts of the remainder are unknown.","Storiel Museum, Bangor (c. 300 coins); British Museum (18 coins)",III century
France,1975,5851,NOYEN-SUR-SARTHE,8,222,235,47.871227,-0.09721,The coins were found during the rescue excavation of a villa: Trajan - Severus Alexander (AD 222-235).,NA,III century
Georgia,1939,16066,STALINIRI,3,283,285,42.220457,43.972818,One barbarous imitation of a Roman gold coin found in a grave together with a denarius of Augustus coin of Caius and Lucius and a plausible drachm of Gotarzes II.,"National Museum of Georgia, Tbilisi",III century
