country,year_of_discovery,find_spot_id,find_spot_name,total_number_of_coins,terminal_year_earliest,terminal_year_latest,lat,long,summary,disposition,century
Algeria,1948,4942,TIPASA 1948-1950,86,143,143,36.618,2.391,The hoard comprised 86 denarii from Mark Antony to Antoninus Pius (AD 143).,NA,II century
Romania,1975,6124,DEALUL PERJULUI,49,140,140,46.455,27.26,(52) 49 denarii found with a ceramic vessel of Carpic manufacture: Vespasian - Antoninus Pius (Diva Faustina I) (post AD 141).,History and Art Museum Bacău,II century
Hungary,1995,18525,KECSKEMÉT-HETÉNYEGYHÁZA,48,192,192,46.944394750045,19.610492607613,Forty-eight Roman denarii were found with a ceramic vessel in the rubble of a Sarmatian house in 1995 in the area of ​​an Avar burial ground in Hetényegyháza.,NA,II century
Israel,2006,7813,NESHER-RAMLA 2006 B,65,117,138,31.932,34.873,The hoard comprised 65 bronze coins dated between 294-283 BC and AD 117-138.,NA,II century
"England, United Kingdom",1990,14570,PADSTOW AREA,14,190,190,50.5553,-4.9519082,Group of 15 first and second century copper alloy coins metal-detected from the same field over a period of years between 1990 and 1998.,NA,II century
Poland,1887,13618,WROCŁAW ZAKRZÓW,4,161,179,51.162069,17.131942,"4 denarii found in the lid from a wooden box (Cassette) found in a princely grave: Hadrian 1, Marcus Aurelius/Lucius Verus 1, uncertain 2. In the same grave was found on the left side of the Skeleton an aureus of Clausiud II (see single gold find WROCŁAW ZAKRZÓW).","Museum Breslau (inv.no. 265:89) (until 1945). Today, lost.",II century
Slovenia,1963,5471,LJUBLJANA 1963 - INSULA XXIX,16,107,110,46.0495,14.501,16 aurei: Vespasian - Trajan (AD 107-110).,"Mestni muzej, Ljubljana, Slovenia",II century
"England, United Kingdom",1826,53,CASTLETHORPE,55,161,169,52.079589,-0.83403465,"A hoard found in a field south of Castlethorpe, comprising 20 denarii and 35 bronze coins, up to Lucius Verus.",NA,II century
Israel,2007,5387,WADI ḤAMAM 2007-2012 B,11,119,120,32.827251361842,35.48938664144,"The hoard comprised 11 bronze coins, dating between AD 79/80 and AD 119/120.",Israel Antiquity Authority (IAA 149385-149395),II century
Romania,1971,16305,TĂMĂȘENI,52,161,180,46.993303,26.951325,Unknown originally number of coins. 52 denarii were found with a hand-made ceramic vessel: Mark Antony – Marcus Aurelius (AD 161-180).,"History Museum, Roman, Romania",II century
Romania,1965,5259,BÎRGĂOANI,771,179,180,47.005,26.652,771 denarii: Nero - Marcus Aurelius (AD 179-180); Septimius Severus coin is an intruder. There were two ceramic vessels buried at 2 m one from the other at the same depth of 0.25 m.,National Museum of History Bucharest; Museum of History and Archaeology Piatra Neamț (Romania),II century
Israel,1992,7740,AVDAT 1992,5,113,113,30.794,34.772,The hoard comprised 5 drachms of Trajan minted in Bostra (AD 113).,Israel Antiquity Authority (IAA 61417-61429; 61422),II century
Germany,1880,17137,APELSTEDT,6,193,193,52.806341,8.742129,"A small hoard of denarii (6+ specimens, Antoninus Pius - Pertinax), found in or around Apelstedt.",Landesmuseum Hannover,II century
Moldova,1965,9157,ROTUNDA,27,190,191,48.24,27.31,(c. 40) 27 denarii found with a ceramic vessel: Trajan - Commodus (AD 190-191).,"Muzeul Naţional de Etnografie şi Istorie Naturală; Inv. 18.494/AR 6.698-6.724, N 6.110; acquisition document 86/22.05.1986.",II century
Israel,2012,7617,NAḤAL SHALWA,136,117,138,31.565,34.794,"The hoard comprised 4 aurei and 132 silver coins, as well as jewellery from the second century AD: Nero - Hadrian (AD 117-138). Associated with Bar Kochba revolt (AD 132-135).",Israel Antiquity Authority (IAA 146753-146888),II century
Romania,1851,16322,PLOPANA,300,161,180,46.680208,27.220599,"Over 300 denarii, only 8 coins were seen: Antoninus Pius 1, Antoninus Pius (Faustina I/Diva Faustina I) Marcus Aurelius 2, Marcus Aurelius (Faustina II/Diva Faustina II), Marcus Aurelius (Commodus Caesar), Marcus Aurelius (Lucilla).",NA,II century
Bulgaria,1980,10251,BABOVO 1980-1985 A,1600,138,161,43.9815,26.3013,1600 denarii found in a ceramic vessel - metal detecting - within an ancient settlement. The latest coins are from Antoninus Pius (AD 138-161).,NA,II century
Poland,1942,13428,GNOJNO-PIASKI,3,139,139,50.601386,20.849637,"Large hoard of Roman denarii found in two ceramic vessels. Only 3 have provided some information on the issuers: Trajan 2, Antoninus Pius (Marcus Aurelius caesar) 1.",2 coins in private collectionin 1958; lost,II century
Bulgaria,1961,10101,SMIRNENSKI 1961,1481,169,170,43.6297,23.0328,"Unknown initial number of coins. 1,481 denarii: Nero - Marcus Aurelius (AD 169-170).","Regional History Museum, Vratsa, Bulgaria; inv.nos. M I 453-1933",II century
Czech Republic,1892,15859,KLUK,49,161,180,49.903,15.3246,"Circa 50 denarii, kept in a belt? 49 documented: Galba – Marcus Aurelius (Faustina II/Diva Faustina II) (AD 161-180).","National Museum, Prague, (inv.nos. H5-27.066–27.073); Museum of Poděbrady (inv.nos. 15.566–15.574, 15.576–15.577, 15.579–15.591) (inv.nos. 15.575, 15.578 were stolen), Czech Republic. Some of the coins are missing today.",II century
Poland,1976,13525,ŚWILCZA,10,186,192,50.071667,21.900278,Unknown originally number of denarii. Only 10 pieces are known: Hadrian - Commodus (AD 186-192).,NA,II century
Austria,1985,2856,NEUNKIRCHEN,175,166,180,47.717,16.083,"175 silver coins: 173 denarii, 1 quinarius and 1 drachm: Republic - Marcus Aurelius (AD 161-180).","Stadtmuseum, Neunkirchen (165 coins), private collection? (10 coins), Austria; lost (unknown no.)",II century
France,1842,5776,DAMVILLE,5,162,163,48.87,1.073,"The hoard was found in a heap of stones without any obvious container and comprised 'some Roman gold coins. There is some debate over the number of coins found. According to Chassant, there were 5, but Leclerc de Pulligny suggests there was 'a multitude'. Pulligny also mentions a coin of Lucius Verus, but this is not recorded amongst the coins examined by Chassant. Found in a pile of stones with no obvious container.",Miard,II century
France,1859,6078,VERNEUIL-SUR-VIENNE,5,138,161,45.849282,1.126404,The coins were found in a glass urn along with a human cremation. Among issuers Hadrian and Antoninus Pius.,NA,II century
France,1945,5863,TEILLÉ,16,138,161,47.461,-1.279,"The hoard comprised 16 coins with the denominations not given. The hoard was found on the Barre farm, while making repairs to the farmyard.",NA,II century
France,1836,6335,LYON 1836 2,25,145,145,45.78,4.799,"25 silver denarii were found along with a considerable amount of human bone, interpreted as being an indicator of a battlefield site.",NA,II century
"England, United Kingdom",2011,14862,AMBER VALLEY 2011-13,9,166,180,53.055049,-1.4643516,"6 sestertii recorded with the PAS, 3 further from excavation of the site (see Amber Valley barbarous radiate hoard). Not classed as Treasure.",NA,II century
Poland,1905,13469,ŁÓDŹ - SURROUNDINGS,300,161,162,51.776667,19.454722,Hoard of 300 denarii found with a vessel. 130 pieces are known: Antoninus Pius - Marcus Aurelius (AD 161-180).,"At the beginning of the 20th century, in the collection of the industrialist Hertig in Łódź.",II century
Sweden,1901,15533,KÄRNA-KÄNNE 1901,2,186,186,57.245327,18.508032,Two denarii of Commodus (AD 186); silver weight: 4.66 g.,"Swedish History Museum, Stockholm (inv.no. 11470)",II century
Portugal,1954,5476,BRAGA AREA,170,167,168,41.545,-8.427,The hoard comprised 171 aurei and 1 denarius from Nero to Marcus Aurelius.,"União de Bancos Portugueses. Fundação Millenium, Oporto, Romania",II century
Poland,1959,13501,ROMANÓW,350,194,195,50.926667,23.133611,Hoard of circa 700 denarii. Only 350 pieces are known: Trajan - Septimius Severus (AD 194-195).,NA,II century
Egypt,1901,7809,MALLAWI A67,800,180,192,27.733,30.84,c. 800 aurei: Hadrian - Commodus (AD 180-192). No further information given.,Probably dispersed,II century
Ukraine,1942,2975,LUKOSHCHINO,1000,193,196,49.489816919667,34.589097179753,"Hoard of around 1,000 silver coins: 999 denarii, 1 drachm: Nero - Septimius Severus (Julia Domna) (AD 193-211).","Poltava Local History Museum (954 specimens; inv.nos. 4919-4920, 5090)",II century
Israel,1962,7604,JUDAEAN DESERT,24,132,136,31.515,35.274,"The hoard comprised 4 tetradrachms, at least 20 denarii, and ""a large number of bronze"" coins of the Bar Kokhba Revolt (AD 132-135/136).",NA,II century
Sweden,1898,15593,EJMUNDS,14,189,189,57.445989,18.267775,"Originally, 78 denarii, 14 preserved: Antoninus Pius - Commodus (AD 189); silver weight: 36.63 g. (14 coins).","Swedish History Museum, Stockholm (inv.no. 10704)",II century
Romania,1951,16333,VLĂDICENI,74,180,192,46.934563,26.678647,74 denarii: Vespasian – Commodus (AD 180-192).,"History Museum, Piatra Neamț, Romania",II century
Hungary,2009,16617,KOMÁROM-SZŐNY 2009,4,121,122,47.733475,18.156686,"Purse(?) of four sestertii: Trajan 2, Hadrian I 2 (AD 121-122) found near a wall in the area of the civil town.","Klapka György Museum (Komárom), Hungary (inv.nos. 2009. K17.098.1-4)",II century
Poland,1903,13647,DURĄG,2,169,170,53.613983,20.026722,"Two denarii found together: Hadrian, Marcus Aurelius.",NA,II century
Germany,1896,17369,RUDOLSTADT,3,117,138,50.718089,11.340337,"Three denarii of Hadrian, found around 1896 on the Debra, a plateau approx. 1.5 km northeast of Rudolstadt, near Debrahof, on Rudolstadt-Teichweiden road; the coins could form part of a larger hoard of denarii.",NA,II century
Croatia,1882,5394,OSIJEK 1882,2,138,161,45.555,18.696,A hoard of silver and bronze (perhaps also gold) coins. There is only data for two coins of Antoninius Pius.,NA,II century
Lithuania,1938,15444,VERŠVAI,7,161,180,54.928322,23.952113,"7 sestertii: Trajan 2, Hadrian (Sabina) 1, Antoninus Pius (Faustina I) 2, Marcus Aurelius 2 (AD 161-180).","Private collection P. Baleniunas, Kaunas",II century
Spain,1960,12882,RABAL,86,119,120,41.847676366576,-7.4403051936419,Unknown originally number of coins. 86 bronze coins: Tiberius - Hadrian (AD 119-120).,"Museo Arqueológico Provincial de Orense, Spain; private collections of M. Taborda and X. Taborda",II century
"Wales, United Kingdom",1924,1791,BRECON GAER,9,120,121,51.950472,-3.4564508,"9 denarii (Vespasian to Trajan) found among the infill of a trench carrying a conduit to service latrines in Building B, outside the north-western corner of the fort. Wheeler (1927) dated the infill (and therefore the construction of the conduit) by the date of the latest coin, arguing that its fine condition supported a deposition soon after its issue around AD 120. Simpson (1967) agreed that the hoard must have been deposited at about this time, but added that the accompanying pottery indicated the conduit and trench belonged to the later second or third centuries. The hoard, therefore, is likely to have been disturbed and moved from its original place of burial among the soil and other waste material used to fill the trench.",National Museum Cardiff,II century
France,1858,5630,PERNES-LÈS-BOULOGNE,176,161,180,50.751893,1.701299,The hoard comprised between 150 and 175 bronze coins 'mostly of the Early Empire'. One coin bears the effigy of Faustina II,NA,II century
Egypt,1923,5226,TELL SAKHA A 35,299,114,117,31.08,30.94,"Hoard bought by E.T. Newell in Cairo in Dec. 1923, found near Sakha. It comprised 299 coins: 33 Greek silver coins from the 2nd and 1st c. BC, 261 denarii (Nero to Trajan) and 5 provincial silver issues of Trajan (one Arabian drachm; three drachms of Cyrenaica and one hemidrachm of Cyrenaica).",NA,II century
"England, United Kingdom",2008,14956,OSWESTRY AREA II,23,161,176,52.863042,-3.0263448,"100 denarii found in June 2008 (Oswestry Area I), followed by a further 23 denarii found in September 2008 (Oswestry Area II), both up to Marcus Aurelius. These were regarded as two separate groups, even if the date range is similar.",NA,II century
Slovenia,1992,9064,CELJE - SPODNJI GRAD [LOWER CASTLE],4,176,177,46.229,15.261,"4 coins: 1 denarius, 3 sestertii: Vespasian, Hadrian Marcus Aurelius (2)","Pokrajinski muzej Celje, Slovenia",II century
Georgia,1940,18758,MTSKHETA 1940 2,6,117,138,41.846495,44.71702,"Six gold Roman coins found in a burial: Vespasian 1, Trajan 1, Hadrian 4.",Uncertain,II century
Denmark,2014,20017,HILLESTED,97,193,194,54.753096023119,11.446998986087,Denarius hoard consisting of 97 denarii found through metal detectoring and excavation. Vespasian to Antoninus Pius.,NA,II century
Switzerland,1957,6442,AIROLO TI - MADRANO 1957 / TOMB 2,4,176,176,46.526,8.628,"The hoard comprised 4 sestertii ranging from Trajan to Faustina II. They were recovered during the excavation of a inhumation burial (tomb 2/1957) in the necropolis and were interpreted as the contents of a purse. Only 2 coins preserved, but descriptions of all of them exist.","Ufficio dei beni culturali, Bellinzona (2 coins); lost (2 coins)",II century
Germany,1919,16475,BERLIN-LICHTERFELDE 1919,5,181,181,52.4314,13.3097,"Five denarii, from the reigns of Antoninus Pius, Marcus Aurelius, and Commodus, discovered in a garden in Berlin-Lichterfelde in 1919.",NA,II century
Hungary,1919,13136,ZALAHOSSZÚJFALU 1919,171,158,159,46.761,17.103,"171 coins: 169 denarii,1 sestertius, 1 dupondius: Nero - Antoninus Pius (AD 158-159).","Balaton Museum, Keszthely (91 coins); private collection (72 coins), Hungary",II century
Poland,1956,13536,WILKÓW,100,193,193,50.770833,23.765278,Circa 150 denarii. 100 were studied: Hadrian - Pertinax (AD 193).,NA,II century
Georgia,1940,16034,MTSKHETA – ARMAZI 1940,6,117,138,41.839326,44.663121,"Six aurei found in grave of Asfagur: Titus, Trajan, Hadrian 4 (AD 117-138).","National Museum of Georgia, Tbilisi",II century
Poland,1925,13527,TOKARY,433,193,194,50.803333,22.638889,Hoard of circa 600-700 denarii. 433 pieces were studied: Trajan - Septimius Severus (AD 193-194).,NA,II century
Netherlands,1997,9841,ALPHEN AAN DEN RIJN 1997,5,180,180,52.12795,4.660886,"1 silver + 4 bronze coins: (1st century -2nd century AD), Augustus - Commodus (AD 192) found during archaeological excavations.",Municipality Alphen aan den Rijn,II century
Germany,1909,18897,FRÖNDENBERG,257,175,176,51.469736702367,7.7699997477814,A hoard of 257 denarii: Republic - Marcus Aurelius (AD 175-176).,"Museum, Dortmund (243 coins); the Ruhr Valley Museum in Schwerte and Fröndenberg (14 coins)",II century
France,1865,7224,MORIENVAL 1865,72,193,193,49.298,2.92,72 sestertii found with a ceramic vessel: Augustus - Didius Julianus (AD 193).,NA,II century
"Israel, Palestinian Territories",1967,7631,HERODION 1967,831,134,135,31.667,35.243,The hoard comprised 831 bronze coins from the Second Jewish Revolt (AD 132-136).,NA,II century
Romania,1990,2586,MEDVEŞ,141,112,117,46.301,24.067,"(180) 141 silver coins: 140 denarii, 1 Lycian drachm dating from the Republic to Trajan.","Union Museum Alba Iulia, Romania (141 coins)",II century
Germany,1908,15473,UNTERAMMERGAU 1908,106,184,184,47.617019,11.023929,"A Roman coin hoard consisting of 106 denarii (Republic - Commodus) was discovered in 1908 during the renovation of a grinding mill, 2 km south-west of Unterammergau. The hoard was in earthenware jar, that had apparently been placed between rocks. The coins are now lost.",NA,II century
Poland,1900,13463,LASKOWA,5,145,175,49.763743,20.45085,Unknown number of Roman coins. Five denarii were placed in a liturgical cup in Limanowa!,NA,II century
Ukraine,2018,20664,CYHYRYN - SURROUNDINGS,32,180,192,49.0719491069,32.6743013453,"A hoard of 32 Roman imperial denarii (from Trajan to Commodus) was found in April 2018 in Cherkassy region. Information about the hoard was published in three videos on YouTube, in the channel “Aleksander Mercedes w poiske klada”. The hoard was discovered by a group of treasure hunters on April 20, 2018 on ploughed field, at a depth of up to 15 cm. 21 coins and half of a bronze bracelet were collected from the surface of ca. 10-15 square m (the main concentration, 12 coins, in an area of 5x5 m). On April, 24 a sondage was undertaken at the findspot (ca. 3x3 m. with a depth of ca. 20-50 cm), and 6 more coins were found, including one broken into several pieces. On August 31, 2018, one of the finders found another 5 denarii at the site of the main concentration of coins. It is possible that further searches were also made at this site. The fate of the coins in the hoard is unknown. The identification of the coins was based on the photos that were posted in this video.",NA,II century
Poland,1900,13644,ZGNIŁOBŁOTY,2,166,176,53.28031,19.231665,Two denarii issued by Marcus Aurelius (AD 166-176) were bought from the same local person.,NA,II century
Czech Republic,1870,15957,DERFLE,3,114,117,49.051272,17.480989,"3 coins, of which one aureus of Trajan (AD 114-117).",Private collection.,II century
Netherlands,1997,9940,LINDEN 1997,97,166,167,51.748,5.829,"97 coins: 1 denarius and 96 bronzes found concentrated around an earthenware dish within a level of a building: Republic - Marcus Aurelius (AD 166-167). The coins were found together with a brooch, as well as several pieces of pottery and nails.",Private collection,II century
Poland,1890,13411,CIEPŁOWODY,2,140,176,50.6741,16.9042,"Unknown number of denarii found with a ceramic vessel. Only two of them were known: 1 Trajan, 1 Faustina II.",Museum Wroclaw (Bresalu) in 1933.,II century
Spain,1982,13020,AMPURIAS - FORUM,4,117,138,42.1325,3.1174,Four asses found during the excavations. To be checked whether were found together.,NA,II century
Italy,1951,12015,CA' NOGHERA,514,193,196,45.522,12.358,The hoard comprised 514 imperial bronze coins: Nero-Septimius Severus (AD 193-196).,"Museo Archeologico Nazionale di Altino, Italy; private collection; some lost",II century
Netherlands,2000,10049,WIJNALDUM 2000,2,176,181,53.1953,5.4608,"2 denarii found in mound: Antoninus Pius, Marcus Aurelius/Faustina II (Diva).",Private collection,II century
France,1848,5752,ACLOU,50,138,161,49.166,0.706,"The hoard comprised 50 Roman coins which were thought to be bronzes. There is no further information on denominational composition. It was found on communal heathland and pasture, at a very shallow depth. The majority of the coins were collected together by M. Auvray, mayor of Aclou.",M. Auvray,II century
Georgia,1930,16068,TAKHULANI,8,117,138,42.653562,41.960428,"Hoard of didrachms and drachms of the 1st and 2nd centuries AD. 8 coins have been purchased by the local museum in Zugdidi: 5 didrachms Trajan, 2 didrachms Hadrian, 1 drachm Trajan.","Town museum, Zugdidi, Georgia",II century
Ukraine,2008,18595,CHUTOVE,135,194,195,49.7061,35.1849,135 denarii found by metal detecting: Vitellius - Septimius Severus (AD 194-195). Together were found: Flint pendant; an iron chain; a ceramic spindle.,NA,II century
Sweden,1894,15603,LILLA BLÄSNUNGS,2,163,164,57.68331,18.380685,"2 denarii: Vespasian (Domitian Caesar), Marcus Aurelius (AD 163-164); silver weight: 5.33 g.","Swedish History Museum, Stockholm (inv.no. 9960)",II century
Slovakia,1904,8204,DRŽENICE,236,161,180,48.286742,18.697001,236 aurei and denarii from the time of Marcus Aurelius (AD 161-180).,NA,II century
"England, United Kingdom",1934,54,CHALFONT ST GILES,53,145,161,51.618303,-0.58589283,"In 1934, 40 denarii and 12 sestertii were found with an urn in a field north of Narcott Lane. The coins range from Vespasian to Antoninus Pius.",NA,II century
Slovenia,1937,8847,ULAKA,5,173,174,45.71496,14.46409,5 sestertii ranging from Antoninus Pius - Marcus Aurelius (AD 173-174). Part of a larger hoard.,"Narodni muzej, Ljubljana, Slovenia; 5 coins; dispersed.",II century
Romania,1880,16327,SALONTA,141,180,192,46.802889,21.654794,141 denarii: Republic – Commodus (AD 180-192).,"Hungarian National Museum, Budapest (26 coins)",II century
Ukraine,1782,18223,KOMSOMOLSKOYE,800,193,193,49.720214529794,28.67148027102,"Hoard of 800 denarii. Among them, three pieces of Pertinax",Old collection T. Czacki,II century
Armenia,1955,17473,GAṘNI [ԳԱՌՆԻ] 1955,48,185,191,40.1195,44.723,"A hoard of 48 denarii, ranging from Vespasian to Commodus, discovered in the fortress of Gaṙni in 1955.",History Museum of Armenia,II century
Croatia,1903,9251,PERUŠKI,44,143,161,44.946,14.013,"Initially were found 81 coins. 44 coins: 1 cistophorus, 1 sestertius, 9 asses, 33 unknown bronze denomination: Augustus - Antoninus Pius (AD 138-161).","Arheoloski Muzej Istre, Pula, Croatia (44 coins); othewise dispersed",II century
Netherlands,1985,10030,VECHTEN 1985,15,138,161,52.058,5.162,"15 sestertii, dupondii, asses: Augustus-Antoninus Pius (AD 138-161).",Private collection,II century
Romania,1987,16291,CĂLUGĂRENI,63,162,163,46.746675,27.020254,"Unknown originally number of denarii found with a ceramic vessel. 63 coins were recovered, 62 denarii, 1 drachm: Vitellius – Marcus Aurelius (AD 162-163).",NA,II century
Bulgaria,1965,3011,SEIDOL,103,197,198,43.402,26.51,103 denari: Vitellius - Septimius Severus (AD 197-198); silver weight: 262.8-420.7 g.,"History Museum, Razgrad, Bulgaria; inv.no. IF, hoard 12 (103 coins).",II century
Netherlands,1908,12619,HEES 1908,18,161,180,51.8423,5.8299,18 bronze coins: Augustus - Marcus Aurelius,NA,II century
Ukraine,2013,18623,STARYIE VALKI 2013 2,50,177,178,49.8679,35.5544,"50 denarii found with a ceramic jar: Vespasian - Marcus Aurelius (Commodus Augustus) (AD 177-178). Found one meter from STARYIE VALKY 2013 1, practically, one hoard.",Private collections,II century
India,1948,18421,KADMAT ISLAND,15,180,180,12.309827874573,72.847331259132,"15 Roman gold coins described in the Madras Museum Accessions Register as 'purchases through individuals through the Collector of Canara'. It is unclear whether rhey represent a genuine hoard. Possible part of the cache of Roman coins dating from the first and second centuries A.D. was reportedly discovered some 600 kms. further to the north, on Kadmat Island in the neighbouring Laccadives group (Indian Union Territory of Lakshadweep) during 1948",Madras Museum Accessions Register,II century
Sweden,1906,15535,LILLA GLÄVES,494,194,195,57.243243,18.540547,646 denarii layed in the ground: Vespasian - Septimius Severus (AD 194-195). 152 coins of this find disappeared between 1907 and 1975.,"Swedish History Museum, Stockholm (inv.no. 12684)",II century
Bulgaria,1955,12279,TVARDITSA,3,117,138,42.7001,25.8989,Three aurei of Hadrian. Only one was seen.,NA,II century
Germany,1870,16598,BURG DELLINGEN BEI BRUGGEN,27,145,176,47.92439,8.41776,27 bronze coins (Tiberius - Marcus Aurelius) found in an ash layer covered by a stone and interpreted as a votive deposit.,NA,II century
Albania,2010,18315,DURRËS 2010,64,161,180,41.317893118999,19.448191178349,64 denarii found in a wall of a glass workshop: Nerva - Marcus Aurelius (AD 161-180).,NA,II century
France,1830,7295,LA-CHAPELLE-SAINT-SAUVEUR,324,138,161,46.844,5.269,The hoard comprised 2 batches containing 24 bronzes from Trajan to Antoninus Pius for the first and 300 bronzes for the second.,NA,II century
Italy,1914,18810,MARZAMEMI,24,178,183,36.742,15.118,24 sestertii found with a ceramic vessel: Claudius I to Commodus (AD 180-183).,"Museum of Siracusa, Italy (inv.nos. 34791-34815, casette 195)",II century
Romania,1963,2941,FĂUREI,42,193,194,46.911546,26.709364,Unknown originally number of coins. 42 denarii: Otho - Septimius Severus (AD 193-194); silver weight: 78.0-122.8 g.,NA,II century
Netherlands,1990,10036,VECHTEN 1990 2,14,145,176,52.058,5.162,14 silver and bronze coins of unknown denominations: Republic - Antoninus Pius/Marcus Aurelius (Faustina II) (AD 145-176).,Private collection,II century
France,1837,5784,LA HAYE-MALHERBE 1837,60,176,180,49.22299,1.065632,"The hoard comprised a 'vessel containing 60 aurei, of which 17 were bought by the Cabinet des Médailles and 2 by the Musée de Rouen, although neither acquisition can be found today.'",NA,II century
Luxembourg,1970,7445,NOSPELT (GOEBLANGE),6,184,184,49.674,6.008,The hoard was found during the excavation of a Gallo-Roman villa and comprised 6 sestertii from Trajan to Commodus with a tpq of AD.,NA,II century
Croatia,1966,5395,SVETA MARIJA,5,151,161,46.3325,16.7432,"5 denarii from Vespasian (Domitian) to Antoninus Pius (M. Aurelius). Part of a larger hoard, details unknown.",Varaždin Town Museum,II century
Belgium,1806,6117,AERDRYCKE,5,145,160,51.119186,3.089995,Some aurei. Only five are presented from Nero to Antoninus Pius (Marcus Aurelius Caesar).,NA,II century
Romania,1938,2595,TIBRU,220,141,161,46.196,23.558,"220 denarii: Republican (163), Imperial (57); Republican - Antoninus Pius (AD post 141)","Union Museum Alba Iulia, Romania (49 coins)",II century
France,1826,6309,GENAS,2000,196,197,45.732,5.001,"The hoard comprised a large number of silver denarii of Clodius Albinus (approximately 15 pounds in weight or 2,000 pieces).",NA,II century
"England, United Kingdom",1833,1011,BARTON WOOD,8,161,169,50.743287,-1.2643805,"A hoard found in Barton Wood, consisting of nearly a gallon measure of Roman brass coins. The coins, from being originally deposited in a box, had become so corroded, that they were unable easily to be separated, and in the attempt to effect this separation by a strong liquid the coins were rendered nearly illegible. Some were, however, rescued for the Newport Museum, and include an Augustus, a Trajan, two of Antoninus Pius, two of Lucius Verus, and two of Faustina, wife of Marcus Aurelius.",Carisbrooke Castle Museum,II century
Austria,1799,8185,WIEN - RENNWEG 1799,279,161,180,48.193,16.392,"A hoard of 298 aurei dating from Nero to Lucius Verus was discovered in Vienna in 1799 during the construction of the Wiener Neustadt Canal. Of the 298 aurei, 24 were stolen and 274 initially were recovered. There is information for 279 coins: Nero - Marcus Aurelius (AD 161-180). The average weight of the coins was 6.3g.","Münzkabinett, Kunsthistorischen Museum, Vienna, Austria (191 coins)",II century
